institution_code,institution_name,akreditasi_institusi,wilayah
2532,UNIVERSITAS NAHDLATUL ULAMA KALIMANTAN SELATAN,BAIK,WILAYAH 11
2533,UNIVERSITAS KATOLIK DE LA SALLE,B,WILAYAH 16
2534,AKADEMI FARMASI YAMASI MAKASSAR,BAIK,WILAYAH 09
2535,SEKOLAH TINGGI TEOLOGI INJILI INDONESIA PURWOKERTO,BAIK,WILAYAH PTAS
2538,AKADEMI KEPERAWATAN BERKALA WIDYA HUSADA,BAIK,WILAYAH 03
2539,SEKOLAH TINGGI ILMU EKONOMI RAJAWALI,BAIK,WILAYAH 06
2543,UNIVERSITAS PERJUANGAN TASIKMALAYA,BAIK,WILAYAH 04
2544,STMIK LOMBOK,BAIK,WILAYAH 08
2545,AKADEMI FARMASI KUSUMA HUSADA PURWOKERTO,BAIK,WILAYAH 06
2546,STIPER SANTO THOMAS AQUINAS JAYAPURA,BAIK,WILAYAH 14
2548,UNIVERSITAS KATOLIK SOEGIJAPRANATA,UNGGUL,WILAYAH 06
2550,SEKOLAH TINGGI ILMU EKONOMI AMM,BAIK,WILAYAH 08
2551,POLITEKNIK PERTANIAN NEGERI PAYAKUMBUH,B,WILAYAH PTN
2552,UNIVERSITAS ISLAM NAHDLATUL ULAMA JEPARA,BAIK SEKALI,WILAYAH 06
2554,AKADEMI PARIWISATA CITRA BUANA INDONESIA,BAIK,WILAYAH 04
2555,SEKOLAH TINGGI ILMU ISLAM DAN BAHASA ARAB MAKASSAR,BAIK,WILAYAH PTAS
2556,SEKOLAH TINGGI ILMU EKONOMI MUJAHIDIN,BAIK,WILAYAH 16
2557,SEKOLAH TINGGI ILMU EKONOMI AL-MADANI,BAIK,WILAYAH 02
2558,UNIVERSITAS NUSANTARA MANADO,BAIK,WILAYAH 16
2559,POLITEKNIK PENERBANGAN JAYAPURA,BAIK,WILAYAH PTKL
2560,STAI MEMPAWAH PONTIANAK,BAIK,WILAYAH PTAS
2561,UNIVERSITAS KATOLIK SANTO AGUSTINUS HIPPO,BAIK,WILAYAH 11
2562,UNIVERSITAS WIDYA GAMA MAHAKAM SAMARINDA,BAIK SEKALI,WILAYAH 11
2563,UNIVERSITAS ABULYATAMA,B,WILAYAH 13
2564,UNIVERSITAS BUNG KARNO,B,WILAYAH 03
2565,UNIVERSITAS BALIKPAPAN,B,WILAYAH 11
2566,AKADEMI KEBIDANAN MENARA PRIMADANI,BAIK,WILAYAH 09
2567,SEKOLAH TINGGI PARIWISATA BOGOR,BAIK SEKALI,WILAYAH 04
2568,UNIVERSITAS NAHDLATUL ULAMA YOGYAKARTA,BAIK,WILAYAH 05
2569,POLITEKNIK KUTARAJA,BAIK,WILAYAH 13
2570,STIE YBPK PALANGKA RAYA,BAIK,WILAYAH 11
2572,POLITEKNIK ADIGUNA MARITIM INDONESIA MEDAN,B,WILAYAH 01
2573,SEKOLAH TINGGI ILMU KESEHATAN MERANGIN,BAIK,WILAYAH 10
2574,"STAI AL-AZHARY CIANJUR, JAWA BARAT",BAIK,WILAYAH PTAS
2575,SEKOLAH TINGGI ILMU KESEHATAN SEMARANG,BAIK,WILAYAH 06
2576,UNIVERSITAS AL-IRSYAD CILACAP,BAIK,WILAYAH 06
2577,SEKOLAH TINGGI ILMU ADMINISTRASI YPPT TASIKMALAYA,BAIK SEKALI,WILAYAH 04
2580,INSTITUT TEKNOLOGI DAN ILMU SOSIAL KHATULISTIWA,B,WILAYAH 10
2583,STKIP MUHAMMADIYAH LUMAJANG,BAIK,WILAYAH 07
2584,AKADEMI KEBIDANAN BAKTI NUSANTARA RANTEPAO,BAIK,WILAYAH 09
2585,POLITEKNIK AMAMAPARE,BAIK,WILAYAH 14
2586,STES HARAPAN BIMA NUSA TENGGARA BARAT,BAIK,WILAYAH PTAS
2587,UNIVERSITAS MUSLIM BUTON,BAIK,WILAYAH 09
2588,UNIVERSITAS NAHDLATUL ULAMA SUMATERA UTARA,BAIK,WILAYAH 01
2589,UNIVERSITAS NEGERI GORONTALO,UNGGUL,WILAYAH PTN
2590,UNIVERSITAS MUHAMMADIYAH PALANGKA RAYA,BAIK SEKALI,WILAYAH 11
2591,SEKOLAH TINGGI ILMU TARBIYAH SERDANG BEDAGAI,BAIK,WILAYAH PTAS
2592,STEI WALISONGO SAMPANG,BAIK,WILAYAH PTAS
2593,UNIVERSITAS LAMAPPAPOLEONRO,B,WILAYAH 09
2594,SEKOLAH TINGGI ILMU EKONOMI DHARMA NASIONAL JEMBER,BAIK,WILAYAH 07
2595,SEKOLAH TINGGI ILMU EKONOMI MANAJEMEN BISNIS INDONESIA,BAIK,WILAYAH 04
2596,SEKOLAH TINGGI KEGURUAN DAN ILMU PENDIDIKAN PGRI PAPUA,BAIK,WILAYAH 14
2597,SEKOLAH TINGGI ILMU PERTANIAN BELITANG,BAIK,WILAYAH 02
2598,AKADEMI KEPERAWATAN PEMERINTAH KABUPATEN NGAWI,BAIK,WILAYAH 07
2599,UNIVERSITAS MULTI DATA PALEMBANG,BAIK SEKALI,WILAYAH 02
2600,UNIVERSITAS BUMIGORA,BAIK SEKALI,WILAYAH 08
2601,SEKOLAH TINGGI PARIWISATA SAHID SURAKARTA,B,WILAYAH 06
2602,UNIVERSITAS SATYA NEGARA INDONESIA,B,WILAYAH 03
2603,STMIK HIMSYA,BAIK,WILAYAH 06
2604,SEKOLAH TINGGI KEGURUAN DAN ILMU PENDIDIKAN ANDI MATAPPA,BAIK,WILAYAH 09
2605,UNIVERSITAS MUHAMMADIYAH A.R. FACHRUDDIN,BAIK SEKALI,WILAYAH 04
2606,UNIVERSITAS COKROAMINOTO YOGYAKARTA,BAIK SEKALI,WILAYAH 05
2607,STAI BADRUS SHOLEH PURWOASRI KEDIRI,BAIK,WILAYAH PTAS
2608,INSTITUT AGAMA ISLAM AL-GHURABA RAWAMANGUN JAKARTA TIMUR,BAIK,WILAYAH PTAS
2609,AKADEMI ANALIS FARMASI DAN MAKANAN BANDA ACEH,BAIK,WILAYAH 13
2610,STIT AR-RAUDHAH,BAIK,WILAYAH PTAS
2612,UNIVERSITAS TANGERANG RAYA,BAIK,WILAYAH 04
2613,"STIT RAUDHATUL ULUM, SAKATIGA INDRALAYA, KOTA PALEMBANG, SUMATERA SELATAN",BAIK,WILAYAH PTAS
2614,"STIT AL-FALAH RIMBO BUJANG, TEBO, JAMBI",BAIK,WILAYAH PTAS
2615,INSTITUT AGAMA ISLAM SUNAN KALIJOGO MALANG JAWA TIMUR,BAIK,WILAYAH PTAS
2616,AKADEMI ENTERPRENEURSHIP TERANG BANGSA,BAIK,WILAYAH 06
2617,STIE SAINT THERESA,BAIK,WILAYAH 14
2619,"STIT IQRA` KAPUAS HULU, KALIMANTAN BARAT",BAIK,WILAYAH PTAS
2620,UNIVERSITAS INDONESIA TIMUR,BAIK SEKALI,WILAYAH 09
2621,SEKOLAH TINGGI ILMU TARBIYAH NUSANTARA BEKASI,BAIK,WILAYAH PTAS
2622,STAI DARUL QUR`AN PAYAKUMBUH,BAIK SEKALI,WILAYAH PTAS
2623,INSTITUT PENDIDIKAN NUSANTARA GLOBAL,BAIK,WILAYAH 08
2624,SEKOLAH TINGGI ILMU SYARIAH ABU ZAIRI BONDOWOSO JAWA TIMUR,BAIK,WILAYAH PTAS
2625,STMIK MERCUSUAR,BAIK,WILAYAH 04
2626,UNIVERSITAS SAINS DAN TEKNOLOGI JAYAPURA,BAIK,WILAYAH 14
2627,POLITEKNIK TRANSPORTASI SUNGAI DANAU DAN PENYEBERANGAN,BAIK SEKALI,WILAYAH PTKL
2628,SEKOLAH TINGGI TEOLOGI PANTEKOSTA SUMUT - ACEH,BAIK,WILAYAH PTAS
2629,SEKOLAH TINGGI ILMU EKONOMI NUSANTARA MAKASSAR,BAIK,WILAYAH 09
2630,STIT PALAPA NUSANTARA LOMBOK NUSA TENGGARA BARAT,BAIK,WILAYAH PTAS
2632,SEKOLAH TINGGI PERIKANAN DAN KELAUTAN PALU,BAIK,WILAYAH 16
2633,SEKOLAH TINGGI ILMU HUKUM MANOKWARI,BAIK SEKALI,WILAYAH 14
2635,SEKOLAH TINGGI TEOLOGI BAPTIS KALVARI JAKARTA,BAIK,WILAYAH PTAS
2636,STAI AL-AULIA BOGOR,BAIK,WILAYAH PTAS
2638,AKADEMI PARIWISATA DHARMA NUSANTARA SAKTI,BAIK,WILAYAH 05
2639,SEKOLAH TINGGI ILMU SYARIAH AL-MANAR,BAIK,WILAYAH PTAS
2640,SEKOLAH TINGGI ILMU TARBIYAH LAKBOK,BAIK,WILAYAH PTAS
2641,SEKOLAH TINGGI ILMU KESEHATAN AR-RUM,BAIK,WILAYAH 06
2642,UNIVERSITAS FORT DE KOCK,BAIK SEKALI,WILAYAH 10
2643,SEKOLAH TINGGI AGAMA ISLAM MINHAAJURROOSYIDIIN,BAIK,WILAYAH PTAS
2644,STIE PASIM SUKABUMI,BAIK,WILAYAH 04
2645,UNIVERSITAS KRISTEN SATYA WACANA,UNGGUL,WILAYAH 06
2646,UNIVERSITAS SUMATERA UTARA,UNGGUL,WILAYAH PTN
2647,UNIVERSITAS DINAMIKA BANGSA,B,WILAYAH 10
2648,IAIN PALOPO,B,WILAYAH PTAN
2649,UNIVERSITAS DIPONEGORO,UNGGUL,WILAYAH PTN
2650,UNIVERSITAS BANDAR LAMPUNG,B,WILAYAH 02
2651,INSTITUT KEGURUAN DAN TEKNOLOGI LARANTUKA,BAIK,WILAYAH 15
2652,POLITEKNIK HARAPAN BANGSA SURAKARTA,BAIK,WILAYAH 06
2653,STAI NAHDLATUL WATHAN SAMAWA SUMBAWA BESAR NTB,BAIK,WILAYAH PTAS
2654,"SEKOLAH TINGGI ILMU USHULUDDIN DARUSSALAM, BANGKALAN, JAWA TIMUR",BAIK,WILAYAH PTAS
2655,AKADEMI KEBIDANAN MATORKIS,BAIK,WILAYAH 01
2656,SEKOLAH TINGGI KEGURUAN DAN ILMU PENDIDIKAN PADANG LAWAS,BAIK,WILAYAH 01
2658,INSTITUT PERTANIAN BOGOR,UNGGUL,WILAYAH PTN
2659,UNIVERSITAS PALANGKA RAYA,BAIK SEKALI,WILAYAH PTN
2660,INSTITUT AGAMA ISLAM NEGERI KERINCI,BAIK SEKALI,WILAYAH PTAN
2661,AKADEMI PARIWISATA NHI BANDUNG,BAIK SEKALI,WILAYAH 04
2662,AKADEMI KOMUNITAS OLAT MARAS,BAIK,WILAYAH 08
2663,STAI H.M. LUKMAN EDY PEKANBARU,B,WILAYAH PTAS
2664,SEKOLAH TINGGI TEOLOGI INJILI ARASTAMAR TAPANULI,BAIK,WILAYAH PTAS
2665,UNIVERSITAS INDONESIA,UNGGUL,WILAYAH PTN
2666,UNIVERSITAS HASANUDDIN,UNGGUL,WILAYAH PTN
2667,SEKOLAH TINGGI MANAJEMEN INFORMATIKA DAN KOMPUTER PESAT NABIRE,BAIK,WILAYAH 14
2668,STMIK PELITA NUSANTARA,BAIK SEKALI,WILAYAH 01
2669,STT LIGHTHOUSE EQUIPPING THEOLOGICAL SCHOOL,BAIK,WILAYAH PTAS
2671,POLITEKNIK MARITIM AMI MAKASSAR,BAIK SEKALI,WILAYAH 09
2672,UNIVERSITAS SURABAYA,UNGGUL,WILAYAH 07
2673,SEKOLAH TINGGI TEOLOGI EL-SHADDAY SURAKARTA,BAIK,WILAYAH PTAS
2674,STMIK TIDORE MANDIRI,BAIK,WILAYAH 12
2675,STIE IBMI MEDAN,BAIK,WILAYAH 01
2676,INSTITUT AGAMA ISLAM TASIKMALAYA,BAIK,WILAYAH PTAS
2677,POLITEKNIK AL-ISLAM BANDUNG,BAIK,WILAYAH 04
2678,SEKOLAH TINGGI ILMU SOSIAL DAN ILMU POLITIK WIRA BHAKTI,BAIK,WILAYAH 08
2679,SEKOLAH TINGGI ILMU KESEHATAN SUKMA WIJAYA SAMPANG,BAIK,WILAYAH 07
2680,UNIVERSITAS SAM RATULANGI,UNGGUL,WILAYAH PTN
2681,UNIVERSITAS MUHAMMADIYAH YOGYAKARTA,UNGGUL,WILAYAH 05
2682,UNIVERSITAS ISLAM INDONESIA,UNGGUL,WILAYAH 05
2683,INSTITUT TEKNOLOGI BANDUNG,UNGGUL,WILAYAH PTN
2684,UNIVERSITAS NEGERI SURABAYA,UNGGUL,WILAYAH PTN
2685,UNIVERSITAS GADJAH MADA,UNGGUL,WILAYAH PTN
2686,AMIK BUKITTINGGI,BAIK,WILAYAH 10
2687,SEKOLAH TINGGI ILMU ADMINISTRASI MATARAM,BAIK,WILAYAH 08
2688,SEKOLAH TINGGI ILMU ADMINISTRASI DARUL RACHMAN TUAL,BAIK,WILAYAH 12
2689,SEKOLAH TINGGI ILMU EKONOMI SUTAATMADJA,BAIK SEKALI,WILAYAH 04
2690,SEKOLAH TINGGI ILMU EKONOMI AL-WASHLIYAH,BAIK,WILAYAH 01
2691,STT INJILI ARASTAMAR NIAS SELATAN,BAIK,WILAYAH PTAS
2692,POLITEKNIK BISNIS INDONESIA,BAIK,WILAYAH 01
2693,SEKOLAH TINGGI AGAMA ISLAM SYEKH JANGKUNG,BAIK,WILAYAH PTAS
2694,SEKOLAH TINGGI ILMU KESEHATAN DONA PALEMBANG,BAIK,WILAYAH 02
2695,UNIVERSITAS KATOLIK PARAHYANGAN,UNGGUL,WILAYAH 04
2696,UNIVERSITAS YAYASAN PENDIDIKAN IMAM BONJOL MAJALENGKA,BAIK,WILAYAH 04
2697,POLITEKNIK GAJAH SAKTI,BAIK,WILAYAH 02
2698,UNIVERSITAS DARUL  ULUM,B,WILAYAH 07
2699,UNIVERSITAS BINAWAN,BAIK SEKALI,WILAYAH 03
2700,SEKOLAH TINGGI ILMU KESEHATAN PANCA BHAKTI,BAIK,WILAYAH 02
2701,SEKOLAH TINGGI TEOLOGI KIBAID MAKALE,BAIK,WILAYAH PTAS
2702,POLITEKNIK KELAUTAN DAN PERIKANAN BONE,BAIK SEKALI,WILAYAH PTKL
2703,INSTITUT AGAMA ISLAM AL-KHAIRAT PAMEKASAN JAWA TIMUR,BAIK,WILAYAH PTAS
2704,SEKOLAH TINGGI ILMU EKONOMI BHAKTI PEMBANGUNAN,B,WILAYAH 03
2705,UNIVERSITAS INSAN CENDEKIA MANDIRI,BAIK,WILAYAH 04
2706,AKADEMI MARITIM NASIONAL JAYA,BAIK,WILAYAH 03
2707,UNIVERSITAS MULAWARMAN,BAIK SEKALI,WILAYAH PTN
2708,SEKOLAH TINGGI ILMU EKONOMI PARIWISATA INDONESIA,B,WILAYAH 06
2709,AKADEMI ILMU KOMPUTER TERNATE,BAIK,WILAYAH 12
2710,POLITEKNIK PENERBANGAN PALEMBANG,BAIK,WILAYAH PTKL
2711,"STAI TULANG BAWANG, LAMPUNG",BAIK,WILAYAH PTAS
2713,SEKOLAH TINGGI KESENIAN WILWATIKTA,BAIK SEKALI,WILAYAH 07
2714,STAI AL-FITHRAH SURABAYA,BAIK,WILAYAH PTAS
2715,POLITEKNIK BALEKAMBANG JEPARA,BAIK,WILAYAH 06
2716,STISIPOL MUJAHIDIN,BAIK,WILAYAH 16
2717,AKADEMI KOMUNITAS MANAJEMEN PERHOTELAN INDONESIA,BAIK,WILAYAH 08
2718,SEKOLAH TINGGI ILMU EKONOMI JAYAKARTA,BAIK,WILAYAH 03
2719,AKADEMI KEBIDANAN SAKINAH,BAIK,WILAYAH 07
2720,STAI AL-FATTAH PACITAN,BAIK,WILAYAH PTAS
2721,SEKOLAH TINGGI AGAMA HINDU DHARMA NUSANTARA JAKARTA,B,WILAYAH PTAN
2723,SEKOLAH TINGGI ILMU EKONOMI SYARIAH PUTERA BANGSA TEGAL JAWA TENGAH,BAIK,WILAYAH PTAS
2724,STEI AR - RACHMAN,BAIK,WILAYAH PTAS
2727,SEKOLAH TINGGI ILMU KESEHATAN KENDAL,BAIK,WILAYAH 06
2729,SEKOLAH TINGGI TEOLOGI INJILI INDONESIA BATAM,BAIK,WILAYAH PTAS
2730,SEKOLAH TINGGI AKUNTANSI DAN MANAJEMEN INDONESIA,BAIK,WILAYAH 01
2731,POLITEKNIK KELAUTAN DAN PERIKANAN JEMBRANA,BAIK SEKALI,WILAYAH PTKL
2732,AKADEMI KEBIDANAN AR-RAHMA,BAIK,WILAYAH 07
2733,SEKOLAH TINGGI ILMU EKONOMI ANINDYAGUNA,BAIK,WILAYAH 06
2734,STAI AL-HAMIDIYAH BANGKALAN,BAIK,WILAYAH PTAS
2735,UNIVERSITAS MAHAPUTRA MUHAMMAD YAMIN,BAIK SEKALI,WILAYAH 10
2736,SEKOLAH TINGGI ILMU SYARIAH HAJI  ABDUL RASYID LOMBOK TENGAH,BAIK,WILAYAH PTAS
2738,SEKOLAH TINGGI AGAMA HINDU DHARMA SENTANA SULAWESI TENGAH,BAIK SEKALI,WILAYAH PTAN
2739,SEKOLAH TINGGI EKONOMI DAN BISNIS ISLAM AL-ANWAR BANGKALAN,BAIK,WILAYAH PTAS
2740,STID MUSTAFA IBRAHIM AL-ISHLAHUDDINY KEDIRI LOMBOK BARAT NTB,BAIK,WILAYAH PTAS
2741,SEKOLAH TINGGI TEOLOGI MAWAR SARON LAMPUNG,BAIK,WILAYAH PTAS
2742,UNIVERSITAS NEGERI SEMARANG,UNGGUL,WILAYAH PTN
2743,SEKOLAH TINGGI ILMU EKONOMI PARIWISATA API,BAIK,WILAYAH 05
2744,AKADEMI KEPERAWATAN DHARMA HUSADA CIREBON,BAIK,WILAYAH 04
2745,SEKOLAH TINGGI ILMU HUKUM BINTUNI,BAIK,WILAYAH 14
2746,SEKOLAH TINGGI EKONOMI ISLAM KANJENG SEPUH GRESIK JAWA TIMUR,BAIK,WILAYAH PTAS
2747,POLITEKNIK KESEHATAN KARTINI BALI,BAIK,WILAYAH 08
2748,UNIVERSITAS PUANGRIMAGGALATUNG,BAIK SEKALI,WILAYAH 09
2749,AKADEMI PARIWISATA BUNDA PADANG,BAIK,WILAYAH 10
2750,STAI JAMIATUT TARBIYAH LHOKSUKON ACEH UTARA,BAIK,WILAYAH PTAS
2751,STISIP SILAS PAPARE JAYAPURA,BAIK,WILAYAH 14
2753,SEKOLAH TINGGI ILMU TARBIYAH BAHANA SUMBAWA BARAT,BAIK,WILAYAH PTAS
2754,SEKOLAH TINGGI TEOLOGI ABDIEL UNGARAN,BAIK,WILAYAH PTAS
2755,STAI HASAN JUFRI BAWEAN,BAIK,WILAYAH PTAS
2756,STKIP MUTIARA BANTEN,BAIK,WILAYAH 04
2757,UNIVERSITAS MUHAMMADIYAH BONE,BAIK SEKALI,WILAYAH 09
2758,STIS DARUL FALAH PAGUTAN MATARAM NTB,BAIK,WILAYAH PTAS
2759,AKADEMI AKUNTANSI YPK MEDAN,BAIK,WILAYAH 01
2760,INSTITUT TEKNOLOGI DAN BISNIS NOBEL INDONESIA,BAIK SEKALI,WILAYAH 09
2761,STIKES LAKIPADADA,BAIK,WILAYAH 09
2762,AKADEMI KEBIDANAN KHOLISATUR RAHMI BINJAI,BAIK,WILAYAH 01
2763,SEKOLAH TINGGI ILMU KESEHATAN RS DUSTIRA,BAIK,WILAYAH 04
2764,STT ARASTAMAR RIAU,BAIK,WILAYAH PTAS
2766,UNIVERSITAS TANRI ABENG,BAIK SEKALI,WILAYAH 03
2767,SEKOLAH TINGGI KEGURUAN DAN ILMU PENDIDIKAN AL MAKSUM,BAIK,WILAYAH 01
2768,POLITEKNIK NEGERI BALI,BAIK SEKALI,WILAYAH PTN
2769,"SEKOLAH TINGGI ILMU SYARIAH AS SALAFIYAH SUMBER DUKO, PAMEKASAN JAWA TIMUR",BAIK,WILAYAH PTAS
2771,UNIVERSITAS MATHLA UL ANWAR,BAIK SEKALI,WILAYAH 04
2773,SEKOLAH TINGGI ILMU SYARIAH AL WAFA,BAIK,WILAYAH PTAS
2775,POLITEKNIK NEGERI SAMBAS,BAIK SEKALI,WILAYAH PTN
2776,SEKOLAH TINGGI ILMU EKONOMI SABANG,BAIK SEKALI,WILAYAH 13
2777,SEKOLAH TINGGI AGAMA ISLAM AL FALAH PAMEKASAN,BAIK,WILAYAH PTAS
2778,SEKOLAH TINGGI ILMU EKONOMI JAYA NEGARA TAMANSISWA,BAIK,WILAYAH 07
2780,INSTITUT AGAMA ISLAM YASNI BUNGO,BAIK,WILAYAH PTAS
2781,INSTITUT AGAMA ISLAM NUSANTARA BATANG HARI,BAIK,WILAYAH PTAS
2783,SEKOLAH TINGGI ILMU EKONOMI NGANJUK,BAIK,WILAYAH 07
2784,UNIVERSITAS NURDIN HAMZAH,BAIK,WILAYAH 10
2785,SEKOLAH TINGGI ILMU PERTANIAN FARMING,BAIK,WILAYAH 06
2786,INSTITUT SAINS DAN TEKNOLOGI TD PARDEDE,BAIK,WILAYAH 01
2787,SEKOLAH TINGGI ILMU EKONOMI WIDYA MANGGALIA,BAIK,WILAYAH 06
2790,"STAI MADRASAH `ARABIYAH BAYANG, PESISIR SELATAN, SUMATERA BARAT",BAIK,WILAYAH PTAS
2791,STAI YAYASAN TARBIYAH ISLAMIYAH LUBUK BAGALUNG PADANG,BAIK,WILAYAH PTAS
2792,"STAI YDI LUBUK SIKAPING, PASAMAN, SUMATERA BARAT",BAIK,WILAYAH PTAS
2794,SEKOLAH TINGGI TEOLOGI TAWANGMANGU,BAIK,WILAYAH PTAS
2796,SEKOLAH TINGGI AGAMA KRISTEN ARASTAMAR GRIMENAWA JAYAPURA,BAIK,WILAYAH PTAS
2797,INSTITUT AGAMA ISLAM TEBO,BAIK,WILAYAH PTAS
2798,STMIK INDONESIA BANJARMASIN,BAIK,WILAYAH 11
2800,SEKOLAH TINGGI DESAIN INTERSTUDI,BAIK,WILAYAH 03
2801,UNIVERSITAS PUTRA INDONESIA,BAIK,WILAYAH 04
2802,SEKOLAH TINGGI AGAMA KRISTEN NABIRE,BAIK,WILAYAH PTAS
2803,STIKES ARRAHMA MANDIRI INDONESIA,BAIK,WILAYAH 07
2805,POLITEKNIK INTERNASIONAL BALI,BAIK SEKALI,WILAYAH 08
2806,STAI YAPTIP SIMPANG EMPAT PASAMAN BARAT,BAIK,WILAYAH PTAS
2807,INSTITUT SAINS DAN TEKNOLOGI ANNUQAYAH,BAIK,WILAYAH 07
2808,AKADEMI PARIWISATA ULCLA,BAIK,WILAYAH 01
2809,POLITEKNIK MARITIM NEGERI INDONESIA,BAIK SEKALI,WILAYAH PTN
2810,POLITEKNIK NEGERI LAMPUNG,BAIK SEKALI,WILAYAH PTN
2811,SEKOLAH TINGGI ILMU KESEHATAN BINA BANGSA MAJENE,BAIK,WILAYAH 09
2812,SEKOLAH TINGGI ILMU HUKUM PENGAYOMAN,BAIK SEKALI,WILAYAH 09
2813,SEKOLAH TINGGI ILMU KESEHATAN HUSADA MANDIRI POSO,BAIK,WILAYAH 16
2815,SEKOLAH TINGGI ILMU TARBIYAH MADANI YOGYAKARTA,BAIK,WILAYAH PTAS
2816,UNIVERSITAS DOKTOR HUSNI INGRATUBUN TUAL,BAIK,WILAYAH 12
2817,UNIVERSITAS SUNAN BONANG,BAIK,WILAYAH 07
2818,POLITEKNIK INDUSTRI LOGAM MOROWALI,BAIK,WILAYAH PTKL
2819,INSTITUT KESEHATAN SUMATERA UTARA,BAIK,WILAYAH 01
2820,STIT MUHAMMADIYAH TEMPUREJO NGAWI,BAIK,WILAYAH PTAS
2822,"STAI AL-FALAH BANJARBARU, BANJARMASIN KALIMANTAN SELATAN",BAIK,WILAYAH PTAS
2823,SEKOLAH TINGGI ILMU EKONOMI WIDYA DARMA KOTAMOBAGU,BAIK,WILAYAH 16
2824,SEKOLAH TINGGI ILMU EKONOMI MULIA DARMA PRATAMA,BAIK,WILAYAH 02
2825,UNIVERSITAS ISLAM MALANG,UNGGUL,WILAYAH 07
2826,SEKOLAH TINGGI ILMU KESEHATAN HOLISTIK,BAIK,WILAYAH 04
2828,UNIVERSITAS JAKARTA,BAIK,WILAYAH 03
2829,UNIVERSITAS TULUNGAGUNG,B,WILAYAH 07
2830,UNIVERSITAS SINTUWU MAROSO POSO,B,WILAYAH 16
2831,UNIVERSITAS ICHSAN GORONTALO,B,WILAYAH 16
2833,SEKOLAH TINGGI TEOLOGI EFATA SALATIGA,BAIK,WILAYAH PTAS
2834,UNIVERSITAS DIPA MAKASSAR,B,WILAYAH 09
2835,UNIVERSITAS NUSA MANDIRI,B,WILAYAH 03
2837,UNIVERSITAS PUTRA ABADI LANGKAT,BAIK,WILAYAH 01
2838,UNIVERSITAS TEKNOLOGI AKBA MAKASSAR,BAIK,WILAYAH 09
2839,UNIVERSITAS MUHAMMADIYAH BIMA,BAIK,WILAYAH 08
2840,UNIVERSITAS ISLAM NEGERI SYEKH ALI HASAN AHMAD ADDARY PADANGSIDIMPUAN,BAIK SEKALI,WILAYAH PTAN
2841,AKADEMI FILM YOGYAKARTA,BAIK,WILAYAH 05
2843,AKADEMI KEBIDANAN SINGKAWANG,BAIK,WILAYAH 11
2844,POLITEKNIK NEGERI KETAPANG,BAIK,WILAYAH PTN
2846,SEKOLAH TINGGI ILMU EKONOMI ENAM ENAM KENDARI,BAIK SEKALI,WILAYAH 09
2848,SEKOLAH TINGGI ILMU DAKWAH DAN KOMUNIKASI ISLAM AL MARDLIYYAH PAMEKASAN,BAIK,WILAYAH PTAS
2849,SEKOLAH TINGGI ILMU EKONOMI TRI BHAKTI,BAIK SEKALI,WILAYAH 04
2850,SEKOLAH TINGGI EKONOMI DAN BISNIS ISLAM SYAIKHONA KHOLIL SIDOGIRI PASURUAN,BAIK,WILAYAH PTAS
2851,SEKOLAH TINGGI TEOLOGI IMAN JAKARTA,BAIK,WILAYAH PTAS
2852,POLITEKNIK ENERGI DAN PERTAMBANGAN BANDUNG,BAIK,WILAYAH PTKL
2853,SEKOLAH TINGGI ILMU EKONOMI GEMPOL,BAIK,WILAYAH 07
2854,SEKOLAH TINGGI ILMU ADMINISTRASI LPPN,B,WILAYAH 10
2855,INSTITUT ISLAM MAMBAUL ULUM SURAKARTA,BAIK,WILAYAH PTAS
2857,UNIVERSITAS HAMZANWADI,B,WILAYAH 08
2858,AKADEMI MARITIM NUSANTARA CILACAP,B,WILAYAH 06
2859,UNIVERSITAS MALAHAYATI,B,WILAYAH 02
2860,UNIVERSITAS SISINGAMANGARAJA XII TAPANULI UTARA,B,WILAYAH 01
2861,STT INJILI SETIA SIAU,BAIK,WILAYAH PTAS
2862,UNIVERSITAS PRIMAGRAHA,BAIK,WILAYAH 04
2863,STT YESYURUN ARASTAMAR SERITI LUWU,BAIK,WILAYAH PTAS
2864,"STAI AN-NADWAH KUALA TUNGKAL, JAMBI",BAIK,WILAYAH PTAS
2865,STIT AL-HIKMAH TEBING TINGGI SUMATERA UTARA,BAIK,WILAYAH PTAS
2866,SEKOLAH TINGGI KEGURUAN DAN ILMU PENDIDIKAN PASUNDAN,B,WILAYAH 04
2867,AKADEMI KEBIDANAN WAHANA HUSADA BANDAR JAYA,BAIK,WILAYAH 02
2868,AKADEMI PARIWISATA PARAMITHA JAKARTA,BAIK,WILAYAH 03
2869,UNIVERSITAS BAKTI TUNAS HUSADA,B,WILAYAH 04
2870,UNIVERSITAS AMIKOM PURWOKERTO,B,WILAYAH 06
2872,SEKOLAH TINGGI TEOLOGI ARASTAMAR MAMASA,BAIK,WILAYAH PTAS
2873,STIT MULTAZAM,BAIK,WILAYAH PTAS
2874,UNIVERSITAS NGURAH RAI,BAIK SEKALI,WILAYAH 08
2875,SEKOLAH TINGGI ILMU AGAMA BUDDHA JINARAKKHITA,BAIK SEKALI,WILAYAH PTAS
2876,SEKOLAH TINGGI AGAMA ISLAM BATURAJA,BAIK,WILAYAH PTAS
2877,AKADEMI KEPERAWATAN BUNTET PESANTREN,BAIK,WILAYAH 04
2878,AKADEMI PARIWISATA YASMI,BAIK,WILAYAH 04
2879,UNIVERSITAS PASIFIK MOROTAI,BAIK,WILAYAH 12
2880,AKADEMI KEBIDANAN SEMPENA NEGERI PEKANBARU,BAIK,WILAYAH 17
2881,AKADEMI KEPERAWATAN HUSADA KARYA JAYA,BAIK,WILAYAH 03
2882,SEKOLAH TINGGI TEOLOGI IKSM SANTOSA ASIH,BAIK,WILAYAH PTAS
2883,UNIVERSITAS DARUSSALAM AMBON,BAIK SEKALI,WILAYAH 12
2884,"STAI AL-HIKMAH, TANJUNG BALAI, SUMATERA UTARA",BAIK,WILAYAH PTAS
2885,UNIVERSITAS BANTEN JAYA,BAIK,WILAYAH 04
2886,SEKOLAH TINGGI ILMU EKONOMI ADI UNGGUL BHIRAWA,B,WILAYAH 06
2887,UNIVERSITAS PEMBINAAN MASYARAKAT INDONESIA,BAIK,WILAYAH 01
2888,INSTITUT INJIL INDONESIA,BAIK,WILAYAH PTAS
2889,STIT ISLAMIC VILLAGE TANGERANG BANTEN,BAIK,WILAYAH PTAS
2890,INSTITUT AGAMA ISLAM AN NUR LAMPUNG,BAIK,WILAYAH PTAS
2891,INSTITUT TEKNOLOGI DAN BISNIS INDONESIA,BAIK,WILAYAH 01
2892,POLITEKNIK NEGERI BANYUWANGI,BAIK SEKALI,WILAYAH PTN
2893,SEKOLAH TINGGI ILMU KESEHATAN SEHATI,BAIK,WILAYAH 01
2894,SEKOLAH TINGGI ILMU KESEHATAN FATMAWATI,BAIK,WILAYAH 03
2895,STIT DARUSSALIMIN NAHDLATUL WATHAN PRAYA LOMBOK TENGAH NUSA TENGGARA BARAT,BAIK,WILAYAH PTAS
2896,INSTITUT PENDIDIKAN DAN BAHASA INVADA,B,WILAYAH 04
2897,UNIVERSITAS ISLAM NEGERI DATOKARAMA PALU,BAIK SEKALI,WILAYAH PTAN
2898,UNIVERSITAS BAITURRAHMAH,B,WILAYAH 10
2899,INSTITUT AGAMA KRISTEN NEGERI TORAJA,BAIK,WILAYAH PTAN
2900,SEKOLAH TINGGI ILMU KESEHATAN MAKARIWO HALMAHERA,BAIK,WILAYAH 12
2901,UNIVERSITAS HKBP NOMMENSEN PEMATANGSIANTAR,BAIK SEKALI,WILAYAH 01
2902,SEKOLAH TINGGI ILMU KEPOLISIAN,BAIK SEKALI,WILAYAH PTKL
2903,AKADEMI KEPERAWATAN SRI BUNGA TANJUNG,BAIK,WILAYAH 17
2904,SEKOLAH TINGGI EKONOMI ISLAM LPPM,BAIK,WILAYAH PTAS
2905,SEKOLAH TINGGI MANAJEMEN IMMI,BAIK SEKALI,WILAYAH 03
2906,UNIVERSITAS DAYANU IKHSANUDDIN,BAIK SEKALI,WILAYAH 09
2907,STAI AL-MUNAWWAROH TOLITOLI,BAIK,WILAYAH PTAS
2909,UNIVERSITAS BUDDHI DHARMA,BAIK,WILAYAH 04
2910,STAINU KOTABUMI LAMPUNG UTARA,BAIK,WILAYAH PTAS
2911,STAI MADIUN JAWA TIMUR,BAIK,WILAYAH PTAS
2912,STT GEREJA PROTESTAN INDONESIA PAPUA,BAIK,WILAYAH PTAS
2916,STIQ KEPULAUAN RIAU,BAIK,WILAYAH PTAS
2917,STAI BINAMADANI TANGERANG,BAIK,WILAYAH PTAS
2918,UNIVERSITAS ISLAM INDRAGIRI,BAIK,WILAYAH 17
2919,POLITEKNIK MALINAU,BAIK,WILAYAH 11
2920,STKIP PGRI NGANJUK,BAIK,WILAYAH 07
2921,SEKOLAH TINGGI MEDIA KOMUNIKASI TRISAKTI,BAIK,WILAYAH 03
2922,SEKOLAH TINGGI PARIWISATA BANDUNG,B,WILAYAH PTKL
2923,UNIVERSITAS KRISNADWIPAYANA,B,WILAYAH 03
2924,POLITEKNIK JAMBI,BAIK,WILAYAH 10
2925,UNIVERSITAS WISNUWARDHANA,B,WILAYAH 07
2926,UNIVERSITAS BOJONEGORO,BAIK,WILAYAH 07
2928,STISIP SYAMSUL ULUM,BAIK,WILAYAH 04
2929,SEKOLAH TINGGI ILMU ADMINISTRASI BANDUNG,BAIK,WILAYAH 04
2930,UNIVERSITAS NUSA BANGSA,BAIK,WILAYAH 04
2931,INSTITUT PERTANIAN STIPER,B,WILAYAH 05
2932,SEKOLAH TINGGI ILMU PERTANIAN DHARMA WACANA,B,WILAYAH 02
2933,AKADEMI KEBIDANAN HARAPAN IBU PEKALONGAN,BAIK,WILAYAH 06
2934,AKADEMI PARIWISATA INDONESIA JAKARTA,BAIK SEKALI,WILAYAH 03
2935,SEKOLAH TINGGI KEGURUAN DAN ILMU PENDIDIKAN AL-AMIN INDRAMAYU,BAIK,WILAYAH 04
2936,AMIK PARBINA NUSANTARA,BAIK,WILAYAH 01
2937,AKADEMI KEUANGAN DAN PERBANKAN MULIA DARMA PRATAMA,BAIK,WILAYAH 02
2938,SEKOLAH TINGGI ILMU TARBIYAH MUHAMMADIYAH BANGIL,BAIK,WILAYAH PTAS
2939,SEKOLAH TINGGI TEKNOLOGI BONTANG,BAIK,WILAYAH 11
2940,SEKOLAH TINGGI KEGURUAN DAN ILMU PENDIDIKAN MELAWI,BAIK,WILAYAH 11
2942,SEKOLAH TINGGI TEOLOGI INJILI INDONESIA BALI,BAIK,WILAYAH PTAS
2947,SEKOLAH TINGGI AGAMA ISLAM AL-GAZALI BONE,BAIK,WILAYAH PTAS
2949,INSTITUT KRISTEN BORNEO,BAIK,WILAYAH PTAS
2950,SEKOLAH TINGGI TEOLOGI BASOM,BAIK,WILAYAH PTAS
2951,AKADEMI KEPERAWATAN SAWERIGADING PEMDA LUWU,BAIK,WILAYAH 09
2953,UNIVERSITAS EFARINA,BAIK,WILAYAH 01
2954,SEKOLAH TINGGI ILMU TARBIYAH MISBAHUL ULUM GUMAWANG,BAIK,WILAYAH PTAS
2955,SEKOLAH TINGGI ILMU KESEHATAN JAYAPURA,BAIK,WILAYAH 14
2956,AKADEMI KEPERAWATAN RS MARTHEN INDEY,BAIK,WILAYAH 14
2957,AKADEMI ANALIS KESEHATAN HARAPAN BANGSA,BAIK,WILAYAH 02
2959,UNIVERSITAS PANCA MARGA,BAIK,WILAYAH 07
2960,AKADEMI KEBIDANAN BARUNA HUSADA SIBUHUAN,BAIK,WILAYAH 01
2961,SEKOLAH TINGGI ILMU ADMINISTRASI BAGASASI,BAIK,WILAYAH 04
2962,SEKOLAH TINGGI ILMU KESEHATAN KARYA KESEHATAN,BAIK,WILAYAH 09
2963,AKADEMI KEPERAWATAN BETHESDA SERUKAM,BAIK,WILAYAH 11
2964,SEKOLAH TINGGI ILMU EKONOMI MULIA SINGKAWANG,BAIK,WILAYAH 11
2965,INSTITUT AGAMA ISLAM AL-QODIRI JEMBER,BAIK,WILAYAH PTAS
2966,SEKOLAH TINGGI ILMU EKONOMI PETRA,BAIK,WILAYAH 16
2967,SEKOLAH TINGGI TEOLOGI SOTERIA PURWOKERTO,BAIK,WILAYAH PTAS
2968,POLITEKNIK KOTABARU,BAIK,WILAYAH 11
2970,POLITEKNIK ST. WILHELMUS,BAIK,WILAYAH 15
2971,POLITEKNIK KATOLIK SAINT PAUL,BAIK,WILAYAH 14
2973,AKADEMI MANAJEMEN INFORMATIKA DAN KOMPUTER KOSGORO,BAIK,WILAYAH 10
2974,STIT DARUL FATTAH BANDAR LAMPUNG,BAIK,WILAYAH PTAS
2975,SEKOLAH TINGGI AGAMA ISLAM AL-MA`ARIF WAY KANAN,BAIK,WILAYAH PTAS
2976,SEKOLAH TINGGI ILMU TARBIYAH AL-CHAERIYAH MAMUJU SULAWESI BARAT,BAIK,WILAYAH PTAS
2978,SEKOLAH TINGGI ILMU EKONOMI PENGEMBANGAN BISNIS DAN MANAJEMEN,BAIK,WILAYAH 03
2983,UNIVERSITAS LAKIDENDE UNAHAA,BAIK,WILAYAH 09
2984,SEKOLAH TINGGI ILMU TARBIYAH AL-QURANIYAH MANNA,BAIK,WILAYAH PTAS
2985,SEKOLAH TINGGI AGAMA ISLAM NIDA EL ADABI PARUNG PANJANG BOGOR,BAIK,WILAYAH PTAS
2986,SEKOLAH TINGGI ILMU EKONOMI EL FATAH MANADO,BAIK,WILAYAH 16
2988,POLITEKNIK PIKSI INPUT SERANG,BAIK,WILAYAH 04
2989,UNIVERSITAS MAHAKARYA ASIA,BAIK,WILAYAH 05
2991,SEKOLAH TINGGI ILMU TEKNIK TRISULA,BAIK,WILAYAH 02
2992,SEKOLAH TINGGI ILMU EKONOMI MUHAMMADIYAH KALIANDA,BAIK,WILAYAH 02
2993,UNIVERSITAS PEJUANG REPUBLIK INDONESIA,BAIK,WILAYAH 09
2994,"SEKOLAH TINGGI TEOLOGI BAPTIS PAPUA, ABEPURA",BAIK,WILAYAH PTAS
2995,SEKOLAH TINGGI ILMU KESEHATAN MITRA ADIGUNA,BAIK,WILAYAH 02
2996,AKADEMI KEPERAWATAN WIRAHUSADA MEDAN,BAIK,WILAYAH 01
2997,INSTITUT TEKNOLOGI DAN BISNIS HAJI AGUS SALIM BUKITTINGGI,BAIK,WILAYAH 10
2998,UNIVERSITAS KRISTEN PALANGKA RAYA,BAIK,WILAYAH 11
3000,SEKOLAH TINGGI AGAMA ISLAM DARUL HIKMAH,BAIK,WILAYAH PTAS
3001,STAI RAWA AOPA KONAWE SELATAN,BAIK,WILAYAH PTAS
3002,SEKOLAH TINGGI ILMU EKONOMI MIFTAHUL HUDA,BAIK,WILAYAH 04
3004,SEKOLAH TINGGI KEGURUAN DAN ILMU PENDIDIKAN PERSADA KHATULISTIWA SINTANG,BAIK,WILAYAH 11
3005,SEKOLAH TINGGI BAHASA ASING YAPARI,BAIK,WILAYAH 04
3006,SEKOLAH TINGGI ILMU EKONOMI INDONESIA MALANG,BAIK,WILAYAH 07
3007,STAIN GAJAH PUTIH TAKENGON ACEH TENGAH,BAIK,WILAYAH PTAN
3009,AKADEMI MARITIM DJADAJAT,BAIK,WILAYAH 03
3010,UNIVERSITAS AN NUUR,BAIK,WILAYAH 06
3011,UNIVERSITAS BINA TARUNA GORONTALO,BAIK,WILAYAH 16
3012,INSTITUT AGAMA ISLAM MUHAMMAD AZIM JAMBI,BAIK,WILAYAH PTAS
3013,UNIVERSITAS PGRI BANYUWANGI,BAIK,WILAYAH 07
3014,SEKOLAH TINGGI ILMU ADMINISTRASI PELITA NUSANTARA,BAIK,WILAYAH 13
3015,SEKOLAH TINGGI ILMU EKONOMI WIYATAMANDALA,BAIK,WILAYAH 03
3016,UNIVERSITAS SAMAWA,BAIK,WILAYAH 08
3017,SEKOLAH TINGGI PEMBANGUNAN MASYARAKAT SANTA URSULA,BAIK,WILAYAH 15
3018,UNIVERSITAS SAWERIGADING MAKASSAR,BAIK,WILAYAH 09
3021,UNIVERSITAS BINANIAGA INDONESIA,BAIK,WILAYAH 04
3022,SEKOLAH TINGGI ILMU BAHASA DAN SASTRA SATYA WIDYA,BAIK,WILAYAH 07
3024,SEKOLAH TINGGI ILMU ADMINISTRASI TABALONG,BAIK,WILAYAH 11
3025,INSTITUT AGAMA ISLAM AL MAWADDAH WARRAHMAH KOLAKA SULAWESI TENGGARA,BAIK,WILAYAH PTAS
3028,UNIVERSITAS ATMA JAYA MAKASSAR,BAIK,WILAYAH 09
3029,SEKOLAH TINGGI KEGURUAN DAN ILMU PENDIDIKAN CITRA BAKTI,BAIK,WILAYAH 15
3031,UNIVERSITAS NUKU,BAIK,WILAYAH 12
3033,AKADEMI FARMASI BHUMI HUSADA,BAIK,WILAYAH 03
3034,AKADEMI KESEJAHTERAAN SOSIAL AKK,BAIK,WILAYAH 05
3035,UNIVERSITAS BINA MANDIRI GORONTALO,BAIK,WILAYAH 16
3036,UNIVERSITAS ISLAM JEMBER,BAIK,WILAYAH 07
3037,UNIVERSITAS GAJAH PUTIH,BAIK,WILAYAH 13
3038,STT BETHEL INDONESIA JAKARTA,BAIK,WILAYAH PTAS
3039,POLITEKNIK TEDC,BAIK,WILAYAH 04
3040,INSTITUT KESEHATAN DAN BISNIS SURABAYA,BAIK,WILAYAH 07
3041,POLITEKNIK SAWUNGGALIH AJI,BAIK,WILAYAH 06
3042,INSTITUT DIROSAT ISLAMIYAH AL-AMIEN PRENDUAN SUMENEP,BAIK,WILAYAH PTAS
3043,UNIVERSITAS PAT PETULAI,BAIK,WILAYAH 02
3044,STAI AULIAURRASYIDIN,BAIK,WILAYAH PTAS
3045,STIKES PELITA IBU,BAIK,WILAYAH 09
3047,UNIVERSITAS KATOLIK WIDYA KARYA,BAIK,WILAYAH 07
3049,AKADEMI KEPERAWATAN LAPATAU BONE,BAIK,WILAYAH 09
3050,POLITEKNIK NEGERI LHOKSEUMAWE,BAIK SEKALI,WILAYAH PTN
3052,SEKOLAH TINGGI MANAJEMEN INFORMATIKA DAN KOMPUTER HORIZON KARAWANG,BAIK,WILAYAH 04
3053,UNIVERSITAS MARITIM AMNI,BAIK SEKALI,WILAYAH 06
3054,POLITEKNIK NEGERI MADURA,BAIK SEKALI,WILAYAH PTN
