institution_code,institution_name,akreditasi_institusi,wilayah
977,SEKOLAH TINGGI ILMU EKONOMI GENTIARAS,BAIK SEKALI,WILAYAH 02
978,POLITEKNIK KATOLIK MANGUNWIJAYA,BAIK SEKALI,WILAYAH 06
979,UNIVERSITAS HKBP NOMMENSEN,BAIK SEKALI,WILAYAH 01
980,SEKOLAH TINGGI ILMU USHULUDDIN WADI MUBARAK BOGOR JAWA BARAT,BAIK,WILAYAH PTAS
981,UNIVERSITAS CARITAS INDONESIA,BAIK,WILAYAH 14
982,INSTITUT PESANTREN BABAKAN CIREBON,BAIK,WILAYAH PTAS
984,UNIVERSITAS AL-HIKMAH INDONESIA,BAIK,WILAYAH PTAS
986,SEKOLAH TINGGI ILMU TARBIYAH ASSUNNIYAH TAMBARANGAN RANTAU TAPIN,BAIK,WILAYAH PTAS
988,SEKOLAH TINGGI TEOLOGI LUTHERAN YOGYA,BAIK,WILAYAH PTAS
989,STAI MA`HAD ALY AL-HIKAM MALANG,BAIK SEKALI,WILAYAH PTAS
990,STIMI BANJARMASIN,BAIK SEKALI,WILAYAH 11
991,SEKOLAH TINGGI ILMU EKONOMI TRISAKTI,UNGGUL,WILAYAH 03
992,UNIVERSITAS ISLAM NEGERI WALISONGO SEMARANG,UNGGUL,WILAYAH PTAN
993,SEKOLAH TINGGI ILMU EKONOMI PGRI DEWANTARA,BAIK SEKALI,WILAYAH 07
994,SEKOLAH TINGGI ILMU HUKUM IBLAM,BAIK SEKALI,WILAYAH 03
995,UNIVERSITAS AMIKOM YOGYAKARTA,BAIK SEKALI,WILAYAH 05
996,SEKOLAH TINGGI ILMU EKONOMI INDONESIA MAKASSAR,BAIK,WILAYAH 09
997,STT ANUGERAH ALIANSE SEMARANG,BAIK,WILAYAH PTAS
998,SEKOLAH TINGGI TEOLOGI WALTER POST JAYAPURA PAPUA,BAIK,WILAYAH PTAS
999,SEKOLAH TINGGI TEOLOGI PRESBYTERIAN BATAM,BAIK,WILAYAH PTAS
1000,SEKOLAH TINGGI THEOLOGIA INJILI INDONESIA PONTIANAK,BAIK,WILAYAH PTAS
1003,AKADEMI MARITIM MALUKU,BAIK,WILAYAH 12
1004,POLITEKNIK PERTANIAN YASANTO,BAIK,WILAYAH 14
1005,POLITEKNIK BINTAN CAKRAWALA,BAIK,WILAYAH 17
1006,SEKOLAH TINGGI AGAMA KRISTEN ABDI WACANA PONTIANAK,BAIK,WILAYAH PTAS
1007,SEKOLAH TINGGI AGAMA ISLAM DAARUT TAUHIID,BAIK,WILAYAH PTAS
1008,SEKOLAH TINGGI ILMU TARBIYAH NAHDLATUL ULAMA SUMBER AGUNG OKU TIMUR,BAIK,WILAYAH PTAS
1009,POLITEKNIK INDONUSA SURAKARTA,BAIK SEKALI,WILAYAH 06
1010,SEKOLAH TINGGI ILMU HUKUM PROFESOR GAYUS LUMBUUN,BAIK SEKALI,WILAYAH 03
1011,SEKOLAH TINGGI ILMU BAHASA ASING BUMI BERINGIN,BAIK,WILAYAH 16
1013,SEKOLAH TINGGI ILMU EKONOMI BULUNGAN TARAKAN,BAIK,WILAYAH 11
1014,AKADEMI KOMUNITAS INDUSTRI PERTAMBANGAN BUKIT ASAM,BAIK,WILAYAH 02
1015,SEKOLAH TINGGI KEGURUAN DAN ILMU PENDIDIKAN SURYA KASIH,BAIK,WILAYAH 15
1016,POLITEKNIK BOMBANA,BAIK,WILAYAH 09
1017,"STIT YPI AL-YAQIN MUARO SIJUNJUNG, SAWAHLUNTO",BAIK,WILAYAH PTAS
1018,POLITEKNIK KESDAM VI BANJARMASIN,BAIK,WILAYAH 11
1019,SEKOLAH TINGGI TEOLOGI PELITA KEBENARAN,BAIK,WILAYAH PTAS
1020,INSTITUT TEKNOLOGI DAN KESEHATAN IKA BINA,BAIK,WILAYAH 01
1021,AKADEMI KEPERAWATAN TEUNGKU FAKINAH BANDA ACEH,BAIK,WILAYAH 13
1022,SEKOLAH TINGGI TEOLOGI JAFFRAY JAKARTA,BAIK,WILAYAH PTAS
1023,UNIVERSITAS RIAU,UNGGUL,WILAYAH PTN
1024,SEKOLAH TINGGI TEOLOGI YERUSALEM BARU MANADO,BAIK,WILAYAH PTAS
1026,UNIVERSITAS ISLAM NEGERI IMAM BONJOL PADANG,UNGGUL,WILAYAH PTAN
1027,UNIVERSITAS PAKUAN,UNGGUL,WILAYAH 04
1028,INSTITUT KESEHATAN HELVETIA PEKANBARU,BAIK,WILAYAH 17
1029,SEKOLAH TINGGI TEOLOGI PARAKLETOS SURABAYA,BAIK,WILAYAH PTAS
1030,STAI YAMISA SOREANG,BAIK,WILAYAH PTAS
1031,SEKOLAH TINGGI ILMU SYARIAH DARUL ULUM LAMPUNG TIMUR,BAIK,WILAYAH PTAS
1032,SEKOLAH TINGGI TEOLOGI PANTEKOSTA BATAM,BAIK,WILAYAH PTAS
1033,SEKOLAH TINGGI EKONOMI ISLAM SEKAYU PALEMBANG,BAIK,WILAYAH PTAS
1034,SEKOLAH TINGGI ILMU EKONOMI SYARIAH SALEH BUDIMAN,BAIK,WILAYAH PTAS
1035,STIS KEBUMEN JAWA TENGAH,BAIK,WILAYAH PTAS
1036,INSTITUT ISLAM AL-MUJADDID SABAK,BAIK,WILAYAH PTAS
1037,SEKOLAH TINGGI AGAMA ISLAM NEGERI MANDAILING NATAL,BAIK SEKALI,WILAYAH PTAN
1038,UNIVERSITAS ISLAM JAKARTA,BAIK SEKALI,WILAYAH 03
1039,UNIVERSITAS WANITA INTERNASIONAL,BAIK SEKALI,WILAYAH 04
1040,AKADEMI KESEHATAN KARTINI BATAM,BAIK,WILAYAH 17
1042,UNIVERSITAS MITRA BANGSA,BAIK SEKALI,WILAYAH 03
1044,UNIVERSITAS MUHAMMADIYAH TEGAL,BAIK,WILAYAH 06
1045,POLITEKNIK GUSDURIAN,BAIK,WILAYAH 06
1046,UNIVERSITAS SANTO BORROMEUS,B,WILAYAH 04
1047,SEKOLAH TINGGI TEOLOGI INJILI MAHKOTA SION SAUMLAKI,BAIK,WILAYAH PTAS
1048,SEKOLAH TINGGI OLAHRAGA DAN KESEHATAN BINA GUNA,BAIK SEKALI,WILAYAH 01
1050,UNIVERSITAS SEPULUH NOPEMBER PAPUA,BAIK,WILAYAH 14
1051,AKADEMI KOMUNITAS NURUL JADID,BAIK,WILAYAH 07
1052,SEKOLAH TINGGI AGAMA ISLAM SENORI TUBAN,BAIK,WILAYAH PTAS
1053,INSTITUT AGAMA ISLAM NEGERI PONOROGO,UNGGUL,WILAYAH PTAN
1054,SEKOLAH TINGGI TEOLOGI EXCELSIUS,BAIK,WILAYAH PTAS
1057,STT RUMAH MURID KRISTUS BITUNG,BAIK,WILAYAH PTAS
1058,POLITEKNIK DAMARA,BAIK,WILAYAH 06
1059,INSTITUT TEKNOLOGI DAN SAINS MANDALA,BAIK SEKALI,WILAYAH 07
1060,SEKOLAH TINGGI AGAMA ISLAM IMAM BUKHORI BULUKUMBA,BAIK,WILAYAH PTAS
1061,UNIVERSITAS ACHMAD YANI BANJARMASIN,B,WILAYAH 11
1063,AKADEMI PENERBANG INDONESIA BANYUWANGI,BAIK SEKALI,WILAYAH PTKL
1064,UNIVERSITAS NAHDLATUL ULAMA INDONESIA,BAIK SEKALI,WILAYAH 03
1065,POLITEKNIK UNGGULAN CIPTA MANDIRI,BAIK,WILAYAH 01
1066,INSTITUT DIGITAL EKONOMI LPKIA,BAIK,WILAYAH 04
1067,SEKOLAH TINGGI ILMU KESEHATAN BOGOR HUSADA,BAIK,WILAYAH 04
1068,INSTITUT BISNIS DAN INFORMATIKA KOSGORO 1957,BAIK SEKALI,WILAYAH 03
1069,SEKOLAH TINGGI ILMU ADMINISTRASI KARYA DHARMA MERAUKE,BAIK,WILAYAH 14
1070,SEKOLAH TINGGI KEGURUAN DAN ILMU PENDIDIKAN MUHAMMADIYAH OKU TIMUR,BAIK,WILAYAH 02
1071,SEKOLAH TINGGI ILMU KESEHATAN MITRA HUSADA MEDAN,UNGGUL,WILAYAH 01
1072,UNIVERSITAS QUALITY BERASTAGI,BAIK,WILAYAH 01
1073,INSTITUT SYEKH ABDUL HALIM HASAN BINJAI,BAIK,WILAYAH PTAS
1074,AKADEMI KOMUNITAS TOYOTA INDONESIA,BAIK SEKALI,WILAYAH 04
1075,SEKOLAH TINGGI ILMU EKONOMI SULAWESI UTARA,BAIK,WILAYAH 16
1076,AKADEMI KEBIDANAN WIJAYA KUSUMA MALANG,BAIK,WILAYAH 12
1077,UNIVERSITAS INTERNASIONAL JAKARTA,BAIK,WILAYAH 04
1078,INSTITUT TEKNOLOGI BISNIS DAN KESEHATAN MUHAMMADIYAH TULUNGAGUNG,BAIK,WILAYAH 07
1079,INSTITUT AGAMA ISLAM SYEKH MAULANA QORI BANGKO,BAIK SEKALI,WILAYAH PTAS
1080,SEKOLAH TINGGI AGAMA ISLAM ALIF LAAM MIIM SURABAYA,BAIK,WILAYAH PTAS
1081,STITNU SAKINAH DHARMASRAYA,BAIK,WILAYAH PTAS
1082,UNIVERSITAS PRASETIYA MULYA,BAIK SEKALI,WILAYAH 03
1083,SEKOLAH TINGGI ILMU KEPERAWATAN FAMIKA,BAIK,WILAYAH 09
1084,SEKOLAH TINGGI ILMU KESEHATAN INDAH MEDAN,BAIK,WILAYAH 01
1085,UNIVERSITAS ICHSAN SIDENRENG RAPPANG,BAIK,WILAYAH 09
1086,UNIVERSITAS MITRA INDONESIA,BAIK SEKALI,WILAYAH 02
1087,INSTITUT BISNIS DAN EKONOMI INDONESIA,BAIK,WILAYAH 11
1088,"STAI RAUDHATUL AKMAL, DELI SERDANG, SUMATERA UTARA",BAIK,WILAYAH PTAS
1089,AKADEMI KEBIDANAN SISMADI,BAIK,WILAYAH 03
1091,POLITEKNIK PELAYARAN SURABAYA,UNGGUL,WILAYAH PTKL
1092,UNIVERSITAS BHAKTI ASIH TANGERANG,BAIK,WILAYAH 04
1093,UNIVERSITAS MERCUBAKTIJAYA,B,WILAYAH 10
1094,UNIVERSITAS PGRI KALIMANTAN,B,WILAYAH 11
1095,INSTITUT AGAMA ISLAM PERSIS BANDUNG,BAIK SEKALI,WILAYAH PTAS
1096,POLITEKNIK PRASETIYA MANDIRI,BAIK,WILAYAH 04
1097,INSTITUT PAHLAWAN 12,BAIK,WILAYAH 02
1098,INSTITUT AGAMA ISLAM PEMALANG,BAIK,WILAYAH PTAS
1099,UNIVERSITAS SYEDZA SAINTIKA,B,WILAYAH 10
1100,UNIVERSITAS ISLAM NEGERI SUMATERA UTARA MEDAN,UNGGUL,WILAYAH PTAN
1101,UNIVERSITAS ISLAM NEGERI SULTAN SYARIF KASIM RIAU,UNGGUL,WILAYAH PTAN
1102,UNIVERSITAS JAMBI,UNGGUL,WILAYAH PTN
1103,SEKOLAH TINGGI FILSAFAT TEOLOGI WIDYA SASANA,B,WILAYAH 07
1104,AMIK TOMAKAKA,BAIK,WILAYAH 09
1105,SEKOLAH TINGGI ILMU ADMINISTRASI TRINITAS,BAIK,WILAYAH 12
1106,SEKOLAH TINGGI ILMU EKONOMI IGI,BAIK,WILAYAH 03
1107,UNIVERSITAS 45 SURABAYA,BAIK,WILAYAH 07
1108,SEKOLAH TINGGI ILMU EKONOMI PUTRA TIMOR,BAIK,WILAYAH 15
1109,SEKOLAH TINGGI TEOLOGI PANTEKOSTA JAKARTA,BAIK,WILAYAH PTAS
1110,SEKOLAH TINGGI TEOLOGI ABDI GUSTI NGANJUK,BAIK,WILAYAH PTAS
1111,STT PRESBYTERIAN INDONESIA,BAIK,WILAYAH PTAS
1112,SEKOLAH TINGGI ILMU TARBIYAH HIDAYATULLAH BATAM KEPULAUAN RIAU,BAIK,WILAYAH PTAS
1113,INSTITUT KEISLAMAN TUAH NEGERI,BAIK,WILAYAH PTAS
1114,SEKOLAH TINGGI ILMU EKONOMI PELITA BUANA,BAIK,WILAYAH 09
1115,SEKOLAH TINGGI ILMU EKONOMI DHARMA AGUNG INDONESIA,BAIK,WILAYAH 04
1117,INSITUT ILMU KESEHATAN NAHDLATUL ULAMA TUBAN,BAIK SEKALI,WILAYAH 07
1119,AKADEMI SEKRETARI DAN MANAJEMEN PERSADA BUNDA,BAIK,WILAYAH 17
1120,INSTITUT DARUL ULUM SAROLANGUN,BAIK,WILAYAH PTAS
1121,STAI MIFTAHUL ULUM TASIKMALAYA,BAIK,WILAYAH PTAS
1122,INSTITUT UMMUL QURO AL-ISLAMI BOGOR JAWA BARAT,BAIK,WILAYAH PTAS
1124,UNIVERSITAS W R SUPRATMAN,BAIK,WILAYAH 07
1125,SEKOLAH TINGGI EKONOMI DAN BISNIS ISLAM AL JABAR BANDUNG JAWA BARAT,BAIK,WILAYAH PTAS
1127,SEKOLAH TINGGI ILMU TARBIYAH AZ ZAHRA TASIKMALAYA,BAIK,WILAYAH PTAS
1128,SEKOLAH TINGGI TEOLOGI EKKLESIA PONTIANAK,BAIK,WILAYAH PTAS
1129,STT HARAPAN INDAH,BAIK,WILAYAH PTAS
1130,UNIVERSITAS CENDEKIA MITRA INDONESIA,BAIK,WILAYAH 05
1131,INSTITUT TEKNOLOGI BACHARUDDIN JUSUF HABIBIE,BAIK,WILAYAH PTN
1132,SEKOLAH TINGGI AGAMA ISLAM AL-UTSMANI BONDOWOSO,BAIK,WILAYAH PTAS
1133,UNIVERSITAS GRAHA NUSANTARA,B,WILAYAH 01
1134,UNIVERSITAS MUHAMMADIYAH CILEUNGSI,BAIK,WILAYAH 04
1135,STKIP SINAR CENDEKIA,BAIK,WILAYAH 04
1136,POLITEKNIK KRAKATAU,BAIK,WILAYAH 04
1137,SEKOLAH TINGGI ILMU HUKUM CENDANA WANGI,BAIK,WILAYAH 15
1138,SEKOLAH TINGGI AGAMA ISLAM KUPANG,BAIK,WILAYAH PTAS
1140,UNIVERSITAS TOMAKAKA,BAIK,WILAYAH 09
1141,POLITEKNIK SIBER DAN SANDI NEGARA,BAIK SEKALI,WILAYAH PTKL
1142,UNIVERSITAS MUHAMMADIYAH MAHAKARYA ACEH,BAIK SEKALI,WILAYAH 13
1143,"SEKOLAH TINGGI TEOLOGI BETHEL THE WAY, JAKARTA",BAIK,WILAYAH PTAS
1144,SEKOLAH TINGGI ILMU KESEHATAN PEMKAB JOMBANG,BAIK SEKALI,WILAYAH 07
1145,STKIP PESISIR SELATAN,BAIK,WILAYAH 10
1146,POLITEKNIK MUARA TEWEH,BAIK,WILAYAH 11
1147,UNIVERSITAS ISLAM NEGERI SUNAN AMPEL,UNGGUL,WILAYAH PTAN
1148,AMIK MASTER LAMPUNG,BAIK,WILAYAH 02
1149,SEKOLAH TINGGI ILMU KESEHATAN MAYAPADA,BAIK,WILAYAH 03
1150,SEKOLAH TINGGI BAHASA ASING MALANG,BAIK,WILAYAH 07
1151,STT INJILI JAKARTA,BAIK,WILAYAH PTAS
1152,UNIVERSITAS ISLAM RIAU,UNGGUL,WILAYAH 17
1153,UNIVERSITAS PEMBANGUNAN PANCA BUDI,UNGGUL,WILAYAH 01
1154,UNIVERSITAS ISLAM NEGERI SJECH M. DJAMIL DJAMBEK BUKITTINGGI,UNGGUL,WILAYAH PTAN
1155,UNIVERSITAS SULTAN AGENG TIRTAYASA,UNGGUL,WILAYAH PTN
1156,SEKOLAH TINGGI ILMU SYARIAH UMMUL AYMAN PIDIE JAYA,BAIK,WILAYAH PTAS
1157,STAI AL-FATAH CILEUNGSI BOGOR,BAIK,WILAYAH PTAS
1158,STT PERIAGO,BAIK,WILAYAH PTAS
1160,SEKOLAH TINGGI ILMU HUKUM SUMPAH PEMUDA,UNGGUL,WILAYAH 02
1161,SEKOLAH TINGGI ILMU KESEHATAN SERULINGMAS,BAIK SEKALI,WILAYAH 06
1162,UNIVERSITAS MUHAMMADIYAH PEKAJANGAN PEKALONGAN,BAIK SEKALI,WILAYAH 06
1163,UNIVERSITAS SARJANAWIYATA TAMANSISWA,BAIK SEKALI,WILAYAH 05
1164,AKADEMI KEBIDANAN MINASA UPA,BAIK,WILAYAH 09
1165,INSTITUT TEKNOLOGI KELING KUMANG,BAIK,WILAYAH 11
1166,UNIVERSITAS 17 AGUSTUS 1945 SAMARINDA,BAIK SEKALI,WILAYAH 11
1167,UNIVERSITAS OKMIN PAPUA,BAIK,WILAYAH 14
1168,STKIP NUSA TIMOR,BAIK,WILAYAH 15
1169,UNIVERSITAS SATYAGAMA,BAIK,WILAYAH 03
1170,SEKOLAH TINGGI TEKNOLOGI IMMANUEL,BAIK,WILAYAH 01
1171,POLITEKNIK PIKSI GANESHA INDONESIA,BAIK SEKALI,WILAYAH 06
1172,AKADEMI KOMUNITAS NEGERI REJANG LEBONG,BAIK,WILAYAH PTN
1173,POLITEKNIK DEWANTARA,BAIK,WILAYAH 09
1174,UNIVERSITAS AL WASHLIYAH DARUSSALAM BANDA ACEH,BAIK,WILAYAH 13
1175,SEKOLAH TINGGI TEOLOGI TABGHA BATAM,BAIK,WILAYAH PTAS
1177,SEKOLAH TINGGI TEOLOGI IMMANUEL SINTANG KAL-BAR,BAIK,WILAYAH PTAS
1178,SEKOLAH TINGGI ILMU KESEHATAN PELITA ILMU DEPOK,BAIK,WILAYAH 04
1179,AKADEMI KEBIDANAN SARI HUSADA,BAIK,WILAYAH 01
1180,POLITEKNIK LENGGURU,BAIK,WILAYAH 14
1181,UNIVERSITAS DOKTOR HUSNI INGRATUBUN PAPUA,B,WILAYAH 14
1182,UNIVERSITAS BANTEN,BAIK,WILAYAH 04
1184,INSTITUT SAINS DAN BISNIS INTERNASIONAL SINGKAWANG,BAIK SEKALI,WILAYAH 11
1185,SEKOLAH TINGGI ILMU KESEHATAN KAMUS ARUNIKA,BAIK,WILAYAH 09
1186,STISIP BUNDA TANAH MELAYU,BAIK,WILAYAH 17
1187,SEKOLAH TINGGI TEOLOGI INJILI DAN KEJURUAN KUPANG,BAIK,WILAYAH PTAS
1188,AKADEMIK KEBIDANAN ARMINA CENTRE PANYABUNGAN,BAIK,WILAYAH 01
1189,POLITEKNIK KARTINI JAKARTA,BAIK,WILAYAH 03
1190,"STIT PAGAR ALAM, SUMATERA SELATAN",BAIK,WILAYAH PTAS
1191,AMIK BUMI NUSANTARA,BAIK,WILAYAH 04
1192,SEKOLAH TINGGI EKONOMI DAN BISNIS ISLAM PAGARALAM,BAIK,WILAYAH PTAS
1193,SEKOLAH TINGGI TEOLOGI PRESBYTERIAN MEDAN,BAIK,WILAYAH PTAS
1194,SEKOLAH TINGGI ILMU TARBIYAH HIDAYATUNNAJAH BEKASI,BAIK,WILAYAH PTAS
1195,SEKOLAH TINGGI EKONOMI DAN BISNIS ISLAM KYAI HAJI AHMAD SYAIRAZI,BAIK,WILAYAH PTAS
1196,UNIVERSITAS TRUNOJOYO,UNGGUL,WILAYAH PTN
1197,AKADEMI KOMUNITAS BPPMNU BANAT,BAIK,WILAYAH 06
1198,POLITEKNIK KESEHATAN BHAKTI MULIA,BAIK,WILAYAH 06
1199,"STAI DDI MANGKOSO, BARRU, SULAWESI SELATAN",BAIK,WILAYAH PTAS
1201,AKADEMI AKUNTANSI BANDUNG,BAIK,WILAYAH 04
1203,STMIK KRISTEN NEUMANN INDONESIA,BAIK,WILAYAH 01
1205,SEKOLAH TINGGI AGAMA KRISTEN LUWUK BANGGAI,BAIK,WILAYAH PTAS
1206,SEKOLAH TINGGI ILMU KESEHATAN ABDI PERSADA BANJARMASIN,BAIK,WILAYAH 11
1207,STAI YPBWI SURABAYA,BAIK,WILAYAH PTAS
1208,UNIVERSITAS ARY GINANJAR,BAIK,WILAYAH 03
1209,STAI AL-MASTHURIYAH SUKABUMI,BAIK,WILAYAH PTAS
1210,SEKOLAH TINGGI TEOLOGI PRESBYTERIAN SHEMA,BAIK,WILAYAH PTAS
1211,POLITEKNIK TRIDAYA VIRTU MOROSI,BAIK,WILAYAH 09
1212,UNIVERSITAS NAHDLATUL ULAMA MALUKU UTARA,BAIK,WILAYAH 12
1213,INSTITUT TEKNOLOGI AL-MUHAJIRIN,BAIK,WILAYAH 04
1214,AKADEMI KEPERAWATAN PELNI,BAIK,WILAYAH 03
1215,AKADEMI KEBIDANAN MADINA HUSADA,BAIK,WILAYAH 01
1216,UNIVERSITAS ISLAM NEGERI SAYYID ALI RAHMATULLAH TULUNGAGUNG,UNGGUL,WILAYAH PTAN
1217,SEKOLAH TINGGI ILMU KESEHATAN MAJAPAHIT,B,WILAYAH 07
1218,UNIVERSITAS KATOLIK INDONESIA SANTU PAULUS RUTENG,B,WILAYAH 15
1219,INSTITUT TEKNOLOGI DAN KESEHATAN TRI TUNAS NASIONAL,BAIK,WILAYAH 09
1220,AKADEMI FARMASI TORAJA,BAIK,WILAYAH 09
1221,SEKOLAH TINGGI TEOLOGI EKUMENE MEDAN,BAIK,WILAYAH PTAS
1222,INSTITUT MEKONGGA,BAIK,WILAYAH 09
1224,AKADEMI SEKRETARI TRIGUNA,BAIK,WILAYAH 04
1225,AMIK TRI DHARMA PALU,BAIK,WILAYAH 16
1226,UNIVERSITAS AWAL BROS,BAIK SEKALI,WILAYAH 17
1227,UNIVERSITAS SRAGEN,BAIK,WILAYAH 06
1228,INSTITUT AT TANWIR BOJONEGORO,BAIK,WILAYAH PTAS
1230,INSTITUT TEKNOLOGI KALIMANTAN,BAIK SEKALI,WILAYAH PTN
1231,UNIVERSITAS JENDERAL SOEDIRMAN,UNGGUL,WILAYAH PTN
1232,STMIK PGRI TANGERANG,BAIK,WILAYAH 04
1233,SEKOLAH TINGGI ILMU EKONOMI SEMARANG,BAIK SEKALI,WILAYAH 06
1234,UNIVERSITAS ISLAM NEGERI K.H. ABDURRAHMAN WAHID PEKALONGAN,UNGGUL,WILAYAH PTAN
1235,STMIK GANESHA BANDUNG,BAIK,WILAYAH 04
1236,STKIP PELITA NUSANTARA BUTON,BAIK,WILAYAH 09
1238,UNIVERSITAS NAZHATUT THULLAB AL-MUAFA SAMPANG,BAIK,WILAYAH 07
1239,SEKOLAH TINGGI TEOLOGI RUSSEL TIMIKA,BAIK,WILAYAH PTAS
1240,SEKOLAH TINGGI AGAMA ISLAM AL ITTIHAD CIANJUR JAWA BARAT,BAIK,WILAYAH PTAS
1241,UNIVERSITAS ISLAM NEGERI KIAI HAJI ACHMAD SIDDIQ JEMBER,UNGGUL,WILAYAH PTAN
1242,UNIVERSITAS TANJUNGPURA,UNGGUL,WILAYAH PTN
1243,UNIVERSITAS MUHAMMADIYAH KUDUS,BAIK SEKALI,WILAYAH 06
1244,STIKES ADI HUSADA,BAIK SEKALI,WILAYAH 07
1245,UNIVERSITAS ISLAM NEGERI MATARAM,UNGGUL,WILAYAH PTAN
1246,UNIVERSITAS HANG TUAH PEKANBARU,BAIK SEKALI,WILAYAH 17
1247,SEKOLAH TINGGI FILSAFAT DRIYARKARA,UNGGUL,WILAYAH 03
1248,INSTITUT TEKNOLOGI SAINS DAN KESEHATAN PKU MUHAMMADIYAH SURAKARTA,BAIK SEKALI,WILAYAH 06
1249,INSTITUT TEKNOLOGI DEL,BAIK SEKALI,WILAYAH 01
1250,INSTITUT AGAMA ISLAM TAZKIA,BAIK SEKALI,WILAYAH PTAS
1251,STKIP KRISTEN WAMENA,BAIK,WILAYAH 14
1252,UNIVERSITAS CAHAYA PRIMA,BAIK SEKALI,WILAYAH 09
1253,UNIVERSITAS SUGENG HARTONO,BAIK,WILAYAH 06
1254,UNIVERSITAS DARUNNAJAH,BAIK,WILAYAH 03
1256,UNIVERSITAS MUHAMMADIYAH MAUMERE,BAIK,WILAYAH 15
1257,INSTITUT TARUMANAGARA,BAIK,WILAYAH 03
1258,SEKOLAH TINGGI ILMU KESEHATAN PANCA BHAKTI PONTIANAK,BAIK SEKALI,WILAYAH 11
1259,UNIVERSITAS TEKNOLOGI BANDUNG,BAIK,WILAYAH 04
1260,"STAI AL-FALAH CICALENGKA, BANDUNG",BAIK,WILAYAH PTAS
1261,SEKOLAH TINGGI ILMU EKONOMI WIDYA MANGGALA,BAIK SEKALI,WILAYAH 06
1262,SEKOLAH TINGGI MANAJEMEN ASURANSI TRISAKTI,BAIK SEKALI,WILAYAH 03
1263,INSTITUT INFORMATIKA DAN BISNIS DARMAJAYA,BAIK SEKALI,WILAYAH 02
1264,SEKOLAH TINGGI ILMU PERTANIAN YASHAFA,BAIK,WILAYAH 13
1265,UNIVERSITAS YARSI PRATAMA,BAIK,WILAYAH 04
1269,AKADEMI KEPERAWATAN SARI HUSADA,BAIK,WILAYAH 01
1271,INSTITUT TEKNOLOGI DAN BISNIS TUBAN,BAIK,WILAYAH 07
1272,SEKOLAH TINGGI ILMU AL-QURAN AN-NUR LEMPUING OKI,BAIK,WILAYAH PTAS
1273,STAI MIFTAHUL HUDA AL-AZHAR BANJAR,BAIK,WILAYAH PTAS
1274,INSTITUT KESEHATAN DAN BISNIS ST. FATIMAH MAMUJU,BAIK,WILAYAH 09
1275,INSTITUT TEKNOLOGI PERTANIAN,BAIK,WILAYAH 09
1276,POLITEKNIK BHAKTI SEMESTA,BAIK,WILAYAH 06
1277,POLITEKNIK RUKUN ABDI LUHUR,BAIK,WILAYAH 06
1278,UNIVERSITAS AL HIKMAH JEPARA,BAIK,WILAYAH 06
1279,POLITEKNIK SANDI KARSA,BAIK,WILAYAH 09
1280,SEKOLAH TINGGI ILMU KESEHATAN RS HUSADA,BAIK,WILAYAH 03
1281,SEKOLAH TINGGI ILMU EKONOMI PORT NUMBAY JAYAPURA,BAIK,WILAYAH 14
1282,SEKOLAH TINGGI TEOLOGI INJILI ARASTAMAR JAKARTA,BAIK,WILAYAH PTAS
1283,SEKOLAH TINGGI TEOLOGI IMANUEL MINISTRY EL SHADDAY,BAIK,WILAYAH PTAS
1284,AKADEMI ANALIS KESEHATAN MALANG,BAIK,WILAYAH 07
1285,SEKOLAH TINGGI TEOLOGI SOLA GRATIA INDONESIA,BAIK,WILAYAH PTAS
1286,UNIVERSITAS DARMA AGUNG,BAIK,WILAYAH 01
1287,UNIVERSITAS DR. DJAR WATTIHELUW,BAIK,WILAYAH 12
1288,SEKOLAH TINGGI SENI MUSIK BANDUNG,BAIK,WILAYAH 04
1289,SEKOLAH TINGGI BAHASA ASING BINA DINAMIKA CIANJUR,BAIK,WILAYAH 04
1290,INSTITUT NASIONAL FLORES,BAIK,WILAYAH 15
1293,"STAI MA`ARIF SINTANG, KALIMANTAN BARAT",BAIK,WILAYAH PTAS
1295,UNIVERSITAS PERTIWI,BAIK,WILAYAH 04
1296,SEKOLAH TINGGI ILMU KESEHATAN CIANJUR,BAIK,WILAYAH 04
1298,AKADEMI TEKNIK ALAT BERAT INDONESIA,BAIK,WILAYAH 07
1299,INSTITUT TEKNOLOGI DAN BISNIS MESUJI,BAIK,WILAYAH 02
1300,POLITEKNIK INSAN TAZAKKA,BAIK,WILAYAH 04
1301,AKADEMI BAHASA ASING UMI MAKASSAR,BAIK,WILAYAH 09
1302,STIBA INDONESIA LPI,BAIK,WILAYAH 03
1303,STMIK MUARA DUA,BAIK,WILAYAH 02
1305,AKADEMI MANAJEMEN INFORMATIKA DAN KOMPUTER ITMI,BAIK,WILAYAH 01
1306,SEKOLAH TINGGI ILMU KESEHATAN MITRA SEJATI,BAIK,WILAYAH 01
1307,POLITEKNIK GEOLOGI DAN PERTAMBANGAN AGP,BAIK,WILAYAH 04
1308,AKADEMI KEUANGAN PERBANKAN NUSANTARA,BAIK,WILAYAH 13
1311,INSTITUT TEKNOLOGI DAN BISNIS CARNEGIE,BAIK,WILAYAH 01
1312,STKIP AHLUSSUNNAH,BAIK,WILAYAH 10
1314,POLITEKNIK GUNAKARYA INDONESIA BEKASI,BAIK,WILAYAH 04
1316,SEKOLAH TINGGI TEKNOLOGI INFORMASI NIIT,BAIK,WILAYAH 03
1317,INSTITUT TEKNOLOGI SAPTA MANDIRI,BAIK,WILAYAH 11
1318,AKADEMI PARIWISATA MEDAN HOTEL SCHOOL,BAIK,WILAYAH 01
1319,POLITEKNIK KREATIF INDONESIA,BAIK,WILAYAH 03
1320,UNIVERSITAS AUDI INDONESIA,BAIK,WILAYAH 01
1322,AKADEMI PENDIDIKAN KESEHATAN TALITAKUM,BAIK,WILAYAH 01
1323,AKADEMI MARITIM ACEH DARUSSALAM,BAIK,WILAYAH 13
1325,STIH INDONESIA JENTERA,BAIK,WILAYAH 03
1328,SEKOLAH TINGGI ILMU EKONOMI KALPATARU,BAIK,WILAYAH 04
1329,AKADEMI PARIWISATA BANDUNG,BAIK,WILAYAH 04
1330,SEKOLAH TINGGI FILSAFAT ISLAM SADRA JAKARTA,BAIK,WILAYAH PTAS
1331,SEKOLAH TINGGI ILMU MARITIM MEGA BUANA,BAIK,WILAYAH 09
1332,AKADEMI KOMUNITAS PETERNAKAN JORONG,BAIK,WILAYAH 11
1333,UNIVERSITAS NAHDLATUL ULAMA CIREBON,BAIK,WILAYAH 04
1334,AMIK WIRA NUSANTARA,BAIK,WILAYAH 04
1335,SEKOLAH TINGGI ILMU EKONOMI NASIONAL INDONESIA,BAIK,WILAYAH 03
1336,POLITEKNIK GIHON,BAIK,WILAYAH 01
1337,AKADEMI KEBIDANAN ARU,BAIK,WILAYAH 12
1338,SEKOLAH TINGGI ILMU KESEHATAN AN NUR HUSADA LAMPUNG UTARA,BAIK,WILAYAH 02
1339,INSTITUT TEKNOLOGI DAN KESEHATAN SUMATERA UTARA,BAIK,WILAYAH 01
1341,STMIK PAMITRAN,BAIK,WILAYAH 04
1342,POLITEKNIK KESEHATAN WIRA HUSADA NUSANTARA MALANG,BAIK,WILAYAH 07
1343,SEKOLAH TINGGI ILMU KEGURUAN DAN ILMU PENDIDIKAN TERANG BANGSA,BAIK,WILAYAH 14
1344,SEKOLAH TINGGI ILMU KESEHATAN AKSARI,BAIK,WILAYAH 04
1345,POLITEKNIK CENDANA,BAIK,WILAYAH 01
1347,AKADEMI PARIWISATA NUSANTARA MEDAN,BAIK,WILAYAH 01
1348,AKADEMI KEBIDANAN PRESTASI AGUNG,BAIK,WILAYAH 02
1349,STMIK SAMARINDA,BAIK,WILAYAH 11
1351,AKADEMI KEPERAWATAN SURYA NUSANTARA,BAIK,WILAYAH 01
1352,AKADEMI KEBIDANAN HAMPAR BAIDURI,BAIK,WILAYAH 02
1353,AKADEMI KEPERAWATAN HARUM,BAIK,WILAYAH 03
1355,UNIVERSITAS INDONESIA MANDIRI,BAIK,WILAYAH 02
1356,AKADEMI KEBIDANAN AIFA HUSADA,BAIK,WILAYAH 07
1358,SEKOLAH TINGGI BAHASA ASING MENTARI KUPANG,BAIK,WILAYAH 15
1359,INSTITUT TEKNOLOGI DAN SAINS NAHDLATUL ULAMA JAMBI,BAIK,WILAYAH 10
1360,SEKOLAH TINGGI ILMU KESEHATAN PERMATA NUSANTARA,BAIK,WILAYAH 04
1362,INSTITUT KESEHATAN DAN TEKNOLOGI PONDOK KARYA PEMBANGUNAN,BAIK,WILAYAH 03
1363,UNIVERSITAS INTERNASIONAL PAPUA,BAIK,WILAYAH 14
1365,STMIK CITRA MANDIRI PADANGSIDIMPUAN,BAIK,WILAYAH 01
1366,AKADEMI SEKRETARI DAN MANAJEMEN SRIWIJAYA,BAIK,WILAYAH 02
1367,STMIK SURYA INTAN,BAIK,WILAYAH 02
1368,STISIP GUNA NUSANTARA,BAIK,WILAYAH 04
1369,SEKOLAH TINGGI ILMU EKONOMI DAN BISNIS PRANA PUTRA,BAIK,WILAYAH 02
1370,AKADEMI KEBIDANAN BANUA BINA HUSADA,BAIK,WILAYAH 11
1371,STISIP TRIMASDA CILEGON,BAIK,WILAYAH 04
1372,AKADEMI ILMU GIZI YPAG MAKASSAR,BAIK,WILAYAH 09
1373,POLITEKNIK ISLAM SYEKH SALMAN AL-FARISI RANTAU,BAIK,WILAYAH 11
1374,AKADEMI KEBIDANAN BAKTI INDONESIA BALIKPAPAN,BAIK,WILAYAH 11
1375,SEKOLAH TINGGI ILMU EKONOMI TRI DHARMA WIDYA,BAIK,WILAYAH 03
1376,UNIVERSITAS HANDAYANI MAKASSAR,BAIK,WILAYAH 09
1377,POLITEKNIK TUNAS PEMUDA,BAIK,WILAYAH 04
1378,SEKOLAH TINGGI ILMU EKONOMI STAN IM,BAIK,WILAYAH 04
1379,SEKOLAH TINGGI ILMU KESEHATAN BUDI MULIA,BAIK,WILAYAH 09
1380,AKADEMI SEKRETARI MANAJEMEN NUSANTARA,BAIK,WILAYAH 13
1381,AKADEMI KEPERAWATAN ANDAKARA,BAIK,WILAYAH 03
1382,STKIP NAHDLATUL ULAMA INDRAMAYU,BAIK,WILAYAH 04
1383,AKADEMI KEBIDANAN DARUL HUSADA,BAIK,WILAYAH 13
1384,AKADEMI ANALIS KESEHATAN PUTRA JAYA BATAM,BAIK,WILAYAH 17
1386,SEKOLAH TINGGI ILMU KESEHATAN BORNEO NUSANTARA,BAIK,WILAYAH 11
1387,UNIVERSITAS LINGGABUANA PGRI SUKABUMI,B,WILAYAH 04
1388,STIE BAKTI BANGSA,BAIK,WILAYAH 07
1389,UNIVERSITAS SERASAN,BAIK,WILAYAH 02
1391,AKADEMI KEPERAWATAN DHARMA WACANA,BAIK,WILAYAH 02
1392,POLITEKNIK INDONESIA BANJARMASIN,BAIK,WILAYAH 11
1393,AKADEMI RADIOGNOSTIK DAN RADIOTERAPI YAPENPERNUS,BAIK,WILAYAH 04
1394,SEKOLAH TINGGI ILMU EKONOMI JAYAKUSUMA,BAIK,WILAYAH 03
1395,AKADEMI REFRAKSI OPTISI DAN OPTOMETRY GAPOPIN,BAIK,WILAYAH 03
1396,SEKOLAH TINGGI ILMU EKONOMI YKPN,UNGGUL,WILAYAH 05
1397,POLITEKNIK KESEHATAN MEGAREZKY,BAIK,WILAYAH 09
1398,SEKOLAH TINGGI EKONOMI ISLAM AL FURQON PRABUMULIH SUMATERA SELATAN,BAIK,WILAYAH PTAS
1399,STIT DARUL ULUM KUBU RAYA KALIMANTAN BARAT,BAIK,WILAYAH PTAS
1400,SEKOLAH TINGGI ILMU EKONOMI KERTANEGARA,BAIK,WILAYAH 07
1401,SEKOLAH TINGGI KEGURUAN DAN ILMU PENDIDIKAN SERAM RAYA,BAIK,WILAYAH 12
1402,UNIVERSITAS NURUL HASAN BACAN,BAIK,WILAYAH 12
1404,STAI MAU`IZHAH TANJUNG JABUNG BARAT,BAIK,WILAYAH PTAS
1406,UNIVERSITAS INSAN PEMBANGUNAN INDONESIA,BAIK,WILAYAH 04
1407,SEKOLAH TINGGI ILMU MANAJEMEN INDONESIA MEULABOH,BAIK,WILAYAH 13
1408,AKADEMI AKUPUNKTUR ACEH,BAIK,WILAYAH 13
1409,INSTITUT PRIMA BANGSA,B,WILAYAH 04
1410,SEKOLAH TINGGI ILMU TARBIYAH SIBAWAIHI MUTAWALLI,BAIK,WILAYAH PTAS
1411,UNIVERSITAS BALIEM PAPUA,BAIK,WILAYAH 14
1412,AKADEMI KEPERAWATAN BINA INSANI SAKTI,BAIK,WILAYAH 10
1413,SEKOLAH TINGGI ILMU EKONOMI BUDI PERTIWI,BAIK,WILAYAH 04
1415,AKADEMI KEBIDANAN AISYAH KABUPATEN PANGKEP,BAIK,WILAYAH 09
1416,UNIVERSITAS TIMIKA,BAIK,WILAYAH 14
1417,STISIPOL DHARMA WACANA,BAIK,WILAYAH 02
1418,SEKOLAH TINGGI ILMU EKONOMI YAYASAN PENGEMBANGAN BISNIS INDONESIA,BAIK,WILAYAH 04
1420,AKADEMI KEPERAWATAN RS EFARINA,BAIK,WILAYAH 04
1421,INSTITUT AGAMA ISLAM AL-MUHAMMAD CEPU,BAIK,WILAYAH PTAS
1424,SEKOLAH TINGGI ILMU EKONOMI LPI MAKASSAR,BAIK,WILAYAH 09
1425,SEKOLAH TINGGI ILMU EKONOMI SAMARINDA,BAIK,WILAYAH 11
1426,UNIVERSITAS CATUR INSAN CENDEKIA,BAIK,WILAYAH 04
1428,STT ADVENT PAPUA,BAIK,WILAYAH PTAS
1429,POLITEKNIK TEKNOKRAT INTERNASIONAL KOLAKA,BAIK,WILAYAH 09
1430,POLITEKNIK IDN BOGOR,BAIK,WILAYAH 04
1431,POLITEKNIK KESEHATAN SITEBA,BAIK,WILAYAH 10
1432,POLITEKNIK KESEHATAN KMC KUNINGAN,BAIK,WILAYAH 04
1433,AKADEMI KESEHATAN SUMENEP,BAIK,WILAYAH 07
1434,SEKOLAH TINGGI ILMU EKONOMI TRIANANDRA,BAIK,WILAYAH 03
1436,AKADEMI PARIWISATA GSP INTERNASIONAL,BAIK,WILAYAH 03
1437,INSTITUT TEKNOLOGI PETROLEUM BALONGAN,BAIK,WILAYAH 04
1439,STKIP PGRI TRENGGALEK,BAIK,WILAYAH 07
1440,SEKOLAH TINGGI ILMU KOMPUTER EL RAHMA,BAIK,WILAYAH 04
1441,AKADEMI MARITIM PALOPO,BAIK,WILAYAH 09
1442,INSTITUT ILMU SOSIAL DAN ILMU POLITIK JAKARTA,BAIK,WILAYAH 03
1444,SEKOLAH TINGGI ILMU AL QURAN AL MULTAZAM,BAIK,WILAYAH PTAS
1445,"STIT GUNUNG TUA, PADANG LAWAS UTARA, TAPANULI SELATAN, SUMATERA UTARA",BAIK,WILAYAH PTAS
1446,POLITEKNIK MULTIMEDIA NUSANTARA,BAIK,WILAYAH 03
1448,UNIVERSITAS MUHAMMADIYAH SORONG,BAIK SEKALI,WILAYAH 14
1449,STMIK DHARMA WACANA,BAIK,WILAYAH 02
1450,STMIK TULUS CENDEKIA,BAIK,WILAYAH 04
1451,AKADEMI KEBIDANAN BAKTI INDONESIA BOGOR,BAIK,WILAYAH 04
1452,SEKOLAH TINGGI ILMU TARBIYAH AR-RAUDLATUL HASANAH MEDAN SUMATERA UTARA,BAIK,WILAYAH PTAS
1453,INSTITUT TEKNOLOGI DIRGANTARA ADISUTJIPTO,BAIK SEKALI,WILAYAH 05
1454,AKADEMI FARMASI PERSADA SUKABUMI,BAIK,WILAYAH 04
1455,POLITEKNIK BISNIS KALTARA,BAIK,WILAYAH 11
1457,"STIS SYARIF ABDURRAHMAN PONTIANAK, KALIMANTAN BARAT",BAIK,WILAYAH PTAS
1458,SEKOLAH TINGGI MANAJEMEN INFORMATIKA DAN KOMPUTER AL MUSLIM,BAIK,WILAYAH 04
1459,SEKOLAH TINGGI TEKNOLOGI MINERAL INDONESIA,BAIK,WILAYAH 04
1460,AKADEMI KEPERAWATAN COLUMBIA ASIA,BAIK,WILAYAH 01
1462,SEKOLAH TINGGI ILMU EKONOMI PARIWISATA,BAIK,WILAYAH 16
1463,IAIN TERNATE,B,WILAYAH PTAN
1464,UNIVERSITAS PANCASAKTI TEGAL,UNGGUL,WILAYAH 06
1465,AKADEMI KEUANGAN DAN PERBANKAN BOROBUDUR,BAIK,WILAYAH 03
1466,INSTITUT TEKNOLOGI DAN BISNIS MUHAMMADIYAH WAKATOBI,BAIK,WILAYAH 09
1467,UNIVERSITAS TRISAKTI,UNGGUL,WILAYAH 03
1468,SEKOLAH TINGGI INFORMATIKA KOMPUTER ARTHA BUANA,BAIK,WILAYAH 15
1469,SEKOLAH TINGGI AGAMA KRISTEN KUPANG PROVINSI NUSA TENGGARA TIMUR,BAIK,WILAYAH PTAS
1470,SEKOLAH TINGGI ILMU EKONOMI WIDYA DARMA,BAIK,WILAYAH 07
1471,AKADEMI AKUNTANSI BIMA SAKAPENTA,BAIK,WILAYAH 06
1472,"STAI UMAR BIN KHATTAB DI UJUNGGADING, PASAMAN BARAT, SUMATERA BARAT",BAIK,WILAYAH PTAS
1473,SEKOLAH TINGGI MANAJEMEN INFORMATIKA DAN KOMPUTER AL-FATH,BAIK,WILAYAH 04
1474,INSTITUT ELKATARIE,BAIK,WILAYAH PTAS
1475,AKADEMI KEBIDANAN YALEKA MARO MERAUKE,BAIK,WILAYAH 14
1476,SEKOLAH TINGGI ILMU KESEHATAN FATIMA PAREPARE,BAIK,WILAYAH 09
1478,AKADEMI FARMASI TADULAKO FARMA,BAIK,WILAYAH 16
1480,INSTITUT SAINS DAN TEKNOLOGI ESA TRINITA,BAIK,WILAYAH 16
1483,SEKOLAH TINGGI DIRASAT ISLAMIYAH IMAM SYAFI`I JEMBER,BAIK,WILAYAH PTAS
1484,UNIVERSITAS PEPABRI MAKASSAR,BAIK,WILAYAH 09
1485,SEKOLAH TINGGI BAHASA HARAPAN BERSAMA,BAIK SEKALI,WILAYAH 11
1486,POLITEKNIK ENJINIRING PERTANIAN INDONESIA,BAIK SEKALI,WILAYAH PTKL
1487,SEKOLAH TINGGI ILMU USHULUDDIN DARUL QURAN,BAIK,WILAYAH PTAS
1488,UNIVERSITAS NAHDLATUL ULAMA KALIMANTAN BARAT,BAIK SEKALI,WILAYAH 11
