institution_code,institution_name,akreditasi_institusi,wilayah
1,POLITEKNIK BANGGAI INDUSTRI,TERAKREDITASI SEMENTARA,WILAYAH 16
2,SEKOLAH TINGGI ILMU EKONOMI SATYA DHARMA,BAIK,WILAYAH 08
3,SEKOLAH TINGGI ILMU DAKWAH SIRNARASA,BAIK,WILAYAH PTAS
4,AKADEMI GIZI KARYA HUSADA KEDIRI,BAIK,WILAYAH 07
6,SEKOLAH TINGGI ILMU PERTANIAN WUNA RAHA,BAIK,WILAYAH 09
7,STITNU AL-MAHSUNI,BAIK,WILAYAH PTAS
8,UNIVERSITAS ISLAM MADURA,BAIK,WILAYAH 07
11,SEKOLAH TINGGI ILMU KESEHATAN KESDAM IX/UDAYANA,BAIK,WILAYAH 08
12,UNIVERSITAS ISLAM DEPOK,BAIK,WILAYAH PTAS
13,UNIVERSITAS WIRAHUSADA MEDAN,BAIK,WILAYAH 01
14,POLITEKNIK ALKON KALIMANTAN,BAIK,WILAYAH 11
15,INSTITUT NIDA EL ADABI,BAIK,WILAYAH PTAS
16,UNIVERSITAS SULTAN MUHAMMAD SYAFIUDDIN SAMBAS,BAIK,WILAYAH PTAS
18,INSTITUT AGAMA ISLAM DINIYYAH PEKANBARU,BAIK SEKALI,WILAYAH PTAS
19,UNIVERSITAS SEBELAS APRIL,BAIK SEKALI,WILAYAH 04
20,UNIVERSITAS SANG BUMI RUWA JURAI,BAIK SEKALI,WILAYAH 02
21,AKADEMI KULINER MONAS PASIFIK,BAIK SEKALI,WILAYAH 07
22,UNIVERSITAS WAHIDIYAH,BAIK,WILAYAH 07
23,AKADEMI BAKTI KEMANUSIAAN PALANG MERAH INDONESIA,BAIK SEKALI,WILAYAH 03
24,SEKOLAH TINGGI ILMU SYARIAH HUSNUL KHOTIMAH KUNINGAN,BAIK SEKALI,WILAYAH PTAS
25,SEKOLAH TINGGI AGAMA HINDU BHATARA GURU KENDARI SULAWESI TENGGARA,BAIK,WILAYAH PTAN
26,SEKOLAH TINGGI ILMU KESEHATAN PASAR REBO,BAIK,WILAYAH 03
27,UNIVERSITAS PGRI MPU SINDOK,BAIK,WILAYAH 07
28,POLITEKNIK PALOPO,BAIK,WILAYAH 09
29,UNIVERSITAS ISLAM IBRAHIMY BANYUWANGI,BAIK,WILAYAH PTAS
30,UNIVERSITAS PERSADA BUNDA INDONESIA,BAIK SEKALI,WILAYAH 17
31,UNIVERSITAS BHINNEKA NUSANTARA,BAIK SEKALI,WILAYAH 07
32,UNIVERSITAS MUHAMMADIYAH PKU SURAKARTA,BAIK SEKALI,WILAYAH 06
33,INSTITUT BISNIS DAN TEKNOLOGI KALIMANTAN,BAIK SEKALI,WILAYAH 11
34,AKADEMI KEBIDANAN MEGA BUANA,BAIK,WILAYAH 09
35,SEKOLAH TINGGI ILMU PERTANIAN AMUNTAI,BAIK,WILAYAH 11
36,STMIK DCI,BAIK,WILAYAH 04
37,INSTITUT PENDIDIKAN DAN TEKNOLOGI `AISYIYAH RIAU,BAIK,WILAYAH 17
38,UNIVERSITAS TIGA SERANGKAI,BAIK,WILAYAH 06
39,UNIVERSITAS MUHAMMADIYAH BREBES,BAIK,WILAYAH 06
40,UNIVERSITAS SUNAN GRESIK,BAIK,WILAYAH 07
41,POLITEKNIK SOROWAKO,BAIK,WILAYAH 09
42,STAI AL-ANDINA SUKABUMI,BAIK SEKALI,WILAYAH PTAS
43,STIE MADANI BALIKPAPAN,BAIK,WILAYAH 11
44,POLITEKNIK HAJI ANWAR SANUSI,TERAKREDITASI SEMENTARA,WILAYAH 04
45,SEKOLAH TINGGI ILMU KESEHATAN SAPTA BAKTI,BAIK,WILAYAH 02
46,INSTITUT TEKNOLOGI MUHAMMADIYAH SUMATERA,BAIK,WILAYAH 02
47,POLITEKNIK STATISTIKA STIS,UNGGUL,WILAYAH PTKL
48,INSTITUT BISNIS DAN KOMUNIKASI SWADAYA,BAIK SEKALI,WILAYAH 03
49,UNIVERSITAS WIRA BHAKTI,BAIK,WILAYAH 09
50,SEKOLAH TINGGI AGAMA HINDU LAMPUNG,BAIK,WILAYAH PTAN
51,SEKOLAH TINGGI EKONOMI DAN BISNIS ISLAM YAYASAN PELITA ILMU INSANI,BAIK,WILAYAH PTAS
52,SEKOLAH TINGGI TEOLOGI TENGGARONG,BAIK,WILAYAH PTAS
54,SEKOLAH TINGGI KEGURUAN DAN ILMU PENDIDIKAN BINA HARAPAN CELEBES,BAIK,WILAYAH 09
55,AKADEMI KEBIDANAN SALEHA,BAIK,WILAYAH 13
56,INSTITUT TEKNOLOGI BISNIS RIAU,BAIK,WILAYAH 17
57,SEKOLAH TINGGI TEOLOGI BAPTIS INDEPENDEN INDONESIA PURWOREJO,BAIK,WILAYAH PTAS
58,STKIP PGRI BANDAR LAMPUNG,BAIK SEKALI,WILAYAH 02
59,UNIVERSITAS MURIA KUDUS,UNGGUL,WILAYAH 06
60,UNIVERSITAS ALWASHLIYAH,BAIK SEKALI,WILAYAH 01
61,UNIVERSITAS MERDEKA MALANG,BAIK SEKALI,WILAYAH 07
62,STT SAMUEL ELIZABETH,BAIK,WILAYAH PTAS
63,UNIVERSITAS PEMBANGUNAN NASIONAL VETERAN YOGYAKARTA,UNGGUL,WILAYAH PTN
64,UNIVERSITAS SAHID SURAKARTA,BAIK SEKALI,WILAYAH 06
65,POLITEKNIK AISYIYAH PONTIANAK,BAIK SEKALI,WILAYAH 11
66,"STAI PATI, JAWA TENGAH",BAIK,WILAYAH PTAS
67,UNIVERSITAS NEGERI MANADO,UNGGUL,WILAYAH PTN
68,POLITEKNIK PARIWISATA LOMBOK,UNGGUL,WILAYAH PTKL
69,SEKOLAH TINGGI ILMU EKONOMI YAPI BONE,BAIK,WILAYAH 09
70,POLITEKNIK MUARA DUA,TIDAK TERAKREDITASI,WILAYAH 02
71,SEKOLAH TINGGI MARITIM YOGYAKARTA,TERAKREDITASI,WILAYAH 05
72,SEKOLAH TINGGI ILMU KESEHATAN MITRA KELUARGA,TERAKREDITASI,WILAYAH 03
73,AKADEMI FARMASI INDONESIA YOGYAKARTA,TERAKREDITASI,WILAYAH 05
74,SEKOLAH TINGGI ILMU KEPERAWATAN PPNI JAWA BARAT,TERAKREDITASI,WILAYAH 04
75,SEKOLAH TINGGI ILMU EKONOMI MUHAMMADIYAH CILACAP,BAIK,WILAYAH 06
76,UNIVERSITAS BPD,BAIK SEKALI,WILAYAH 06
77,SEKOLAH TINGGI ILMU TARBIYAH AL HIKMAH BENDA,BAIK,WILAYAH PTAS
78,SEKOLAH TINGGI TEKNOLOGI MUHAMMADIYAH AR FACHRUDDIN,BAIK,WILAYAH 07
79,STAI KI AGENG PEKALONGAN,BAIK SEKALI,WILAYAH PTAS
80,INSTITUT TEKNOLOGI DAN BISNIS AHMAD DAHLAN LAMONGAN,BAIK SEKALI,WILAYAH 07
81,"STAI MUHAMMADIYAH BLORA, JAWA TENGAH",BAIK SEKALI,WILAYAH PTAS
82,INSTITUT AGAMA ISLAM STIBA MAKASSAR,BAIK,WILAYAH PTAS
83,UNIVERSITAS WIRARAJA,BAIK SEKALI,WILAYAH 07
84,AKADEMI KOMUNITAS INDUSTRI MANUFAKTUR BANTAENG,BAIK SEKALI,WILAYAH PTKL
85,INSTITUT AGAMA ISLAM SAHID,BAIK SEKALI,WILAYAH PTAS
86,SEKOLAH TINGGI PARIWISATA MATARAM,BAIK SEKALI,WILAYAH 08
88,INSTITUT TEKNOLOGI AI MAHRUSIYAH,BAIK,WILAYAH 07
89,SEKOLAH TINGGI ALKITAB SURABAYA,TIDAK TERAKREDITASI,WILAYAH PTAS
90,AMIK JABAL GHAFUR,TIDAK TERAKREDITASI,WILAYAH 13
91,INSTITUT TEKNOLOGI DAN BISNIS ARUNGPALAKKA,TIDAK TERAKREDITASI,WILAYAH 09
92,UNIVERSITAS NUSA MEGARKENCANA,B,WILAYAH 05
93,UNIVERSITAS ALIFAH PADANG,BAIK SEKALI,WILAYAH 10
95,SEKOLAH TINGGI AGAMA ISLAM KH. ZAINUDDIN PONPES MOJOSARI NGANJUK,BAIK,WILAYAH PTAS
96,UNIVERSITAS PRIMA NUSANTARA BUKITTINGGI,UNGGUL,WILAYAH 10
97,SEKOLAH TINGGI AGAMA ISLAM AL BADAR CIPULUS PURWAKARTA,BAIK,WILAYAH PTAS
98,INSTITUT AGAMA ISLAM HASANUDDIN PARE,BAIK SEKALI,WILAYAH PTAS
99,POLITEKNIK INDUSTRI ATMI,BAIK SEKALI,WILAYAH 04
100,UNIVERSITAS NUSA PUTRA,UNGGUL,WILAYAH 04
101,POLITEKNIK PENERBANGAN SURABAYA,UNGGUL,WILAYAH PTKL
102,SEKOLAH TINGGI KEGURUAN DAN ILMU PENDIDIKAN BIAK,BAIK,WILAYAH 14
103,SEKOLAH TINGGI ILMU TARBIYAH SYAMSUDDHUHA ACEH UTARA BANDA ACEH,BAIK SEKALI,WILAYAH PTAS
104,UNIVERSITAS PRIMAKARA,BAIK SEKALI,WILAYAH 08
105,POLITEKNIK MARDIRA INDONESIA,BAIK,WILAYAH 04
106,SEKOLAH TINGGI ILMU KESEHATAN RS PROF. DR. J.A. LATUMETEN,BAIK,WILAYAH 12
107,"STAI BABUNNAJAH PANDEGLANG, BANTEN",BAIK SEKALI,WILAYAH PTAS
108,UNIVERSITAS DHARMA ANDALAS,BAIK SEKALI,WILAYAH 10
109,INSTITUT AGAMA ISLAM AN-NAWAWI PURWOREJO,BAIK SEKALI,WILAYAH PTAS
110,INSTITUT AGAMA ISLAM PAGARALAM,BAIK,WILAYAH PTAS
112,INSTITUT MADANI NUSANTARA,BAIK,WILAYAH PTAS
113,UNIVERSITAS ISLAM DARUD DA`WAH WAL-IRSYAD A.G.H. ABDURRAHMAN AMBO DALLE,BAIK,WILAYAH PTAS
114,UNIVERSITAS SUNAN DRAJAT LAMONGAN,BAIK,WILAYAH PTAS
115,UNIVERSITAS WASKITA DHARMA,BAIK,WILAYAH 07
117,AKADEMI KEPERAWATAN GIRI SATRIA HUSADA,BAIK,WILAYAH 06
119,STAI NURUL HUDA KAPONGAN SITUBONDO,BAIK,WILAYAH PTAS
120,UNIVERSITAS PEKALONGAN,UNGGUL,WILAYAH 06
121,UNIVERSITAS PGRI SEMARANG,UNGGUL,WILAYAH 06
123,UNIVERSITAS DHARMA INDONESIA,BAIK,WILAYAH 04
124,UNIVERSITAS ISLAM INTERNASIONAL INDONESIA,BAIK SEKALI,WILAYAH PTAN
125,SEKOLAH TINGGI AGAMA ISLAM KH BADRUZZAMAN,BAIK,WILAYAH PTAS
126,"STAI AL-MAS`UDIYAH, SUKABUMI",BAIK,WILAYAH PTAS
127,SEKOLAH TINGGI AGAMA ISLAM AL-BAHJAH CIREBON,BAIK,WILAYAH PTAS
128,SEKOLAH TINGGI AGAMA ISLAM SIDOGIRI PASURUAN,BAIK,WILAYAH PTAS
129,UNIVERSITAS MUHAMMADIYAH BENGKULU,UNGGUL,WILAYAH 02
130,POLITEKNIK NEGERI TANAH LAUT,BAIK SEKALI,WILAYAH PTN
131,INSTITUT AGAMA ISLAM NEGERI SYAIKH ABDURRAHMAN SIDDIK BANGKA BELITUNG,BAIK SEKALI,WILAYAH PTAN
132,UNIVERSITAS BAITURRAHIM,BAIK SEKALI,WILAYAH 10
133,SEKOLAH TINGGI AGAMA ISLAM NEGERI SULTAN ABDURRAHMAN KEPULAUAN RIAU,BAIK SEKALI,WILAYAH PTAN
134,SEKOLAH TINGGI EKONOMI ISLAM PERMATA BOJONEGORO,BAIK,WILAYAH PTAS
135,SEKOLAH TINGGI AGAMA BUDDHA SAMANTABADRA - NSI,BAIK,WILAYAH PTAS
136,SEKOLAH TINGGI AGAMA ISLAM NURUL ABROR AL-ROBBANIYIN,BAIK,WILAYAH PTAS
137,AKADEMI PERHOTELAN TUNAS INDONESIA,BAIK,WILAYAH 04
138,STAI AL-MUSADDADIYAH GARUT,BAIK SEKALI,WILAYAH PTAS
139,SEKOLAH TINGGI ILMU KESEHATAN BAITUL HIKMAH,BAIK,WILAYAH 02
140,UNIVERSITAS NIAS,BAIK,WILAYAH 01
141,INSTITUT TEKNOLOGI DAN BISNIS PELITA RAYA,BAIK,WILAYAH 10
142,POLITEKNIK TUNAS GARUDA,BAIK,WILAYAH 02
143,AKADEMI FARMASI YPF,BAIK,WILAYAH 04
145,STT LEVINUS RUMASEB SENTANI,BAIK,WILAYAH PTAS
146,UNIVERSITAS LINTAS INTERNASIONAL INDONESIA,BAIK SEKALI,WILAYAH 04
147,SEKOLAH TINGGI ILMU KESEHATAN NANI HASANUDDIN,B,WILAYAH 09
148,UNIVERSITAS METAMEDIA,B,WILAYAH 10
149,UNIVERSITAS ABDURACHMAN SALEH SITUBONDO,B,WILAYAH 07
150,INSTITUT AGAMA ISLAM NAHDLATUL ULAMA BANGIL,BAIK,WILAYAH PTAS
151,STIT MUHAMMADIYAH ACEH BARAT DAYA,BAIK,WILAYAH PTAS
152,INSTITUT AGAMA ISLAM K.H. SUFYAN TSAURI MAJENANG,BAIK,WILAYAH PTAS
154,UNIVERSITAS JEMBER,UNGGUL,WILAYAH PTN
156,SEKOLAH TINGGI ILMU EKONOMI BENTARA PERSADA BATAM,BAIK,WILAYAH 17
157,POLITEKNIK ARUTALA JOHANA HENDARTO,BAIK,WILAYAH 03
158,SEKOLAH TINGGI AGAMA ISLAM AL-RUZHAN,BAIK,WILAYAH PTAS
159,UNIVERSITAS MUHAMMADIYAH PALEMBANG,UNGGUL,WILAYAH 02
160,SEKOLAH TINGGI ILMU DAKWAH DAN KOMUNIKASI AL-HAMIDY PAMEKASAN,BAIK,WILAYAH PTAS
161,UNIVERSITAS ISLAM AL-AZIZIYAH INDONESIA,BAIK SEKALI,WILAYAH PTAS
162,SEKOLAH TINGGI AGAMA ISLAM AL-HIDAYAT,BAIK,WILAYAH PTAS
163,INSTITUT NAHDLATUL ULAMA CIAMIS,BAIK,WILAYAH PTAS
164,INSTITUT AGAMA ISLAM YPBWI,BAIK,WILAYAH PTAS
165,INSTITUT MEDIA DIGITAL EMTEK,BAIK,WILAYAH 03
166,SEKOLAH TINGGI ILMU KESEHATAN MEDISTRA INDONESIA,UNGGUL,WILAYAH 03
167,SEKOLAH TINGGI AGAMA ISLAM NURUL ISLAM MOJOKERTO,BAIK,WILAYAH PTAS
168,UNIVERSITAS MOHAMMAD NATSIR BUKITTINGGI,BAIK SEKALI,WILAYAH 10
169,UNIVERSITAS CENDEKIA ABDITAMA,BAIK,WILAYAH 04
171,INSTITUT BISNIS DAN KEUANGAN NITRO,B,WILAYAH 09
172,INSTITUT AGAMA ISLAM ROKAN,BAIK,WILAYAH PTAS
173,SEKOLAH TINGGI TEOLOGI SANGKAKALA,BAIK,WILAYAH PTAS
174,INSTITUT KESEHATAN MITRA BUNDA,B,WILAYAH 17
176,UNIVERSITAS ISLAM KEBANGSAAN INDONESIA,BAIK,WILAYAH 13
177,UNIVERSITAS BHAYANGKARA SURABAYA,B,WILAYAH 07
178,UNIVERSITAS DIRGANTARA MARSEKAL SURYADARMA,B,WILAYAH 03
179,UNIVERSITAS ISLAM DARUL `ULUM,BAIK,WILAYAH 07
180,UNIVERSITAS INDONESIA MEMBANGUN,B,WILAYAH 04
181,UNIVERSITAS MUHAMMADIYAH BARRU,B,WILAYAH 09
183,UNIVERSITAS FAMIKA,BAIK,WILAYAH 09
184,UNIVERSITAS KEPANJEN,B,WILAYAH 07
186,INSTITUT SAINS DAN TEKNOLOGI NASIONAL,B,WILAYAH 03
188,STAI NATUNA,BAIK,WILAYAH PTAS
189,UNIVERSITAS KHAIRUN,B,WILAYAH PTN
190,UNIVERSITAS ISLAM SYARIFUDDIN LUMAJANG,BAIK SEKALI,WILAYAH PTAS
191,UNIVERSITAS BHAKTI HUSADA INDONESIA,B,WILAYAH 04
192,INSTITUT TEKNOLOGI DAN BISNIS PGRI DEWANTARA JOMBANG,BAIK SEKALI,WILAYAH 07
194,SEKOLAH TINGGI ILMU KESEHATAN MUHAMMADIYAH ACEH,BAIK SEKALI,WILAYAH 13
195,INSTITUT TEKNOLOGI DAN BISNIS MUHAMMADIYAH PURBALINGGA,BAIK,WILAYAH 06
197,UNIVERSITAS MUHAMMADIYAH ASAHAN,BAIK,WILAYAH 01
198,UNIVERSITAS BHAKTI PERTIWI INDONESIA,BAIK,WILAYAH 03
199,UNIVERSITAS AN NASHER,BAIK,WILAYAH 04
200,UNIVERSITAS SAPTA MANDIRI,BAIK,WILAYAH 11
201,UNIVERSITAS ISLAM ACEH,B,WILAYAH PTAS
202,UNIVERSITAS SAINTEK MUHAMMADIYAH,BAIK,WILAYAH 03
203,STIT JEMBRANA BALI,BAIK,WILAYAH PTAS
204,AKADEMI TEKNIK INFORMATIKA TUNAS BANGSA,BAIK,WILAYAH 03
205,UNIVERSITAS PATRIA ARTHA,BAIK,WILAYAH 09
206,AKADEMI KEPERAWATAN YPTK SOLOK,BAIK,WILAYAH 10
208,UNIVERSITAS BOYOLALI,BAIK SEKALI,WILAYAH 06
209,UNIVERSITAS SERELO LAHAT,BAIK SEKALI,WILAYAH 02
210,STAI DIPONEGORO TULUNGAGUNG,BAIK SEKALI,WILAYAH PTAS
211,POLITEKNIK PARIWISATA BALI,UNGGUL,WILAYAH PTKL
212,SEKOLAH TINGGI ILMU EKONOMI BUKIT ZAITUN SORONG,BAIK,WILAYAH 14
213,"SEKOLAH TINGGI ILMU QUR`AN AMUNTAI, KALIMANTAN SELATAN",BAIK,WILAYAH PTAS
214,SEKOLAH TINGGI TEOLOGI INJILI INDONESIA SAMARINDA,BAIK,WILAYAH PTAS
215,INSTITUT JAM`IYAH MAHMUDIYAH LANGKAT,BAIK,WILAYAH PTAS
216,INSTITUT TEKNOLOGI DAN BISNIS DEWANTARA,BAIK,WILAYAH 04
217,UNIVERSITAS AISYIYAH PALEMBANG,BAIK,WILAYAH 02
218,UNIVERSITAS DARUL MA`ARIF,BAIK,WILAYAH 04
219,SEKOLAH TINGGI TEKNOLOGI PEKERJAAN UMUM,BAIK,WILAYAH 03
220,SEKOLAH TINGGI ILMU KESEHATAN KERIS HUSADA,BAIK,WILAYAH 03
221,UNIVERSITAS ADVENT SURYA NUSANTARA,BAIK,WILAYAH 01
222,UNIVERSITAS SURYA,BAIK,WILAYAH 04
223,STISIP MERDEKA MANADO,BAIK,WILAYAH 16
224,INSTITUT SAINS DAN TEKNOLOGI MUHAMMADIYAH TARAKAN,BAIK,WILAYAH 11
225,INSTITUT TEKNOLOGI DAN SAINS NAHDLATUL ULAMA SRIWIJAYA SUMATERA SELATAN,BAIK,WILAYAH 02
226,UNIVERSITAS STIKUBANK,BAIK SEKALI,WILAYAH 06
227,SEKOLAH TINGGI ILMU HUKUM ASY-SYAFI IYAH MEDAN,BAIK,WILAYAH 01
228,STAI AL-MUKHLISIN BOGOR,BAIK,WILAYAH PTAS
229,SEKOLAH TINGGI AGAMA ISLAM NURUL QADIM,BAIK,WILAYAH PTAS
230,UNIVERSITAS PUTERA BATAM,BAIK SEKALI,WILAYAH 17
231,AKADEMI KULINER DAN PATISERI OTTIMMO INTERNASIONAL,BAIK SEKALI,WILAYAH 07
232,POLITEKNIK NUSANTARA MAKASSAR,BAIK,WILAYAH 09
233,SEKOLAH TINGGI ILMU KESEHATAN COLUMBIA ASIA,BAIK,WILAYAH 01
234,AKADEMI PERNIAGAAN DAN PERUSAHAAN APIPSU MEDAN,BAIK,WILAYAH 01
235,SEKOLAH TINGGI AGAMA ISLAM DARUSSALAM KUNIR,BAIK,WILAYAH PTAS
236,SEKOLAH TINGGI ILMU EKONOMI MARS,BAIK,WILAYAH 01
238,POLITEKNIK CENDRAWASIH PALU,BAIK,WILAYAH 16
239,SEKOLAH TINGGI AGAMA ISLAM TANBIHUL GHOFILIN BANJARNEGARA,BAIK,WILAYAH PTAS
240,UNIVERSITAS PERSATUAN ISLAM,BAIK SEKALI,WILAYAH 04
241,INSTITUT TEKNOLOGI SAINS DAN BISNIS MUHAMMADIYAH SELAYAR,BAIK,WILAYAH 09
242,SEKOLAH TINGGI ILMU KESEHATAN JABAL GHAFUR,BAIK,WILAYAH 13
243,UNIVERSITAS MUHAMMADIYAH LUWUK BANGGAI,BAIK SEKALI,WILAYAH 16
244,POLITEKNIK TEKNOLOGI KIMIA INDUSTRI MEDAN,BAIK SEKALI,WILAYAH PTKL
245,UNIVERSITAS AMAL ILMIAH YAPIS WAMENA,BAIK,WILAYAH 14
246,UNIVERSITAS ISLAM KH. ACHMAD MUZAKKI SYAH,BAIK,WILAYAH PTAS
248,UNIVERSITAS DEZTRON INDONESIA,BAIK,WILAYAH 01
249,STAI LA TANSA MASHIRO RANGKASBITUNG LEBAK,BAIK,WILAYAH PTAS
250,SEKOLAH TINGGI ILMU EKONOMI MALANGKUCECWARA,BAIK SEKALI,WILAYAH 07
251,SEKOLAH TINGGI ILMU EKONOMI KASIH BANGSA,BAIK,WILAYAH 03
252,INSTITUT AGAMA KRISTEN NEGERI MANADO,BAIK,WILAYAH PTAN
253,SEKOLAH TINGGI ILMU ADMINISTRASI SANDIKTA,BAIK,WILAYAH 04
254,UNIVERSITAS SEMBILANBELAS NOVEMBER KOLAKA,BAIK SEKALI,WILAYAH PTN
255,"INSTITUT TEKNOLOGI, SAINS, DAN KESEHATAN RS.DR. SOEPRAOEN KESDAM V/BRW",BAIK SEKALI,WILAYAH 07
256,UNIVERSITAS MURNI TEGUH,BAIK SEKALI,WILAYAH 01
257,UNIVERSITAS JAKARTA INTERNASIONAL,BAIK SEKALI,WILAYAH 03
258,UNIVERSITAS PGRI DELTA,BAIK SEKALI,WILAYAH 07
259,UNIVERSITAS NURUL JADID,BAIK SEKALI,WILAYAH 07
260,"STAI PERTINU PADANGSIDIMPUAN, SUMATERA UTARA",BAIK,WILAYAH PTAS
261,UNIVERSITAS VETERAN BANGUN NUSANTARA,BAIK SEKALI,WILAYAH 06
262,UNIVERSITAS AL-KHAIRIYAH,BAIK,WILAYAH 04
263,"STAI YPK IMAM BONJOL PADANG PANJANG, SUMATERA BARAT",BAIK,WILAYAH PTAS
265,"STAI AL-AZHARY MAMUJU, SULAWESI BARAT",BAIK,WILAYAH PTAS
266,SEKOLAH TINGGI TEOLOGI MAKEDONIA NGABANG,BAIK,WILAYAH PTAS
267,SEKOLAH TINGGI AGAMA ISLAM AZ-ZAIN SAMPANG,BAIK,WILAYAH PTAS
268,SEKOLAH TINGGI AGAMA ISLAM AL-MUNTAHY,BAIK,WILAYAH PTAS
269,SEKOLAH TINGGI TEOLOGI AMADEUS SURABAYA,BAIK,WILAYAH PTAS
270,STAI DDI MAJENE,BAIK,WILAYAH PTAS
271,POLITEKNIK BHAKTI KARTINI,BAIK,WILAYAH 04
272,STMIK BINA MULIA,BAIK,WILAYAH 16
273,STIT AL-AZAMI CIANJUR,BAIK,WILAYAH PTAS
274,STT KERUSSO INDONESIA BEKASI,BAIK,WILAYAH PTAS
275,AMIK DEPATI PARBO KERINCI,BAIK,WILAYAH 10
276,INSTITUT TEKNOLOGI DAN BISNIS BINA SRIWIJAYA PALEMBANG,BAIK,WILAYAH 02
277,POLITEKNIK DIGITAL BOASH INDONESIA,BAIK,WILAYAH 04
278,SEKOLAH TINGGI ILMU KESEHATAN BETHESDA TOMOHON,BAIK,WILAYAH 16
279,UNIVERSITAS DELI SUMATERA,BAIK,WILAYAH 01
280,SEKOLAH TINGGI AGAMA HINDU SHANTIKA DHARMA MALANG,BAIK SEKALI,WILAYAH PTAN
281,POLITEKNIK BISNIS DAN PERPAJAKAN INDONESIA,BAIK,WILAYAH 06
282,UNIVERSITAS POHUWATO,BAIK,WILAYAH 16
284,"STAI WASILATUL FALAH, RANGKASBITUNG, LEBAK",BAIK,WILAYAH PTAS
286,SEKOLAH TINGGI ILMU TARBIYAH MUMTAZ,BAIK,WILAYAH PTAS
287,UNIVERSITAS HALU OLEO,B,WILAYAH PTN
288,INSTITUT AGAMA KRISTEN NEGERI KUPANG,BAIK,WILAYAH PTAN
289,UNIVERSITAS BUNG HATTA,UNGGUL,WILAYAH 10
290,UNIVERSITAS MEGAREZKY,BAIK SEKALI,WILAYAH 09
291,UNIVERSITAS  HARAPAN BANGSA,BAIK SEKALI,WILAYAH 06
292,UNIVERSITAS MUHAMMADIYAH JEMBER,UNGGUL,WILAYAH 07
293,SEKOLAH TINGGI EKONOMI DAN BISNIS ISLAM LAMPUNG,BAIK SEKALI,WILAYAH PTAS
294,POLITEKNIK MARITIM EKA UTAMA SUBANG,BAIK,WILAYAH 04
295,INSTITUT TEKNOLOGI NASIONAL MALANG,B,WILAYAH 07
296,UNIVERSITAS ISLAM ZAINUL HASAN GENGGONG PROBOLINGGO,BAIK,WILAYAH PTAS
297,SEKOLAH TINGGI KESEHATAN AL-FATAH BENGKULU,BAIK,WILAYAH 02
298,SEKOLAH TINGGI ILMU ADMINISTRASI BENGKULU,BAIK,WILAYAH 02
299,AKADEMI KEBIDANAN BINA HUSADA TANGERANG,BAIK,WILAYAH 04
300,UNIVERSITAS LUMAJANG,BAIK,WILAYAH 07
301,SEKOLAH TINGGI ISLAM BLAMBANGAN BANYUWANGI,BAIK,WILAYAH PTAS
302,STMIK SYAIKH ZAINUDDIN NAHDLATUL WATHAN,BAIK,WILAYAH 08
303,SEKOLAH TINGGI TEOLOGI GEREJA KALIMANTAN EVANGELIS,BAIK,WILAYAH PTAS
304,UNIVERSITAS ISLAM NEGERI SULTAN MAULANA HASANUDDIN BANTEN,UNGGUL,WILAYAH PTAN
305,UNIVERSITAS MUHAMMADIYAH PONOROGO,UNGGUL,WILAYAH 07
306,INSTITUT AL AZHAR MENGANTI GRESIK,BAIK SEKALI,WILAYAH PTAS
307,UNIVERSITAS MALIKUSSALEH,UNGGUL,WILAYAH PTN
308,UNIVERSITAS DJUANDA,UNGGUL,WILAYAH 04
309,SEKOLAH TINGGI ILMU EKONOMI AMKOP MAKASSAR,BAIK SEKALI,WILAYAH 09
310,INSTITUT KEGURUAN DAN ILMU PENDIDIKAN SILIWANGI,BAIK SEKALI,WILAYAH 04
311,SEKOLAH TINGGI AGAMA BUDDHA BODHI DHARMA,BAIK SEKALI,WILAYAH PTAS
312,INSTITUT SENI INDONESIA DENPASAR,UNGGUL,WILAYAH PTN
313,AKADEMI KEPERAWATAN KESDAM I/BUKIT BARISAN PADANG,BAIK SEKALI,WILAYAH 10
314,UNIVERSITAS WIDYA NUSANTARA,BAIK SEKALI,WILAYAH 16
315,SEKOLAH TINGGI ILMU HUKUM HABARING HURUNG SAMPIT,BAIK SEKALI,WILAYAH 11
316,POLITEKNIK STIA LAN MAKASSAR,B,WILAYAH PTKL
317,UNIVERSITAS INSAN BUDI UTOMO,BAIK SEKALI,WILAYAH 07
318,UNIVERSITAS NAHDLATUL ULAMA BLITAR,BAIK SEKALI,WILAYAH 07
319,INSTITUT AGAMA ISLAM NEGERI KUDUS,UNGGUL,WILAYAH PTAN
320,SEKOLAH TINGGI ILMU SOSIAL TEMINABUAN,TIDAK TERAKREDITASI,WILAYAH 14
321,POLITEKNIK PELAYARAN SULAWESI UTARA,BAIK SEKALI,WILAYAH PTKL
322,POLITEKNIK ILMU PELAYARAN BALIKPAPAN,BAIK,WILAYAH 11
323,INSTITUT TEKNOLOGI INSAN CENDEKIA MANDIRI,BAIK,WILAYAH 07
324,SEKOLAH TINGGI TEOLOGI INTI BANDUNG,BAIK,WILAYAH PTAS
325,STT POKOK ANGGUR JAKARTA,BAIK,WILAYAH PTAS
327,SEKOLAH TINGGI ILMU EKONOMI PELITA HARAPAN NABIRE,BAIK,WILAYAH 14
328,SEKOLAH TINGGI MANAJEMEN INFORMATIKA DAN KOMPUTER MULIA DARMA,BAIK,WILAYAH 01
329,AKADEMI OPTOMETRI YOGYAKARTA,BAIK,WILAYAH 05
330,ST AGAMA KRISTEN WILLIAM BOOTH JAKARTA,BAIK,WILAYAH PTAS
331,AKADEMI MANAJEMEN INFORMATIKA DAN KOMPUTER JOMBANG,TIDAK TERAKREDITASI,WILAYAH 07
332,UNIVERSITAS PATOMPO,BAIK,WILAYAH 09
333,SEKOLAH TINGGI ILMU EKONOMI ARLINDO,BAIK,WILAYAH 04
334,SEKOLAH TINGGI TEOLOGI HKBP,BAIK SEKALI,WILAYAH PTAS
335,SEKOLAH TINGGI ILMU TEKNIK BINA PUTRA,TIDAK TERAKREDITASI,WILAYAH 04
337,SEKOLAH TINGGI ILMU EKONOMI YP-KARYA,TIDAK TERAKREDITASI,WILAYAH 04
339,SEKOLAH TINGGI ILMU EKONOMI KUALA KAPUAS,TIDAK TERAKREDITASI,WILAYAH 11
340,SEKOLAH TINGGI BAHASA ASING CIPTO HADI PRANOTO,BAIK,WILAYAH 04
341,INSTITUT TEKNOLOGI DAN KESEHATAN ASPIRASI,BAIK,WILAYAH 08
342,STAI DARUL QALAM TANGERANG,BAIK,WILAYAH PTAS
343,STMIK METHODIST BINJAI,BAIK,WILAYAH 01
344,SEKOLAH TINGGI TEOLOGI BAPTIS INDONESIA,BAIK,WILAYAH PTAS
345,SEKOLAH TINGGI ILMU EKONOMI DAHANI DAHANAI BUNTOK,BAIK,WILAYAH 11
346,STT JEMAAT KRISTUS INDONESIA SALATIGA,BAIK,WILAYAH PTAS
347,UNIVERSITAS CENDERAWASIH,B,WILAYAH PTN
348,UNIVERSITAS JANABADRA,B,WILAYAH 05
350,"STAI SOLOK NAN INDAH, KOTA PADANG",BAIK,WILAYAH PTAS
351,"STAI RAHMANIYAH SEKAYU, MUSI BANYUASIN, SUMATERA SELATAN",BAIK,WILAYAH PTAS
352,SEKOLAH TINGGI TEOLOGI SAAT,B,WILAYAH PTAS
353,UNIVERSITAS WIDYA KARTIKA,BAIK,WILAYAH 07
354,STT  INTERNASIONAL HARVEST SEMARANG,BAIK,WILAYAH PTAS
355,UNIVERSITAS PAWYATAN DAHA,BAIK,WILAYAH 07
356,SEKOLAH TINGGI ILMU EKONOMI YAPAN,B,WILAYAH 07
357,AKADEMI KESEHATAN SINAR KASIH TORAJA,BAIK,WILAYAH 09
358,AKADEMI KEBIDANAN WIYATA MITRA HUSADA NGANJUK,BAIK,WILAYAH 07
359,SEKOLAH TINGGI TEOLOGI TERPADU WAINGAPU,BAIK,WILAYAH PTAS
360,STMIK ADHI GUNA,BAIK,WILAYAH 16
361,AKADEMI KEPERAWATAN YATNA YUANA LEBAK,BAIK,WILAYAH 04
363,UNIVERSITAS JAYABAYA,UNGGUL,WILAYAH 03
364,UNIVERSITAS MUHAMMADIYAH TANGERANG,UNGGUL,WILAYAH 04
365,SEKOLAH TINGGI AGAMA ISLAM SUMBAWA,BAIK,WILAYAH PTAS
368,UNIVERSITAS KRISTEN CIPTA WACANA,BAIK SEKALI,WILAYAH 07
370,STIT TARBIYATUN NISA SENTUL-BOGOR,BAIK,WILAYAH PTAS
372,SEKOLAH TINGGI KEGURUAN DAN ILMU PENDIDIKAN NABIRE,BAIK,WILAYAH 14
373,SEKOLAH TINGGI ILMU KESEHATAN MASYARAKAT ABDI NUSA,BAIK SEKALI,WILAYAH 02
374,SEKOLAH TINGGI TEKNIK ISKANDAR THANI,BAIK,WILAYAH 13
375,POLITEKNIK ISTIKOM BINA CITRA INFORMATIKA,BAIK,WILAYAH 04
376,INSTITUT RAHMANIYAH SEKAYU,BAIK,WILAYAH 02
377,SEKOLAH TINGGI TEOLOGI MISI INJILI INDONESIA SINTANG,BAIK,WILAYAH PTAS
379,POLITEKNIK SIBER CERDIKA INTERNASIONAL,BAIK,WILAYAH 04
380,INSTITUT TEKNOLOGI DAN BISNIS MUHAMMADIYAH GROBOGAN,BAIK,WILAYAH 06
381,SEKOLAH TINGGI ILMU KESEHATAN SISMADI,BAIK,WILAYAH 03
383,AKADEMI OLAHRAGA PRESTASI NASIONAL,BAIK SEKALI,WILAYAH 03
384,POLITEKNIK SAINS SENI REKAKREASI,BAIK,WILAYAH 04
385,SEKOLAH TINGGI ILMU KESEHATAN PATRIOT BANGSA LAMPUNG,BAIK,WILAYAH 02
386,UNIVERSITAS ISLAM MAKASSAR,B,WILAYAH 09
387,UNIVERSITAS LANCANG KUNING,BAIK SEKALI,WILAYAH 17
389,UNIVERSITAS SERANG RAYA,B,WILAYAH 04
390,UNIVERSITAS TEKNOLOGI DIGITAL INDONESIA,B,WILAYAH 05
391,UNIVERSITAS GORONTALO,B,WILAYAH 16
392,UNIVERSITAS NAHDLATUL ULAMA SUNAN GIRI,BAIK SEKALI,WILAYAH 07
393,INSTITUT KESEHATAN DELI HUSADA DELI TUA,UNGGUL,WILAYAH 01
394,INSTITUT TEKNOLOGI DAN BISNIS SABDA SETIA,BAIK,WILAYAH 11
395,INSTITUT SAINS DAN KEPENDIDIKAN KIE RAHA MALUKU UTARA,BAIK,WILAYAH 12
396,STMIK DHARMAPALA RIAU,BAIK,WILAYAH 17
397,SEKOLAH TINGGI ILMU HUKUM SOELTHAN M TSJAFIOEDDIN,BAIK,WILAYAH 11
398,UNIVERSITAS BINA SARANA INFORMATIKA,UNGGUL,WILAYAH 03
399,SEKOLAH TINGGI AGAMA ISLAM SALAFIYAH BANGIL,BAIK,WILAYAH PTAS
400,SEKOLAH TINGGI AGAMA ISLAM AL-AKBAR SURABAYA,BAIK,WILAYAH PTAS
401,SEKOLAH TINGGI ILMU ADMINISTRASI AMUNTAI,BAIK SEKALI,WILAYAH 11
402,STMIK WIDYA CIPTA DHARMA,B,WILAYAH 11
403,SEKOLAH TINGGI AGAMA BUDDHA NEGERI SRIWIJAYA TANGERANG,BAIK,WILAYAH PTAN
404,SEKOLAH TINGGI AGAMA ISLAM KH. MUHAMMAD ALI SHODIQ,BAIK,WILAYAH PTAS
405,AKADEMI BAHASA ASING INTERNASIONAL BANDUNG,BAIK,WILAYAH 04
406,UNIVERSITAS MUSI RAWAS,BAIK,WILAYAH 02
407,UNIVERSITAS SETIA BUDHI RANGKASBITUNG,BAIK,WILAYAH 04
408,UNIVERSITAS COKROAMINOTO PALOPO,BAIK SEKALI,WILAYAH 09
409,STIT MUHAMMADIYAH BOJONEGORO,B,WILAYAH PTAS
410,SEKOLAH TINGGI TEKNOLOGI MANDALA,BAIK,WILAYAH 04
411,INSTITUT AGAMA ISLAM NEGERI BONE,B,WILAYAH PTAN
412,UNIVERSITAS DARMA PERSADA,B,WILAYAH 03
413,SEKOLAH TINGGI AGAMA ISLAM DARUL HIKMAH TULUNGAGUNG,BAIK,WILAYAH PTAS
414,POLITEKNIK MERCUSUAR INDONESIA,BAIK,WILAYAH 07
415,STT SALATIGA,BAIK,WILAYAH PTAS
416,UNIVERSITAS KATOLIK DARMA CENDIKA,B,WILAYAH 07
418,UNIVERSITAS MUHAMMADIYAH MANADO,BAIK,WILAYAH 16
419,INSTITUT AGAMA ISLAM CIREBON,BAIK,WILAYAH PTAS
420,STIKS TARAKANITA,B,WILAYAH 03
421,POLITEKNIK NUSANTARA BALIKPAPAN,BAIK,WILAYAH 11
422,UNIVERSITAS PANJI SAKTI SINGARAJA,BAIK,WILAYAH 08
423,STAI SANGATTA,B,WILAYAH PTAS
424,UNIVERSITAS PRADITA,BAIK SEKALI,WILAYAH 03
425,SEKOLAH TINGGI ILMU PERTANIAN SURYA DHARMA,BAIK,WILAYAH 02
426,AKADEMI TATA BOGA BANDUNG,BAIK SEKALI,WILAYAH 04
427,AKADEMI AKUNTANSI BOROBUDUR,BAIK,WILAYAH 03
428,SEKOLAH TINGGI TEOLOGI BINA MUDA WIRAWAN MEDAN,BAIK,WILAYAH PTAS
429,POLITEKNIK KEPRIBADIAN,BAIK,WILAYAH 04
430,AKADEMI MANAJEMEN PUTRA JAYA,BAIK,WILAYAH 05
431,STISIP BINA GENERASI POLEWALI,BAIK,WILAYAH 09
432,POLITEKNIK NEGERI MALANG,UNGGUL,WILAYAH PTN
433,SEKOLAH TINGGI EKONOMI DAN BISNIS ISLAM BADRI MASHDUQI,BAIK,WILAYAH PTAS
434,POLITEKNIK BALI MAHA WERDHI,BAIK,WILAYAH 08
435,SEKOLAH TINGGI ILMU KESEHATAN SIHAT BEURATA BANDA ACEH,BAIK,WILAYAH 13
436,"STAI BALAISELASA YPPTI PESISIR SELATAN, SUMATERA BARAT",BAIK,WILAYAH PTAS
437,SEKOLAH TINGGI ILMU EKONOMI DAN BISNIS SYARIAH NAHDLATUL ULAMA GARUT,BAIK,WILAYAH PTAS
438,STISIPOL PAHLAWAN 12,BAIK,WILAYAH 02
439,STIA ABDUL AZIS KATALOKA,BAIK,WILAYAH 12
440,UNIVERSITAS NAHDLATUL ULAMA GORONTALO,BAIK SEKALI,WILAYAH 16
441,UNIVERSITAS DUTA BANGSA SURAKARTA,UNGGUL,WILAYAH 06
442,STAI DUTA BANGSA BEKASI,BAIK,WILAYAH PTAS
443,UNIVERSITAS DHARMA WACANA,B,WILAYAH 02
444,INSTITUT NALANDA,BAIK,WILAYAH PTAS
445,STIT AL-ANSHAR TANJUNG SELOR BULUNGAN,BAIK,WILAYAH PTAS
446,POLITEKNIK JATILUHUR,BAIK,WILAYAH 04
447,UNIVERSITAS BINA DARMA,UNGGUL,WILAYAH 02
448,POLITEKNIK PARIWISATA MAKASSAR,UNGGUL,WILAYAH PTKL
449,INSTITUT ILMU KESEHATAN BHAKTI WIYATA KEDIRI,UNGGUL,WILAYAH 07
450,SEKOLAH TINGGI ILMU EKONOMI SYARIAH NAHDLATUL ULAMA BENGKULU,BAIK SEKALI,WILAYAH PTAS
451,UNIVERSITAS PGRI JOMBANG,BAIK SEKALI,WILAYAH 07
452,SEKOLAH TINGGI AGAMA ISLAM MOROWALI,BAIK,WILAYAH PTAS
453,INSTITUT AGAMA ISLAM ABDULLAH SAID BATAM,BAIK,WILAYAH PTAS
454,SEKOLAH TINGGI EKONOMI ISLAM NAHDLATUL ULAMA SUBANG JAWA BARAT,BAIK,WILAYAH PTAS
455,SEKOLAH TINGGI AGAMA ISLAM RAUDHATUL ULUM ARRAHMANIYAH SAMPANG,BAIK,WILAYAH PTAS
456,SEKOLAH TINGGI ILMU DAKWAH DAN KOMUNIKASI ISLAM NAHDLATUL ULAMA INDRAMAYU,BAIK,WILAYAH PTAS
457,POLITEKNIK MEDICA FARMA HUSADA MATARAM,BAIK SEKALI,WILAYAH 08
458,INSTITUT TEKNOLOGI DAN BISNIS JAKARTA,BAIK,WILAYAH 03
459,INSTITUT SENI BUDAYA INDONESIA TANAH PAPUA,BAIK,WILAYAH PTN
460,SEKOLAH TINGGI ILMU MANAJEMEN PASE,BAIK,WILAYAH 13
461,INSTITUT TEKNOLOGI DAN SAINS NAHDLATUL ULAMA KALIMANTAN,BAIK,WILAYAH 11
462,UNIVERSITAS MATARAM,UNGGUL,WILAYAH PTN
463,UNIVERSITAS SWADAYA GUNUNG DJATI,UNGGUL,WILAYAH 04
465,SEKOLAH TINGGI TEKNOLOGI DUTA BANGSA,BAIK,WILAYAH 04
467,UNIVERSITAS PGRI PONTIANAK,B,WILAYAH 11
468,SEKOLAH TINGGI AGAMA ISLAM SALAHUDDIN PASURUAN,BAIK,WILAYAH PTAS
469,STAI NURUL HIDAYAH,BAIK,WILAYAH PTAS
470,AKADEMI TEKNIK TIRTA WIYATA,BAIK,WILAYAH 06
471,UNIVERSITAS NAHDLATUL ULAMA AL GHAZALI CILACAP,BAIK SEKALI,WILAYAH 06
472,SEKOLAH TINGGI ILMU EKONOMI MAHARDHIKA,B,WILAYAH 07
473,UNIVERSITAS ISLAM NEGERI SIBER SYEKH NURJATI CIREBON,UNGGUL,WILAYAH PTAN
474,INSTITUT TEKNOLOGI DAN KESEHATAN BALI,UNGGUL,WILAYAH 08
475,UNIVERSITAS ISLAM AL-AZHAR,BAIK SEKALI,WILAYAH 08
476,SEKOLAH TINGGI AGAMA BUDDHA DHARMA WIDYA,BAIK SEKALI,WILAYAH PTAS
477,UNIVERSITAS MUHAMMADIYAH MALUKU,BAIK,WILAYAH 12
478,UNIVERSITAS MEDIA NUSANTARA CITRA,BAIK SEKALI,WILAYAH 03
479,AKADEMI FARMASI BINA FARMASI,BAIK,WILAYAH 16
480,SEKOLAH TINGGI ILMU EKONOMI PERDAGANGAN,BAIK,WILAYAH 10
481,INSTITUT AGAMA ISLAM MIFTAHUL ULUM LUMAJANG,BAIK SEKALI,WILAYAH PTAS
482,POLITEKNIK PERTANIAN NEGERI PANGKAJENE KEPULAUAN,B,WILAYAH PTN
483,UNIVERSITAS MUHAMMADIYAH BULUKUMBA,BAIK,WILAYAH 09
484,SEKOLAH TINGGI EKONOMI ISLAM BINA MUDA BANDUNG,BAIK SEKALI,WILAYAH PTAS
