institution_code,institution_name,akreditasi_institusi,no_sk,tahun_sk,wilayah,tanggal_kadaluarsa
banpt-994,Institut Sains Teknologi dan Kesehatan 'Aisyiyah Kendari,Baik,2127/SK/BAN-PT/Ak/PT/XI/2024,2024,09,2029-11-26
banpt-995,Sekolah Tinggi Ilmu Kesehatan Bakti Utama Pati,Baik Sekali,2117/SK/BAN-PT/Ak/PT/XI/2024,2024,06,2029-11-19
banpt-996,Universitas Kaltara,Baik Sekali,2107/SK/BAN-PT/Ak/PT/XI/2024,2024,11,2029-11-19
banpt-997,Universitas Oso,Baik,2106/SK/BAN-PT/Ak/PT/XI/2024,2024,11,2029-11-19
banpt-998,Akademi Kebidanan Bandung,Baik,2109/SK/BAN-PT/Ak/PT/XI/2024,2024,04,2029-11-19
banpt-999,Sekolah Tinggi Ilmu Hukum Al-Banna,Baik,2105/SK/BAN-PT/Ak/PT/XI/2024,2024,13,2029-11-19
banpt-1000,Institut Agama Kristen Negeri Palangka Raya,Baik Sekali,2100/SK/BAN-PT/Ak/PT/XI/2024,2024,PTAN,2029-11-19
banpt-1001,Universitas Borobudur,Unggul,2101/SK/BAN-PT/Ak/PT/XI/2024,2024,03,2029-11-19
banpt-1002,Universitas Wahid Hasyim,Unggul,2104/SK/BAN-PT/Ak/PT/XI/2024,2024,06,2029-11-19
banpt-1003,Universitas Islam Negeri Sultan Aji Muhammad Idris Samarinda,Unggul,2102/SK/BAN-PT/Ak/PT/XI/2024,2024,PTAN,2029-11-19
banpt-1004,Universitas Islam Negeri Antasari Banjarmasin,Unggul,2103/SK/BAN-PT/Ak/PT/XI/2024,2024,PTAN,2029-11-19
banpt-1005,Sekolah Tinggi Teologi Willfingger Kampung Baru,Baik,2116/SK/BAN-PT/Ak.P/PT/XI/2024,2024,PTAS,2026-11-19
banpt-1006,Akademi Sages,Baik,2115/SK/BAN-PT/Ak.P/PT/XI/2024,2024,07,2026-11-19
banpt-1007,Sekolah Tinggi Teologi Sunergeo Banten,Baik,2114/SK/BAN-PT/Ak.P/PT/XI/2024,2024,PTAS,2026-11-19
banpt-1008,STKIP PANCAKARYA,Baik,2113/SK/BAN-PT/Ak.P/PT/XI/2024,2024,04,2026-11-19
banpt-1009,Akademi Kebidanan Murung Raya,Baik,2112/SK/BAN-PT/Ak.P/PT/XI/2024,2024,11,2026-11-19
banpt-1010,Sekolah Tinggi Teologi dan Entrepreneurship Pringgading,Baik,2108/SK/BAN-PT/Ak/PT/XI/2024,2024,PTAS,2029-11-19
banpt-1011,Institut Cokroaminoto Pinrang,Baik,2090/SK/BAN-PT/Ak/PT/XI/2024,2024,09,2029-11-12
banpt-1012,STAI Daarussalam Sukabumi,Baik,2044/SK/BAN-PT/Ak/PT/XI/2024,2024,PTAS,2029-11-12
banpt-1013,Institut Teknologi dan Bisnis Muhammadiyah Kolaka,Baik,2089/SK/BAN-PT/Ak/PT/XI/2024,2024,09,2029-11-12
banpt-1014,STMIK Indragiri,Baik,2088/SK/BAN-PT/Ak/PT/XI/2024,2024,17,2029-11-12
banpt-1015,Universitas Budi Luhur,Unggul,2099/SK/BAN-PT/Ak/PT/XI/2024,2024,03,2029-11-12
banpt-1016,Universitas Islam Negeri Mahmud Yunus Batusangkar,Unggul,2040/SK/BAN-PT/Ak/PT/XI/2024,2024,PTAN,2029-11-12
banpt-1017,Universitas Swiss German,Baik Sekali,2063/SK/BAN-PT/Ak.KP/PT/XI/2024,2024,04,2029-03-06
banpt-1018,Universitas Islam Negeri Salatiga,Unggul,2039/SK/BAN-PT/Ak/PT/XI/2024,2024,PTAN,2029-11-12
banpt-1019,Universitas Esa Unggul,Unggul,2041/SK/BAN-PT/Ak/PT/XI/2024,2024,03,2029-11-12
banpt-1020,IAIN Kendari,Baik Sekali,2062/SK/BAN-PT/Ak.KP/PT/XI/2024,2024,PTAN,2029-03-27
banpt-1021,Politeknik Perkapalan Negeri Surabaya,Unggul,2067/SK/BAN-PT/Ak.KP/PT/XI/2024,2024,PTN,2028-12-29
banpt-1022,Universitas Wijaya Putra,Baik Sekali,2061/SK/BAN-PT/Ak.KP/PT/XI/2024,2024,07,2029-03-13
banpt-1023,Sekolah Tinggi Ilmu Ekonomi Pasundan,Baik Sekali,2059/SK/BAN-PT/Ak.KP/PT/XI/2024,2024,04,2029-03-27
banpt-1024,Sekolah Tinggi Ilmu Administrasi Aan,Baik Sekali,2058/SK/BAN-PT/Ak.KP/PT/XI/2024,2024,05,2029-03-06
banpt-1025,Institut Agama Islam (IAI) Syarifuddin Wonorejo Lumajang,Baik Sekali,2057/SK/BAN-PT/Ak.KP/PT/XI/2024,2024,PTAS,2029-03-13
banpt-1026,sekolah Tinggi Keguruan dan Ilmu Pendidikan Rosalia Lampung,Baik,2091/SK/BAN-PT/Ak/PT/XI/2024,2024,02,2029-11-12
banpt-1027,Universitas Dumoga Kotamobagu,Baik,2048/SK/BAN-PT/Ak/PT/XI/2024,2024,16,2029-11-12
banpt-1028,Universitas Nusa Nipa,Baik Sekali,2037/SK/BAN-PT/Ak/PT/XI/2024,2024,15,2029-11-12
banpt-1029,Universitas Karya Persada Muna,Baik,2047/SK/BAN-PT/Ak/PT/XI/2024,2024,09,2029-11-12
banpt-1030,Universitas Satu Nusa Lampung,Baik,2092/SK/BAN-PT/Ak/PT/XI/2024,2024,02,2029-11-12
banpt-1031,Institut Agama Islam Negeri Sorong,Baik Sekali,2064/SK/BAN-PT/Ak.KP/PT/XI/2024,2024,PTAN,2029-02-27
banpt-1032,Universitas Lelemuku Saumlaki,Baik,2046/SK/BAN-PT/Ak/PT/XI/2024,2024,12,2029-11-12
banpt-1033,Politeknik Negeri Samarinda,Baik Sekali,2065/SK/BAN-PT/Ak.KP/PT/XI/2024,2024,PTN,2028-03-21
banpt-1034,STITEK Dharma Yadi Makassar,Baik,2042/SK/BAN-PT/Ak/PT/XI/2024,2024,09,2029-11-12
banpt-1035,Institut Kesehatan dan Teknologi Graha Medika,Baik,2094/SK/BAN-PT/Ak/PT/XI/2024,2024,16,2029-11-12
banpt-1036,Universitas Sehati Indonesia,Baik,2036/SK/BAN-PT/Ak/PT/XI/2024,2024,04,2029-11-12
banpt-1037,STISIP Samudera Indonesia Selatan,Baik,2043/SK/BAN-PT/Ak/PT/XI/2024,2024,04,2029-11-12
banpt-1038,Universitas Muhammadiyah Madiun,Baik Sekali,2038/SK/BAN-PT/Ak/PT/XI/2024,2024,07,2029-11-12
banpt-1039,Sekolah Tinggi Teknologi Texmaco,Baik,2049/SK/BAN-PT/Ak/PT/XI/2024,2024,04,2029-11-12
banpt-1040,Institut Teknologi dan Sains Nahdlatul Ulama Lampung,Baik,2093/SK/BAN-PT/Ak/PT/XI/2024,2024,02,2029-11-12
banpt-1041,Sekolah Tinggi Ilmu Administrasi Pembangunan,Baik Sekali,2045/SK/BAN-PT/Ak/PT/XI/2024,2024,07,2029-11-12
banpt-1042,Sekolah Tinggi Ilmu Ekonomi Gentiaras,Baik Sekali,2056/SK/BAN-PT/Ak.KP/PT/XI/2024,2024,02,2029-04-10
banpt-1043,Politeknik Katolik Mangunwijaya,Baik Sekali,2055/SK/BAN-PT/Ak.KP/PT/XI/2024,2024,06,2029-04-10
banpt-1044,Universitas HKBP Nommensen,Baik Sekali,2060/SK/BAN-PT/Ak.KP/PT/XI/2024,2024,01,2027-05-24
banpt-1045,Sekolah Tinggi Ilmu Ushuluddin Wadi Mubarak Bogor Jawa Barat,Baik,2074/SK/BAN-PT/Ak.P/PT/XI/2024,2024,PTAS,2026-11-12
banpt-1046,Universitas Caritas Indonesia,Baik,2073/SK/BAN-PT/Ak.P/PT/XI/2024,2024,14,2026-11-12
banpt-1047,Institut Pesantren Babakan Cirebon,Baik,2098/SK/BAN-PT/Ak-PNB/PT/XI/2024,2024,PTAS,2026-12-22
banpt-1048,Politeknik Assalam Surakarta,Baik,2097/SK/BAN-PT/Ak-PNB/PT/XI/2024,2024,06,2028-02-07
banpt-1049,Universitas Al-Hikmah Indonesia,Baik,2096/SK/BAN-PT/Ak-PNB/PT/XI/2024,2024,PTAS,2027-08-02
banpt-1050,"STIT Muara Enim, Sumatera Selatan",Baik,2072/SK/BAN-PT/Ak.P/PT/XI/2024,2024,PTAS,2026-11-12
banpt-1051,Sekolah Tinggi Ilmu Tarbiyah Assunniyah Tambarangan Rantau Tapin,Baik,2071/SK/BAN-PT/Ak.P/PT/XI/2024,2024,PTAS,2026-11-12
banpt-1052,Akademi Kebidanan Isma Husada Cirebon,Baik,2085/SK/BAN-PT/Ak.B/PT/XI/2024,2024,04,2026-11-12
banpt-1053,Sekolah Tinggi Teologi Lutheran Yogya,Baik,2076/SK/BAN-PT/Ak.P/PT/XI/2024,2024,PTAS,2026-11-12
banpt-1054,STAI Ma`had Aly Al-Hikam Malang,Baik Sekali,2054/SK/BAN-PT/Ak.KP/PT/XI/2024,2024,PTAS,2029-04-10
banpt-1055,STIMI Banjarmasin,Baik Sekali,2053/SK/BAN-PT/Ak.KP/PT/XI/2024,2024,11,2029-02-27
banpt-1056,Sekolah Tinggi Ilmu Ekonomi Trisakti,Unggul,2066/SK/BAN-PT/Ak.KP/PT/XI/2024,2024,03,2027-09-06
banpt-1057,Universitas Islam Negeri Walisongo Semarang,Unggul,2084/SK/BAN-PT/Ak.KP/PT/XI/2024,2024,PTAN,2029-03-06
banpt-1058,Sekolah Tinggi Ilmu Ekonomi PGRI Dewantara,Baik Sekali,2052/SK/BAN-PT/Ak.KP/PT/XI/2024,2024,07,2029-04-24
banpt-1059,Sekolah Tinggi Ilmu Hukum IBLAM,Baik Sekali,2035/SK/BAN-PT/Ak.KP/PT/XI/2024,2024,03,2029-02-21
banpt-1060,Universitas Amikom Yogyakarta,Baik Sekali,2051/SK/BAN-PT/Ak.KP/PT/XI/2024,2024,05,2028-12-29
banpt-1061,Sekolah Tinggi Ilmu Ekonomi Indonesia Makassar,Baik,2050/SK/BAN-PT/Ak.Ppj/PT/XI/2024,2024,09,2029-04-10
banpt-1062,STT Anugerah Alianse Semarang,Baik,2083/SK/BAN-PT/Ak.P/PT/XI/2024,2024,PTAS,2026-11-12
banpt-1063,Sekolah Tinggi Teologi Walter Post Jayapura Papua,Baik,2082/SK/BAN-PT/Ak.P/PT/XI/2024,2024,PTAS,2026-11-12
banpt-1064,Sekolah Tinggi Teologi Presbyterian Batam,Baik,2080/SK/BAN-PT/Ak.P/PT/XI/2024,2024,PTAS,2026-11-12
banpt-1065,Sekolah Tinggi Theologia Injili Indonesia Pontianak,Baik,2079/SK/BAN-PT/Ak.P/PT/XI/2024,2024,PTAS,2026-11-12
banpt-1066,Akademi Audiologi Indonesia Jakarta,Baik,2078/SK/BAN-PT/Ak.P/PT/XI/2024,2024,03,2026-11-12
banpt-1067,Sekolah Tinggi Ekonomi Islam (STEI) Darul Qur'an Minak Selebah,Baik,2068/SK/BAN-PT/Ak.P/PT/XI/2024,2024,PTAS,2026-11-12
banpt-1068,Akademi Maritim Maluku,Baik,1989/SK/BAN-PT/Ak/PT/XI/2024,2024,12,2029-11-05
banpt-1069,Politeknik Pertanian Yasanto,Baik,2008/SK/BAN-PT/Ak/PT/XI/2024,2024,14,2029-11-05
banpt-1070,Politeknik Bintan Cakrawala,Baik,2007/SK/BAN-PT/Ak/PT/XI/2024,2024,17,2029-11-05
banpt-1071,Sekolah Tinggi Agama Kristen Abdi Wacana Pontianak,Baik,2000/SK/BAN-PT/Ak/PT/XI/2024,2024,PTAS,2029-11-05
banpt-1072,Sekolah Tinggi Agama Islam Daarut Tauhiid,Baik,1999/SK/BAN-PT/Ak/PT/XI/2024,2024,PTAS,2029-11-05
banpt-1073,Sekolah Tinggi Ilmu Tarbiyah Nahdlatul Ulama Sumber Agung Oku Timur,Baik,2010/SK/BAN-PT/Ak/PT/XI/2024,2024,PTAS,2029-11-05
banpt-1074,Politeknik Indonusa Surakarta,Baik Sekali,2033/SK/BAN-PT/Ak/PT/II/2025,2025,06,2030-02-25
banpt-1075,Sekolah Tinggi Ilmu Hukum Profesor Gayus Lumbuun,Baik Sekali,1993/SK/BAN-PT/Ak/PT/XI/2024,2024,03,2029-11-05
banpt-1076,Sekolah Tinggi Ilmu Bahasa Asing Bumi Beringin,Baik,2001/SK/BAN-PT/Ak/PT/XI/2024,2024,16,2029-11-05
banpt-1077,Sekolah Tinggi Ilmu Adab dan Budaya Islam Riyadul 'Ulum,Baik,2009/SK/BAN-PT/Ak/PT/XI/2024,2024,PTAS,2029-11-05
banpt-1078,Sekolah Tinggi Ilmu Ekonomi Bulungan Tarakan,Baik,1992/SK/BAN-PT/Ak/PT/XI/2024,2024,11,2029-11-05
banpt-1079,Akademi Komunitas Industri Pertambangan Bukit Asam,Baik,1988/SK/BAN-PT/Ak/PT/XI/2024,2024,02,2029-11-05
banpt-1080,Sekolah Tinggi Keguruan dan Ilmu Pendidikan Surya Kasih,Baik,1994/SK/BAN-PT/Ak/PT/XI/2024,2024,15,2029-11-05
banpt-1081,Politeknik Bombana,Baik,1990/SK/BAN-PT/Ak/PT/XI/2024,2024,09,2029-11-05
banpt-1082,"STIT YPI Al-Yaqin Muaro Sijunjung, Sawahlunto",Baik,1997/SK/BAN-PT/Ak/PT/XI/2024,2024,PTAS,2029-11-05
banpt-1083,Politeknik Kesdam VI Banjarmasin,Baik,2028/SK/BAN-PT/Ak/PT/XI/2024,2024,11,2029-11-05
banpt-1084,Sekolah Tinggi Teologi Pelita Kebenaran,Baik,2002/SK/BAN-PT/Ak/PT/XI/2024,2024,PTAS,2029-11-05
banpt-1085,Institut Teknologi dan Kesehatan Ika Bina,Baik,2006/SK/BAN-PT/Ak/PT/XI/2024,2024,01,2029-11-05
banpt-1086,Akademi Keperawatan Teungku Fakinah Banda Aceh,Baik,2005/SK/BAN-PT/Ak/PT/XI/2024,2024,13,2029-11-05
banpt-1087,Sekolah Tinggi Teologi Jaffray Jakarta,Baik,1995/SK/BAN-PT/Ak/PT/XI/2024,2024,PTAS,2029-11-05
banpt-1088,Universitas Riau,Unggul,2026/SK/BAN-PT/Ak.KP/PT/XI/2024,2024,PTN,2028-07-18
banpt-1089,Sekolah Tinggi Teologi Yerusalem Baru Manado,Baik,2003/SK/BAN-PT/Ak/PT/XI/2024,2024,PTAS,2029-11-05
banpt-1090,STIKES Maluku Husada,B,2004/SK/BAN-PT/Ak.Ppj/PT/XI/2024,2024,12,2029-07-31
banpt-1091,Universitas Islam Negeri Imam Bonjol Padang,Unggul,1996/SK/BAN-PT/Ak/PT/XI/2024,2024,PTAN,2029-11-05
banpt-1092,Universitas Pakuan,Unggul,1998/SK/BAN-PT/Ak/PT/XI/2024,2024,04,2029-11-05
banpt-1093,Institut Kesehatan Helvetia Pekanbaru,Baik,2014/SK/BAN-PT/Ak.P/PT/XI/2024,2024,17,2026-11-05
banpt-1094,Sekolah Tinggi Teologi Parakletos Surabaya,Baik,2020/SK/BAN-PT/Ak.P/PT/XI/2024,2024,PTAS,2026-11-05
banpt-1095,STAI YAMISA Soreang,Baik,2021/SK/BAN-PT/Ak.P/PT/XI/2024,2024,PTAS,2026-11-05
banpt-1096,Sekolah Tinggi Ilmu Syariah (STIS) Darul Ulum Lampung Timur,Baik,2018/SK/BAN-PT/Ak.P/PT/XI/2024,2024,PTAS,2026-11-05
banpt-1097,Sekolah Tinggi Teologi Pantekosta Batam,Baik,2019/SK/BAN-PT/Ak.P/PT/XI/2024,2024,PTAS,2026-11-05
banpt-1098,Sekolah Tinggi Ekonomi Islam Sekayu Palembang,Baik,2016/SK/BAN-PT/Ak.P/PT/XI/2024,2024,PTAS,2026-11-05
banpt-1099,STIS Kebumen Jawa Tengah,Baik,2022/SK/BAN-PT/Ak.P/PT/XI/2024,2024,PTAS,2026-11-05
banpt-1100,Institut Islam Al-Mujaddid Sabak,Baik,2027/SK/BAN-PT/Ak-PNB/PT/XI/2024,2024,PTAS,2025-12-22
banpt-1101,Sekolah Tinggi Agama Islam Negeri Mandailing Natal,Baik Sekali,1991/SK/BAN-PT/Ak/PT/XI/2024,2024,PTAN,2029-11-05
banpt-1102,Universitas Islam Jakarta,Baik Sekali,2032/SK/BAN-PT/Ak.KP/PT/XI/2024,2024,03,2028-10-31
banpt-1103,Universitas Wanita Internasional,Baik Sekali,2034/SK/BAN-PT/Ak.KP/PT/XI/2024,2024,04,2028-12-20
banpt-1104,Akademi Kesehatan Kartini Batam,Baik,2011/SK/BAN-PT/Ak.P/PT/XI/2024,2024,17,2026-11-05
banpt-1105,Poltekkes Kemenkes Riau,Baik,2024/SK/BAN-PT/Ak.B/PT/XI/2024,2024,PTKL,2026-11-05
banpt-1106,Universitas Mitra Bangsa,Baik Sekali,2029/SK/BAN-PT/Ak-PNB/PT/XI/2024,2024,03,2027-10-04
banpt-1107,Universitas Islam Internasional Darullughah Wadda'wah,Baik Sekali,2031/SK/BAN-PT/Ak-PNB/PT/XI/2024,2024,PTAS,2025-12-15
banpt-1108,Universitas Muhammadiyah Tegal,Baik,2030/SK/BAN-PT/Ak-PNB/PT/XI/2024,2024,06,2029-02-20
banpt-1109,Politeknik Gusdurian,Baik,2015/SK/BAN-PT/Ak.P/PT/XI/2024,2024,06,2026-11-05
banpt-1110,Universitas Santo Borromeus,B,1930/SK/BAN-PT/Ak-PNB/PT/X/2024,2023,04,2026-12-28
banpt-1111,Sekolah Tinggi Teologi Injili Mahkota Sion Saumlaki,Baik,1982/SK/BAN-PT/Ak.P/PT/X/2024,2024,PTAS,2026-10-29
banpt-1112,Sekolah Tinggi Olahraga Dan Kesehatan Bina Guna,Baik Sekali,1987/SK/BAN-PT/Ak/PT/X/2024,2024,01,2029-10-29
banpt-1113,STIT Ibnu Sina Malang,Baik,1976/SK/BAN-PT/Ak/PT/X/2024,2024,PTAS,2029-10-29
banpt-1114,Universitas Sepuluh Nopember Papua,Baik,1986/SK/BAN-PT/Ak/PT/X/2024,2024,14,2029-10-29
banpt-1115,Akademi Komunitas Nurul Jadid,Baik,1974/SK/BAN-PT/Ak/PT/X/2024,2024,07,2029-10-29
banpt-1116,Sekolah Tinggi Agama Islam Senori Tuban,Baik,1984/SK/BAN-PT/Ak/PT/X/2024,2024,PTAS,2029-10-29
banpt-1117,Institut Agama Islam Negeri Ponorogo,Unggul,1975/SK/BAN-PT/Ak/PT/X/2024,2024,PTAN,2029-10-29
banpt-1118,Sekolah Tinggi Teologi Excelsius,Baik,1981/SK/BAN-PT/Ak.P/PT/X/2024,2024,PTAS,2026-10-29
banpt-1119,Institut Teknologi Pembangunan Surabaya,Baik,1977/SK/BAN-PT/Ak.P/PT/X/2024,2024,07,2026-10-29
banpt-1120,Sekolah Tinggi Ilmu Al-Qur'an Darussalam Lhokseumawe Aceh,Baik,1980/SK/BAN-PT/Ak.P/PT/X/2024,2024,PTAS,2026-10-29
banpt-1121,STT Rumah Murid Kristus Bitung,Baik,1983/SK/BAN-PT/Ak.P/PT/X/2024,2024,PTAS,2026-10-29
banpt-1122,Politeknik Damara,Baik,1978/SK/BAN-PT/Ak.P/PT/X/2024,2024,06,2026-10-29
banpt-1123,Institut Teknologi dan Sains Mandala,Baik Sekali,1985/SK/BAN-PT/Ak/PT/X/2024,2024,07,2029-10-29
banpt-1124,Sekolah Tinggi Agama Islam Imam Bukhori Bulukumba,Baik,1971/SK/BAN-PT/Ak/PT/X/2024,2024,PTAS,2029-10-23
banpt-1125,Universitas Achmad Yani Banjarmasin,B,1969/SK/BAN-PT/Ak.Ppj/PT/X/2024,2024,11,2029-08-21
banpt-1126,STIKES Darussalam Lhokseumawe,Baik,1965/SK/BAN-PT/Ak/PT/X/2024,2024,13,2029-10-22
banpt-1127,Akademi Penerbang Indonesia Banyuwangi,Baik Sekali,1959/SK/BAN-PT/Ak/PT/X/2024,2024,PTKL,2029-10-22
banpt-1128,Universitas Nahdlatul Ulama Indonesia,Baik Sekali,1961/SK/BAN-PT/Ak/PT/X/2024,2024,03,2029-10-22
banpt-1129,Politeknik Unggulan Cipta Mandiri,Baik,1963/SK/BAN-PT/Ak/PT/X/2024,2024,01,2029-10-22
banpt-1130,Institut Digital Ekonomi LPKIA,Baik,1960/SK/BAN-PT/Ak/PT/X/2024,2024,04,2029-10-22
banpt-1131,Sekolah Tinggi Ilmu Kesehatan Bogor Husada,Baik,1964/SK/BAN-PT/Ak/PT/X/2024,2024,04,2029-10-22
banpt-1132,Institut Bisnis dan Informatika (IBI) Kosgoro 1957,Baik Sekali,1968/SK/BAN-PT/Ak/PT/X/2024,2024,03,2029-10-22
banpt-1133,Sekolah Tinggi Ilmu Administrasi Karya Dharma Merauke,Baik,1966/SK/BAN-PT/Ak/PT/X/2024,2024,14,2029-10-22
banpt-1134,Sekolah Tinggi Keguruan dan Ilmu Pendidikan Muhammadiyah OKU Timur,Baik,1967/SK/BAN-PT/Ak/PT/X/2024,2024,02,2029-10-22
banpt-1135,Sekolah Tinggi Ilmu Kesehatan Mitra Husada Medan,Unggul,1970/SK/BAN-PT/Ak/PT/X/2024,2024,01,2029-10-22
banpt-1136,Universitas Quality Berastagi,Baik,1962/SK/BAN-PT/Ak/PT/X/2024,2024,01,2029-10-22
banpt-1137,Institut Syekh Abdul Halim Hasan Binjai,Baik,1958/SK/BAN-PT/Ak-PNB/PT/X/2024,2024,PTAS,2026-07-14
banpt-1138,Akademi Komunitas Toyota Indonesia,Baik Sekali,1931/SK/BAN-PT/Ak/PT/X/2024,2024,04,2029-10-19
banpt-1139,Sekolah Tinggi Ilmu Ekonomi Sulawesi Utara,Baik,1951/SK/BAN-PT/Ak/PT/X/2024,2024,16,2029-10-19
banpt-1140,Akademi Kebidanan Wijaya Kusuma Malang,Baik,1949/SK/BAN-PT/Ak/PT/X/2024,2024,12,2029-10-19
banpt-1141,Universitas Internasional Jakarta,Baik,1935/SK/BAN-PT/Ak/PT/X/2024,2024,04,2029-10-19
banpt-1142,Institut Teknologi Bisnis dan Kesehatan Muhammadiyah Tulungagung,Baik,1957/SK/BAN-PT/Ak/PT/X/2024,2024,07,2029-10-19
banpt-1143,Institut Agama Islam Syekh Maulana Qori Bangko,Baik Sekali,1955/SK/BAN-PT/Ak/PT/X/2024,2024,PTAS,2029-10-19
banpt-1144,Sekolah Tinggi Agama Islam Alif Laam Miim Surabaya,Baik,1943/SK/BAN-PT/Ak/PT/X/2024,2024,PTAS,2029-10-19
banpt-1145,STITNU Sakinah Dharmasraya,Baik,1954/SK/BAN-PT/Ak/PT/X/2024,2024,PTAS,2029-10-19
banpt-1146,Universitas Prasetiya Mulya,Baik Sekali,1939/SK/BAN-PT/Ak/PT/X/2024,2024,03,2029-10-19
banpt-1147,Sekolah Tinggi Ilmu Keperawatan Famika,Baik,1948/SK/BAN-PT/Ak/PT/X/2024,2024,09,2029-10-19
banpt-1148,Sekolah Tinggi Ilmu Kesehatan Indah Medan,Baik,1933/SK/BAN-PT/Ak/PT/X/2024,2024,01,2029-10-19
banpt-1149,Universitas Ichsan Sidenreng Rappang,Baik,1946/SK/BAN-PT/Ak/PT/X/2024,2024,09,2029-10-19
banpt-1150,Universitas Mitra Indonesia,Baik Sekali,1938/SK/BAN-PT/Ak/PT/X/2024,2024,02,2029-10-19
banpt-1151,Institut Bisnis dan Ekonomi Indonesia,Baik,1956/SK/BAN-PT/Ak/PT/X/2024,2024,11,2029-10-19
banpt-1152,"STAI Raudhatul Akmal, Deli Serdang, Sumatera Utara",Baik,1947/SK/BAN-PT/Ak/PT/X/2024,2024,PTAS,2029-10-19
banpt-1153,Akademi Kebidanan Sismadi,Baik,1941/SK/BAN-PT/Ak/PT/X/2024,2024,03,2029-10-19
banpt-1154,Sekolah Tinggi Manajemen Informatika dan Komputer (STMIK) Bina Bangsa Kendari,Baik,1934/SK/BAN-PT/Ak/PT/X/2024,2024,09,2029-10-19
banpt-1155,Politeknik Pelayaran Surabaya,Unggul,1932/SK/BAN-PT/Ak/PT/X/2024,2024,PTKL,2029-10-19
banpt-1156,Universitas Bhakti Asih Tangerang,Baik,1953/SK/BAN-PT/Ak-PNB/PT/X/2024,2024,04,2025-10-21
banpt-1157,Universitas Mercubaktijaya,B,1929/SK/BAN-PT/Ak-PNB/PT/X/2024,2024,10,2029-05-24
banpt-1158,Universitas PGRI Kalimantan,B,1928/SK/BAN-PT/Ak-PNB/PT/X/2024,2024,11,2029-10-15
banpt-1159,Institut Agama Islam Persis Bandung,Baik Sekali,1924/SK/BAN-PT/Ak-PNB/PT/X/2024,2024,PTAS,2026-03-24
banpt-1160,Politeknik Prasetiya Mandiri,Baik,1952/SK/BAN-PT/Ak-PNB/PT/X/2024,2024,04,2027-12-06
banpt-1161,Institut Pahlawan 12,Baik,1926/SK/BAN-PT/Ak-PNB/PT/X/2024,2024,02,2026-06-26
banpt-1162,Institut Agama Islam Pemalang,Baik,1925/SK/BAN-PT/Ak-PNB/PT/X/2024,2024,PTAS,2026-06-02
banpt-1163,Universitas Syedza Saintika,B,1927/SK/BAN-PT/Ak-PNB/PT/X/2024,2024,10,2026-01-30
banpt-1164,Universitas Islam Negeri Sumatera Utara Medan,Unggul,1936/SK/BAN-PT/Ak/PT/X/2024,2024,PTAN,2029-10-19
banpt-1165,Universitas Islam Negeri Sultan Syarif Kasim Riau,Unggul,1940/SK/BAN-PT/Ak/PT/X/2024,2024,PTAN,2029-10-19
banpt-1166,Universitas Jambi,Unggul,1937/SK/BAN-PT/Ak/PT/X/2024,2024,PTN,2029-10-19
banpt-1167,Sekolah Tinggi Filsafat Teologi Widya Sasana,B,1950/SK/BAN-PT/Ak.Ppj/PT/X/2024,2024,07,2029-04-10
banpt-1168,AMIK Tomakaka,Baik,1942/SK/BAN-PT/Ak/PT/X/2024,2024,09,2029-10-19
banpt-1169,Sekolah Tinggi Ilmu Administrasi Trinitas,Baik,1944/SK/BAN-PT/Ak/PT/X/2024,2024,12,2029-10-19
banpt-1170,Sekolah Tinggi Ilmu Ekonomi IGI,Baik,1945/SK/BAN-PT/Ak/PT/X/2024,2024,03,2029-10-19
banpt-1171,Universitas 45 Surabaya,Baik,1923/SK/BAN-PT/Ak/PT/X/2024,2024,07,2029-10-15
banpt-1172,Sekolah Tinggi Ilmu Ekonomi Putra Timor,Baik,1893/SK/BAN-PT/Ak.P/PT/X/2024,2024,15,2026-10-15
banpt-1173,Sekolah Tinggi Teologi Pantekosta Jakarta,Baik,1905/SK/BAN-PT/Ak.P/PT/X/2024,2024,PTAS,2026-10-15
banpt-1174,Sekolah Tinggi Teologi Abdi Gusti Nganjuk,Baik,1903/SK/BAN-PT/Ak.P/PT/X/2024,2024,PTAS,2026-10-15
banpt-1175,STT PRESBYTERIAN INDONESIA,Baik,1911/SK/BAN-PT/Ak.P/PT/X/2024,2024,PTAS,2026-10-15
banpt-1176,Sekolah Tinggi Ilmu Tarbiyah Hidayatullah Batam Kepulauan Riau,Baik,1901/SK/BAN-PT/Ak.P/PT/X/2024,2024,PTAS,2026-10-15
banpt-1177,Sekolah Tinggi Ilmu Ekonomi Pelita Buana,Baik,1920/SK/BAN-PT/Ak/PT/X/2024,2024,09,2029-10-15
banpt-1178,Sekolah Tinggi Ilmu Ekonomi Dharma Agung Indonesia,Baik,1919/SK/BAN-PT/Ak/PT/X/2024,2024,04,2029-10-15
banpt-1179,Sekolah Tinggi Pendidikan Holistik Berbasis Karekter,Baik,1921/SK/BAN-PT/Ak/PT/X/2024,2024,04,2029-10-15
banpt-1180,Insitut Ilmu Kesehatan Nahdlatul Ulama Tuban,Baik Sekali,1922/SK/BAN-PT/Ak/PT/X/2024,2024,07,2029-10-15
banpt-1181,Akademi Kebidanan Bina Nusantara Mandiri,Baik,1880/SK/BAN-PT/Ak.P/PT/X/2024,2024,10,2026-10-15
banpt-1182,Akademi Sekretari Dan Manajemen Persada Bunda,Baik,1882/SK/BAN-PT/Ak.P/PT/X/2024,2024,17,2026-10-15
banpt-1183,STAI Miftahul Ulum Tasikmalaya,Baik,1906/SK/BAN-PT/Ak.P/PT/X/2024,2024,PTAS,2026-10-15
banpt-1184,Institut Ummul Quro AL-Islami Bogor Jawa Barat,Baik,1886/SK/BAN-PT/Ak.P/PT/X/2024,2024,PTAS,2026-10-15
banpt-1185,Akademi Kebidanan Gema Nusantara Bekasi,Baik,1881/SK/BAN-PT/Ak.P/PT/X/2024,2024,04,2026-10-15
banpt-1186,Universitas W R Supratman,Baik,1918/SK/BAN-PT/Ak.B/PT/X/2024,2024,07,2026-10-15
banpt-1187,Sekolah Tinggi Ekonomi dan Bisnis Islam Al Jabar Bandung Jawa Barat,Baik,1914/SK/BAN-PT/Ak.B/PT/X/2024,2024,PTAS,2026-10-15
banpt-1188,Sekolah Tinggi Ilmu Tarbiyah Mamba'ul Hikam Pali Sumsel,Baik,1902/SK/BAN-PT/Ak.P/PT/X/2024,2024,PTAS,2026-10-15
banpt-1189,Sekolah Tinggi Ilmu Tarbiyah Az Zahra Tasikmalaya,Baik,1899/SK/BAN-PT/Ak.P/PT/X/2024,2024,PTAS,2026-10-15
banpt-1190,Sekolah Tinggi Teologi Ekklesia Pontianak,Baik,1904/SK/BAN-PT/Ak.P/PT/X/2024,2024,PTAS,2026-10-15
banpt-1191,STT Harapan Indah,Baik,1909/SK/BAN-PT/Ak.P/PT/X/2024,2024,PTAS,2026-10-15
banpt-1192,Universitas Cendekia Mitra Indonesia,Baik,1912/SK/BAN-PT/Ak.P/PT/X/2024,2024,05,2026-10-15
banpt-1193,Institut Teknologi Bacharuddin Jusuf Habibie,Baik,1885/SK/BAN-PT/Ak.P/PT/X/2024,2024,PTN,2026-10-15
banpt-1194,Universitas Graha Nusantara,B,1879/SK/BAN-PT/Ak.Ppj/PT/X/2024,2024,01,2029-05-22
banpt-1195,Universitas Muhammadiyah Cileungsi,Baik,1873/SK/BAN-PT/Ak.P/PT/X/2024,2024,04,2026-10-08
banpt-1196,STKIP Sinar Cendekia,Baik,1861/SK/BAN-PT/Ak/PT/X/2024,2024,04,2029-10-08
banpt-1197,Politeknik Krakatau,Baik,1854/SK/BAN-PT/Ak/PT/X/2024,2024,04,2029-10-08
banpt-1198,Sekolah Tinggi Ilmu Hukum Cendana Wangi,Baik,1858/SK/BAN-PT/Ak/PT/X/2024,2024,15,2029-10-08
banpt-1199,Sekolah Tinggi Agama Islam Kupang,Baik,1857/SK/BAN-PT/Ak/PT/X/2024,2024,PTAS,2029-10-08
banpt-1200,STKIP Simbiosis,Baik,1862/SK/BAN-PT/Ak/PT/X/2024,2024,15,2029-10-08
banpt-1201,Universitas Tomakaka,Baik,1859/SK/BAN-PT/Ak/PT/X/2024,2024,09,2029-10-08
banpt-1202,Politeknik Siber dan Sandi Negara,Baik Sekali,1856/SK/BAN-PT/Ak/PT/X/2024,2024,PTKL,2029-10-08
banpt-1203,Universitas Muhammadiyah Mahakarya Aceh,Baik Sekali,1860/SK/BAN-PT/Ak/PT/X/2024,2024,13,2029-10-08
banpt-1204,"Sekolah Tinggi Teologi Bethel The Way, Jakarta",Baik,1878/SK/BAN-PT/Ak/PT/X/2024,2024,PTAS,2029-10-08
banpt-1205,Sekolah Tinggi Ilmu Kesehatan Pemkab Jombang,Baik Sekali,1867/SK/BAN-PT/Ak/PT/X/2024,2024,07,2029-10-08
banpt-1206,STKIP Pesisir Selatan,Baik,1863/SK/BAN-PT/Ak/PT/X/2024,2024,10,2029-10-08
banpt-1207,Politeknik Muara Teweh,Baik,1855/SK/BAN-PT/Ak/PT/X/2024,2024,11,2029-10-08
banpt-1208,Universitas Islam Negeri Sunan Ampel,Unggul,1877/SK/BAN-PT/Ak.Ppj/PT/X/2024,2024,PTAN,2029-04-10
banpt-1209,AMIK Master Lampung,Baik,1870/SK/BAN-PT/Ak.P/PT/X/2024,2024,02,2026-10-08
banpt-1210,Sekolah Tinggi Ilmu Kesehatan Mayapada,Baik,1871/SK/BAN-PT/Ak.P/PT/X/2024,2024,03,2026-10-08
banpt-1211,Sekolah Tinggi Bahasa Asing Malang,Baik,1874/SK/BAN-PT/Ak.B/PT/X/2024,2024,07,2026-10-08
banpt-1212,STT INJILI JAKARTA,Baik,1872/SK/BAN-PT/Ak.P/PT/X/2024,2024,PTAS,2026-10-08
banpt-1213,Universitas Islam Riau,Unggul,1868/SK/BAN-PT/Ak/PT/X/2024,2024,17,2029-10-08
banpt-1214,Universitas Pembangunan Panca Budi,Unggul,1865/SK/BAN-PT/Ak/PT/X/2024,2024,01,2029-10-08
banpt-1215,Universitas Islam Negeri Sjech M. Djamil Djambek Bukittinggi,Unggul,1869/SK/BAN-PT/Ak/PT/X/2024,2024,PTAN,2029-10-08
banpt-1216,Universitas Sultan Ageng Tirtayasa,Unggul,1866/SK/BAN-PT/Ak/PT/X/2024,2024,PTN,2029-10-08
banpt-1217,Sekolah Tinggi Ilmu Syariah (STIS) Ummul Ayman Pidie Jaya,Baik,1875/SK/BAN-PT/Ak.Ppj/PT/X/2024,2024,PTAS,2029-05-16
banpt-1218,STAI Al-Fatah Cileungsi Bogor,Baik,1864/SK/BAN-PT/Ak/PT/X/2024,2024,PTAS,2029-10-08
banpt-1219,STT Periago,Baik,1853/SK/BAN-PT/Ak.B/PT/X/2024,2024,PTAS,2026-10-05
banpt-1220,STIKES Insan Se Agung,Baik,1830/SK/BAN-PT/Ak.B/PT/X/2024,2024,07,2026-10-03
banpt-1221,Sekolah Tinggi Ilmu Hukum Sumpah Pemuda,Unggul,1852/SK/BAN-PT/Ak/PT/X/2024,2024,02,2029-10-03
banpt-1222,Sekolah Tinggi Ilmu Kesehatan Serulingmas,Baik Sekali,1843/SK/BAN-PT/Ak.KP/PT/X/2024,2024,06,2028-11-22
banpt-1223,Universitas Muhammadiyah Pekajangan Pekalongan,Baik Sekali,1844/SK/BAN-PT/Ak.KP/PT/X/2024,2024,06,2029-04-10
banpt-1224,Universitas Sarjanawiyata Tamansiswa,Baik Sekali,1845/SK/BAN-PT/Ak.KP/PT/X/2024,2024,05,2028-12-13
banpt-1225,Akademi Kebidanan Minasa Upa,Baik,1840/SK/BAN-PT/Ak.Ppj/PT/X/2024,2024,09,2029-05-01
banpt-1226,Institut Teknologi Keling Kumang,Baik,1824/SK/BAN-PT/Ak/PT/X/2024,2024,11,2029-10-03
banpt-1227,Universitas 17 Agustus 1945 Samarinda,Baik Sekali,1842/SK/BAN-PT/Ak.KP/PT/X/2024,2024,11,2028-10-10
banpt-1228,Universitas Okmin Papua,Baik,1826/SK/BAN-PT/Ak/PT/X/2024,2024,14,2029-10-03
banpt-1229,STKIP Nusa Timor,Baik,1825/SK/BAN-PT/Ak/PT/X/2024,2024,15,2029-10-03
banpt-1230,Universitas Satyagama,Baik,1846/SK/BAN-PT/Ak/PT/X/2024,2024,03,2029-10-03
banpt-1231,Sekolah Tinggi Teknologi Immanuel,Baik,1851/SK/BAN-PT/Ak/PT/X/2024,2024,01,2029-10-03
banpt-1232,Politeknik Piksi Ganesha Indonesia,Baik Sekali,1841/SK/BAN-PT/Ak.KP/PT/X/2024,2024,06,2028-12-13
banpt-1233,Akademi Komunitas Negeri Rejang Lebong,Baik,1823/SK/BAN-PT/Ak/PT/X/2024,2024,PTN,2029-10-03
banpt-1234,Politeknik Dewantara,Baik,1847/SK/BAN-PT/Ak-PNB/PT/X/2024,2024,09,2025-11-14
banpt-1235,Universitas Al Washliyah Darussalam Banda Aceh,Baik,1850/SK/BAN-PT/Ak-PNB/PT/X/2024,2024,13,2026-06-26
banpt-1236,Sekolah Tinggi Teologi Tabgha Batam,Baik,1837/SK/BAN-PT/Ak.P/PT/X/2024,2024,PTAS,2026-10-03
banpt-1237,Sekolah Tinggi Ilmu Syariah Darusy Syafa'ah Lampung Tengah,Baik,1836/SK/BAN-PT/Ak.P/PT/X/2024,2024,PTAS,2026-10-03
banpt-1238,Sekolah Tinggi Teologi Immanuel Sintang Kal-bar,Baik,1829/SK/BAN-PT/Ak.B/PT/X/2024,2024,PTAS,2026-10-03
banpt-1239,Sekolah Tinggi Ilmu Kesehatan Pelita Ilmu Depok,Baik,1835/SK/BAN-PT/Ak.P/PT/X/2024,2024,04,2026-10-03
banpt-1240,Akademi Kebidanan Sari Husada,Baik,1827/SK/BAN-PT/Ak.B/PT/X/2024,2024,01,2026-10-03
banpt-1241,Politeknik Lengguru,Baik,1832/SK/BAN-PT/Ak.P/PT/X/2024,2024,14,2026-10-03
banpt-1242,Universitas Doktor Husni Ingratubun Papua,B,1849/SK/BAN-PT/Ak-PNB/PT/X/2024,2024,14,2026-12-28
