institution_code,institution_name,akreditasi_institusi,wilayah
3106,AKADEMI PARIWISATA DAN PERHOTELAN DARMA AGUNG,B,WILAYAH 01
3107,SEKOLAH TINGGI ILMU KESEHATAN PRIMA INDONESIA,BAIK,WILAYAH 04
3108,POLITEKNIK KETENAGAKERJAAN,BAIK,WILAYAH PTKL
3109,INSTITUT AGAMA ISLAM FAQIH ASY'ARI KEDIRI,BAIK,WILAYAH PTAS
3110,SEKOLAH TINGGI BIBELVROUW HKBP LAGUBOTI,BAIK,WILAYAH PTAS
3111,SEKOLAH TINGGI EKONOMI BISNIS ISLAM SYARI'AH BINA MANDIRI CILEUNGSU BOGOR,BAIK,WILAYAH PTAS
3112,STMIK KHARISMA MAKASSAR,BAIK,WILAYAH 09
3113,AKADEMI ANALIS FARMASI DAN MAKANAN SUNAN GIRI,BAIK,WILAYAH 07
3114,UNIVERSITAS NAHDLATUL ULAMA SURAKARTA,BAIK SEKALI,WILAYAH 06
3115,SEKOLAH TINGGI TEOLOGI ABDI SABDA MEDAN,BAIK,WILAYAH PTAS
3116,STIKES GEMA INSAN AKADEMIK,BAIK,WILAYAH 09
3117,POLITEKNIK ILMU PELAYARAN MAKASSAR,BAIK SEKALI,WILAYAH PTKL
3118,STAI AL-HIKMAH 2,BAIK,WILAYAH PTAS
3119,INSTITUT AGAMA ISLAM SHALAHUDDIN AL-AYYUBI TAMBUN BEKASI,BAIK,WILAYAH PTAS
3120,SEKOLAH TINGGI ILMU KESEHATAN ALIFAH PADANG,BAIK SEKALI,WILAYAH 10
3121,UNIVERSITAS DINAMIKA,BAIK SEKALI,WILAYAH 07
3122,SEKOLAH TINGGI TEOLOGI BETHEL MEDAN,BAIK,WILAYAH PTAS
3123,SEKOLAH TINGGI ILMU TARBIYAH MUHAMMADIYAH TANJUNG REDEB BERAU,BAIK,WILAYAH PTAS
3124,SEKOLAH TINGGI TEOLOGI INJILI BETHSAIDA MEDAN,BAIK,WILAYAH PTAS
3125,AKADEMI PEKERJAAN SOSIAL KUPANG,BAIK,WILAYAH 15
3126,STIA DAN MANAJEMEN KEPELABUHAN BARUNAWATI,BAIK SEKALI,WILAYAH 07
3127,POLITEKNIK TRANSPORTASI DARAT INDONESIA - STTD,BAIK SEKALI,WILAYAH PTKL
3128,AKADEMI KOMUNITAS PERKEBUNAN YOGYAKARTA,BAIK,WILAYAH 05
3129,POLITEKNIK ANGKATAN DARAT,BAIK SEKALI,WILAYAH PTKL
3130,POLITEKNIK STMI JAKARTA,BAIK SEKALI,WILAYAH PTKL
3131,UNIVERSITAS UBUDIYAH INDONESIA,BAIK,WILAYAH 13
3132,INSTITUT DAARUL QUR'AN JAKARTA,BAIK,WILAYAH PTAS
3133,POLITEKNIK PEKERJAAN UMUM,BAIK,WILAYAH PTKL
3134,SEKOLAH TINGGI ILMU AL-QUR'AN DAN SAINS AL-ISHLAH LAMONGAN JAWA TIMUR,BAIK,WILAYAH PTAS
3135,POLITEKNIK KALTARA,BAIK,WILAYAH 11
3136,INSTITUT TEKNOLOGI NASIONAL BANDUNG,UNGGUL,WILAYAH 04
3137,UNIVERSITAS YUDHARTA PASURUAN,BAIK SEKALI,WILAYAH 07
3138,SEKOLAH TINGGI ILMU KESEHATAN RESPATI,BAIK SEKALI,WILAYAH 04
3139,INSTITUT AGAMA ISLAM AL-HIKMAH TUBAN,BAIK,WILAYAH PTAS
3140,UNIVERSITAS TRIDHARMA,TIDAK TERAKREDITASI,WILAYAH 11
3141,SEKOLAH TINGGI KEGURUAN DAN ILMU PENDIDIKAN AGAMA HINDU SINGARAJA,BAIK,WILAYAH 08
3142,POLITEKNIK RAFLESIA,BAIK,WILAYAH 02
3143,AKADEMI KEPERAWATAN GITA MATURA ABADI KISARAN,BAIK,WILAYAH 01
3144,SEKOLAH TINGGI ILMU EKONOMI BANGKINANG,BAIK SEKALI,WILAYAH 17
3145,"STAI TAPANULI PADANGSIDEMPUAN, SUMATERA UTARA",BAIK,WILAYAH PTAS
3146,SEKOLAH TINGGI ILMU EKONOMI ARTHA BODHI ISWARA,BAIK,WILAYAH 07
3147,STAI NUSANTARA KOTA BANDA ACEH,BAIK,WILAYAH PTAS
3148,SEKOLAH TINGGI ILMU KESEHATAN DATU KAMANRE,BAIK,WILAYAH 09
3149,UNIVERSITAS ISLAM OGAN KOMERING ILIR KAYUAGUNG,BAIK,WILAYAH 02
3150,SEKOLAH TINGGI PERTANIAN KEWIRAUSAHAAN BANAU,BAIK SEKALI,WILAYAH 12
3151,STAI NAHDLATUL ULAMA TASIKMALAYA,BAIK,WILAYAH PTAS
3152,AKADEMI PARIWISATA YOGYAKARTA,BAIK,WILAYAH 05
3153,POLITEKNIK BISNIS DAN PASAR MODAL,BAIK,WILAYAH 03
3154,UNIVERSITAS GUNUNG KIDUL,BAIK,WILAYAH 05
3155,UNIVERSITAS WIDYATAMA,UNGGUL,WILAYAH 04
3156,SEKOLAH TINGGI TEKNOLOGI NUSANTARA INDONESIA,BAIK,WILAYAH 09
3157,SEKOLAH TINGGI AGAMA ISLAM SAYID MOHAMMAD ALAWI AL MALIKI,BAIK,WILAYAH PTAS
3158,SEKOLAH TINGGI BISNIS DAN MANAJEMEN DUA SAUDARA,BAIK,WILAYAH 16
3159,"STIT HAMZAH AL-FANSURI SIBOLGA BARUS TAPANULI TENGAH, SUMATERA UTA",BAIK,WILAYAH PTAS
3160,POLITEKNIK KELAUTAN DAN PERIKANAN BITUNG,BAIK SEKALI,WILAYAH PTKL
3161,"INSTITUT PEMBINA ROHANI ISLAM JAKARTA, CIRACAS, JAKARTA TIMUR",BAIK,WILAYAH PTAS
3162,POLITEKNIK ILMU PEMASYARAKATAN,BAIK,WILAYAH PTKL
3163,SEKOLAH TINGGI AGAMA ISLAM ACEH TAMIANG,BAIK,WILAYAH PTAS
3164,POLTEKKES KEMENKES MAMUJU,BAIK,WILAYAH PTKL
3165,UNIVERSITAS MUHAMAMDIYAH KARANGANYAR,BAIK,WILAYAH 06
3166,SEKOLAH TINGGI FILSAFAT FAJAR TIMUR,BAIK,WILAYAH 14
3167,AKADEMI KEBIDANAN PARAMATA RAHA,BAIK,WILAYAH 09
3168,UNIVERSITAS RESPATI YOGYAKARTA,B,WILAYAH 05
3169,AKADEMI MARITIM INDONESIA AIPI,BAIK,WILAYAH 09
3170,UNIVERSITAS CIPASUNG TASIKMALAYA,BAIK,WILAYAH 04
3171,INSTITUT TEKNOLOGI DAN BISNIS WIDYA GAMA LUMAJANG,BAIK,WILAYAH 07
3172,POLITEKNIK PARIWISATA PRIMA INTERNASIONAL,BAIK,WILAYAH 04
3173,POLITEKNIK BAJA TEGAL,BAIK,WILAYAH 06
3174,UNIVERSITAS SATYA WIYATA MANDALA,BAIK,WILAYAH 14
3175,SEKOLAH TINGGI TEKNOLOGI TERPADU NURUL FIKRI,BAIK,WILAYAH 04
3176,UNIVERSITAS ANWAR MEDIKA,BAIK,WILAYAH 07
3177,SEKOLAH TINGGI ILMU AL QUR'AN AR-RAHMAN,BAIK,WILAYAH PTAS
3178,SEKOLAH TINGGI ILMU HUKUM SUNAN GIRI,BAIK,WILAYAH 07
3179,POLTEKKES KEMENKES YOGYAKARTA,BAIK SEKALI,WILAYAH PTKL
3180,STAH NEGERI MPU KUTURAN SINGARAJA BALI,BAIK SEKALI,WILAYAH PTAN
3181,AKADEMI KEUANGAN DAN PERBANKAN EFFATA KUPANG,BAIK,WILAYAH 15
3182,UNIVERSITAS MIKROSKIL,B,WILAYAH 01
3183,INSTITUT TEKNOLOGI PAGAR ALAM,BAIK,WILAYAH 02
3184,INSTITUT AGAMA ISLAM AL-QUR'AN AL-ITTIFAQIAH INDRALAYA,BAIK,WILAYAH PTAS
3185,STIKES WIDYAGAMA HUSADA MALANG,BAIK,WILAYAH 07
3186,UNIVERSITAS PAPUA,BAIK SEKALI,WILAYAH PTN
3187,UNIVERSITAS AGUNG PODOMORO,BAIK SEKALI,WILAYAH 03
3188,POLITEKNIK PERKERETAAPIAN INDONESIA MADIUN,BAIK SEKALI,WILAYAH PTKL
3189,UNIVERSITAS KRISTEN INDONESIA,UNGGUL,WILAYAH 03
3190,UNIVERSITAS TEKNOLOGI SUMBAWA,BAIK SEKALI,WILAYAH 08
3191,STMIK PRANATA INDONESIA,BAIK,WILAYAH 04
3192,STIKES DARUL AZHAR BATULICIN,BAIK,WILAYAH 11
3193,STEI AR RISALAH CIAMIS JAWA BARAT,BAIK,WILAYAH PTAS
3194,AKADEMI PERIKANAN YOGYAKARTA,BAIK,WILAYAH 05
3195,"SEKOLAH TINGGI TEKNOLOGI ""WARGA"" SURAKARTA",BAIK,WILAYAH 06
3196,STIKES KAPUAS RAYA,BAIK,WILAYAH 11
3197,UNIVERSITAS MUHAMMADIYAH PROF DR HAMKA,UNGGUL,WILAYAH 03
3198,UNIVERSITAS PENDIDIKAN INDONESIA,UNGGUL,WILAYAH PTN
3199,UNIVERSITAS BINA NUSANTARA,UNGGUL,WILAYAH 03
3200,SEKOLAH TINGGI AGAMA ISLAM DARUSSALAM SUMATRA SELATAN,BAIK,WILAYAH PTAS
3201,SEKOLAH TINGGI AGAMA ISLAM SYUBBANUL WATHON MAGELANG,BAIK,WILAYAH PTAS
3202,UNIVERSITAS MUHAMMADIYAH MAMUJU,BAIK,WILAYAH 09
3203,UNIVERSITAS NURUL HUDA,BAIK,WILAYAH 02
3204,INSTITUT ILMU SOSIAL DAN MANAJEMEN STIAMI,BAIK SEKALI,WILAYAH 03
3205,SEKOLAH TINGGI ILMU TARBIYAH AL- KIFAYAH RIAU,TIDAK TERAKREDITASI,WILAYAH PTAS
3206,SEKOLAH TINGGI ILMU ADMINISTRASI LANCANG KUNING,BAIK,WILAYAH 17
3207,STIKES GUNA BANGSA YOGYAKARTA,BAIK SEKALI,WILAYAH 05
3208,UNIVERSITAS MERCU BUANA YOGYAKARTA,B,WILAYAH 05
3209,STAK NEGERI TORAJA,BAIK,WILAYAH PTAN
3210,SEKOLAH TINGGI ILMU KESEHATAN BINA GENERASI POLEWALI MANDAR,BAIK,WILAYAH 09
3211,AKADEMI KESEHATAN GIGI KARYA ADI HUSADA MATARAM,BAIK,WILAYAH 08
3212,SEKOLAH TINGGI ILMU KESEHATAN MITRA RIA HUSADA,BAIK,WILAYAH 03
3213,SEKOLAH TINGGI KEGURUAN DAN ILMU PENDIDIKAN BINA MUTIARA,BAIK,WILAYAH 04
3214,STKIP MUHAMMADIYAH BLORA,BAIK,WILAYAH 06
3215,SEKOLAH TINGGI EKONOMI DAN BISNIS ISLAM TANGGAMUS LAMPUNG,BAIK,WILAYAH PTAS
3216,INSTITUT AGAMA ISLAM NEGERI TAKENGON,BAIK,WILAYAH PTAN
3217,AKADEMI KEBIDANAN PANCA BHAKTI,BAIK SEKALI,WILAYAH 11
3218,UNIVERSITAS PASIR PENGARAIAN,BAIK,WILAYAH 17
3219,SEKOLAH TINGGI TEOLOGI GLOBAL GLOW INDONESIA JAKARTA,BAIK,WILAYAH PTAS
3220,SEKOLAH TINGGI ILMU EKONOMI SURAKARTA,B,WILAYAH 06
3221,SEKOLAH TINGGI ILMU EKONOMI SAKTI ALAM KERINCI,B,WILAYAH 10
3222,UNIVERSITAS 'AISYIYAH SURAKARTA,BAIK SEKALI,WILAYAH 06
3223,SEKOLAH TINGGI ILMU KESEHATAN PANTI KOSALA,BAIK SEKALI,WILAYAH 06
3224,AKADEMI MANAJEMEN INFORMATIKA DAN KOMPUTER JAKARTA TEKNOLOGI CIPTA,B,WILAYAH 06
3225,SEKOLAH TINGGI ILMU EKONOMI APRIN,B,WILAYAH 02
3226,UNIVERSITAS YARSI,B,WILAYAH 03
3227,SEKOLAH TINGGI ILMU KESEHATAN MERCUBAKTIJAYA,B,WILAYAH 10
3228,SEKOLAH TINGGI ILMU EKONOMI PELITA NUSANTARA,B,WILAYAH 06
3229,UNIVERSITAS UDAYANA,UNGGUL,WILAYAH PTN
3230,POLITEKNIK NASIONAL,BAIK,WILAYAH 08
3231,SEKOLAH TINGGI TEOLOGI APOLLOS JAKARTA,BAIK,WILAYAH PTAS
3232,SEKOLAH TINGGI ILMU ADMINISTRASI SETIH SETIO,B,WILAYAH 10
3233,SEKOLAH TINGGI BAHASA ASING LIA YOGYAKARTA,B,WILAYAH 05
3234,UNIVERSITAS PATTIMURA,B,WILAYAH PTN
3235,SEKOLAH TINGGI TEOLOGI PELITA BANGSA,BAIK,WILAYAH PTAS
3236,SEKOLAH TINGGI ILMU SYARIAH NAHDLATUL ULAMA NUSANTARA TANGERANG,BAIK,WILAYAH PTAS
3237,UNIVERSITAS NEGERI PADANG,UNGGUL,WILAYAH PTN
3238,POLITEKNIK NEGERI UJUNG PANDANG,BAIK SEKALI,WILAYAH PTN
3239,POLITEKNIK STIA LAN BANDUNG,BAIK SEKALI,WILAYAH PTKL
3240,UNIVERSITAS NEGERI YOGYAKARTA,UNGGUL,WILAYAH PTN
3241,UNIVERSITAS MOHAMMAD HUSNI THAMRIN,B,WILAYAH 03
3242,INSTITUT AGAMA ISLAM AL MUSLIM ACEH,B,WILAYAH PTAS
3243,STIE IBEK PANGKALPINANG BANGKA,BAIK,WILAYAH 02
3244,SEKOLAH TINGGI TEOLOGI IMANUEL PACET,BAIK,WILAYAH PTAS
3245,UNIVERSITAS PERADABAN,BAIK,WILAYAH 06
3246,INSTITUT TEKNOLOGI PERUSAHAAN LISTRIK NEGARA,B,WILAYAH 03
3247,INSTITUT TEKNOLOGI DAN BISNIS SWADHARMA,BAIK,WILAYAH 03
3248,STAI AL-HAMIDIYAH JAKARTA,BAIK,WILAYAH PTAS
3249,SEKOLAH TINGGI ILMU TARBIYAH MAKRIFATUL ILMI BENGKULU SELATAN,BAIK,WILAYAH PTAS
3250,INSTITUT AGAMA ISLAM AL-AMANAH JENEPONTO,BAIK,WILAYAH PTAS
3251,SEKOLAH TINGGI AGAMA ISLAM SABILUL MUTTAQQIN MOJOKERTO JAWA TIMUR,BAIK,WILAYAH PTAS
3252,POLITEKNIK PURBAYA,BAIK,WILAYAH 06
3253,INSTITUT AGAMA KRISTEN NEGERI TARUTUNG,BAIK,WILAYAH PTAN
3254,UNIVERSITAS DIAN NUSWANTORO,UNGGUL,WILAYAH 06
3255,UNIVERSITAS ISLAM LAMONGAN,BAIK SEKALI,WILAYAH 07
3256,STKIP AGAMA HINDU AMLAPURA,BAIK,WILAYAH 08
3257,STIKES ICHSAN MEDICAL CENTRE BINTARO,BAIK,WILAYAH 04
3258,STKIP BABUNNAJAH PANDEGLANG,BAIK,WILAYAH 04
3259,STIKI MALANG,BAIK SEKALI,WILAYAH 07
3260,POLITEKNIK ATK YOGYAKARTA,BAIK SEKALI,WILAYAH PTKL
3261,STAI MA`ARIF JAMBI,BAIK,WILAYAH PTAS
3262,UNIVERSITAS BATAM,B,WILAYAH 17
3263,UNIVERSITAS WIDYA DHARMA PONTIANAK,BAIK,WILAYAH 11
3264,UNIVERSITAS TJUT NYAK DHIEN,BAIK SEKALI,WILAYAH 01
3265,STMIK CATUR SAKTI KENDARI,BAIK,WILAYAH 09
3266,SEKOLAH TINGGI ILMU KESEHATAN TAMALATEA MAKASSAR,BAIK,WILAYAH 09
3267,AKADEMI KOMUNITAS INDUSTRI TEKSTIL DAN PRODUK TEKSTIL SURAKARTA,BAIK,WILAYAH PTKL
3268,UNIVERSITAS BUMI HIJRAH TIDORE,BAIK,WILAYAH 12
3269,STIKES PANAKKUKANG,BAIK,WILAYAH 09
3270,SEKOLAH TINGGI BIO SAINS SWADIRI,BAIK,WILAYAH 14
3271,STKIP KUSUMANEGARA,BAIK SEKALI,WILAYAH 03
3272,STAI TUANKU TAMBUSAI,BAIK,WILAYAH PTAS
3273,UNIVERSITAS MUHAMMADIYAH KOTABUMI,B,WILAYAH 02
3274,INSTITUT TEKNOLOGI GARUT,BAIK SEKALI,WILAYAH 04
3275,AKADEMI KEPERAWATAN RUMKIT TINGKAT III MANADO,BAIK,WILAYAH 16
3276,UNIVERSITAS IBN KHALDUN,B,WILAYAH 04
3277,POLITEKNIK TIARA BUNDA,BAIK,WILAYAH 04
3278,SEKOLAH TINGGI ILMU ADMINISTRASI MALANG,BAIK,WILAYAH 07
3279,INSTITUT STUDI ISLAM MUHAMMADIYAH PACITAN,BAIK,WILAYAH PTAS
3280,UNIVERSITAS MEDIKA SUHERMAN,B,WILAYAH 04
3281,UNIVERSITAS PGRI WIRANEGARA,B,WILAYAH 07
3282,SEKOLAH TINGGI ILMU KESEHATAN BULELENG,B,WILAYAH 08
3283,UNIVERSITAS KRISTEN ARTHA WACANA,B,WILAYAH 15
3284,INSTITUT AGAMA ISLAM NEGERI METRO,B,WILAYAH PTAN
3285,UNIVERSITAS MUHAMMADIYAH RIAU,B,WILAYAH 17
3286,UNIVERSITAS MUHAMMADIYAH PURWOREJO,B,WILAYAH 06
3287,STIKES YAHYA BIMA,BAIK,WILAYAH 08
3288,POLITEKNIK KESEHATAN UMMI KHASANAH,B,WILAYAH 05
3289,SEKOLAH TINGGI ILMU PENDIDIKAN ISLAM MAGHFIRAH BINA UMAT,BAIK,WILAYAH PTAS
3290,POLITEKNIK STIA LAN JAKARTA,B,WILAYAH PTKL
3291,SEKOLAH TINGGI TEKNOLOGI ANGKATAN LAUT,B,WILAYAH PTKL
3292,INSTITUT MEDIKA DRG. SUHERMAN,B,WILAYAH 04
3293,UNIVERSITAS HAYAM WURUK PERBANAS,A,WILAYAH 07
3294,UNIVERSITAS NAROTAMA,B,WILAYAH 07
3295,UNIVERSITAS NEGERI MEDAN,A,WILAYAH PTN
3296,POLITEKNIK NEGERI SEMARANG,A,WILAYAH PTN
3297,UNIVERSITAS WIDYA DHARMA KLATEN,B,WILAYAH 06
3298,UNIVERSITAS DR SOETOMO,B,WILAYAH 07
3299,SEKOLAH TINGGI ILMU EKONOMI WIDYA WIWAHA,B,WILAYAH 05
3300,SEKOLAH TINGGI FILSAFAT THEOLOGI JAKARTA,B,WILAYAH 03
3301,POLITEKNIK PENERBANGAN MEDAN,B,WILAYAH PTKL
3302,INSTITUT BISNIS DAN INFORMATIKA KESATUAN,B,WILAYAH 04
3303,INSTITUT TEKNOLOGI NASIONAL YOGYAKARTA,B,WILAYAH 05
3304,"SEKOLAH TINGGI MULTI MEDIA ""MMTC"" YOGYAKARTA",B,WILAYAH PTKL
3305,SEKOLAH TINGGI ILMU KESEHATAN BINA PUTRA BANJAR,B,WILAYAH 04
3306,UNIVERSITAS PERTAHANAN,A,WILAYAH PTKL
3307,STAI MA`HAD `ALI CIREBON,BAIK,WILAYAH PTAS
3308,UNIVERSITAS SRIWIJAYA,UNGGUL,WILAYAH PTN
3309,UNIVERSITAS TELKOM,UNGGUL,WILAYAH 04
3310,SEKOLAH TINGGI ILMU HUKUM 'UMEL MANDIRI',B,WILAYAH 14
3311,INSTITUT TEKNOLOGI PADANG,B,WILAYAH 10
3312,AKADEMI KEBIDANAN ANUGERAH BINTAN,B,WILAYAH 17
3313,UNIVERSITAS MA CHUNG,B,WILAYAH 07
3314,SEKOLAH TINGGI ILMU KESEHATAN PERTAMEDIKA,B,WILAYAH 03
3315,UNIVERSITAS MUHAMMADIYAH PONTIANAK,B,WILAYAH 11
3316,POLITEKNIK KESEHATAN KEMENTERIAN KESEHATAN KUPANG,B,WILAYAH PTKL
3317,POLITEKNIK NEGERI PONTIANAK,B,WILAYAH PTN
3318,UNIVERSITAS MUHAMMADIYAH SURAKARTA,UNGGUL,WILAYAH 06
3319,SEKOLAH TINGGI  ILMU EKONOMI JIU,TIDAK TERAKREDITASI,WILAYAH 04
3320,SEKOLAH TINGGI ILMU KESEHATAN GUNUNG SARI,C,WILAYAH 09
3321,SEKOLAH TINGGI ILMU EKONOMI PEMUDA,BAIK,WILAYAH 07
3322,UNIVERSITAS GRESIK,BAIK SEKALI,WILAYAH 07
3323,STIKES BHAKTI PERTIWI INDONESIA,BAIK,WILAYAH 03
3324,SEKOLAH TINGGI ILMU HUKUM AWANG LONG,BAIK SEKALI,WILAYAH 11
3325,SEKOLAH TINGGI KEGURUAN DAN ILMU PENDIDIKAN AMAL BAKTI,BAIK,WILAYAH 01
3326,SEKOLAH TINGGI ILMU KESEHATAN PAPUA,BAIK,WILAYAH 14
3327,SEKOLAH TINGGI ILMU KESEHATAN DHARMA HUSADA,BAIK,WILAYAH 04
3328,POLITEKNIK PENERBANGAN MAKASSAR,BAIK,WILAYAH PTKL
3329,SEKOLAH TINGGI ILMU FARMASI DAN  PENGETAHUAN ALAM PELITA MAS PALU,BAIK,WILAYAH 16
3330,AKADEMI SEKRETARI DAN MANAJEMEN DON BOSCO,BAIK,WILAYAH 03
3331,STMIK YMI TEGAL,BAIK,WILAYAH 06
3332,SEKOLAH TINGGI ILMU KESEHATAN HARAPAN BANGSA,BAIK,WILAYAH 07
3333,SEKOLAH TINGGI ILMU HUKUM GRAHA KIRANA,BAIK,WILAYAH 01
3334,AKADEMI BAHASA ASING BALIKPAPAN,BAIK,WILAYAH 11
3335,UNIVERSITAS KATOLIK WIDYA MANDIRA KUPANG,B,WILAYAH 15
3336,INSTITUT AGAMA ISLAM NASIONAL LAA ROIBA BOGOR JAWA BARAT,BAIK,WILAYAH PTAS
3337,SEKOLAH TINGGI ILMU KESEHATAN INDONESIA,BAIK,WILAYAH 10
3338,"STAI SERDANG LUBUK PAKAM, SUMATERA UTARA",BAIK,WILAYAH PTAS
3339,SEKOLAH TINGGI AGAMA ISLAM ISLAMIC CENTRE DEMAK,BAIK,WILAYAH PTAS
3340,POLITEKNIK PELAYARAN SORONG,BAIK,WILAYAH PTKL
3341,STAI AR-ROSYID SURABAYA,BAIK,WILAYAH PTAS
3342,POLITEKNIK KELAUTAN DAN PERIKANAN KUPANG,BAIK,WILAYAH PTKL
3343,SEKOLAH TINGGI ILMU TARBIYAH TOGO AMBARSARI BONDOWOSO JAWA TIMUR,BAIK,WILAYAH PTAS
3344,SEKOLAH TINGGI TEOLOGI BANDUNG,BAIK,WILAYAH PTAS
3345,SEKOLAH TINGGI ILMU TARBIYAH AL MUBAROK BANDAR MATARAM,BAIK,WILAYAH PTAS
3346,POLITEKNIK KELAUTAN DAN PERIKANAN KARAWANG,BAIK SEKALI,WILAYAH PTKL
3347,INSTITUT AGAMA ISLAM BAKTI NEGARA TEGAL,BAIK,WILAYAH PTAS
3348,SEKOLAH TINGGI TEOLOGI INJILI INDONESIA JAKARTA,BAIK,WILAYAH PTAS
3349,SEKOLAH TINGGI TEOLOGI ADHI WACANA SURABAYA,BAIK,WILAYAH PTAS
3350,SEKOLAH TINGGI AGAMA ISLAM MAMBAUL ULUM JAMBI,BAIK,WILAYAH PTAS
3351,SEKOLAH TINGGI BAHASA ASING PONTIANAK,BAIK,WILAYAH 11
3352,INSTITUT ISLAM NAHDLATUL ULAMA TEMANGGUNG,BAIK,WILAYAH PTAS
3353,STIPAS KEUSKUPAN AGUNG KUPANG,BAIK,WILAYAH PTAS
3354,STAK WIYATA WACANA PATI,BAIK,WILAYAH PTAS
3355,POLITEKNIK KELAUTAN DAN PERIKANAN DUMAI,BAIK SEKALI,WILAYAH PTKL
3356,STAI BAITUL ARQOM AL-ISLAMI CIPARAY BANDUNG,BAIK,WILAYAH PTAS
3357,POLITEKNIK AHLI USAHA PERIKANAN,BAIK SEKALI,WILAYAH PTKL
3358,INSTITUT AGAMA ISLAM AZ-ZAYTUN INDONESIA,BAIK,WILAYAH PTAS
3359,STKIP DARUSSALAM CILACAP,BAIK,WILAYAH 06
3360,SEKOLAH TINGGI TEOLOGI ARRABONA BOGOR,BAIK,WILAYAH PTAS
3361,STKIP HAMZAR,BAIK,WILAYAH 08
3362,SEKOLAH TINGGI ILMU KOMUNIKASI ALMAMATER WARTAWAN SURABAYA,BAIK SEKALI,WILAYAH 07
3363,UNIVERSITAS KLABAT,B,WILAYAH 16
3364,SEKOLAH TINGGI AGAMA KRISTEN TERPADU PESAT SALATIGA,BAIK,WILAYAH PTAS
3365,STT BISANRY MAKASSAR,BAIK,WILAYAH PTAS
3366,SEKOLAH TINGGI TEOLOGI SUMATERA UTARA,BAIK,WILAYAH PTAS
3367,SEKOLAH TINGGI ILMU AL-QUR'AN NURUL ISLAM,BAIK,WILAYAH PTAS
3368,SEKOLAH TINGGI TEOLOGI TIBERIAS JAKARTA,BAIK,WILAYAH PTAS
3369,SEKOLAH TINGGI TEOLOGI KINGDOM BALI,BAIK,WILAYAH PTAS
3370,SEKOLAH TINGGI EKONOMI DAN BISNIS ISLAM DARUSSALAM OGAN KOMERING ILIR SUMSEL,BAIK,WILAYAH PTAS
3371,SEKOLAH TINGGI TEOLOGI HAGIASMOS MISSION JAKARTA,BAIK,WILAYAH PTAS
3372,POLITEKNIK KELAUTAN DAN PERIKANAN PANGANDARAN,BAIK,WILAYAH PTKL
3373,STMIK MARDIRA INDONESIA,BAIK,WILAYAH 04
3374,SEKOLAH TINGGI ILMU EKONOMI KARYA,BAIK,WILAYAH 15
3375,SEKOLAH TINGGI TEKNOLOGI BANDUNG,BAIK,WILAYAH 04
3376,INSTITUT AGAMA ISLAM TRIBAKTI KEDIRI,BAIK,WILAYAH PTAS
3377,SEKOLAH TINGGI TEOLOGI LINTAS BUDAYA JAKARTA,BAIK,WILAYAH PTAS
3378,STT IKAT DI BATAM,BAIK,WILAYAH PTAS
3379,STAK ANAK BANGSA,BAIK,WILAYAH PTAS
3380,INSTITUT AGAMA ISLAM NURUL HAKIM KEDIRI LOMBOK BARAT NTB,BAIK,WILAYAH PTAS
3381,INSTITUT PESANTREN KH. ABDUL CHALIM PACET MOJOKERTO,BAIK,WILAYAH PTAS
3382,UNIVERSITAS MUHAMMADIYAH ENREKANG,BAIK,WILAYAH 09
3383,SEKOLAH TINGGI PENDIDIKAN AGAMA KRISTEN MALANG,BAIK,WILAYAH PTAS
3384,UNIVERSITAS KRISTEN INDONESIA TOMOHON,BAIK,WILAYAH 16
3385,AKADEMI KEBIDANAN MANDIRI GRESIK,BAIK,WILAYAH 07
3386,SEKOLAH TINGGI ILMU ADMINISTRASI ISKANDAR THANI,BAIK,WILAYAH 13
3387,SEKOLAH TINGGI TEOLOGI NUSANTARA SALATIGA,BAIK,WILAYAH PTAS
3388,SEKOLAH TINGGI PASTORAL KATEKETIK SANTO FRANSISKUS ASISI SEMARANG,BAIK SEKALI,WILAYAH PTAS
3389,POTITEKNIK INDUSTRI FURNITUR DAN PENGOLAHAN KAYU,BAIK,WILAYAH PTKL
3390,INSTITUT TEKNOLOGI MINAESA,BAIK,WILAYAH 16
3391,INSTITUT TEKNOLOGI DAN BISNIS KALBIS,BAIK SEKALI,WILAYAH 03
3392,SEKOLAH TINGGI AGAMA KRISTEN TERUNA BHAKTI,BAIK,WILAYAH PTAS
3393,STT INDONESIA MANADO,BAIK,WILAYAH PTAS
3394,UNIVERSITAS WIDYA GAMA,B,WILAYAH 07
3395,POLITEKNIK ASTRA,B,WILAYAH 03
3396,UNIVERSITAS MUHAMMADIYAH MATARAM,B,WILAYAH 08
3397,SEKOLAH TINGGI TEOLOGI ERIKSON TRITT,BAIK,WILAYAH PTAS
3398,SEKOLAH TINGGI TEOLOGI ATI ANJUNGAN PONTIANAK,BAIK,WILAYAH PTAS
3399,SEKOLAH TINGGI TEOLOGI INJIL BHAKTI CARAKA BATAM,BAIK,WILAYAH PTAS
3400,SEKOLAH TINGGI TEOLOGI GEREJA PENTAKOSTA DI INDONESIA PEMATANG SIANTAR,BAIK,WILAYAH PTAS
3401,STIT MUHAMMADIYAH PACIRAN,BAIK,WILAYAH PTAS
3402,SEKOLAH TINGGI ILMU EKONOMI PASAMAN,BAIK,WILAYAH 10
3403,SEKOLAH TINGGI ILMU KESEHATAN SALSABILA SERANG,BAIK,WILAYAH 04
3404,SEKOLAH TINGGI FILSAFAT THEOLOGIA SURYA NUSANTARA,BAIK,WILAYAH 01
3405,SEKOLAH TINGGI AGAMA KRISTEN BINA MUDA WIRAWAN WONOGIRI,BAIK,WILAYAH PTAS
3406,STIKES TRI MANDIRI SAKTI BENGKULU,BAIK,WILAYAH 02
3407,SEKOLAH TINGGI ILMU EKONOMI GRAHA KIRANA,BAIK,WILAYAH 01
3408,STIKES RUMAH SAKIT ANWAR MEDIKA,BAIK,WILAYAH 07
3409,SEKOLAH TINGGI ILMU KESEHATAN RS BAPTIS KEDIRI,B,WILAYAH 07
3410,SEKOLAH TINGGI THEOLOGIA NAZARENE INDONESIA,BAIK,WILAYAH PTAS
3411,POLITEKNIK PEMBANGUNAN PERTANIAN MALANG,BAIK SEKALI,WILAYAH PTKL
3412,SEKOLAH TINGGI THEOLOGIA INJILI INDONESIA LOMBOK,TIDAK TERAKREDITASI,WILAYAH PTAS
3413,AKADEMI SEKRETARI MANAJEMEN TARUNA BAKTI,BAIK,WILAYAH 04
3414,SEKOLAH TINGGI AGAMA KRISTEN LENTERA BANGSA MANADO,BAIK,WILAYAH PTAS
3415,SEKOLAH TINGGI TEOLOGI PARAKLETOS TOMOHON,BAIK,WILAYAH PTAS
3416,INSTITUT TEKNOLOGI DAN BISNIS ASIA MALANG,BAIK,WILAYAH 07
3417,POLITEKNIK PEMBANGUNAN PERTANIAN BOGOR,B,WILAYAH PTKL
3418,UNIVERSITAS KRISTEN PAPUA,BAIK,WILAYAH 14
3419,UNIVERSITAS SIMALUNGUN,B,WILAYAH 01
3420,SEKOLAH TINGGI TEOLOGI INTHEOS SURAKARTA,BAIK,WILAYAH PTAS
3421,SEKOLAH TINGGI AGAMA KRISTEN OIKUMENE TIMIKA,BAIK,WILAYAH PTAS
3422,STKIP MUHAMMADIYAH ACEH BARAT DAYA,BAIK,WILAYAH 13
3423,"STAI AZZIYADAH KLENDER, JAKARTA TIMUR",BAIK,WILAYAH PTAS
3424,STMIK PRINGSEWU,BAIK,WILAYAH 02
3425,SEKOLAH TINGGI PEMBANGUNAN MASYARAKAT DESA APMD,B,WILAYAH 05
3426,SEKOLAH TINGGI TEOLOGI INJILI INDONESIA PALU,BAIK,WILAYAH PTAS
3427,SEKOLAH TINGGI TEOLOGI RAHMAT EMMANUEL JAKARTA,BAIK,WILAYAH PTAS
3428,STAIN BENGKALIS,BAIK,WILAYAH PTAN
3429,AKADEMI PETERNAKAN KARANGANYAR,BAIK,WILAYAH 06
3430,"SEKOLAH TINGGI EKONOMI ISLAM MASYARAKAT MADANI, PAMEKASAN JAWA TIMUR",BAIK,WILAYAH PTAS
3431,SEKOLAH TINGGI TEOLOGI KALVARI MALUKU UTARA,TIDAK TERAKREDITASI,WILAYAH PTAS
3432,SEKOLAH TINGGI TEOLOGI SALEM,TIDAK TERAKREDITASI,WILAYAH PTAS
3433,SEKOLAH TINGGI TEOLOGI DIAKONOS,BAIK,WILAYAH PTAS
3434,UNIVERSITAS BINA BANGSA,BAIK,WILAYAH 04
3435,SEKOLAH TINGGI AGAMA ISLAM DARUTTAQWA MANYAR GRESIK,BAIK,WILAYAH PTAS
3436,STT ANUGERAH SINAGOGE MEDAN,TIDAK TERAKREDITASI,WILAYAH PTAS
3437,AKADEMI METROLOGI DAN INSTRUMENTASI,BAIK,WILAYAH PTKL
3438,STAI SABILI BANDUNG,BAIK,WILAYAH PTAS
3439,SEKOLAH TINGGI ILMU KOMPUTER MUHAMMADIYAH BATAM,BAIK,WILAYAH 17
3440,"STAI HIKMATUL FADHILAH MEDAN, SUMATERA UTARA",BAIK,WILAYAH PTAS
3441,INSTITUT AGAMA ISLAM AL-FALAH AS-SUNNIYAH KENCONG JEMBER JAWA TIMUR,BAIK,WILAYAH PTAS
3442,STIS AL-HILAL SIGLI KAB. PIDIE,BAIK,WILAYAH PTAS
3443,SEKOLAH TINGGI DESAIN INDONESIA BANDUNG,BAIK,WILAYAH 04
3444,STIQ MIFTAHUL HUDA RAWALO BANYUMAS JAWA TENGAH,BAIK,WILAYAH PTAS
3445,STAI PERSIS GARUT,BAIK,WILAYAH PTAS
3446,STAI DARUL ARQAM MUHAMMADIYAH GARUT,BAIK,WILAYAH PTAS
3447,STAI SUNAN PANDANARAN YOGYAKARTA,BAIK,WILAYAH PTAS
3448,SEKOLAH TINGGI TEOLOGI REAL BATAM,BAIK,WILAYAH PTAS
3449,SEKOLAH TINGGI TEOLOGI BETHEL SAMARINDA,BAIK,WILAYAH PTAS
3450,"SEKOLAH TINGGI EKONOMI SYARIAH IHYA ULUMIDDIN, BANYUWANGI JAWA TIMUR",TIDAK TERAKREDITASI,WILAYAH PTAS
3451,STAIN TENGKU DIRUNDENG MEULABOH,BAIK SEKALI,WILAYAH PTAN
3452,STIT PTI AL-HILAL SIGLI KAB. PIDIE,BAIK,WILAYAH PTAS
3453,SEKOLAH TINGGI ILMU TARBIYAH SYEKH MUHAMMAD NAFIS,BAIK,WILAYAH PTAS
3454,POLITEKNIK PELAYARAN BANTEN,BAIK,WILAYAH PTKL
3455,INSTITUT AGAMA ISLAM NAHDLATUL ULAMA TUBAN,BAIK,WILAYAH PTAS
3456,UNIVERSITAS FLORES,B,WILAYAH 15
3457,SEKOLAH TINGGI TEOLOGI PAULUS JAKARTA,BAIK,WILAYAH PTAS
3458,UNIVERSITAS ISLAM SUMATERA UTARA,B,WILAYAH 01
3459,STAI NUR EL GHAZY BEKASI,BAIK,WILAYAH PTAS
3460,POLITEKNIK NEGERI CILACAP,BAIK,WILAYAH PTN
3461,INSTITUT TEKNOLOGI BATAM,BAIK,WILAYAH 17
3462,STIT RADEN SANTRI GRESIK,BAIK,WILAYAH PTAS
3463,SEKOLAH TINGGI ILMU EKONOMI LMII,BAIK,WILAYAH 01
3464,STIKES MEDIKA NURUL ISLAM,BAIK,WILAYAH 13
3465,STAI AT-TAQWA BONDOWOSO JAWA TIMUR,BAIK,WILAYAH PTAS
3466,SEKOLAH TINGGI ILMU KESEHATAN RSPAD GATOT SOEBROTO,BAIK,WILAYAH 03
3467,POLITEKNIK UNGGULAN KALIMANTAN,BAIK,WILAYAH 11
3468,INSTITUT AGAMA ISLAM AL-QOLAM,BAIK,WILAYAH PTAS
3469,SEKOLAH TINGGI ILMU KESEHATAN INTAN MARTAPURA,BAIK,WILAYAH 11
3470,"STAI NAHDLATUL ULAMA, TEMANGGUNG, JAWA TENGAH",BAIK,WILAYAH PTAS
3471,"STAI YAPNAS JENEPONTO, SULAWESI SELATAN",BAIK,WILAYAH PTAS
3472,SEKOLAH TINGGI AGAMA ISLAM NEGERI MAJENE,BAIK,WILAYAH PTAN
3473,"INSTITUT AGAMA ISLAM DAAR AL-ULUM ASAHAN, SUMATERA UTARA",BAIK,WILAYAH PTAS
3474,INSTITUT AGAMA ISLAM NEGERI LHOKSEUMAWE,BAIK SEKALI,WILAYAH PTAN
3475,"STAI SYEKH MAULANA QORI BANGKO, JAMBI",TIDAK TERAKREDITASI,WILAYAH PTAS
3476,STAI MADINATUN NAJAH,BAIK,WILAYAH PTAS
3477,INSTITUT PESANTREN MATHALIUL FALAH PATI JAWA TENGAH,BAIK,WILAYAH PTAS
3478,STAI DENPASAR BALI,BAIK,WILAYAH PTAS
3479,"STAI DDI KOTA MAKASSAR, SULAWESI SELATAN",BAIK,WILAYAH PTAS
3480,AKADEMI PEREKAM MEDIS & INFORMATIKA KESEHATAN BANDUNG,BAIK,WILAYAH 04
3481,UNIVERSITAS NUSANTARA PGRI KEDIRI,BAIK SEKALI,WILAYAH 07
3482,STISIPOL RAJA HAJI,BAIK,WILAYAH 17
3483,STAI BAHRIYATUL ULUM KH. ZAINUL ARIFIN PANDAN,BAIK,WILAYAH PTAS
3484,INSTITUT AGAMA ISLAM MA'ARIF NU METRO LAMPUNG,BAIK SEKALI,WILAYAH PTAS
3485,UNIVERSITAS PENDIDIKAN MUHAMMADIYAH SORONG,B,WILAYAH 14
3486,STAI SYAICHONA MOH. CHOLIL BANGKALAN,BAIK,WILAYAH PTAS
3487,STIT BUSTANUL ARIFIN,BAIK,WILAYAH PTAS
3488,SEKOLAH TINGGI ILMU TARBIYAH AL HIKMAH BUMI AGUNG WAY KANAN,BAIK,WILAYAH PTAS
3489,"STAI SYEKH H. ABDUL HALIM HASAN AL-ISLAHIYAH BINJAI, SUMATERA UTARA",BAIK,WILAYAH PTAS
3490,SEKOLAH TINGGI TEOLOGI KRISTUS ALFA OMEGA,BAIK,WILAYAH PTAS
3491,SEKOLAH TINGGI ILMU PERTANIAN BERAU,BAIK,WILAYAH 11
3492,STIKES PUTRA ABADI LANGKAT,BAIK,WILAYAH 01
3493,SEKOLAH TINGGI ILMU KEHUTANAN PANTE KULU,BAIK,WILAYAH 13
3494,STAI DARUL FALAH CILILIN CIHAMPELAS BANDUNG BARAT,BAIK,WILAYAH PTAS
3495,SEKOLAH TINGGI ILMU DAKWAH DAN KOMUNIKASI ISLAM AR-RAHMAH SURABAYA,BAIK,WILAYAH PTAS
3496,STAI SILIWANGI GARUT,BAIK,WILAYAH PTAS
3497,AKADEMI KEBIDANAN ASSYIFA TANGERANG,BAIK,WILAYAH 04
3498,SEKOLAH TINGGI ILMU TARBIYAH IBNU KHALDUN,BAIK,WILAYAH PTAS
3499,IAIN AMBON,BAIK SEKALI,WILAYAH PTAN
3500,STAI IMAM SYAFI`I CIANJUR,BAIK,WILAYAH PTAS
3501,INSTITUT AGAMA ISLAM BANTEN,BAIK,WILAYAH PTAS
3502,STKIP BUDIDAYA,BAIK,WILAYAH 01
3503,UNIVERSITAS BALE BANDUNG,BAIK SEKALI,WILAYAH 04
3504,AMIK PGRI KEBUMEN,BAIK,WILAYAH 06
3505,STIKES BUMI PERSADA LHOKSEUMAWE,BAIK,WILAYAH 13
3506,SEKOLAH TINGGI KULLIYATUL QUR'AN AL-HIKAM DEPOK,BAIK,WILAYAH PTAS
3507,STAI AL-KHAIRAAT HALMAHERA SELATAN,BAIK,WILAYAH PTAS
3508,STAI SILIWANGI BANDUNG,BAIK,WILAYAH PTAS
3509,INSTITUT SAINS DAN TEKNOLOGI AL-KAMAL,BAIK,WILAYAH 03
3510,SEKOLAH TINGGI TEOLOGI INJILI INDONESIA YOGYAKARTA,BAIK,WILAYAH PTAS
3511,STAI AT-TANWIR BOJONEGORO,BAIK,WILAYAH PTAS
3512,STAI AN NAJAH INDONESIA MANDIRI SIDOARJO,BAIK,WILAYAH PTAS
3513,SEKOLAH TINGGI ILMU KESEHATAN NUSANTARA,B,WILAYAH 15
3514,UNIVERSITAS PRISMA,TIDAK TERAKREDITASI,WILAYAH 16
3515,INSTITUT TRANSPORTASI  DAN LOGISTIK TRISAKTI,BAIK SEKALI,WILAYAH 03
3516,POLITEKNIK PEMBANGUNAN PERTANIAN YOGYAKARTA - MAGELANG,BAIK SEKALI,WILAYAH PTKL
3517,UNIVERSITAS MUHAMMADIYAH METRO,BAIK SEKALI,WILAYAH 02
3518,SEKOLAH TINGGI ILMU KESEHATAN BINALITA SUDAMA,BAIK,WILAYAH 01
3519,STKIP AL-WASHLIYAH,BAIK,WILAYAH 13
3520,POLITEKNIK PERTANIAN DAN PETERNAKAN MAPENA,BAIK,WILAYAH 07
3521,UNIVERSITAS SERAMBI MEKKAH,BAIK,WILAYAH 13
3522,INSTITUT TEKNOLOGI DAN BISNIS BANK RAKYAT INDONESIA,BAIK,WILAYAH 03
3523,"STAI DARUL ARAFAH LAU BAKERI DELI SERDANG, SUMATERA UTARA",BAIK,WILAYAH PTAS
3524,INSTITUT AGAMA ISLAM NEGERI BATUSANGKAR,BAIK SEKALI,WILAYAH PTAN
3525,STAI TARUNA SURABAYA,BAIK,WILAYAH PTAS
3526,INSTITUT ILMU KEISLAMAN ANNUQAYAH GULUK-GULUK SUMENEP,BAIK SEKALI,WILAYAH PTAS
3527,INSTITUT AGAMA ISLAM DARUL DA'WAH WAL IRSYAD POLEWALI MANDAR,BAIK,WILAYAH PTAS
3528,SEKOLAH TINGGI ILMU KESEHATAN BANTEN,BAIK,WILAYAH 04
3529,INSTITUT AGAMA ISLAM QOMARUL HUDA BAGU LOMBOK TENGAH NTB,BAIK,WILAYAH PTAS
3530,UNIVERSITAS SAINS DAN TEKNOLOGI KOMPUTER,BAIK,WILAYAH 06
3531,POLITEKNIK PAJAJARAN INSAN CINTA BANGSA BANDUNG,BAIK,WILAYAH 04
3532,"STAI DDI SIDRAP, SULAWESI SELATAN",BAIK,WILAYAH PTAS
3533,STAI NAHDLATUL ULAMA PACITAN,BAIK,WILAYAH PTAS
3534,SEKOLAH TINGGI TEOLOGI ALETHEIA,BAIK,WILAYAH PTAS
3535,STAI DINIYAH PEKANBARU,BAIK,WILAYAH PTAS
3536,STEI IQRA ANNISA PEKANBARU,BAIK,WILAYAH PTAS
3537,STAI NAHDLATUL ULAMA PURWOREJO,BAIK,WILAYAH PTAS
