institution_code,institution_name,akreditasi_institusi,no_sk,tahun_sk,wilayah,tanggal_kadaluarsa
banpt-1,Universitas Dr Soetomo,Baik Sekali,2785/SK/BAN-PT/Ak.KP/PT/X/2025,2025,07,2026-11-25
banpt-2,STAI Sayid Sabiq Indramayu,Baik,2807/SK/BAN-PT/Ak/PT/X/2025,2025,PTAS,2030-10-07
banpt-3,Sekolah Tinggi Teologi Borneo,Baik,2799/SK/BAN-PT/Ak/PT/X/2025,2025,PTAS,2030-10-07
banpt-4,Institut Keislaman Tuah Negeri,Baik,2816/SK/BAN-PT/Ak/PT/X/2025,2025,PTAS,2030-10-07
banpt-5,Sekolah Tinggi Agama Islam Al-Utsmani Bondowoso,Baik,2810/SK/BAN-PT/Ak/PT/X/2025,2025,PTAS,2030-10-07
banpt-6,Akademi Teknik Alat Berat Indonesia,Baik,2800/SK/BAN-PT/Ak/PT/X/2025,2025,07,2030-10-07
banpt-7,Institut Darul Ulum Sarolangun,Baik Sekali,2809/SK/BAN-PT/Ak/PT/X/2025,2025,PTAS,2030-10-07
banpt-8,Politeknik Indotec Kendari,Baik,2802/SK/BAN-PT/Ak/PT/X/2025,2025,09,2030-10-07
banpt-9,"STAI Al-Jami Banjarmasin, Kalimantan Selatan",Baik Sekali,2808/SK/BAN-PT/Ak/PT/X/2025,2025,PTAS,2030-10-07
banpt-10,Institut Teknologi Pendidikan dan Bisnis Qana'ah Sidenreng Rappang,Baik,2811/SK/BAN-PT/Ak/PT/X/2025,2025,09,2030-10-07
banpt-11,Akademi Keuangan Perbankan Nusantara,Baik,2812/SK/BAN-PT/Ak/PT/X/2025,2025,13,2030-10-07
banpt-12,Sekolah Tinggi Teknologi Pekerjaan Umum,Baik,2803/SK/BAN-PT/Ak/PT/X/2025,2025,03,2030-10-07
banpt-13,STKPK  Bina Insan,Baik,2820/SK/BAN-PT/Ak/PT/X/2025,2025,PTAS,2030-10-07
banpt-14,Institut Teknologi dan Kesehatan Permata Ilmu Maros,Baik,2784/SK/BAN-PT/Ak/PT/X/2025,2025,09,2030-10-07
banpt-15,Universitas Muhammadiyah Enrekang,Baik Sekali,2821/SK/BAN-PT/Ak/PT/X/2025,2025,09,2030-10-07
banpt-16,Sekolah Tinggi Ilmu Tarbiyah Hidayatunnajah Bekasi,Baik,2818/SK/BAN-PT/Ak/PT/X/2025,2025,PTAS,2030-10-07
banpt-17,STAI Ar-Ridho Bagansiapiapi,Baik,2798/SK/BAN-PT/Ak/PT/X/2025,2025,PTAS,2030-10-07
banpt-18,Sekolah Tinggi Ilmu Tarbiyah Qurrota Ayun,Baik,2797/SK/BAN-PT/Ak/PT/X/2025,2025,PTAS,2030-10-07
banpt-19,STIKES Marendeng Majene,Baik,2815/SK/BAN-PT/Ak.Ppj/PT/X/2025,2025,09,2030-06-29
banpt-20,Sekolah Tinggi Ilmu Kesehatan Rustida,Baik,2814/SK/BAN-PT/Ak.Ppj/PT/X/2025,2025,07,2030-04-20
banpt-21,Universitas 17 Agustus 1945 Cirebon,Baik Sekali,2786/SK/BAN-PT/Ak.KP/PT/X/2025,2025,04,2030-04-20
banpt-22,Universitas Medika Suherman,Baik Sekali,2787/SK/BAN-PT/Ak.KP/PT/X/2025,2025,04,2026-12-28
banpt-23,Universitas Slamet Riyadi,Baik Sekali,2788/SK/BAN-PT/Ak.KP/PT/X/2025,2025,06,2030-05-25
banpt-24,Poltekkes Kemenkes Palembang,Baik Sekali,2789/SK/BAN-PT/Ak.KP/PT/X/2025,2025,PTKL,2028-08-08
banpt-25,Universitas Dharma AUB Surakarta,Baik Sekali,2790/SK/BAN-PT/Ak.KP/PT/X/2025,2025,06,2027-10-25
banpt-26,Poltekkes Kemenkes Jayapura,Baik Sekali,2791/SK/BAN-PT/Ak.KP/PT/X/2025,2025,PTKL,2028-07-25
banpt-27,Institut Teknologi Kesehatan Cendekia Utama Kudus,Baik Sekali,2792/SK/BAN-PT/Ak.KP/PT/X/2025,2025,06,2029-03-28
banpt-28,Institut Bio Scientia Internasional Indonesia,Baik Sekali,2793/SK/BAN-PT/Ak.KP/PT/X/2025,2025,03,2029-03-27
banpt-29,Institut Kesehatan Yarsi Mataram,Baik,2817/SK/BAN-PT/Ak.Ppj/PT/X/2025,2025,08,2030-04-12
banpt-30,Akademi Kelautan Banyuwangi,Baik,2806/SK/BAN-PT/Ak.Ppj/PT/X/2025,2025,07,2030-04-12
banpt-31,Akademi Keperawatan Yapi,Baik,2813/SK/BAN-PT/Ak.P/PT/X/2025,2025,09,2027-10-07
banpt-32,Universitas Islam Zainul Hasan Genggong Probolinggo,Baik Sekali,2819/SK/BAN-PT/Ak/PT/X/2025,2025,PTAS,2030-10-07
banpt-33,Institut Teknologi Sumatera,Baik Sekali,2795/SK/BAN-PT/Ak/PT/X/2025,2025,PTN,2030-10-07
banpt-34,Universitas Internasional Semen Indonesia,Baik Sekali,2794/SK/BAN-PT/Ak.KP/PT/X/2025,2025,07,2029-05-22
banpt-35,Universitas Islam Sumatera Utara,Unggul,2796/SK/BAN-PT/Ak/PT/X/2025,2025,01,2030-10-07
banpt-36,STISIP Bunda Tanah Melayu,Tidak Terakreditasi,2805/SK/BAN-PT/Ak-TMSP/PT/X/2025,2025,17,
banpt-37,Sekolah Tinggi Agama Islam Darul Hikmah Tulungagung,Tidak Terakreditasi,2801/SK/BAN-PT/Ak-TMSP/PT/X/2025,2025,PTAS,
banpt-38,Sekolah Tinggi Ilmu Manajemen Publik Makassar,Tidak Terakreditasi,2804/SK/BAN-PT/Ak-TMSP/PT/X/2025,2025,09,
banpt-39,STISIP Bunda Tanah Melayu,Tidak Terakreditasi,2805/SK/BAN-PT/Ak-TMSP/PT/X/2025,2025,10,
banpt-40,Universitas Noor Huda Mustofa,B,2783/SK/BAN-PT/Ak-PNB/PT/X/2025,2025,07,2027-09-13
banpt-41,Universitas Sains dan Teknologi Indonesia,B,2782/SK/BAN-PT/Ak-PNB/PT/X/2025,2025,17,2027-10-24
banpt-42,Universitas Muhammadiyah Ahmad Dahlan Cirebon,Baik Sekali,2780/SK/BAN-PT/Ak-PNB/PT/X/2025,2025,04,2030-02-04
banpt-43,Universitas Indo Global Mandiri,Terakreditasi,2564/SK/BAN-PT/Ak.S/2.0/PT/X/2025,2025,02,9999-01-01
banpt-44,Institut Teknologi Sains dan Kesehatan Insan Cendekia Medika Jombang,Terakreditasi,2563/SK/BAN-PT/Ak.S/2.0/PT/X/2025,2025,07,9999-01-01
banpt-45,Universitas Raharja,Terakreditasi,2562/SK/BAN-PT/Ak.S/2.0/PT/X/2025,2025,04,9999-01-01
banpt-46,Universitas Yapis Papua,Terakreditasi,2561/SK/BAN-PT/Ak.S/2.0/PT/X/2025,2025,14,9999-01-01
banpt-47,Akademi Keuangan Dan Perbankan Grha Arta Khatulistiwa Pontianak,Terakreditasi,2560/SK/BAN-PT/Ak.S/2.0/PT/X/2025,2025,11,9999-01-01
banpt-48,Universitas Bakti Tunas Husada,Terakreditasi,2559/SK/BAN-PT/Ak.S/2.0/PT/X/2025,2025,04,9999-01-01
banpt-49,Politeknik Meta Industri Cikarang,Terakreditasi,2558/SK/BAN-PT/Ak.S/2.0/PT/X/2025,2025,04,9999-01-01
banpt-50,Universitas PGRI Kanjuruhan Malang,Terakreditasi,2557/SK/BAN-PT/Ak.S/2.0/PT/X/2025,2025,07,9999-01-01
banpt-51,Universitas Panca Bhakti,Terakreditasi,2556/SK/BAN-PT/Ak.S/2.0/PT/X/2025,2025,11,9999-01-01
banpt-52,Universitas Bina Bangsa Getsempena,Terakreditasi,2555/SK/BAN-PT/Ak.S/2.0/PT/X/2025,2025,13,9999-01-01
banpt-53,Universitas Mahkota Tricom Unggul,Terakreditasi,2554/SK/BAN-PT/Ak.S/2.0/PT/X/2025,2025,01,9999-01-01
banpt-54,Sekolah Tinggi Ilmu Kesehatan Panca Bhakti Pontianak,Terakreditasi,2553/SK/BAN-PT/Ak.S/2.0/PT/X/2025,2025,11,9999-01-01
banpt-55,Sekolah Tinggi Pariwisata Ambarrukmo Yogyakarta,Terakreditasi,2552/SK/BAN-PT/Ak.S/2.0/PT/X/2025,2025,05,9999-01-01
banpt-56,STKIP Syekh Manshur,Terakreditasi,2551/SK/BAN-PT/Ak.S/2.0/PT/X/2025,2025,04,9999-01-01
banpt-57,Politeknik Artificial Intelligence Budi Mulia Dua,Terakreditasi Sementara,2550/SK/BAN-PT/Ak.P/2.0/PT/X/2025,2025,05,2033-10-02
banpt-58,"STAI Al-Gazali Bulukumba, Sulawesi Selatan",Baik,2770/SK/BAN-PT/Ak.Ppj/PT/X/2025,2025,PTAS,2030-06-24
banpt-59,Sekolah Tinggi Ilmu Ekonomi Syariah Saleh Budiman,Baik,2769/SK/BAN-PT/Ak/PT/X/2025,2025,PTAS,2030-10-01
banpt-60,Sekolah Tinggi Ilmu Ekonomi Syariah Riyadlul Jannah Mojokerto Jawa timur,Baik,2768/SK/BAN-PT/Ak/PT/X/2025,2025,PTAS,2030-10-01
banpt-61,Sekolah Tinggi Agama Islam Ahmad Sibawayhie,Baik,2766/SK/BAN-PT/Ak/PT/X/2025,2025,PTAS,2030-10-01
banpt-62,Universitas Bengkulu,Unggul,2774/SK/BAN-PT/Ak/PT/X/2025,2025,PTN,2030-10-01
banpt-63,Universitas Sahid,Unggul,2779/SK/BAN-PT/Ak/PT/X/2025,2025,03,2030-10-01
banpt-64,Universitas Internasional Batam,Unggul,2777/SK/BAN-PT/Ak/PT/X/2025,2025,17,2030-10-01
banpt-65,Universitas Bakti Indonesia,Baik,2773/SK/BAN-PT/Ak.Ppj/PT/X/2025,2025,07,2030-05-11
banpt-66,Politeknik Unisma Malang,Baik,2765/SK/BAN-PT/Ak.Ppj/PT/X/2025,2025,07,2030-07-06
banpt-67,STIKES Patria Husada,Baik,2771/SK/BAN-PT/Ak.Ppj/PT/X/2025,2025,07,2030-07-06
banpt-68,Sekolah Tinggi Agama Islam Muafi Sampang,Baik,2767/SK/BAN-PT/Ak.P/PT/X/2025,2025,PTAS,2027-10-01
banpt-69,Universitas Hafshawaty Zainul Hasan,Baik,2776/SK/BAN-PT/Ak.Ppj/PT/X/2025,2025,07,2030-07-12
banpt-70,Universitas Efarina,Baik,2775/SK/BAN-PT/Ak.S/PT/X/2025,2025,01,9999-01-01
banpt-71,"STIT Al-Azhar Diniyyah (STITAD) Muaro Bungo, Jambi",Baik,2772/SK/BAN-PT/Ak.Ppj/PT/X/2025,2025,PTAS,2030-06-29
banpt-72,Universitas Linggabuana PGRI Sukabumi,Baik,2778/SK/BAN-PT/Ak/PT/X/2025,2025,04,2030-10-01
banpt-73,Politeknik Banggai Industri,Terakreditasi Sementara,2549/SK/BAN-PT/Ak.P/2.0/PT/IX/2025,2025,16,2033-09-30
banpt-74,Sekolah Tinggi Ilmu Ekonomi Satya Dharma,Baik,2546/SK/BAN-PT/Ak.Ppj/2.0/PT/IX/2025,2025,08,2030-11-11
banpt-75,Sekolah Tinggi Ilmu Dakwah Sirnarasa,Baik,2545/SK/BAN-PT/Ak.Ppj/2.0/PT/IX/2025,2025,PTAS,2030-11-04
banpt-76,Akademi Gizi Karya Husada Kediri,Baik,2543/SK/BAN-PT/Ak.Ppj/2.0/PT/IX/2025,2025,07,2030-12-02
banpt-77,STKIP Insan Madani Airmolek,Baik,2536/SK/BAN-PT/Ak.Ppj/2.0/PT/IX/2025,2025,17,2030-08-31
banpt-78,Sekolah Tinggi Ilmu Pertanian Wuna Raha,Baik,2537/SK/BAN-PT/Ak.Ppj/2.0/PT/IX/2025,2025,09,2030-08-31
banpt-79,STITNU Al-Mahsuni,Baik,2518/SK/BAN-PT/Ak.Ppj/2.0/PT/IX/2025,2025,PTAS,2030-10-28
banpt-80,Universitas Islam Madura,Baik,2535/SK/BAN-PT/Ak.Ppj/2.0/PT/IX/2025,2025,07,2030-08-31
banpt-81,STIKES Panti Waluya Malang,B,2534/SK/BAN-PT/Ak.Ppj/2.0/PT/IX/2025,2025,07,2030-08-31
banpt-82,STKIP Darud Da wah Wal Irsyad Pinrang,Baik,2533/SK/BAN-PT/Ak.Ppj/2.0/PT/IX/2025,2025,09,2030-08-23
banpt-83,Sekolah Tinggi Ilmu Kesehatan Kesdam IX/Udayana,Baik,2532/SK/BAN-PT/Ak.Ppj/2.0/PT/IX/2025,2025,08,2030-08-23
banpt-84,Universitas Islam Depok,Baik,2753/SK/BAN-PT/Ak-PNB/PT/IX/2025,2025,PTAS,2027-11-08
banpt-85,Universitas Wirahusada Medan,Baik,2760/SK/BAN-PT/Ak-PNB/PT/IX/2025,2025,01,2026-03-06
banpt-86,Politeknik Alkon Kalimantan,Baik,2746/SK/BAN-PT/Ak-PNB/PT/IX/2025,2025,11,2026-06-30
banpt-87,Institut Nida El Adabi,Baik,2761/SK/BAN-PT/Ak-PNB/PT/IX/2025,2025,PTAS,2025-12-20
banpt-88,Universitas Sultan Muhammad Syafiuddin Sambas,Baik,2762/SK/BAN-PT/Ak-PNB/PT/IX/2025,2025,PTAS,2028-12-29
banpt-89,Institut Darul Qur`an Payakumbuh,Baik Sekali,2763/SK/BAN-PT/Ak-PNB/PT/IX/2025,2025,PTAS,2028-02-22
banpt-90,Institut Agama Islam Diniyyah Pekanbaru,Baik Sekali,2734/SK/BAN-PT/Ak/PT/IX/2025,2025,PTAS,2030-09-23
banpt-91,Universitas Sebelas April,Baik Sekali,2735/SK/BAN-PT/Ak/PT/IX/2025,2025,04,2030-09-23
banpt-92,Universitas Sang Bumi Ruwa Jurai,Baik Sekali,2741/SK/BAN-PT/Ak/PT/IX/2025,2025,02,2030-09-23
banpt-93,Akademi Kuliner Monas Pasifik,Baik Sekali,2736/SK/BAN-PT/Ak/PT/IX/2025,2025,07,2030-09-23
banpt-94,Universitas Wahidiyah,Baik,2733/SK/BAN-PT/Ak/PT/IX/2025,2025,07,2030-09-23
banpt-95,Akademi Bakti Kemanusiaan Palang Merah Indonesia,Baik Sekali,2737/SK/BAN-PT/Ak/PT/IX/2025,2025,03,2030-09-23
banpt-96,Sekolah Tinggi Ilmu Syariah Husnul Khotimah (STISHK) Kuningan,Baik Sekali,2738/SK/BAN-PT/Ak/PT/IX/2025,2025,PTAS,2030-09-23
banpt-97,Sekolah Tinggi Agama Hindu Bhatara Guru Kendari Sulawesi Tenggara,Baik,2739/SK/BAN-PT/Ak/PT/IX/2025,2025,PTAN,2030-09-23
banpt-98,Sekolah Tinggi Ilmu Kesehatan Pasar Rebo,Baik,2759/SK/BAN-PT/Ak-PNB/PT/IX/2025,2025,03,2025-12-15
banpt-99,Universitas PGRI Mpu Sindok,Baik,2748/SK/BAN-PT/Ak-PNB/PT/IX/2025,2025,07,2027-09-06
banpt-100,Politeknik Palopo,Baik,2745/SK/BAN-PT/Ak-PNB/PT/IX/2025,2025,09,2028-08-06
banpt-101,Universitas Islam Ibrahimy Banyuwangi,Baik,2754/SK/BAN-PT/Ak-PNB/PT/IX/2025,2025,PTAS,2026-03-23
banpt-102,Universitas Persada Bunda Indonesia,Baik Sekali,2749/SK/BAN-PT/Ak-PNB/PT/IX/2025,2025,17,2025-12-16
banpt-103,Universitas Bhinneka Nusantara,Baik Sekali,2751/SK/BAN-PT/Ak-PNB/PT/IX/2025,2025,07,2027-03-01
banpt-104,Universitas Muhammadiyah PKU Surakarta,Baik Sekali,2755/SK/BAN-PT/Ak-PNB/PT/IX/2025,2025,06,2027-10-18
banpt-105,Institut Bisnis dan Teknologi Kalimantan,Baik Sekali,2750/SK/BAN-PT/Ak-PNB/PT/IX/2025,2025,11,2029-02-27
banpt-106,Akademi Kebidanan Mega Buana,Baik,2744/SK/BAN-PT/Ak.Ppj/PT/IX/2025,2025,09,2030-05-11
banpt-107,Sekolah Tinggi Ilmu Pertanian Amuntai,Baik,2742/SK/BAN-PT/Ak.Ppj/PT/IX/2025,2025,11,2030-04-20
banpt-108,STMIK DCI,Baik,2743/SK/BAN-PT/Ak.Ppj/PT/IX/2025,2025,04,2030-04-20
banpt-109,Institut Pendidikan dan Teknologi `Aisyiyah Riau,Baik,2756/SK/BAN-PT/Ak-PNB/PT/IX/2025,2025,17,2028-12-29
banpt-110,Universitas Tiga Serangkai,Baik,2747/SK/BAN-PT/Ak-PNB/PT/IX/2025,2025,06,2029-03-26
banpt-111,Universitas Muhammadiyah Brebes,Baik,2757/SK/BAN-PT/Ak-PNB/PT/IX/2025,2025,06,2029-03-05
banpt-112,Universitas Sunan Gresik,Baik,2752/SK/BAN-PT/Ak-PNB/PT/IX/2025,2025,07,2026-10-13
banpt-113,Politeknik Sorowako,Baik,2758/SK/BAN-PT/Ak-PNB/PT/IX/2025,2025,09,2028-08-17
banpt-114,STAI Al-Andina Sukabumi,Baik Sekali,2740/SK/BAN-PT/Ak/PT/IX/2025,2025,PTAS,2030-09-23
banpt-115,STIE Madani Balikpapan,Baik,2515/SK/BAN-PT/Ak.Ppj/2.0/PT/VIII/2025,2025,11,2030-08-23
banpt-116,Sekolah Tinggi Ilmu Kesehatan Rajekwesi Bojonegoro,Terakreditasi,2527/SK/BAN-PT/Ak.S/2.0/PT/IX/2025,2025,07,9999-01-01
banpt-117,Institut Batari Toja Bone,Terakreditasi,2525/SK/BAN-PT/Ak.S/2.0/PT/IX/2025,2025,09,9999-01-01
banpt-118,Akademi Akupunktur Surabaya,Terakreditasi,2523/SK/BAN-PT/Ak.S/2.0/PT/IX/2025,2025,07,9999-01-01
banpt-119,Politeknik Haji Anwar Sanusi,Terakreditasi Sementara,2522/SK/BAN-PT/Ak.P/2.0/PT/IX/2025,2025,04,2033-09-23
banpt-120,Institut Kesehatan dan Teknologi Buton Raya,Terakreditasi,2521/SK/BAN-PT/Ak.S/2.0/PT/IX/2025,2025,09,9999-01-01
banpt-121,Akademi Manajemen Informatika Dan Komputer Taruna,Terakreditasi,2520/SK/BAN-PT/Ak.S/2.0/PT/IX/2025,2025,07,9999-01-01
banpt-122,Sekolah Tinggi Ilmu Kesehatan Sapta Bakti,Baik,2719/SK/BAN-PT/Ak.S/PT/IX/2025,2025,02,9999-01-01
banpt-123,Institut Teknologi Muhammadiyah Sumatera,Baik,2712/SK/BAN-PT/Ak/PT/IX/2025,2025,02,2030-09-16
banpt-124,Politeknik Statistika STIS,Unggul,2723/SK/BAN-PT/Ak/PT/IX/2025,2025,PTKL,2030-09-16
banpt-125,Institut Bisnis dan Komunikasi Swadaya,Baik Sekali,2713/SK/BAN-PT/Ak/PT/IX/2025,2025,03,2030-09-16
banpt-126,Universitas Wira Bhakti,Baik,2709/SK/BAN-PT/Ak/PT/IX/2025,2025,09,2030-09-16
banpt-127,Sekolah Tinggi Agama Hindu Lampung,Baik,2718/SK/BAN-PT/Ak/PT/IX/2025,2025,PTAN,2030-09-16
banpt-128,Sekolah Tinggi Ekonomi dan Bisnis Islam Yayasan Pelita Ilmu Insani,Baik,2714/SK/BAN-PT/Ak/PT/IX/2025,2025,PTAS,2030-09-16
banpt-129,Sekolah Tinggi Teologi Tenggarong,Baik,2722/SK/BAN-PT/Ak/PT/IX/2025,2025,PTAS,2030-09-16
banpt-130,STAI Asshiddiqiyah Karawang,Baik,2715/SK/BAN-PT/Ak/PT/IX/2025,2025,PTAS,2030-09-16
banpt-131,Sekolah Tinggi Keguruan dan Ilmu Pendidikan Bina Harapan Celebes,Baik,2710/SK/BAN-PT/Ak/PT/IX/2025,2025,09,2030-09-16
banpt-132,Akademi Kebidanan Saleha,Baik,2716/SK/BAN-PT/Ak/PT/IX/2025,2025,13,2030-09-16
banpt-133,Institut Teknologi Bisnis Riau,Baik,2717/SK/BAN-PT/Ak/PT/IX/2025,2025,17,2030-09-16
banpt-134,Sekolah Tinggi Teologi Baptis Independen Indonesia Purworejo,Baik,2711/SK/BAN-PT/Ak/PT/IX/2025,2025,PTAS,2030-09-16
banpt-135,STKIP PGRI Bandar Lampung,Baik Sekali,2731/SK/BAN-PT/Ak.KP/PT/IX/2025,2025,02,2030-06-24
banpt-136,Universitas Muria Kudus,Unggul,2727/SK/BAN-PT/Ak/PT/IX/2025,2025,06,2030-09-16
banpt-137,Universitas Alwashliyah,Baik Sekali,2728/SK/BAN-PT/Ak/PT/IX/2025,2025,01,2030-09-16
banpt-138,Universitas Merdeka Malang,Baik Sekali,2730/SK/BAN-PT/Ak.KP/PT/IX/2025,2025,07,2030-07-06
banpt-139,STT SAMUEL ELIZABETH,Baik,2724/SK/BAN-PT/Ak.P/PT/IX/2025,2025,PTAS,2027-09-16
banpt-140,Universitas Pembangunan Nasional Veteran Yogyakarta,Unggul,2726/SK/BAN-PT/Ak/PT/IX/2025,2025,PTN,2030-09-16
banpt-141,Universitas Sahid Surakarta,Baik Sekali,2725/SK/BAN-PT/Ak/PT/IX/2025,2025,06,2030-09-16
banpt-142,Politeknik Aisyiyah Pontianak,Baik Sekali,2720/SK/BAN-PT/Ak/PT/IX/2025,2025,11,2030-09-16
banpt-143,"STAI Pati (STAIP), Jawa Tengah",Baik,2729/SK/BAN-PT/Ak/PT/IX/2025,2025,PTAS,2030-09-16
banpt-144,Universitas Negeri Manado,Unggul,2732/SK/BAN-PT/Ak/PT/IX/2025,2025,PTN,2030-09-16
banpt-145,Politeknik Pariwisata Lombok,Unggul,2721/SK/BAN-PT/Ak/PT/IX/2025,2025,PTKL,2030-09-16
banpt-146,Sekolah Tinggi Ilmu Ekonomi Yapi Bone,Baik,2708/SK/BAN-PT/Ak/PT/IX/2025,2025,09,2030-09-16
banpt-147,Politeknik Muara Dua,Tidak Terakreditasi,2707/SK/BAN-PT/Ak-TMSP/PT/IX/2025,2025,02,
banpt-148,Sekolah Tinggi Maritim Yogyakarta,Terakreditasi,2513/SK/BAN-PT/Ak.Ppj/2.0/PT/VIII/2025,2025,05,2030-09-21
banpt-149,Sekolah Tinggi Ilmu Kesehatan Mitra Keluarga,Terakreditasi,2517/SK/BAN-PT/Ak.Ppj/2.0/PT/IX/2025,2025,03,2030-09-16
banpt-150,Akademi Farmasi Indonesia Yogyakarta,Terakreditasi,2516/SK/BAN-PT/Ak.Ppj/2.0/PT/IX/2025,2025,05,2030-09-05
banpt-151,Sekolah Tinggi Ilmu Keperawatan PPNI Jawa Barat,Terakreditasi,2514/SK/BAN-PT/Ak.Ppj/2.0/PT/VIII/2025,2025,04,2030-08-23
banpt-152,Sekolah Tinggi Ilmu Ekonomi Muhammadiyah Cilacap,Baik,2706/SK/BAN-PT/Ak.Ppj/PT/IX/2025,2025,06,2030-06-24
banpt-153,Universitas BPD,Baik Sekali,2705/SK/BAN-PT/Ak-PNB/PT/IX/2025,2025,06,2028-10-16
banpt-154,Sekolah Tinggi Ilmu Tarbiyah Al Hikmah Benda,Baik,2702/SK/BAN-PT/Ak/PT/IX/2025,2025,PTAS,2030-09-10
banpt-155,Sekolah Tinggi Teknologi Muhammadiyah AR Fachruddin,Baik,2700/SK/BAN-PT/Ak/PT/IX/2025,2025,07,2030-09-10
banpt-156,STAI Ki Ageng Pekalongan,Baik Sekali,2703/SK/BAN-PT/Ak/PT/IX/2025,2025,PTAS,2030-09-10
banpt-157,Institut Teknologi dan Bisnis Ahmad Dahlan Lamongan,Baik Sekali,2701/SK/BAN-PT/Ak/PT/IX/2025,2025,07,2030-09-10
banpt-158,"STAI Muhammadiyah (STAIM) Blora, Jawa Tengah",Baik Sekali,2699/SK/BAN-PT/Ak/PT/IX/2025,2025,PTAS,2030-09-10
banpt-159,Institut Agama Islam STIBA Makassar,Baik,2704/SK/BAN-PT/Ak-PNB/PT/IX/2025,2025,PTAS,2028-08-18
banpt-160,Universitas Wiraraja,Baik Sekali,2690/SK/BAN-PT/Ak/PT/IX/2025,2025,07,2030-09-09
banpt-161,Akademi Komunitas Industri Manufaktur Bantaeng,Baik Sekali,2692/SK/BAN-PT/Ak/PT/IX/2025,2025,PTKL,2030-09-09
banpt-162,Institut Agama Islam Sahid,Baik Sekali,2698/SK/BAN-PT/Ak/PT/IX/2025,2025,PTAS,2030-09-09
banpt-163,Sekolah Tinggi Pariwisata Mataram,Baik Sekali,2693/SK/BAN-PT/Ak/PT/IX/2025,2025,08,2030-09-09
banpt-164,Akademi Teknik Elektromedik Andakara,Baik,2694/SK/BAN-PT/Ak/PT/IX/2025,2025,03,2030-09-09
banpt-165,Institut Teknologi AI Mahrusiyah,Baik,2696/SK/BAN-PT/Ak/PT/IX/2025,2025,07,2030-09-09
banpt-166,Sekolah Tinggi Alkitab Surabaya,Tidak Terakreditasi,2695/SK/BAN-PT/Ak-TMSP/PT/IX/2025,2025,PTAS,
banpt-167,AMIK Jabal Ghafur,Tidak Terakreditasi,2697/SK/BAN-PT/Ak-TMSP/PT/IX/2025,2025,13,
banpt-168,Institut Teknologi dan Bisnis Arungpalakka,Tidak Terakreditasi,2691/SK/BAN-PT/Ak-TMSP/PT/IX/2025,2025,09,
banpt-169,Universitas Nusa Megarkencana,B,2689/SK/BAN-PT/Ak.Ppj/PT/IX/2025,2025,05,2030-07-06
banpt-170,Universitas Alifah Padang,Baik Sekali,2674/SK/BAN-PT/Ak-PNB/PT/IX/2025,2025,10,2027-08-16
banpt-171,Poltekkes Kemenkes Semarang,Unggul,2668/SK/BAN-PT/Ak/PT/IX/2025,2025,PTKL,2030-09-02
banpt-172,Sekolah Tinggi Agama Islam KH. Zainuddin Ponpes Mojosari Nganjuk,Baik,2669/SK/BAN-PT/Ak/PT/IX/2025,2025,PTAS,2030-09-02
banpt-173,Universitas Prima Nusantara Bukittinggi,Unggul,2686/SK/BAN-PT/Ak/PT/IX/2025,2025,10,2030-09-02
banpt-174,Sekolah Tinggi Agama Islam Al Badar Cipulus Purwakarta,Baik,2657/SK/BAN-PT/Ak/PT/IX/2025,2025,PTAS,2030-09-02
banpt-175,Institut Agama Islam Hasanuddin Pare,Baik Sekali,2670/SK/BAN-PT/Ak/PT/IX/2025,2025,PTAS,2030-09-02
banpt-176,Politeknik Industri ATMI,Baik Sekali,2658/SK/BAN-PT/Ak/PT/IX/2025,2025,04,2030-09-02
banpt-177,Universitas Nusa Putra,Unggul,2659/SK/BAN-PT/Ak/PT/IX/2025,2025,04,2030-09-02
banpt-178,Politeknik Penerbangan Surabaya,Unggul,2673/SK/BAN-PT/Ak/PT/IX/2025,2025,PTKL,2030-09-02
banpt-179,Sekolah Tinggi Keguruan dan Ilmu Pendidikan Biak,Baik,2660/SK/BAN-PT/Ak/PT/IX/2025,2025,14,2030-09-02
banpt-180,Sekolah Tinggi Ilmu Tarbiyah Syamsuddhuha Aceh Utara Banda Aceh,Baik Sekali,2661/SK/BAN-PT/Ak/PT/IX/2025,2025,PTAS,2030-09-02
banpt-181,Universitas Primakara,Baik Sekali,2662/SK/BAN-PT/Ak/PT/IX/2025,2025,08,2030-09-02
banpt-182,Politeknik Mardira Indonesia,Baik,2663/SK/BAN-PT/Ak/PT/IX/2025,2025,04,2030-09-02
banpt-183,Sekolah Tinggi Ilmu Kesehatan RS Prof. Dr. J.A. Latumeten,Baik,2664/SK/BAN-PT/Ak/PT/IX/2025,2025,12,2030-09-02
banpt-184,"STAI Babunnajah Pandeglang, Banten",Baik Sekali,2665/SK/BAN-PT/Ak/PT/IX/2025,2025,PTAS,2030-09-02
banpt-185,Universitas Dharma Andalas,Baik Sekali,2672/SK/BAN-PT/Ak/PT/IX/2025,2025,10,2030-09-02
banpt-186,Institut Agama Islam An-Nawawi Purworejo,Baik Sekali,2667/SK/BAN-PT/Ak/PT/IX/2025,2025,PTAS,2030-09-02
banpt-187,Institut Agama Islam Pagaralam,Baik,2675/SK/BAN-PT/Ak-PNB/PT/IX/2025,2025,PTAS,2026-09-24
banpt-188,Institut Miftahul Huda Al-Azhar Kota Banjar,Baik,2676/SK/BAN-PT/Ak-PNB/PT/IX/2025,2025,PTAS,2029-08-19
banpt-189,Institut Madani Nusantara,Baik,2677/SK/BAN-PT/Ak-PNB/PT/IX/2025,2025,PTAS,2027-01-21
banpt-190,Universitas Islam Darud Da`wah Wal-Irsyad A.G.H. Abdurrahman Ambo Dalle,Baik,2678/SK/BAN-PT/Ak-PNB/PT/IX/2025,2025,PTAS,2026-06-29
banpt-191,Universitas Sunan Drajat Lamongan,Baik,2679/SK/BAN-PT/Ak-PNB/PT/IX/2025,2025,PTAS,2026-05-18
banpt-192,Universitas Waskita Dharma,Baik,2681/SK/BAN-PT/Ak-PNB/PT/IX/2025,2025,07,2030-08-09
banpt-193,Sekolah Tinggi Ilmu Al-Qur'an Al-Lathifiyyah Palembang Sumatera Selatan,Baik,2682/SK/BAN-PT/Ak.P/PT/IX/2025,2025,PTAS,2027-09-02
banpt-194,Akademi Keperawatan Giri Satria Husada,Baik,2683/SK/BAN-PT/Ak.Ppj/PT/IX/2025,2025,06,2030-07-12
banpt-195,Sekolah Tinggi Agama Kristen Protestan Negeri (STAKPN) Sentani,Baik,2684/SK/BAN-PT/Ak.S/PT/IX/2025,2025,PTAN,9999-01-01
banpt-196,STAI Nurul Huda Kapongan Situbondo,Baik,2685/SK/BAN-PT/Ak.S/PT/IX/2025,2025,PTAS,9999-01-01
banpt-197,Universitas Pekalongan,Unggul,2687/SK/BAN-PT/Ak/PT/IX/2025,2025,06,2030-09-02
banpt-198,Universitas PGRI Semarang,Unggul,2671/SK/BAN-PT/Ak/PT/IX/2025,2025,06,2030-09-02
banpt-199,Sekolah Tinggi Ilmu Tarbiyah Buntet  Pesantren Cirebon Jawa Barat,Baik Sekali,2666/SK/BAN-PT/Ak/PT/IX/2025,2025,PTAS,2030-09-02
banpt-200,Universitas Dharma Indonesia,Baik,2582/SK/BAN-PT/Ak-PNB/PT/VIII/2025,2025,04,2029-02-21
banpt-201,Universitas Islam Internasional Indonesia,Baik Sekali,2558/SK/BAN-PT/Ak/PT/VIII/2025,2025,PTAN,2030-08-13
banpt-202,Sekolah Tinggi Agama Islam KH Badruzzaman,Baik,2567/SK/BAN-PT/Ak/PT/VIII/2025,2025,PTAS,2030-08-13
banpt-203,"STAI Al-Mas`udiyah, Sukabumi",Baik,2574/SK/BAN-PT/Ak/PT/VIII/2025,2025,PTAS,2030-08-13
banpt-204,Sekolah Tinggi Agama Islam Al-Bahjah Cirebon,Baik,2557/SK/BAN-PT/Ak/PT/VIII/2025,2025,PTAS,2030-08-13
banpt-205,Sekolah Tinggi Agama Islam Sidogiri Pasuruan,Baik,2566/SK/BAN-PT/Ak/PT/VIII/2025,2025,PTAS,2030-08-13
banpt-206,Universitas Muhammadiyah Bengkulu,Unggul,2559/SK/BAN-PT/Ak/PT/VIII/2025,2025,02,2030-08-13
banpt-207,Politeknik Negeri Tanah Laut,Baik Sekali,2556/SK/BAN-PT/Ak/PT/VIII/2025,2025,PTN,2030-08-13
banpt-208,Institut Agama Islam Negeri Syaikh Abdurrahman Siddik Bangka Belitung,Baik Sekali,2565/SK/BAN-PT/Ak/PT/VIII/2025,2025,PTAN,2030-08-13
banpt-209,Universitas Baiturrahim,Baik Sekali,2554/SK/BAN-PT/Ak/PT/VIII/2025,2025,10,2030-08-13
banpt-210,Sekolah Tinggi Agama Islam Negeri Sultan Abdurrahman Kepulauan Riau,Baik Sekali,2555/SK/BAN-PT/Ak/PT/VIII/2025,2025,PTAN,2030-08-13
banpt-211,Sekolah Tinggi Ekonomi Islam Permata Bojonegoro,Baik,2568/SK/BAN-PT/Ak/PT/VIII/2025,2025,PTAS,2030-08-13
banpt-212,Sekolah Tinggi Agama Buddha Samantabadra - NSI,Baik,2569/SK/BAN-PT/Ak/PT/VIII/2025,2025,PTAS,2030-08-13
banpt-213,Sekolah Tinggi Agama Islam Nurul Abror Al-Robbaniyin,Baik,2560/SK/BAN-PT/Ak/PT/VIII/2025,2025,PTAS,2030-08-13
banpt-214,Akademi Perhotelan Tunas Indonesia,Baik,2564/SK/BAN-PT/Ak/PT/VIII/2025,2025,04,2030-08-13
banpt-215,STAI Al-Musaddadiyah Garut,Baik Sekali,2563/SK/BAN-PT/Ak/PT/VIII/2025,2025,PTAS,2030-08-13
banpt-216,Sekolah Tinggi Ilmu Kesehatan Baitul Hikmah,Baik,2573/SK/BAN-PT/Ak/PT/VIII/2025,2025,02,2030-08-13
banpt-217,Universitas Nias,Baik,2572/SK/BAN-PT/Ak/PT/VIII/2025,2025,01,2030-08-13
banpt-218,Institut Teknologi dan Bisnis Pelita Raya,Baik,2553/SK/BAN-PT/Ak/PT/VIII/2025,2025,10,2030-08-13
banpt-219,Politeknik Tunas Garuda,Baik,2562/SK/BAN-PT/Ak/PT/VIII/2025,2025,02,2030-08-13
banpt-220,Akademi Farmasi YPF,Baik,2571/SK/BAN-PT/Ak/PT/VIII/2025,2025,04,2030-08-13
banpt-221,Akademi Sekretaris Dan Manajemen Kencana Bandung,Baik Sekali,2561/SK/BAN-PT/Ak/PT/VIII/2025,2025,04,2030-08-13
banpt-222,STT LEVINUS RUMASEB SENTANI,Baik,2570/SK/BAN-PT/Ak/PT/VIII/2025,2025,PTAS,2030-08-13
banpt-223,Universitas Lintas Internasional Indonesia,Baik Sekali,2552/SK/BAN-PT/Ak/PT/VIII/2025,2025,04,2030-08-13
banpt-224,Sekolah Tinggi Ilmu Kesehatan Nani Hasanuddin,B,2550/SK/BAN-PT/Ak.Ppj/PT/VIII/2025,2025,09,2030-05-17
banpt-225,Universitas Metamedia,B,2549/SK/BAN-PT/Ak.Ppj/PT/VIII/2025,2025,10,2030-06-24
banpt-226,Universitas Abdurachman Saleh Situbondo,B,2548/SK/BAN-PT/Ak.Ppj/PT/VIII/2025,2025,07,2030-07-12
banpt-227,Institut Agama Islam Nahdlatul Ulama Bangil,Baik,2579/SK/BAN-PT/Ak.S/PT/VIII/2025,2025,PTAS,9999-01-01
banpt-228,STIT Muhammadiyah Aceh Barat Daya,Baik,2577/SK/BAN-PT/Ak.S/PT/VIII/2025,2025,PTAS,9999-01-01
banpt-229,Institut Agama Islam K.H. Sufyan Tsauri Majenang,Baik,2576/SK/BAN-PT/Ak.S/PT/VIII/2025,2025,PTAS,9999-01-01
banpt-230,"STAI Kharisma Cicurug, Sukabumi",Baik,2575/SK/BAN-PT/Ak.S/PT/VIII/2025,2025,PTAS,9999-01-01
banpt-231,Universitas Jember,Unggul,2551/SK/BAN-PT/Ak.Ppj/PT/VIII/2025,2025,PTN,2030-07-06
banpt-232,Sekolah Tinggi llmu Ekonomi Pangeran Antasari,Baik,2581/SK/BAN-PT/Ak/PT/VIII/2025,2025,01,2030-08-13
banpt-233,Sekolah Tinggi Ilmu Ekonomi Bentara Persada Batam,Baik,2547/SK/BAN-PT/Ak.S/PT/VIII/2025,2025,17,9999-01-01
banpt-234,Politeknik Arutala Johana Hendarto,Baik,2540/SK/BAN-PT/Ak-PNB/PT/VIII/2025,2025,03,2026-11-12
banpt-235,Sekolah Tinggi Agama Islam Al-Ruzhan,Baik,2519/SK/BAN-PT/Ak/PT/VIII/2025,2025,PTAS,2030-08-05
banpt-236,Universitas Muhammadiyah Palembang,Unggul,2533/SK/BAN-PT/Ak/PT/VIII/2025,2025,02,2030-08-05
banpt-237,Sekolah Tinggi Ilmu Dakwah dan Komunikasi Al-Hamidy Pamekasan,Baik,2516/SK/BAN-PT/Ak/PT/VIII/2025,2025,PTAS,2030-08-05
banpt-238,Universitas Islam Al-Aziziyah Indonesia,Baik Sekali,2513/SK/BAN-PT/Ak/PT/VIII/2025,2025,PTAS,2030-08-05
banpt-239,Sekolah Tinggi Agama Islam Al-Hidayat,Baik,2517/SK/BAN-PT/Ak/PT/VIII/2025,2025,PTAS,2030-08-05
banpt-240,Institut Nahdlatul Ulama Ciamis,Baik,2520/SK/BAN-PT/Ak/PT/VIII/2025,2025,PTAS,2030-08-05
banpt-241,Institut Agama Islam YPBWI,Baik,2515/SK/BAN-PT/Ak-PNB/PT/VIII/2025,2025,PTAS,2026-09-17
banpt-242,Institut Media Digital Emtek,Baik,2539/SK/BAN-PT/Ak-PNB/PT/VIII/2025,2025,03,2026-06-02
banpt-243,Sekolah Tinggi Ilmu Kesehatan Medistra Indonesia,Unggul,2511/SK/BAN-PT/Ak/PT/VIII/2025,2025,03,2030-08-05
banpt-244,Sekolah Tinggi Agama Islam Nurul Islam Mojokerto,Baik,2518/SK/BAN-PT/Ak/PT/VIII/2025,2025,PTAS,2030-08-05
banpt-245,Universitas Mohammad Natsir Bukittinggi,Baik Sekali,2512/SK/BAN-PT/Ak/PT/VIII/2025,2025,10,2030-08-05
