institution_code,institution_name,akreditasi_institusi,no_sk,tahun_sk,wilayah,tanggal_kadaluarsa
banpt-3000,Sekolah Tinggi Ilmu Kesehatan Karya Kesehatan,Baik,1119/SK/BAN-PT/Ak.KP/PT/IX/2022,2022,09,2026-06-18
banpt-3001,Akademi Keperawatan Bethesda Serukam,Baik,1495/SK/BAN-PT/Ak.KP/PT/IX/2022,2022,11,2026-12-28
banpt-3002,Sekolah Tinggi Ilmu Ekonomi Mulia Singkawang,Baik,1160/SK/BAN-PT/Ak.KP/PT/IX/2022,2022,11,2026-12-28
banpt-3003,Institut Agama Islam Al-Qodiri Jember,Baik,1486/SK/BAN-PT/Ak.KP/PT/IX/2022,2022,PTAS,2027-05-10
banpt-3004,Sekolah Tinggi Ilmu Ekonomi Petra,Baik,1183/SK/BAN-PT/Ak.KP/PT/IX/2022,2022,16,2026-12-28
banpt-3005,Sekolah Tinggi Teologi Soteria Purwokerto,Baik,1209/SK/BAN-PT/Ak.KP/PT/IX/2022,2022,PTAS,2026-12-28
banpt-3006,Politeknik Kotabaru,Baik,1196/SK/BAN-PT/Ak.KP/PT/IX/2022,2022,11,2026-12-28
banpt-3007,Sekolah Tinggi Agama Islam AN-Nawawi Purworejo,Baik,1125/SK/BAN-PT/Ak.KP/PT/IX/2022,2022,PTAS,2026-12-28
banpt-3008,Politeknik ST. Wilhelmus,Baik,1440/SK/BAN-PT/Ak.KP/PT/IX/2022,2022,15,2026-12-28
banpt-3009,Politeknik Katolik Saint Paul,Baik,1144/SK/BAN-PT/Ak.KP/PT/IX/2022,2022,14,2026-12-28
banpt-3010,Sekolah Tinggi Teologi Berita Hidup Solo,Baik,1436/SK/BAN-PT/Ak.KP/PT/IX/2022,2022,PTAS,2026-12-28
banpt-3011,Akademi Manajemen Informatika dan Komputer Kosgoro,Baik,1409/SK/BAN-PT/Ak.KP/PT/IX/2022,2022,10,2026-12-28
banpt-3012,STIT Darul Fattah Bandar Lampung,Baik,1485/SK/BAN-PT/Ak.KP/PT/IX/2022,2022,PTAS,2026-06-18
banpt-3013,Sekolah Tinggi Agama Islam (STAI) Al-Ma`arif Way Kanan,Baik,1508/SK/BAN-PT/Ak.KP/PT/IX/2022,2022,PTAS,2026-06-18
banpt-3014,Sekolah Tinggi Ilmu Tarbiyah (STIT) Al-Chaeriyah Mamuju Sulawesi Barat,Baik,1503/SK/BAN-PT/Ak.KP/PT/IX/2022,2022,PTAS,2026-06-11
banpt-3015,Sekolah Tinggi Agama Islam Bani Saleh,Baik,1323/SK/BAN-PT/Ak.KP/PT/IX/2022,2022,PTAS,2026-01-30
banpt-3016,Sekolah Tinggi Ilmu Ekonomi Pengembangan Bisnis dan Manajemen,Baik,1145/SK/BAN-PT/Ak.KP/PT/IX/2022,2022,03,2025-12-30
banpt-3017,Sekolah Tinggi Teologi Kasih Mentawai,Baik,1364/SK/BAN-PT/Ak.KP/PT/IX/2022,2022,PTAS,2025-12-30
banpt-3018,Sekolah Tinggi Teknik Ilmu Komputer Insan Unggul,Baik,1167/SK/BAN-PT/Ak.KP/PT/IX/2022,2022,04,2025-12-30
banpt-3019,Sekolah Tinggi Ilmu Administrasi Panca Marga Palu,Baik,1108/SK/BAN-PT/Ak.KP/PT/IX/2022,2022,16,2025-12-20
banpt-3020,Sekolah Tinggi Ilmu Ekonomi Umel,Baik,1092/SK/BAN-PT/Ak.KP/PT/IX/2022,2022,12,2025-12-20
banpt-3021,Universitas Lakidende Unahaa,Baik,1168/SK/BAN-PT/Ak.KP/PT/IX/2022,2022,09,2025-12-20
banpt-3022,Sekolah Tinggi Ilmu Tarbiyah Al-Quraniyah Manna,Baik,1252/SK/BAN-PT/Ak.KP/PT/IX/2022,2022,PTAS,2025-12-20
banpt-3023,Sekolah Tinggi Agama Islam Nida El Adabi Parung Panjang Bogor,Baik,1237/SK/BAN-PT/Ak.KP/PT/IX/2022,2022,PTAS,2025-12-20
banpt-3024,Sekolah Tinggi Ilmu Ekonomi El Fatah Manado,Baik,1271/SK/BAN-PT/Ak.KP/PT/IX/2022,2022,16,2025-12-20
banpt-3025,Akademi Kebidanan Graha Husada Sampang,Baik,1293/SK/BAN-PT/Ak.KP/PT/IX/2022,2022,07,2026-01-30
banpt-3026,Politeknik Piksi Input Serang,Baik,1244/SK/BAN-PT/Ak.KP/PT/IX/2022,2022,04,2026-01-30
banpt-3027,Universitas Mahakarya Asia,Baik,1333/SK/BAN-PT/Ak.KP/PT/IX/2022,2022,05,2026-05-21
banpt-3028,Sekolah Tinggi Perikanan Sibolga,Baik,1216/SK/BAN-PT/Ak.KP/PT/IX/2022,2022,01,2026-05-21
banpt-3029,Sekolah Tinggi Ilmu Teknik Trisula,Baik,1377/SK/BAN-PT/Ak.KP/PT/IX/2022,2022,02,2026-05-21
banpt-3030,Sekolah Tinggi Ilmu Ekonomi Muhammadiyah Kalianda,Baik,1175/SK/BAN-PT/Ak.KP/PT/IX/2022,2022,02,2026-05-21
banpt-3031,Universitas Pejuang Republik Indonesia,Baik,1243/SK/BAN-PT/Ak.KP/PT/IX/2022,2022,09,2026-05-21
banpt-3032,"Sekolah Tinggi Teologi Baptis Papua, Abepura",Baik,1414/SK/BAN-PT/Ak.KP/PT/IX/2022,2022,PTAS,2026-05-21
banpt-3033,Sekolah Tinggi Ilmu Kesehatan Mitra Adiguna,Baik,1161/SK/BAN-PT/Ak.KP/PT/IX/2022,2022,02,2026-05-21
banpt-3034,Akademi Keperawatan Wirahusada Medan,Baik,1464/SK/BAN-PT/Ak.KP/PT/IX/2022,2022,01,2026-03-06
banpt-3035,Institut Teknologi dan Bisnis Haji Agus Salim Bukittinggi,Baik,1484/SK/BAN-PT/Ak.KP/PT/IX/2022,2022,10,2026-02-19
banpt-3036,Universitas Kristen Palangka Raya,Baik,1389/SK/BAN-PT/Ak.KP/PT/IX/2022,2022,11,2026-02-13
banpt-3037,Sekolah Tinggi Manajemen Informatika dan Komputer Web Informatika Teknologi,Baik,1307/SK/BAN-PT/Ak.KP/PT/IX/2022,2022,04,2026-01-30
banpt-3038,Sekolah Tinggi Agama Islam Darul Hikmah,Baik,1355/SK/BAN-PT/Ak.KP/PT/IX/2022,2022,PTAS,2025-12-20
banpt-3039,STAI Rawa Aopa Konawe Selatan,Baik,872/SK/BAN-PT/Ak/PT/IX/2022,2022,PTAS,2027-09-20
banpt-3040,Sekolah Tinggi Ilmu Ekonomi Miftahul Huda,Baik,1081/SK/BAN-PT/Ak.KP/PT/IX/2022,2022,04,2026-01-30
banpt-3041,Sekolah Tinggi Kesehatan Pondok Pesantren Assanadiyah Palembang,Baik,1036/SK/BAN-PT/Ak.KP/PT/IX/2022,2022,02,2026-01-30
banpt-3042,Sekolah Tinggi Keguruan dan Ilmu Pendidikan Persada Khatulistiwa Sintang,Baik,930/SK/BAN-PT/Ak.KP/PT/IX/2022,2022,11,2026-02-13
banpt-3043,Sekolah Tinggi Bahasa Asing Yapari,Baik,1080/SK/BAN-PT/Ak.KP/PT/IX/2022,2022,04,2026-03-06
banpt-3044,Sekolah Tinggi Ilmu Ekonomi Indonesia Malang,Baik,928/SK/BAN-PT/Ak.KP/PT/IX/2022,2022,07,2026-04-10
banpt-3045,STAIN Gajah Putih Takengon Aceh Tengah,Baik,1067/SK/BAN-PT/Ak.KP/PT/IX/2022,2022,PTAN,2026-05-21
banpt-3046,STISIP Banten Raya,Baik,1028/SK/BAN-PT/Ak.KP/PT/IX/2022,2022,04,2026-05-21
banpt-3047,Akademi Maritim Djadajat,Baik,934/SK/BAN-PT/Ak.KP/PT/IX/2022,2022,03,2026-05-21
banpt-3048,Universitas An Nuur,Baik,982/SK/BAN-PT/Ak.KP/PT/IX/2022,2022,06,2026-05-21
banpt-3049,Universitas Bina Taruna Gorontalo,Baik,1000/SK/BAN-PT/Ak.KP/PT/IX/2022,2022,16,2026-05-21
banpt-3050,Institut Agama Islam Muhammad Azim Jambi,Baik,1014/SK/BAN-PT/Ak.KP/PT/IX/2022,2022,PTAS,2026-05-25
banpt-3051,Universitas PGRI Banyuwangi,Baik,1033/SK/BAN-PT/Ak.KP/PT/IX/2022,2022,07,2026-01-30
banpt-3052,Sekolah Tinggi Ilmu Administrasi Pelita Nusantara,Baik,993/SK/BAN-PT/Ak.KP/PT/IX/2022,2022,13,2026-01-30
banpt-3053,Sekolah Tinggi Ilmu Ekonomi Wiyatamandala,Baik,973/SK/BAN-PT/Ak.KP/PT/IX/2022,2022,03,2025-12-20
banpt-3054,Universitas Samawa,Baik,1037/SK/BAN-PT/Ak.KP/PT/IX/2022,2022,08,2025-12-20
banpt-3055,Sekolah Tinggi Pembangunan Masyarakat Santa Ursula,Baik,968/SK/BAN-PT/Ak.KP/PT/IX/2022,2022,15,2025-12-20
banpt-3056,Universitas Sawerigading Makassar,Baik,1060/SK/BAN-PT/Ak.KP/PT/IX/2022,2022,09,2025-12-20
banpt-3057,Politeknik Darusalam,Baik,876/SK/BAN-PT/Ak.KP/PT/IX/2022,2022,02,2025-12-20
banpt-3058,Sekolah Tinggi Ilmu Kesehatan Al-Su'aibah,Baik,983/SK/BAN-PT/Ak.KP/PT/IX/2022,2022,02,2025-12-20
banpt-3059,Universitas Binaniaga Indonesia,Baik,1082/SK/BAN-PT/Ak.KP/PT/IX/2022,2022,04,2025-12-20
banpt-3060,Sekolah Tinggi Ilmu Bahasa Dan Sastra Satya Widya,Baik,994/SK/BAN-PT/Ak.KP/PT/IX/2022,2022,07,2025-12-30
banpt-3061,Akademi Kebidanan Pemkot Tebing Tinggi,Baik,952/SK/BAN-PT/Ak.KP/PT/IX/2022,2022,PTKL,2025-12-30
banpt-3062,Sekolah Tinggi Ilmu Administrasi Tabalong,Baik,881/SK/BAN-PT/Ak.KP/PT/IX/2022,2022,11,2026-06-11
banpt-3063,Institut Agama Islam Al Mawaddah Warrahmah Kolaka Sulawesi Tenggara,Baik,1066/SK/BAN-PT/Ak.KP/PT/IX/2022,2022,PTAS,2026-06-18
banpt-3064,Akademi Keperawatan Dharma Insan,Baik,1046/SK/BAN-PT/Ak.KP/PT/IX/2022,2022,11,2026-12-28
banpt-3065,Sekolah Tinggi Ilmu Ekonomi Indragiri,Baik,889/SK/BAN-PT/Ak.KP/PT/IX/2022,2022,10,2026-12-28
banpt-3066,Universitas Atma Jaya Makassar,Baik,910/SK/BAN-PT/Ak.KP/PT/IX/2022,2022,09,2026-12-28
banpt-3067,Sekolah Tinggi Keguruan dan Ilmu Pendidikan Citra Bakti,Baik,1059/SK/BAN-PT/Ak.KP/PT/IX/2022,2022,15,2026-12-28
banpt-3068,Sekolah Tinggi Ilmu Administrasi Al Ghazali Barru,Baik,943/SK/BAN-PT/Ak.KP/PT/IX/2022,2022,09,2027-05-10
banpt-3069,Universitas Nuku,Baik,942/SK/BAN-PT/Ak.KP/PT/IX/2022,2022,12,2027-05-10
banpt-3070,Akademi Komunikasi Media Radio Dan TV Jakarta,Baik,888/SK/BAN-PT/Ak.KP/PT/IX/2022,2022,03,2027-08-16
banpt-3071,Akademi Farmasi Bhumi Husada,Baik,920/SK/BAN-PT/Ak.KP/PT/IX/2022,2022,03,2027-09-13
banpt-3072,Akademi Kesejahteraan Sosial AKK,Baik,890/SK/BAN-PT/Ak.KP/PT/IX/2022,2022,05,2027-09-13
banpt-3073,Universitas Bina Mandiri Gorontalo,Baik,1065/SK/BAN-PT/Ak.KP/PT/IX/2022,2022,16,2026-12-28
banpt-3074,Universitas Islam Jember,Baik,929/SK/BAN-PT/Ak.KP/PT/IX/2022,2022,07,2026-12-28
banpt-3075,Universitas Gajah Putih,Baik,1047/SK/BAN-PT/Ak.KP/PT/IX/2022,2022,13,2026-06-18
banpt-3076,STT Bethel Indonesia Jakarta,Baik,903/SK/BAN-PT/Ak.KP/PT/IX/2022,2022,PTAS,2026-06-18
banpt-3077,Politeknik TEDC,Baik,891/SK/BAN-PT/Ak.KP/PT/IX/2022,2022,04,2026-06-18
banpt-3078,Institut Kesehatan dan Bisnis Surabaya,Baik,902/SK/BAN-PT/Ak.KP/PT/IX/2022,2022,07,2026-06-18
banpt-3079,Politeknik Sawunggalih Aji,Baik,999/SK/BAN-PT/Ak.KP/PT/IX/2022,2022,06,2026-07-02
banpt-3080,Institut Dirosat Islamiyah Al-Amien Prenduan Sumenep,Baik,899/SK/BAN-PT/Ak.KP/PT/IX/2022,2022,PTAS,2026-07-15
banpt-3081,Universitas Pat Petulai,Baik,1074/SK/BAN-PT/Ak.KP/PT/IX/2022,2022,02,2026-08-27
banpt-3082,STAI Auliaurrasyidin,Baik,1045/SK/BAN-PT/Ak.KP/PT/IX/2022,2022,PTAS,2026-09-03
banpt-3083,STIKES Pelita Ibu,Baik,1013/SK/BAN-PT/Ak.KP/PT/IX/2022,2022,09,2026-09-03
banpt-3084,Universitas Yos Sudarso,Baik,981/SK/BAN-PT/Ak.KP/PT/IX/2022,2022,07,2026-11-25
banpt-3085,Universitas Katolik Widya Karya,Baik,882/SK/BAN-PT/Ak.KP/PT/IX/2022,2022,07,2026-12-28
banpt-3086,Sekolah Tinggi Keguruan dan Ilmu Pendidikan Yayasan Dharma Bakti Lubuk Alung,Baik,962/SK/BAN-PT/Ak.KP/PT/IX/2022,2022,10,2025-10-04
banpt-3087,Akademi Keperawatan Lapatau Bone,Baik,869/SK/BAN-PT/Ak.Ppj/PT/IX/2022,2022,09,2027-08-16
banpt-3088,Politeknik Negeri Lhokseumawe,Baik Sekali,865/SK/BAN-PT/Ak.KP/PT/IX/2022,2022,PTN,2026-12-28
banpt-3089,Institut Bisnis Dan Teknologi Indonesia Denpasar,Baik,864/SK/BAN-PT/Ak-PNB/PT/IX/2022,2022,08,2025-11-17
banpt-3090,Sekolah Tinggi Manajemen Informatika dan Komputer Horizon Karawang,Baik,863/SK/BAN-PT/Ak-PNB/PT/IX/2022,2022,04,2025-12-15
banpt-3091,Universitas Maritim AMNI,Baik Sekali,845/SK/BAN-PT/Ak.KP/PT/IX/2022,2022,06,2027-05-24
banpt-3092,Politeknik Negeri Madura,Baik Sekali,847/SK/BAN-PT/Ak/PT/IX/2022,2022,PTN,2027-09-13
banpt-3093,Institut Kesehatan Indonesia,Baik,856/SK/BAN-PT/Ak.KP/PT/IX/2022,2022,03,2026-09-30
banpt-3094,STEI Bina Cipta Madani,Baik,848/SK/BAN-PT/Ak/PT/IX/2022,2022,PTAS,2027-09-13
banpt-3095,Sekolah Tinggi Ilmu Pertanian Muhammadiyah Tanah Grogot,Baik,838/SK/BAN-PT/Ak.KP/PT/IX/2022,2022,11,2025-12-20
banpt-3096,STKIP Yasika,Baik,722/SK/BAN-PT/Ak/PT/IX/2022,2022,04,2027-09-07
banpt-3097,STAI PTDII Jakarta,Baik,723/SK/BAN-PT/Ak/PT/IX/2022,2022,PTAS,2027-09-07
banpt-3098,Politeknik Negeri Fakfak,Baik,630/SK/BAN-PT/Ak/PT/IX/2022,2022,PTN,2027-09-06
banpt-3099,Universitas Muhammadiyah Palu,Baik Sekali,626/SK/BAN-PT/Ak/PT/IX/2022,2022,16,2027-09-06
banpt-3100,Institut Seni Budaya Indonesia Aceh,Baik,629/SK/BAN-PT/Ak/PT/IX/2022,2022,PTN,2027-09-06
banpt-3101,Institut Agama Islam Dar Aswaja Rokan Hilir,Baik,632/SK/BAN-PT/Ak/PT/IX/2022,2022,PTAS,2027-09-06
banpt-3102,STKIP Nasional,Baik,627/SK/BAN-PT/Ak/PT/IX/2022,2022,10,2027-09-06
banpt-3103,Sekolah Tinggi Teologi Saint Paul Bandung,Baik,631/SK/BAN-PT/Ak/PT/IX/2022,2022,PTAS,2027-09-06
banpt-3104,STIKES Pamenang,Baik,628/SK/BAN-PT/Ak/PT/IX/2022,2022,07,2027-09-06
banpt-3105,Institut Agama Islam As Siddiq Kie Raha Maluku Utara,Baik,633/SK/BAN-PT/Ak/PT/IX/2022,2022,PTAS,2027-09-06
banpt-3106,Universitas Mandiri Bina Prestasi,Baik,623/SK/BAN-PT/Ak-PNB/PT/IX/2022,2022,01,2026-05-05
banpt-3107,STKIP Modern Ngawi,Baik,606/SK/BAN-PT/Ak.Ppj/PT/VIII/2022,2022,07,2027-08-16
banpt-3108,Sekolah Tinggi Ilmu Ekonomi Jambi,Baik,617/SK/BAN-PT/Ak.S/PT/VIII/2022,2022,10,9999-01-01
banpt-3109,STAI Assalamiyah Curugsari Jawilan Serang,Baik,483/SK/BAN-PT/Ak/PT/VIII/2022,2022,PTAS,2027-08-30
banpt-3110,Sekolah Tinggi Ilmu Ekonomi Muhammadiyah Jakarta,Baik Sekali,548/SK/BAN-PT/Ak.Ppj/PT/VIII/2022,2022,03,2027-08-16
banpt-3111,STAI Ibnu Sina Batam,B,509/SK/BAN-PT/Ak.Ppj/PT/VIII/2022,2022,PTAS,2027-08-16
banpt-3112,Universitas Merdeka Madiun,B,498/SK/BAN-PT/Ak.Ppj/PT/VIII/2022,2022,07,2027-08-16
banpt-3113,STAI Al-Yasini Pasuruan,Baik,481/SK/BAN-PT/Ak/PT/VIII/2022,2022,PTAS,2027-08-30
banpt-3114,STKIP Taman Siswa Bima,Baik,484/SK/BAN-PT/Ak/PT/VIII/2022,2022,08,2027-08-30
banpt-3115,Sekolah Tinggi Kesehatan Indonesia Wirautama,Baik,485/SK/BAN-PT/Ak/PT/VIII/2022,2022,04,2027-08-30
banpt-3116,STKIP Purwakarta,Baik,480/SK/BAN-PT/Ak/PT/VIII/2022,2022,04,2027-08-30
banpt-3117,Politeknik Pariwisata Medan,Baik Sekali,579/SK/BAN-PT/Ak/PT/VIII/2022,2022,PTKL,2027-08-30
banpt-3118,"STAI DDI Jeneponto, Sulawesi Selatan",Baik,482/SK/BAN-PT/Ak/PT/VIII/2022,2022,PTAS,2027-08-30
banpt-3119,Universitas Mercu Buana,Unggul,478/SK/BAN-PT/Ak.KP/PT/VIII/2022,2022,03,2026-12-21
banpt-3120,Sekolah Tinggi Farmasi Indonesia,B,539/SK/BAN-PT/Ak.Ppj/PT/VIII/2022,2022,04,2027-08-16
banpt-3121,Universitas Islam Bandung,Unggul,497/SK/BAN-PT/Ak.Ppj/PT/VIII/2022,2022,04,2027-08-16
banpt-3122,Universitas Hindu Indonesia,B,527/SK/BAN-PT/Ak.Ppj/PT/VIII/2022,2022,08,2027-09-13
banpt-3123,Universitas Muhammadiyah Malang,Unggul,494/SK/BAN-PT/Ak.Ppj/PT/VIII/2022,2022,07,2027-09-13
banpt-3124,Universitas Widya Mataram,B,507/SK/BAN-PT/Ak.Ppj/PT/VIII/2022,2022,05,2027-09-13
banpt-3125,Sekolah Tinggi Agama Buddha Syailendra,B,506/SK/BAN-PT/Ak.Ppj/PT/VIII/2022,2022,PTAS,2027-09-13
banpt-3126,Universitas Fajar,B,528/SK/BAN-PT/Ak.Ppj/PT/VIII/2022,2022,09,2027-09-13
banpt-3127,Universitas Putra Indonesia Yptk Padang,B,521/SK/BAN-PT/Ak.Ppj/PT/VIII/2022,2022,10,2027-09-13
banpt-3128,Universitas Tarumanagara,Unggul,496/SK/BAN-PT/Ak.Ppj/PT/VIII/2022,2022,03,2027-09-06
banpt-3129,Sekolah Tinggi Ilmu Ekonomi Bina Karya,B,530/SK/BAN-PT/Ak.Ppj/PT/VIII/2022,2022,01,2027-09-06
banpt-3130,Sekolah Tinggi Ilmu Farmasi Yayasan Pharmasi,B,500/SK/BAN-PT/Ak.Ppj/PT/VIII/2022,2022,06,2027-09-06
banpt-3131,Akademi Pariwisata Dan Perhotelan Darma Agung,B,532/SK/BAN-PT/Ak.Ppj/PT/VIII/2022,2022,01,2027-09-13
banpt-3132,Sekolah Tinggi Ilmu Kesehatan Prima Indonesia,Baik,419/SK/BAN-PT/Ak.Ppj/PT/VIII/2022,2022,04,2027-05-24
banpt-3133,Politeknik Ketenagakerjaan,Baik,463/SK/BAN-PT/Ak/PT/VIII/2022,2022,PTKL,2027-08-23
banpt-3134,Institut Agama Islam Faqih Asy'ari Kediri,Baik,456/SK/BAN-PT/Ak/PT/VIII/2022,2022,PTAS,2027-08-23
banpt-3135,Sekolah Tinggi Bibelvrouw HKBP Laguboti,Baik,458/SK/BAN-PT/Ak/PT/VIII/2022,2022,PTAS,2027-08-23
banpt-3136,Sekolah Tinggi Ekonomi Bisnis Islam Syari'ah Bina Mandiri Cileungsu Bogor,Baik,462/SK/BAN-PT/Ak/PT/VIII/2022,2022,PTAS,2027-08-23
banpt-3137,STMIK Kharisma Makassar,Baik,461/SK/BAN-PT/Ak/PT/VIII/2022,2022,09,2027-08-23
banpt-3138,Akademi Analis Farmasi Dan Makanan Sunan Giri,Baik,460/SK/BAN-PT/Ak/PT/VIII/2022,2022,07,2027-08-23
banpt-3139,Universitas Nahdlatul Ulama Surakarta,Baik Sekali,455/SK/BAN-PT/Ak/PT/VIII/2022,2022,06,2027-08-23
banpt-3140,Sekolah Tinggi Teologi Abdi Sabda Medan,Baik,459/SK/BAN-PT/Ak/PT/VIII/2022,2022,PTAS,2027-08-23
banpt-3141,STIKES Gema Insan Akademik,Baik,457/SK/BAN-PT/Ak/PT/VIII/2022,2022,09,2027-08-23
banpt-3142,Politeknik Ilmu Pelayaran Makassar,Baik Sekali,453/SK/BAN-PT/Ak/PT/VIII/2022,2022,PTKL,2027-08-23
banpt-3143,STAI Al-Hikmah 2,Baik,438/SK/BAN-PT/Ak/PT/VIII/2022,2022,PTAS,2027-08-16
banpt-3144,Institut Agama Islam Shalahuddin Al-Ayyubi (INISA) Tambun Bekasi,Baik,433/SK/BAN-PT/Ak/PT/VIII/2022,2022,PTAS,2027-08-16
banpt-3145,Sekolah Tinggi Ilmu Kesehatan Alifah Padang,Baik Sekali,437/SK/BAN-PT/Ak/PT/VIII/2022,2022,10,2027-08-16
banpt-3146,Universitas Dinamika,Baik Sekali,432/SK/BAN-PT/Ak/PT/VIII/2022,2022,07,2027-08-16
banpt-3147,Sekolah Tinggi Teologi Bethel Medan,Baik,439/SK/BAN-PT/Ak/PT/VIII/2022,2022,PTAS,2027-08-16
banpt-3148,Sekolah Tinggi Ilmu Tarbiyah Muhammadiyah Tanjung Redeb Berau,Baik,444/SK/BAN-PT/Ak-PNB/PT/VIII/2022,2022,PTAS,2026-07-06
banpt-3149,Sekolah Tinggi Teologi Injili Bethsaida Medan,Baik,434/SK/BAN-PT/Ak/PT/VIII/2022,2022,PTAS,2027-08-16
banpt-3150,Akademi Pekerjaan Sosial Kupang,Baik,430/SK/BAN-PT/Ak.S/PT/VIII/2022,2022,15,9999-01-01
banpt-3151,STIA Dan Manajemen Kepelabuhan Barunawati,Baik Sekali,425/SK/BAN-PT/Ak/PT/VIII/2022,2022,07,2027-08-09
banpt-3152,Politeknik Transportasi Darat Indonesia - STTD,Baik Sekali,420/SK/BAN-PT/Ak/PT/VIII/2022,2022,PTKL,2027-08-09
banpt-3153,Akademi Komunitas Perkebunan Yogyakarta,Baik,424/SK/BAN-PT/Ak/PT/VIII/2022,2022,05,2027-08-09
banpt-3154,Politeknik Angkatan Darat,Baik Sekali,422/SK/BAN-PT/Ak/PT/VIII/2022,2022,PTKL,2027-08-09
banpt-3155,Politeknik STMI Jakarta,Baik Sekali,421/SK/BAN-PT/Ak/PT/VIII/2022,2022,PTKL,2027-08-09
banpt-3156,Universitas Ubudiyah Indonesia,Baik,423/SK/BAN-PT/Ak/PT/VIII/2022,2022,13,2027-08-09
banpt-3157,Institut Daarul Qur'an Jakarta,Baik,417/SK/BAN-PT/Ak/PT/VIII/2022,2022,PTAS,2027-08-04
banpt-3158,Politeknik Pekerjaan Umum,Baik,410/SK/BAN-PT/Ak/PT/VIII/2022,2022,PTKL,2027-08-02
banpt-3159,Sekolah Tinggi Ilmu Al-Qur'an Dan Sains Al-Ishlah Lamongan Jawa Timur,Baik,411/SK/BAN-PT/Ak/PT/VIII/2022,2022,PTAS,2027-08-02
banpt-3160,Politeknik Kaltara,Baik,412/SK/BAN-PT/Ak/PT/VIII/2022,2022,11,2027-08-02
banpt-3161,Institut Teknologi Nasional Bandung,Unggul,407/SK/BAN-PT/Ak/PT/VIII/2022,2022,04,2027-08-02
banpt-3162,Universitas Yudharta Pasuruan,Baik Sekali,409/SK/BAN-PT/Ak/PT/VIII/2022,2022,07,2027-08-02
banpt-3163,Sekolah Tinggi Ilmu Kesehatan Respati,Baik Sekali,408/SK/BAN-PT/Ak/PT/VIII/2022,2022,04,2027-08-02
banpt-3164,Institut Agama Islam Al-Hikmah Tuban,Baik,416/SK/BAN-PT/Ak/PT/VIII/2022,2022,PTAS,2027-08-02
banpt-3165,Universitas Tridharma,Tidak Terakreditasi,292/SK/BAN-PT/Ak-TMSP/PT/VI/2022,2022,11,
banpt-3166,Sekolah Tinggi Keguruan dan Ilmu Pendidikan Agama Hindu Singaraja,Baik,204/SK/BAN-PT/Ak-PPJ/PT/V/2022,2022,08,2027-05-24
banpt-3167,Politeknik Raflesia,Baik,205/SK/BAN-PT/Ak-PPJ/PT/V/2022,2022,02,2027-05-24
banpt-3168,Akademi Keperawatan Gita Matura Abadi Kisaran,Baik,206/SK/BAN-PT/Ak-PPJ/PT/V/2022,2022,01,2027-05-24
banpt-3169,Sekolah Tinggi Ilmu Ekonomi Bangkinang,Baik Sekali,1/SK/BAN-PT/Akred-PMT/PT/I/2022,2022,17,2027-01-04
banpt-3170,"STAI Tapanuli (STAITA) Padangsidempuan, Sumatera Utara",Baik,403/SK/BAN-PT/Ak.S/PT/VII/2022,2022,PTAS,9999-01-01
banpt-3171,Sekolah Tinggi Ilmu Ekonomi Artha Bodhi Iswara,Baik,404/SK/BAN-PT/Ak/PT/VII/2022,2022,07,2027-07-27
banpt-3172,STAI Nusantara Kota Banda Aceh,Baik,399/SK/BAN-PT/Ak/PT/VII/2022,2022,PTAS,2027-07-27
banpt-3173,Sekolah Tinggi Ilmu Kesehatan Datu Kamanre,Baik,400/SK/BAN-PT/Ak/PT/VII/2022,2022,09,2027-07-27
banpt-3174,Universitas Islam Ogan Komering Ilir Kayuagung,Baik,391/SK/BAN-PT/Ak/PT/VII/2022,2022,02,2027-07-26
banpt-3175,Sekolah Tinggi Pertanian Kewirausahaan Banau,Baik Sekali,395/SK/BAN-PT/Ak/PT/VII/2022,2022,12,2027-07-26
banpt-3176,STAI Nahdlatul Ulama (STAINU) Tasikmalaya,Baik,390/SK/BAN-PT/Ak/PT/VII/2022,2022,PTAS,2027-07-26
banpt-3177,Akademi Pariwisata Yogyakarta,Baik,396/SK/BAN-PT/Ak/PT/VII/2022,2022,05,2027-07-26
banpt-3178,Politeknik Bisnis dan Pasar Modal,Baik,394/SK/BAN-PT/Ak/PT/VII/2022,2022,03,2027-07-26
banpt-3179,Universitas Gunung Kidul,Baik,392/SK/BAN-PT/Ak/PT/VII/2022,2022,05,2027-07-26
banpt-3180,Universitas Widyatama,Unggul,1134/SK/BAN-PT/SURV-BDG/PT/XII/2021,2021,04,2025-12-22
banpt-3181,Sekolah Tinggi Teknologi Nusantara Indonesia,Baik,378/SK/BAN-PT/Ak/PT/VII/2022,2022,09,2027-07-20
banpt-3182,Sekolah Tinggi Agama Islam Sayid Mohammad Alawi Al Maliki,Baik,381/SK/BAN-PT/Ak/PT/VII/2022,2022,PTAS,2027-07-20
banpt-3183,Sekolah Tinggi Bisnis dan Manajemen Dua Saudara,Baik,380/SK/BAN-PT/Ak/PT/VII/2022,2022,16,2027-07-20
banpt-3184,"STIT Hamzah Al-Fansuri Sibolga Barus (STIT HASIBA) Tapanuli Tengah, Sumatera Uta",Baik,379/SK/BAN-PT/Ak/PT/VII/2022,2022,PTAS,2027-07-20
banpt-3185,Politeknik Kelautan dan Perikanan Bitung,Baik Sekali,375/SK/BAN-PT/Ak/PT/VII/2022,2022,PTKL,2027-07-20
banpt-3186,"Institut Pembina Rohani Islam (IPRIJA) Jakarta, Ciracas, Jakarta Timur",Baik,377/SK/BAN-PT/Ak/PT/VII/2022,2022,PTAS,2027-07-20
banpt-3187,Politeknik Ilmu Pemasyarakatan,Baik,376/SK/BAN-PT/Ak/PT/VII/2022,2022,PTKL,2027-07-20
banpt-3188,Sekolah Tinggi Agama Islam Aceh Tamiang,Baik,368/SK/BAN-PT/Ak/PT/VII/2022,2022,PTAS,2027-07-19
banpt-3189,Poltekkes Kemenkes Mamuju,Baik,367/SK/BAN-PT/Ak/PT/VII/2022,2022,PTKL,2027-07-19
banpt-3190,Universitas Muhamamdiyah Karanganyar,Baik,372/SK/BAN-PT/Ak-PNB/PT/VII/2022,2022,06,2026-08-31
banpt-3191,Sekolah Tinggi Filsafat Fajar Timur,Baik,361/SK/BAN-PT/Ak-PPJ/PT/VII/2022,2022,14,2026-11-25
banpt-3192,Akademi Kebidanan Paramata Raha,Baik,353/SK/BAN-PT/Akred/PT/VII/2022,2022,09,2027-07-13
banpt-3193,Universitas Respati Yogyakarta,B,354/SK/BAN-PT/Ak-PPJ/PT/VII/2022,2022,05,2027-05-24
banpt-3194,Akademi Maritim Indonesia AIPI,Baik,345/SK/BAN-PT/Akred-PMT/PT/VII/2022,2022,09,2027-07-12
banpt-3195,Universitas Cipasung Tasikmalaya,Baik,336/SK/BAN-PT/Ak-PNB/PT/VII/2022,2022,04,2026-05-21
banpt-3196,Institut Teknologi dan Bisnis Widya Gama Lumajang,Baik,343/SK/BAN-PT/Ak-PNB/PT/VII/2022,2022,07,2025-12-15
banpt-3197,Politeknik Pariwisata Prima Internasional,Baik,340/SK/BAN-PT/Akred/PT/VII/2022,2022,04,2027-07-12
banpt-3198,Politeknik Baja Tegal,Baik,341/SK/BAN-PT/Akred/PT/VII/2022,2022,06,2027-07-12
banpt-3199,Universitas Satya Wiyata Mandala,Baik,339/SK/BAN-PT/Akred/PT/VII/2022,2022,14,2027-07-12
banpt-3200,Sekolah Tinggi Teknologi Terpadu Nurul Fikri,Baik,207/SK/BAN-PT/Ak-PPJ/PT/V/2022,2022,04,2027-05-17
banpt-3201,Universitas Anwar Medika,Baik,325/SK/BAN-PT/Ak-PNB/PT/VII/2022,2022,07,2026-09-21
banpt-3202,Sekolah Tinggi Ilmu Al Qur'an Ar-Rahman,Baik,323/SK/BAN-PT/Akred/PT/VII/2022,2022,PTAS,2027-07-05
banpt-3203,Sekolah Tinggi Ilmu Hukum Sunan Giri,Baik,322/SK/BAN-PT/Akred/PT/VII/2022,2022,07,2027-07-05
banpt-3204,Poltekkes Kemenkes Yogyakarta,Baik Sekali,320/SK/BAN-PT/Akred/PT/VII/2022,2022,PTKL,2027-07-05
banpt-3205,STAH Negeri Mpu Kuturan Singaraja Bali,Baik Sekali,321/SK/BAN-PT/Akred/PT/VII/2022,2022,PTAN,2027-07-05
banpt-3206,Akademi Keuangan Dan Perbankan Effata Kupang,Baik,324/SK/BAN-PT/Akred/PT/VII/2022,2022,15,2027-07-05
banpt-3207,Universitas Mikroskil,B,332/SK/BAN-PT/Ak-PNB/PT/VII/2022,2022,01,2026-05-21
banpt-3208,Institut Teknologi Pagar Alam,Baik,318/SK/BAN-PT/Ak-PNB/PT/VII/2022,2022,02,2025-12-15
banpt-3209,Institut Agama Islam Al-Qur'an Al-Ittifaqiah Indralaya,Baik,316/SK/BAN-PT/Ak-PNB/PT/VII/2022,2022,PTAS,2026-04-13
banpt-3210,STIKES Widyagama Husada Malang,Baik,298/SK/BAN-PT/Akred/PT/VI/2022,2022,07,2027-06-28
banpt-3211,Universitas Papua,Baik Sekali,296/SK/BAN-PT/Akred/PT/VI/2022,2022,PTN,2027-06-28
banpt-3212,Universitas Agung Podomoro,Baik Sekali,295/SK/BAN-PT/Akred/PT/VI/2022,2022,03,2027-06-28
banpt-3213,Politeknik Perkeretaapian Indonesia Madiun,Baik Sekali,294/SK/BAN-PT/Akred/PT/VI/2022,2022,PTKL,2027-06-28
banpt-3214,Universitas Kristen Indonesia,Unggul,304/SK/BAN-PT/Akred/PT/VI/2022,2022,03,2027-06-28
banpt-3215,Universitas Teknologi Sumbawa,Baik Sekali,297/SK/BAN-PT/Akred/PT/VI/2022,2022,08,2027-06-28
banpt-3216,STMIK Pranata Indonesia,Baik,300/SK/BAN-PT/Akred/PT/VI/2022,2022,04,2027-06-28
banpt-3217,STIKES Darul Azhar Batulicin,Baik,299/SK/BAN-PT/Akred/PT/VI/2022,2022,11,2027-06-28
banpt-3218,STEI Ar Risalah Ciamis Jawa Barat,Baik,303/SK/BAN-PT/Akred/PT/VI/2022,2022,PTAS,2027-06-28
banpt-3219,Akademi Perikanan Yogyakarta,Baik,302/SK/BAN-PT/Akred/PT/VI/2022,2022,05,2027-06-28
banpt-3220,"Sekolah Tinggi Teknologi ""Warga"" Surakarta",Baik,293/SK/BAN-PT/Ak-PPJ/PT/VI/2022,2022,06,2027-05-24
banpt-3221,STIKES Kapuas Raya,Baik,301/SK/BAN-PT/Akred/PT/VI/2022,2022,11,2027-06-28
banpt-3222,Universitas Muhammadiyah Prof Dr Hamka,Unggul,290/SK/BAN-PT/AK-ISK/PT/VI/2022,2022,03,2026-12-28
banpt-3223,Universitas Pendidikan Indonesia,Unggul,288/SK/BAN-PT/AK-ISK/PT/VI/2022,2022,PTN,2026-12-21
banpt-3224,Universitas Bina Nusantara,Unggul,289/SK/BAN-PT/AK-ISK/PT/VI/2022,2022,03,2026-12-21
banpt-3225,Sekolah Tinggi Agama Islam Darussalam Sumatra Selatan,Baik,284/SK/BAN-PT/Ak-PNB/PT/VI/2022,2022,PTAS,2026-10-26
banpt-3226,Sekolah Tinggi Agama Islam Syubbanul Wathon Magelang,Baik,281/SK/BAN-PT/Ak-PNB/PT/VI/2022,2022,PTAS,2025-11-25
banpt-3227,Universitas Muhammadiyah Mamuju,Baik,274/SK/BAN-PT/Ak-PNB/PT/VI/2022,2022,09,2025-12-20
banpt-3228,Universitas Nurul Huda,Baik,280/SK/BAN-PT/Ak-PNB/PT/VI/2022,2022,02,2025-11-24
banpt-3229,Institut Ilmu Sosial dan Manajemen STIAMI,Baik Sekali,271/SK/BAN-PT/Akred-PMT/PT/VI/2022,2022,03,2027-06-14
banpt-3230,Sekolah Tinggi Ilmu Tarbiyah Al- Kifayah Riau,Tidak Terakreditasi,272/SK/BAN-PT/Ak-TMSP/PT/VI/2022,2022,PTAS,
banpt-3231,Sekolah Tinggi Ilmu Administrasi Lancang Kuning,Baik,261/SK/BAN-PT/Akred/PT/VI/2022,2022,17,2027-06-14
banpt-3232,STIKES Guna Bangsa Yogyakarta,Baik Sekali,260/SK/BAN-PT/Akred/PT/VI/2022,2022,05,2027-06-14
banpt-3233,Universitas Mercu Buana Yogyakarta,B,258/SK/BAN-PT/Ak-PPJ/PT/VI/2022,2022,05,2026-12-21
banpt-3234,STAK Negeri Toraja,Baik,234/SK/BAN-PT/Ak-PPJ/PT/V/2022,2022,PTAN,0000-00-00
banpt-3235,Sekolah Tinggi Ilmu Kesehatan Bina Generasi Polewali Mandar,Baik,212/SK/BAN-PT/Ak-PPJ/PT/V/2022,2022,09,2027-05-31
banpt-3236,Akademi Kesehatan Gigi Karya Adi Husada Mataram,Baik,215/SK/BAN-PT/Ak-PPJ/PT/V/2022,2022,08,2027-05-31
banpt-3237,Sekolah Tinggi Ilmu Kesehatan Mitra Ria Husada,Baik,227/SK/BAN-PT/Ak-PPJ/PT/V/2022,2022,03,2027-05-24
banpt-3238,Sekolah Tinggi Keguruan dan Ilmu Pendidikan Bina Mutiara,Baik,240/SK/BAN-PT/Akred/PT/VI/2022,2022,04,2027-06-07
banpt-3239,STKIP Muhammadiyah Blora,Baik,238/SK/BAN-PT/Akred/PT/VI/2022,2022,06,2027-06-07
banpt-3240,Sekolah Tinggi Ekonomi dan Bisnis Islam Tanggamus Lampung,Baik,239/SK/BAN-PT/Akred/PT/VI/2022,2022,PTAS,2027-06-07
banpt-3241,Institut Agama Islam Negeri Takengon,Baik,249/SK/BAN-PT/Ak-PNB/PT/VI/2022,2022,PTAN,2026-05-21
banpt-3242,Akademi Kebidanan Panca Bhakti,Baik Sekali,242/SK/BAN-PT/AK-ISK/PT/VI/2022,2022,11,2025-10-04
banpt-3243,Universitas Pasir Pengaraian,Baik,243/SK/BAN-PT/AK-ISK/PT/VI/2022,2022,17,2025-12-30
banpt-3244,Sekolah Tinggi Teologi Global Glow Indonesia Jakarta,Baik,229/SK/BAN-PT/Akred/PT/V/2022,2022,PTAS,2027-05-31
banpt-3245,Sekolah Tinggi Ilmu Ekonomi Surakarta,B,233/SK/BAN-PT/Ak-PPJ/PT/V/2022,2022,06,2027-05-10
