institution_code,institution_name,akreditasi_institusi,wilayah
878,UNIVERSITAS NAHDLATUL ULAMA NUSA TENGGARA BARAT,BAIK SEKALI,WILAYAH 08
879,INSTITUT AGAMA ISLAM AL-FATIMAH BOJONEGORO,BAIK,WILAYAH PTAS
880,UNIVERSITAS PARNA RAYA,BAIK,WILAYAH 16
881,SEKOLAH TINGGI ILMU EKONOMI PIONER MANADO,BAIK,WILAYAH 16
882,AKADEMI PEREKAM MEDIS DAN INFOKES BHUMI HUSADA,BAIK,WILAYAH 03
883,STMIK WIDURI,BAIK,WILAYAH 03
884,STMIK KUWERA,BAIK,WILAYAH 03
885,"INSTITUT ILMU AL-QUR`AN JAKARTA, JAKARTA SELATAN",BAIK SEKALI,WILAYAH PTAS
886,UNIVERSITAS MUHAMMADIYAH BANGKA BELITUNG,BAIK SEKALI,WILAYAH 02
887,SEKOLAH TINGGI AGAMA ISLAM KUNINGAN,BAIK,WILAYAH PTAS
888,UNIVERSITAS MAARIF HASYIM LATIF,BAIK SEKALI,WILAYAH 07
889,STEI AL-ISHLAH BOBOS DUKUPUNTANG CIREBON,BAIK,WILAYAH PTAS
890,INSTITUT TEKNOLOGI KELAUTAN BUTON,BAIK,WILAYAH 09
891,AKADEMI FISIOTERAPI HARAPAN BANGSA BANDA ACEH,BAIK,WILAYAH 13
892,INSTITUT TEKNOLOGI LOMBOK,BAIK,WILAYAH 08
893,AKADEMI KESEHATAN MUHAMMADIYAH TEMANGGUNG,BAIK,WILAYAH 06
894,STIT AL-MUSLIHUN TLOGO KANAIGORO BLITAR,BAIK,WILAYAH PTAS
895,POLITEKNIK MUHAMMADIYAH MAGELANG,BAIK,WILAYAH 06
896,SEKOLAH TINGGI ILMU KESEHATAN BETHESDA YAKKUM,B,WILAYAH 05
897,STIKES RAFLESIA,BAIK,WILAYAH 04
898,UNIVERSITAS AL ASYARIAH MANDAR,BAIK SEKALI,WILAYAH 09
899,"STAI DDI PINRANG, SULAWESI SELATAN",BAIK SEKALI,WILAYAH PTAS
900,AKADEMI FARMASI SANTO FRANSISKUS XAVERIUS,BAIK,WILAYAH 15
901,UNIVERSITAS NAGOYA INDONESIA,BAIK,WILAYAH 17
902,SEKOLAH TINGGI TEOLOGI SILOAM MEDAN,BAIK,WILAYAH PTAS
903,INSTITUT DHARMA BHARATA GRUP,BAIK,WILAYAH 09
904,UNIVERSITAS NASIONAL PASIM,BAIK,WILAYAH 04
905,SEKOLAH TINGGI ILMU EKONOMI FAJAR,BAIK,WILAYAH 04
906,UNIVERSITAS SULAWESI RAYA,BAIK,WILAYAH 09
907,"STAI SERAM TIMUR GESER, MALUKU",BAIK,WILAYAH PTAS
908,SEKOLAH TINGGI ILMU SYARIAH AL-SYAIKH ABDUL WAHID BAU-BAU,BAIK,WILAYAH PTAS
909,UNIVERSITAS ROYAL,B,WILAYAH 01
910,INSTITUT AGAMA ISLAM AT-TAQWA BONDOWOSO,BAIK,WILAYAH PTAS
911,SEKOLAH TINGGI KEGURUAN DAN ILMU PENDIDIKAN AN-NUR NANGGROE ACEH DARUSSALAM,BAIK,WILAYAH 13
912,POLITEKNIK BISNIS DIGITAL INDONESIA,BAIK,WILAYAH 04
913,STISIP BINA PUTERA BANJAR,BAIK,WILAYAH 04
914,AKADEMI SEKRETARI DAN MANAJEMEN INSULINDO,BAIK,WILAYAH 04
915,STT GEREJA KRISTEN SUMBA,BAIK,WILAYAH PTAS
916,SEKOLAH TINGGI AGAMA ISLAM SADRA,C,WILAYAH PTAS
917,UNIVERSITAS PENDIDIKAN NASIONAL,UNGGUL,WILAYAH 08
918,UNIVERSITAS MUHAMMADIYAH SURABAYA,UNGGUL,WILAYAH 07
919,POLITEKNIK AKAMIGAS PALEMBANG,BAIK SEKALI,WILAYAH 02
920,SEKOLAH TINGGI ILMU EKONOMI SYARI'AH BABUSSALAM,BAIK,WILAYAH PTAS
921,SEKOLAH TINGGI ILMU EKONOMI EL HAKIM,BAIK,WILAYAH 10
922,SEKOLAH TINGGI ILMU HUKUM MUHAMMADIYAH TAKENGON,BAIK SEKALI,WILAYAH 13
923,STKIP ISLAM SABILAL MUHTADIN BANJARMASIN,BAIK,WILAYAH 11
924,SEKOLAH TINGGI KEGURUAN DAN ILMU PENDIDIKAN PERSADA EVAV TUAL,BAIK,WILAYAH 12
925,SEKOLAH TINGGI ILMU EKONOMI JAMBATAN BULAN,BAIK,WILAYAH 14
926,"STAI AL-HAUDL KETAPANG, KALIMANTAN BARAT",BAIK,WILAYAH PTAS
927,SEKOLAH TINGGI KEGURUAN DAN ILMU PENDIDIKAN TANJUNGPURA,BAIK,WILAYAH 11
928,UNIVERSITAS MUHAMMADIYAH BOGOR RAYA,BAIK SEKALI,WILAYAH 04
929,UNIVERSITAS WIDYA HUSADA SEMARANG,B,WILAYAH 06
930,INSTITUT TEKNOLOGI DAN BISNIS TRENGGALEK,BAIK,WILAYAH 07
931,SEKOLAH TINGGI TEOLOGI MAMASA,BAIK,WILAYAH PTAS
932,INSTITUT KH. AHMAD SANUSI SUKABUMI,BAIK,WILAYAH PTAS
933,STT OIKUMENE INJILI SIDIKALANG,BAIK,WILAYAH PTAS
934,SEKOLAH TINGGI TEOLOGI TABERNAKEL LAWANG,BAIK,WILAYAH PTAS
935,SEKOLAH TINGGI AGAMA ISLAM NASY'ATUL MUTA'ALLIMIN,BAIK,WILAYAH PTAS
936,STT GEREJA INJILI DI INDONESIA,BAIK,WILAYAH PTAS
937,STT WIDYA AGAPE MALANG,BAIK,WILAYAH PTAS
938,STT PERMATA BANGSA BARITO,BAIK,WILAYAH PTAS
939,STK TOUYE PAAPAA DEIYAI KEUSKUPAN TIMIKA,BAIK,WILAYAH PTAS
940,SEKOLAH TINGGI ILMU TARBIYAH ISPINI,BAIK,WILAYAH PTAS
941,STP DON BOSCO TOMOHON,BAIK,WILAYAH PTAS
942,SEKOLAH TINGGI TEOLOGI PONTIANAK,BAIK,WILAYAH PTAS
943,"STIT AS-SALAMA TUAL MALUKU TENGGARA, MALUKU",BAIK,WILAYAH PTAS
944,SEKOLAH TINGGI KEGURUAN DAN ILMU PENDIDIKAN KRISTEN SORONG SELATAN,BAIK,WILAYAH 14
945,SEKOLAH TINGGI TEOLOGI WILLIAM CAREY MEDAN,BAIK,WILAYAH PTAS
946,SEKOLAH TINGGI TARBIYAH OTTO ISKANDAR DINATA BANTEN,BAIK,WILAYAH PTAS
947,INSTITUT SAINS TEKNOLOGI DAN KESEHATAN 'AISYIYAH KENDARI,BAIK,WILAYAH 09
948,SEKOLAH TINGGI ILMU KESEHATAN BAKTI UTAMA PATI,BAIK SEKALI,WILAYAH 06
949,UNIVERSITAS KALTARA,BAIK SEKALI,WILAYAH 11
950,UNIVERSITAS OSO,BAIK,WILAYAH 11
951,AKADEMI KEBIDANAN BANDUNG,BAIK,WILAYAH 04
952,SEKOLAH TINGGI ILMU HUKUM AL-BANNA,BAIK,WILAYAH 13
953,INSTITUT AGAMA KRISTEN NEGERI PALANGKA RAYA,BAIK SEKALI,WILAYAH PTAN
954,UNIVERSITAS BOROBUDUR,UNGGUL,WILAYAH 03
955,UNIVERSITAS WAHID HASYIM,UNGGUL,WILAYAH 06
956,UNIVERSITAS ISLAM NEGERI SULTAN AJI MUHAMMAD IDRIS SAMARINDA,UNGGUL,WILAYAH PTAN
957,UNIVERSITAS ISLAM NEGERI ANTASARI BANJARMASIN,UNGGUL,WILAYAH PTAN
958,SEKOLAH TINGGI TEOLOGI WILLFINGGER KAMPUNG BARU,BAIK,WILAYAH PTAS
959,AKADEMI SAGES,BAIK,WILAYAH 07
960,SEKOLAH TINGGI TEOLOGI SUNERGEO BANTEN,BAIK,WILAYAH PTAS
961,STKIP PANCAKARYA,BAIK,WILAYAH 04
962,AKADEMI KEBIDANAN MURUNG RAYA,BAIK,WILAYAH 11
963,SEKOLAH TINGGI TEOLOGI DAN ENTREPRENEURSHIP PRINGGADING,BAIK,WILAYAH PTAS
964,INSTITUT COKROAMINOTO PINRANG,BAIK,WILAYAH 09
965,STAI DAARUSSALAM SUKABUMI,BAIK,WILAYAH PTAS
966,INSTITUT TEKNOLOGI DAN BISNIS MUHAMMADIYAH KOLAKA,BAIK,WILAYAH 09
967,STMIK INDRAGIRI,BAIK,WILAYAH 17
968,UNIVERSITAS BUDI LUHUR,UNGGUL,WILAYAH 03
969,UNIVERSITAS ISLAM NEGERI MAHMUD YUNUS BATUSANGKAR,UNGGUL,WILAYAH PTAN
970,UNIVERSITAS SWISS GERMAN,BAIK SEKALI,WILAYAH 04
971,UNIVERSITAS ISLAM NEGERI SALATIGA,UNGGUL,WILAYAH PTAN
972,UNIVERSITAS ESA UNGGUL,UNGGUL,WILAYAH 03
973,IAIN KENDARI,BAIK SEKALI,WILAYAH PTAN
974,POLITEKNIK PERKAPALAN NEGERI SURABAYA,UNGGUL,WILAYAH PTN
975,UNIVERSITAS WIJAYA PUTRA,BAIK SEKALI,WILAYAH 07
976,SEKOLAH TINGGI ILMU EKONOMI PASUNDAN,BAIK SEKALI,WILAYAH 04
977,SEKOLAH TINGGI ILMU ADMINISTRASI AAN,BAIK SEKALI,WILAYAH 05
978,INSTITUT AGAMA ISLAM SYARIFUDDIN WONOREJO LUMAJANG,BAIK SEKALI,WILAYAH PTAS
979,SEKOLAH TINGGI KEGURUAN DAN ILMU PENDIDIKAN ROSALIA LAMPUNG,BAIK,WILAYAH 02
980,UNIVERSITAS DUMOGA KOTAMOBAGU,BAIK,WILAYAH 16
981,UNIVERSITAS NUSA NIPA,BAIK SEKALI,WILAYAH 15
982,UNIVERSITAS KARYA PERSADA MUNA,BAIK,WILAYAH 09
983,UNIVERSITAS SATU NUSA LAMPUNG,BAIK,WILAYAH 02
984,INSTITUT AGAMA ISLAM NEGERI SORONG,BAIK SEKALI,WILAYAH PTAN
985,UNIVERSITAS LELEMUKU SAUMLAKI,BAIK,WILAYAH 12
986,POLITEKNIK NEGERI SAMARINDA,BAIK SEKALI,WILAYAH PTN
987,STITEK DHARMA YADI MAKASSAR,BAIK,WILAYAH 09
988,INSTITUT KESEHATAN DAN TEKNOLOGI GRAHA MEDIKA,BAIK,WILAYAH 16
989,UNIVERSITAS SEHATI INDONESIA,BAIK,WILAYAH 04
990,STISIP SAMUDERA INDONESIA SELATAN,BAIK,WILAYAH 04
991,UNIVERSITAS MUHAMMADIYAH MADIUN,BAIK SEKALI,WILAYAH 07
992,SEKOLAH TINGGI TEKNOLOGI TEXMACO,BAIK,WILAYAH 04
993,INSTITUT TEKNOLOGI DAN SAINS NAHDLATUL ULAMA LAMPUNG,BAIK,WILAYAH 02
994,SEKOLAH TINGGI ILMU ADMINISTRASI PEMBANGUNAN,BAIK SEKALI,WILAYAH 07
995,SEKOLAH TINGGI ILMU EKONOMI GENTIARAS,BAIK SEKALI,WILAYAH 02
996,POLITEKNIK KATOLIK MANGUNWIJAYA,BAIK SEKALI,WILAYAH 06
997,UNIVERSITAS HKBP NOMMENSEN,BAIK SEKALI,WILAYAH 01
998,SEKOLAH TINGGI ILMU USHULUDDIN WADI MUBARAK BOGOR JAWA BARAT,BAIK,WILAYAH PTAS
999,UNIVERSITAS CARITAS INDONESIA,BAIK,WILAYAH 14
1000,INSTITUT PESANTREN BABAKAN CIREBON,BAIK,WILAYAH PTAS
1001,POLITEKNIK ASSALAM SURAKARTA,BAIK,WILAYAH 06
1002,UNIVERSITAS AL-HIKMAH INDONESIA,BAIK,WILAYAH PTAS
1003,"STIT MUARA ENIM, SUMATERA SELATAN",BAIK,WILAYAH PTAS
1004,SEKOLAH TINGGI ILMU TARBIYAH ASSUNNIYAH TAMBARANGAN RANTAU TAPIN,BAIK,WILAYAH PTAS
1005,AKADEMI KEBIDANAN ISMA HUSADA CIREBON,BAIK,WILAYAH 04
1006,SEKOLAH TINGGI TEOLOGI LUTHERAN YOGYA,BAIK,WILAYAH PTAS
1007,STAI MA`HAD ALY AL-HIKAM MALANG,BAIK SEKALI,WILAYAH PTAS
1008,STIMI BANJARMASIN,BAIK SEKALI,WILAYAH 11
1009,SEKOLAH TINGGI ILMU EKONOMI TRISAKTI,UNGGUL,WILAYAH 03
1010,UNIVERSITAS ISLAM NEGERI WALISONGO SEMARANG,UNGGUL,WILAYAH PTAN
1011,SEKOLAH TINGGI ILMU EKONOMI PGRI DEWANTARA,BAIK SEKALI,WILAYAH 07
1012,SEKOLAH TINGGI ILMU HUKUM IBLAM,BAIK SEKALI,WILAYAH 03
1013,UNIVERSITAS AMIKOM YOGYAKARTA,BAIK SEKALI,WILAYAH 05
1014,SEKOLAH TINGGI ILMU EKONOMI INDONESIA MAKASSAR,BAIK,WILAYAH 09
1015,STT ANUGERAH ALIANSE SEMARANG,BAIK,WILAYAH PTAS
1016,SEKOLAH TINGGI TEOLOGI WALTER POST JAYAPURA PAPUA,BAIK,WILAYAH PTAS
1017,SEKOLAH TINGGI TEOLOGI PRESBYTERIAN BATAM,BAIK,WILAYAH PTAS
1018,SEKOLAH TINGGI THEOLOGIA INJILI INDONESIA PONTIANAK,BAIK,WILAYAH PTAS
1019,AKADEMI AUDIOLOGI INDONESIA JAKARTA,BAIK,WILAYAH 03
1020,SEKOLAH TINGGI EKONOMI ISLAM DARUL QUR'AN MINAK SELEBAH,BAIK,WILAYAH PTAS
1021,AKADEMI MARITIM MALUKU,BAIK,WILAYAH 12
1022,POLITEKNIK PERTANIAN YASANTO,BAIK,WILAYAH 14
1023,POLITEKNIK BINTAN CAKRAWALA,BAIK,WILAYAH 17
1024,SEKOLAH TINGGI AGAMA KRISTEN ABDI WACANA PONTIANAK,BAIK,WILAYAH PTAS
1025,SEKOLAH TINGGI AGAMA ISLAM DAARUT TAUHIID,BAIK,WILAYAH PTAS
1026,SEKOLAH TINGGI ILMU TARBIYAH NAHDLATUL ULAMA SUMBER AGUNG OKU TIMUR,BAIK,WILAYAH PTAS
1027,POLITEKNIK INDONUSA SURAKARTA,BAIK SEKALI,WILAYAH 06
1028,SEKOLAH TINGGI ILMU HUKUM PROFESOR GAYUS LUMBUUN,BAIK SEKALI,WILAYAH 03
1029,SEKOLAH TINGGI ILMU BAHASA ASING BUMI BERINGIN,BAIK,WILAYAH 16
1030,SEKOLAH TINGGI ILMU ADAB DAN BUDAYA ISLAM RIYADUL 'ULUM,BAIK,WILAYAH PTAS
1031,SEKOLAH TINGGI ILMU EKONOMI BULUNGAN TARAKAN,BAIK,WILAYAH 11
1032,AKADEMI KOMUNITAS INDUSTRI PERTAMBANGAN BUKIT ASAM,BAIK,WILAYAH 02
1033,SEKOLAH TINGGI KEGURUAN DAN ILMU PENDIDIKAN SURYA KASIH,BAIK,WILAYAH 15
1034,POLITEKNIK BOMBANA,BAIK,WILAYAH 09
1035,"STIT YPI AL-YAQIN MUARO SIJUNJUNG, SAWAHLUNTO",BAIK,WILAYAH PTAS
1036,POLITEKNIK KESDAM VI BANJARMASIN,BAIK,WILAYAH 11
1037,SEKOLAH TINGGI TEOLOGI PELITA KEBENARAN,BAIK,WILAYAH PTAS
1038,INSTITUT TEKNOLOGI DAN KESEHATAN IKA BINA,BAIK,WILAYAH 01
1039,AKADEMI KEPERAWATAN TEUNGKU FAKINAH BANDA ACEH,BAIK,WILAYAH 13
1040,SEKOLAH TINGGI TEOLOGI JAFFRAY JAKARTA,BAIK,WILAYAH PTAS
1041,UNIVERSITAS RIAU,UNGGUL,WILAYAH PTN
1042,SEKOLAH TINGGI TEOLOGI YERUSALEM BARU MANADO,BAIK,WILAYAH PTAS
1043,STIKES MALUKU HUSADA,B,WILAYAH 12
1044,UNIVERSITAS ISLAM NEGERI IMAM BONJOL PADANG,UNGGUL,WILAYAH PTAN
1045,UNIVERSITAS PAKUAN,UNGGUL,WILAYAH 04
1046,INSTITUT KESEHATAN HELVETIA PEKANBARU,BAIK,WILAYAH 17
1047,SEKOLAH TINGGI TEOLOGI PARAKLETOS SURABAYA,BAIK,WILAYAH PTAS
1048,STAI YAMISA SOREANG,BAIK,WILAYAH PTAS
1049,SEKOLAH TINGGI ILMU SYARIAH DARUL ULUM LAMPUNG TIMUR,BAIK,WILAYAH PTAS
1050,SEKOLAH TINGGI TEOLOGI PANTEKOSTA BATAM,BAIK,WILAYAH PTAS
1051,SEKOLAH TINGGI EKONOMI ISLAM SEKAYU PALEMBANG,BAIK,WILAYAH PTAS
1052,STIS KEBUMEN JAWA TENGAH,BAIK,WILAYAH PTAS
1053,INSTITUT ISLAM AL-MUJADDID SABAK,BAIK,WILAYAH PTAS
1054,SEKOLAH TINGGI AGAMA ISLAM NEGERI MANDAILING NATAL,BAIK SEKALI,WILAYAH PTAN
1055,UNIVERSITAS ISLAM JAKARTA,BAIK SEKALI,WILAYAH 03
1056,UNIVERSITAS WANITA INTERNASIONAL,BAIK SEKALI,WILAYAH 04
1057,AKADEMI KESEHATAN KARTINI BATAM,BAIK,WILAYAH 17
1058,POLTEKKES KEMENKES RIAU,BAIK,WILAYAH PTKL
1059,UNIVERSITAS MITRA BANGSA,BAIK SEKALI,WILAYAH 03
1060,UNIVERSITAS ISLAM INTERNASIONAL DARULLUGHAH WADDA'WAH,BAIK SEKALI,WILAYAH PTAS
1061,UNIVERSITAS MUHAMMADIYAH TEGAL,BAIK,WILAYAH 06
1062,POLITEKNIK GUSDURIAN,BAIK,WILAYAH 06
1063,UNIVERSITAS SANTO BORROMEUS,B,WILAYAH 04
1064,SEKOLAH TINGGI TEOLOGI INJILI MAHKOTA SION SAUMLAKI,BAIK,WILAYAH PTAS
1065,SEKOLAH TINGGI OLAHRAGA DAN KESEHATAN BINA GUNA,BAIK SEKALI,WILAYAH 01
1066,STIT IBNU SINA MALANG,BAIK,WILAYAH PTAS
1067,UNIVERSITAS SEPULUH NOPEMBER PAPUA,BAIK,WILAYAH 14
1068,AKADEMI KOMUNITAS NURUL JADID,BAIK,WILAYAH 07
1069,SEKOLAH TINGGI AGAMA ISLAM SENORI TUBAN,BAIK,WILAYAH PTAS
1070,INSTITUT AGAMA ISLAM NEGERI PONOROGO,UNGGUL,WILAYAH PTAN
1071,SEKOLAH TINGGI TEOLOGI EXCELSIUS,BAIK,WILAYAH PTAS
1072,INSTITUT TEKNOLOGI PEMBANGUNAN SURABAYA,BAIK,WILAYAH 07
1073,SEKOLAH TINGGI ILMU AL-QUR'AN DARUSSALAM LHOKSEUMAWE ACEH,BAIK,WILAYAH PTAS
1074,STT RUMAH MURID KRISTUS BITUNG,BAIK,WILAYAH PTAS
1075,POLITEKNIK DAMARA,BAIK,WILAYAH 06
1076,INSTITUT TEKNOLOGI DAN SAINS MANDALA,BAIK SEKALI,WILAYAH 07
1077,SEKOLAH TINGGI AGAMA ISLAM IMAM BUKHORI BULUKUMBA,BAIK,WILAYAH PTAS
1078,UNIVERSITAS ACHMAD YANI BANJARMASIN,B,WILAYAH 11
1079,STIKES DARUSSALAM LHOKSEUMAWE,BAIK,WILAYAH 13
1080,AKADEMI PENERBANG INDONESIA BANYUWANGI,BAIK SEKALI,WILAYAH PTKL
1081,UNIVERSITAS NAHDLATUL ULAMA INDONESIA,BAIK SEKALI,WILAYAH 03
1082,POLITEKNIK UNGGULAN CIPTA MANDIRI,BAIK,WILAYAH 01
1083,INSTITUT DIGITAL EKONOMI LPKIA,BAIK,WILAYAH 04
1084,SEKOLAH TINGGI ILMU KESEHATAN BOGOR HUSADA,BAIK,WILAYAH 04
1085,INSTITUT BISNIS DAN INFORMATIKA KOSGORO 1957,BAIK SEKALI,WILAYAH 03
1086,SEKOLAH TINGGI ILMU ADMINISTRASI KARYA DHARMA MERAUKE,BAIK,WILAYAH 14
1087,SEKOLAH TINGGI KEGURUAN DAN ILMU PENDIDIKAN MUHAMMADIYAH OKU TIMUR,BAIK,WILAYAH 02
1088,SEKOLAH TINGGI ILMU KESEHATAN MITRA HUSADA MEDAN,UNGGUL,WILAYAH 01
1089,UNIVERSITAS QUALITY BERASTAGI,BAIK,WILAYAH 01
1090,INSTITUT SYEKH ABDUL HALIM HASAN BINJAI,BAIK,WILAYAH PTAS
1091,AKADEMI KOMUNITAS TOYOTA INDONESIA,BAIK SEKALI,WILAYAH 04
1092,SEKOLAH TINGGI ILMU EKONOMI SULAWESI UTARA,BAIK,WILAYAH 16
1093,AKADEMI KEBIDANAN WIJAYA KUSUMA MALANG,BAIK,WILAYAH 12
1094,UNIVERSITAS INTERNASIONAL JAKARTA,BAIK,WILAYAH 04
1095,INSTITUT TEKNOLOGI BISNIS DAN KESEHATAN MUHAMMADIYAH TULUNGAGUNG,BAIK,WILAYAH 07
1096,INSTITUT AGAMA ISLAM SYEKH MAULANA QORI BANGKO,BAIK SEKALI,WILAYAH PTAS
1097,SEKOLAH TINGGI AGAMA ISLAM ALIF LAAM MIIM SURABAYA,BAIK,WILAYAH PTAS
1098,STITNU SAKINAH DHARMASRAYA,BAIK,WILAYAH PTAS
1099,UNIVERSITAS PRASETIYA MULYA,BAIK SEKALI,WILAYAH 03
1100,SEKOLAH TINGGI ILMU KEPERAWATAN FAMIKA,BAIK,WILAYAH 09
1101,SEKOLAH TINGGI ILMU KESEHATAN INDAH MEDAN,BAIK,WILAYAH 01
1102,UNIVERSITAS ICHSAN SIDENRENG RAPPANG,BAIK,WILAYAH 09
1103,UNIVERSITAS MITRA INDONESIA,BAIK SEKALI,WILAYAH 02
1104,INSTITUT BISNIS DAN EKONOMI INDONESIA,BAIK,WILAYAH 11
1105,"STAI RAUDHATUL AKMAL, DELI SERDANG, SUMATERA UTARA",BAIK,WILAYAH PTAS
1106,AKADEMI KEBIDANAN SISMADI,BAIK,WILAYAH 03
1107,SEKOLAH TINGGI MANAJEMEN INFORMATIKA DAN KOMPUTER BINA BANGSA KENDARI,BAIK,WILAYAH 09
1108,POLITEKNIK PELAYARAN SURABAYA,UNGGUL,WILAYAH PTKL
1109,UNIVERSITAS BHAKTI ASIH TANGERANG,BAIK,WILAYAH 04
1110,UNIVERSITAS MERCUBAKTIJAYA,B,WILAYAH 10
1111,UNIVERSITAS PGRI KALIMANTAN,B,WILAYAH 11
1112,INSTITUT AGAMA ISLAM PERSIS BANDUNG,BAIK SEKALI,WILAYAH PTAS
1113,POLITEKNIK PRASETIYA MANDIRI,BAIK,WILAYAH 04
1114,INSTITUT PAHLAWAN 12,BAIK,WILAYAH 02
1115,INSTITUT AGAMA ISLAM PEMALANG,BAIK,WILAYAH PTAS
1116,UNIVERSITAS SYEDZA SAINTIKA,B,WILAYAH 10
1117,UNIVERSITAS ISLAM NEGERI SUMATERA UTARA MEDAN,UNGGUL,WILAYAH PTAN
1118,UNIVERSITAS ISLAM NEGERI SULTAN SYARIF KASIM RIAU,UNGGUL,WILAYAH PTAN
1119,UNIVERSITAS JAMBI,UNGGUL,WILAYAH PTN
1120,SEKOLAH TINGGI FILSAFAT TEOLOGI WIDYA SASANA,B,WILAYAH 07
1121,AMIK TOMAKAKA,BAIK,WILAYAH 09
1122,SEKOLAH TINGGI ILMU ADMINISTRASI TRINITAS,BAIK,WILAYAH 12
1123,SEKOLAH TINGGI ILMU EKONOMI IGI,BAIK,WILAYAH 03
1124,UNIVERSITAS 45 SURABAYA,BAIK,WILAYAH 07
1125,SEKOLAH TINGGI ILMU EKONOMI PUTRA TIMOR,BAIK,WILAYAH 15
1126,SEKOLAH TINGGI TEOLOGI PANTEKOSTA JAKARTA,BAIK,WILAYAH PTAS
1127,SEKOLAH TINGGI TEOLOGI ABDI GUSTI NGANJUK,BAIK,WILAYAH PTAS
1128,STT PRESBYTERIAN INDONESIA,BAIK,WILAYAH PTAS
1129,SEKOLAH TINGGI ILMU TARBIYAH HIDAYATULLAH BATAM KEPULAUAN RIAU,BAIK,WILAYAH PTAS
1130,INSTITUT KEISLAMAN TUAH NEGERI,BAIK,WILAYAH PTAS
1131,SEKOLAH TINGGI ILMU EKONOMI PELITA BUANA,BAIK,WILAYAH 09
1132,SEKOLAH TINGGI ILMU EKONOMI DHARMA AGUNG INDONESIA,BAIK,WILAYAH 04
1133,SEKOLAH TINGGI PENDIDIKAN HOLISTIK BERBASIS KAREKTER,BAIK,WILAYAH 04
1134,INSITUT ILMU KESEHATAN NAHDLATUL ULAMA TUBAN,BAIK SEKALI,WILAYAH 07
1135,AKADEMI KEBIDANAN BINA NUSANTARA MANDIRI,BAIK,WILAYAH 10
1136,AKADEMI SEKRETARI DAN MANAJEMEN PERSADA BUNDA,BAIK,WILAYAH 17
1137,INSTITUT DARUL ULUM SAROLANGUN,BAIK,WILAYAH PTAS
1138,STAI MIFTAHUL ULUM TASIKMALAYA,BAIK,WILAYAH PTAS
1139,INSTITUT UMMUL QURO AL-ISLAMI BOGOR JAWA BARAT,BAIK,WILAYAH PTAS
1140,AKADEMI KEBIDANAN GEMA NUSANTARA BEKASI,BAIK,WILAYAH 04
1141,UNIVERSITAS W R SUPRATMAN,BAIK,WILAYAH 07
1142,SEKOLAH TINGGI EKONOMI DAN BISNIS ISLAM AL JABAR BANDUNG JAWA BARAT,BAIK,WILAYAH PTAS
1143,SEKOLAH TINGGI ILMU TARBIYAH MAMBA'UL HIKAM PALI SUMSEL,BAIK,WILAYAH PTAS
1144,SEKOLAH TINGGI ILMU TARBIYAH AZ ZAHRA TASIKMALAYA,BAIK,WILAYAH PTAS
1145,SEKOLAH TINGGI TEOLOGI EKKLESIA PONTIANAK,BAIK,WILAYAH PTAS
1146,STT HARAPAN INDAH,BAIK,WILAYAH PTAS
1147,UNIVERSITAS CENDEKIA MITRA INDONESIA,BAIK,WILAYAH 05
1148,INSTITUT TEKNOLOGI BACHARUDDIN JUSUF HABIBIE,BAIK,WILAYAH PTN
1149,SEKOLAH TINGGI AGAMA ISLAM AL-UTSMANI BONDOWOSO,BAIK,WILAYAH PTAS
1150,UNIVERSITAS GRAHA NUSANTARA,B,WILAYAH 01
1151,UNIVERSITAS MUHAMMADIYAH CILEUNGSI,BAIK,WILAYAH 04
1152,STKIP SINAR CENDEKIA,BAIK,WILAYAH 04
1153,POLITEKNIK KRAKATAU,BAIK,WILAYAH 04
1154,SEKOLAH TINGGI ILMU HUKUM CENDANA WANGI,BAIK,WILAYAH 15
1155,SEKOLAH TINGGI AGAMA ISLAM KUPANG,BAIK,WILAYAH PTAS
1156,STKIP SIMBIOSIS,BAIK,WILAYAH 15
1157,UNIVERSITAS TOMAKAKA,BAIK,WILAYAH 09
1158,POLITEKNIK SIBER DAN SANDI NEGARA,BAIK SEKALI,WILAYAH PTKL
1159,UNIVERSITAS MUHAMMADIYAH MAHAKARYA ACEH,BAIK SEKALI,WILAYAH 13
1160,"SEKOLAH TINGGI TEOLOGI BETHEL THE WAY, JAKARTA",BAIK,WILAYAH PTAS
1161,SEKOLAH TINGGI ILMU KESEHATAN PEMKAB JOMBANG,BAIK SEKALI,WILAYAH 07
1162,STKIP PESISIR SELATAN,BAIK,WILAYAH 10
1163,POLITEKNIK MUARA TEWEH,BAIK,WILAYAH 11
1164,UNIVERSITAS ISLAM NEGERI SUNAN AMPEL,UNGGUL,WILAYAH PTAN
1165,AMIK MASTER LAMPUNG,BAIK,WILAYAH 02
1166,SEKOLAH TINGGI ILMU KESEHATAN MAYAPADA,BAIK,WILAYAH 03
1167,SEKOLAH TINGGI BAHASA ASING MALANG,BAIK,WILAYAH 07
1168,STT INJILI JAKARTA,BAIK,WILAYAH PTAS
1169,UNIVERSITAS ISLAM RIAU,UNGGUL,WILAYAH 17
1170,UNIVERSITAS PEMBANGUNAN PANCA BUDI,UNGGUL,WILAYAH 01
1171,UNIVERSITAS ISLAM NEGERI SJECH M. DJAMIL DJAMBEK BUKITTINGGI,UNGGUL,WILAYAH PTAN
1172,UNIVERSITAS SULTAN AGENG TIRTAYASA,UNGGUL,WILAYAH PTN
1173,SEKOLAH TINGGI ILMU SYARIAH UMMUL AYMAN PIDIE JAYA,BAIK,WILAYAH PTAS
1174,STAI AL-FATAH CILEUNGSI BOGOR,BAIK,WILAYAH PTAS
1175,STT PERIAGO,BAIK,WILAYAH PTAS
1176,STIKES INSAN SE AGUNG,BAIK,WILAYAH 07
1177,SEKOLAH TINGGI ILMU HUKUM SUMPAH PEMUDA,UNGGUL,WILAYAH 02
1178,SEKOLAH TINGGI ILMU KESEHATAN SERULINGMAS,BAIK SEKALI,WILAYAH 06
1179,UNIVERSITAS MUHAMMADIYAH PEKAJANGAN PEKALONGAN,BAIK SEKALI,WILAYAH 06
1180,UNIVERSITAS SARJANAWIYATA TAMANSISWA,BAIK SEKALI,WILAYAH 05
1181,AKADEMI KEBIDANAN MINASA UPA,BAIK,WILAYAH 09
1182,INSTITUT TEKNOLOGI KELING KUMANG,BAIK,WILAYAH 11
1183,UNIVERSITAS 17 AGUSTUS 1945 SAMARINDA,BAIK SEKALI,WILAYAH 11
1184,UNIVERSITAS OKMIN PAPUA,BAIK,WILAYAH 14
1185,STKIP NUSA TIMOR,BAIK,WILAYAH 15
1186,UNIVERSITAS SATYAGAMA,BAIK,WILAYAH 03
1187,SEKOLAH TINGGI TEKNOLOGI IMMANUEL,BAIK,WILAYAH 01
1188,POLITEKNIK PIKSI GANESHA INDONESIA,BAIK SEKALI,WILAYAH 06
1189,AKADEMI KOMUNITAS NEGERI REJANG LEBONG,BAIK,WILAYAH PTN
1190,POLITEKNIK DEWANTARA,BAIK,WILAYAH 09
1191,UNIVERSITAS AL WASHLIYAH DARUSSALAM BANDA ACEH,BAIK,WILAYAH 13
1192,SEKOLAH TINGGI TEOLOGI TABGHA BATAM,BAIK,WILAYAH PTAS
1193,SEKOLAH TINGGI ILMU SYARIAH DARUSY SYAFA'AH LAMPUNG TENGAH,BAIK,WILAYAH PTAS
1194,SEKOLAH TINGGI TEOLOGI IMMANUEL SINTANG KAL-BAR,BAIK,WILAYAH PTAS
1195,SEKOLAH TINGGI ILMU KESEHATAN PELITA ILMU DEPOK,BAIK,WILAYAH 04
1196,AKADEMI KEBIDANAN SARI HUSADA,BAIK,WILAYAH 01
1197,POLITEKNIK LENGGURU,BAIK,WILAYAH 14
1198,UNIVERSITAS DOKTOR HUSNI INGRATUBUN PAPUA,B,WILAYAH 14
1199,UNIVERSITAS BANTEN,BAIK,WILAYAH 04
1200,AKADEMI KEPERAWATAN HKBP BALIGE,BAIK,WILAYAH 01
1201,INSTITUT SAINS DAN BISNIS INTERNASIONAL SINGKAWANG,BAIK SEKALI,WILAYAH 11
1202,SEKOLAH TINGGI ILMU KESEHATAN KAMUS ARUNIKA,BAIK,WILAYAH 09
1203,STISIP BUNDA TANAH MELAYU,BAIK,WILAYAH 17
1204,SEKOLAH TINGGI TEOLOGI INJILI DAN KEJURUAN KUPANG,BAIK,WILAYAH PTAS
1205,AKADEMIK KEBIDANAN ARMINA CENTRE PANYABUNGAN,BAIK,WILAYAH 01
1206,POLITEKNIK KARTINI JAKARTA,BAIK,WILAYAH 03
1207,"STIT PAGAR ALAM, SUMATERA SELATAN",BAIK,WILAYAH PTAS
1208,AMIK BUMI NUSANTARA,BAIK,WILAYAH 04
1209,SEKOLAH TINGGI EKONOMI DAN BISNIS ISLAM PAGARALAM,BAIK,WILAYAH PTAS
1210,SEKOLAH TINGGI TEOLOGI PRESBYTERIAN MEDAN,BAIK,WILAYAH PTAS
1211,SEKOLAH TINGGI ILMU TARBIYAH HIDAYATUNNAJAH BEKASI,BAIK,WILAYAH PTAS
1212,SEKOLAH TINGGI EKONOMI DAN BISNIS ISLAM KYAI HAJI AHMAD SYAIRAZI,BAIK,WILAYAH PTAS
1213,UNIVERSITAS TRUNOJOYO,UNGGUL,WILAYAH PTN
1214,AKADEMI KOMUNITAS BPPMNU BANAT,BAIK,WILAYAH 06
1215,POLITEKNIK KESEHATAN BHAKTI MULIA,BAIK,WILAYAH 06
1216,"STAI DDI MANGKOSO, BARRU, SULAWESI SELATAN",BAIK,WILAYAH PTAS
1217,STIKES SITI HAJAR,BAIK,WILAYAH 01
1218,AKADEMI AKUNTANSI BANDUNG,BAIK,WILAYAH 04
1219,STKIP TOMAKAKA TIWIKRAMA,BAIK,WILAYAH 09
1220,STMIK KRISTEN NEUMANN INDONESIA,BAIK,WILAYAH 01
1221,STIPAS ST.SIRILUS RUTENG,BAIK,WILAYAH PTAS
1222,SEKOLAH TINGGI AGAMA KRISTEN LUWUK BANGGAI,BAIK,WILAYAH PTAS
1223,SEKOLAH TINGGI ILMU KESEHATAN ABDI PERSADA BANJARMASIN,BAIK,WILAYAH 11
1224,STAI YPBWI SURABAYA,BAIK,WILAYAH PTAS
1225,UNIVERSITAS ARY GINANJAR,BAIK,WILAYAH 03
1226,STAI AL-MASTHURIYAH SUKABUMI,BAIK,WILAYAH PTAS
1227,SEKOLAH TINGGI TEOLOGI PRESBYTERIAN SHEMA,BAIK,WILAYAH PTAS
1228,POLITEKNIK TRIDAYA VIRTU MOROSI,BAIK,WILAYAH 09
1229,UNIVERSITAS NAHDLATUL ULAMA MALUKU UTARA,BAIK,WILAYAH 12
1230,INSTITUT TEKNOLOGI AL-MUHAJIRIN,BAIK,WILAYAH 04
1231,AKADEMI KEPERAWATAN PELNI,BAIK,WILAYAH 03
1232,AKADEMI KEBIDANAN MADINA HUSADA,BAIK,WILAYAH 01
1233,UNIVERSITAS ISLAM NEGERI SAYYID ALI RAHMATULLAH TULUNGAGUNG,UNGGUL,WILAYAH PTAN
1234,SEKOLAH TINGGI ILMU KESEHATAN MAJAPAHIT,B,WILAYAH 07
1235,UNIVERSITAS KATOLIK INDONESIA SANTU PAULUS RUTENG,B,WILAYAH 15
1236,INSTITUT TEKNOLOGI DAN KESEHATAN TRI TUNAS NASIONAL,BAIK,WILAYAH 09
1237,AKADEMI FARMASI TORAJA,BAIK,WILAYAH 09
1238,SEKOLAH TINGGI TEOLOGI EKUMENE MEDAN,BAIK,WILAYAH PTAS
1239,INSTITUT MEKONGGA,BAIK,WILAYAH 09
1240,SEKOLAH TINGGI ILMU EKONOMI SYARIAH SAYAGA SANISKARA NUSANTARA,BAIK,WILAYAH PTAS
1241,AKADEMI SEKRETARI TRIGUNA,BAIK,WILAYAH 04
1242,AMIK TRI DHARMA PALU,BAIK,WILAYAH 16
1243,UNIVERSITAS AWAL BROS,BAIK SEKALI,WILAYAH 17
1244,UNIVERSITAS SRAGEN,BAIK,WILAYAH 06
1245,INSTITUT AT TANWIR BOJONEGORO,BAIK,WILAYAH PTAS
1246,STIKES HANG TUAH TANJUNG PINANG,B,WILAYAH 17
1247,INSTITUT TEKNOLOGI KALIMANTAN,BAIK SEKALI,WILAYAH PTN
1248,UNIVERSITAS JENDERAL SOEDIRMAN,UNGGUL,WILAYAH PTN
1249,STMIK PGRI TANGERANG,BAIK,WILAYAH 04
1250,SEKOLAH TINGGI ILMU EKONOMI SEMARANG,BAIK SEKALI,WILAYAH 06
1251,UNIVERSITAS ISLAM NEGERI K.H. ABDURRAHMAN WAHID PEKALONGAN,UNGGUL,WILAYAH PTAN
1252,STMIK GANESHA BANDUNG,BAIK,WILAYAH 04
1253,STKIP PELITA NUSANTARA BUTON,BAIK,WILAYAH 09
1254,AKADEMI PETERNAKAN BRAHMA PUTRA,BAIK,WILAYAH 05
1255,UNIVERSITAS NAZHATUT THULLAB AL-MUAFA SAMPANG,BAIK,WILAYAH 07
1256,SEKOLAH TINGGI TEOLOGI RUSSEL TIMIKA,BAIK,WILAYAH PTAS
1257,SEKOLAH TINGGI AGAMA ISLAM AL ITTIHAD CIANJUR JAWA BARAT,BAIK,WILAYAH PTAS
1258,UNIVERSITAS ISLAM NEGERI KIAI HAJI ACHMAD SIDDIQ JEMBER,UNGGUL,WILAYAH PTAN
1259,UNIVERSITAS TANJUNGPURA,UNGGUL,WILAYAH PTN
1260,UNIVERSITAS MUHAMMADIYAH KUDUS,BAIK SEKALI,WILAYAH 06
1261,STIKES ADI HUSADA,BAIK SEKALI,WILAYAH 07
1262,UNIVERSITAS ISLAM NEGERI MATARAM,UNGGUL,WILAYAH PTAN
1263,UNIVERSITAS HANG TUAH PEKANBARU,BAIK SEKALI,WILAYAH 17
1264,SEKOLAH TINGGI FILSAFAT DRIYARKARA,UNGGUL,WILAYAH 03
1265,INSTITUT TEKNOLOGI SAINS DAN KESEHATAN PKU MUHAMMADIYAH SURAKARTA,BAIK SEKALI,WILAYAH 06
1266,INSTITUT TEKNOLOGI DEL,BAIK SEKALI,WILAYAH 01
1267,INSTITUT AGAMA ISLAM TAZKIA,BAIK SEKALI,WILAYAH PTAS
1268,STKIP KRISTEN WAMENA,BAIK,WILAYAH 14
1269,UNIVERSITAS CAHAYA PRIMA,BAIK SEKALI,WILAYAH 09
1270,UNIVERSITAS SUGENG HARTONO,BAIK,WILAYAH 06
1271,UNIVERSITAS DARUNNAJAH,BAIK,WILAYAH 03
1272,UNIVERSITAS ISLAM DR. KHEZ MUTTAQIEN,BAIK,WILAYAH 04
1273,UNIVERSITAS MUHAMMADIYAH MAUMERE,BAIK,WILAYAH 15
1274,INSTITUT TARUMANAGARA,BAIK,WILAYAH 03
1275,UNIVERSITAS TEKNOLOGI BANDUNG,BAIK,WILAYAH 04
1276,"STAI AL-FALAH CICALENGKA, BANDUNG",BAIK,WILAYAH PTAS
1277,SEKOLAH TINGGI ILMU EKONOMI WIDYA MANGGALA,BAIK SEKALI,WILAYAH 06
1278,SEKOLAH TINGGI MANAJEMEN ASURANSI TRISAKTI,BAIK SEKALI,WILAYAH 03
1279,INSTITUT INFORMATIKA DAN BISNIS DARMAJAYA,BAIK SEKALI,WILAYAH 02
1280,SEKOLAH TINGGI ILMU PERTANIAN YASHAFA,BAIK,WILAYAH 13
1281,UNIVERSITAS YARSI PRATAMA,BAIK,WILAYAH 04
1282,AKADEMI KEBIDANAN BUNDA AUNI BOGOR,BAIK,WILAYAH 04
1283,AKADEMI KEBIDANAN TUTI RAHAYU,BAIK,WILAYAH 17
1284,AKADEMI KEBIDANAN GLOBAL MEDIKA,BAIK,WILAYAH 07
1285,AKADEMI KEPERAWATAN SARI HUSADA,BAIK,WILAYAH 01
1286,AKADEMI PARIWISATA WIDYA DHARMA,BAIK,WILAYAH 02
1287,INSTITUT TEKNOLOGI DAN BISNIS TUBAN,BAIK,WILAYAH 07
1288,SEKOLAH TINGGI ILMU AL-QURAN AN-NUR LEMPUING OKI,BAIK,WILAYAH PTAS
1289,STAI MIFTAHUL HUDA AL-AZHAR BANJAR,BAIK,WILAYAH PTAS
1290,INSTITUT KESEHATAN DAN BISNIS ST. FATIMAH MAMUJU,BAIK,WILAYAH 09
1291,INSTITUT TEKNOLOGI PERTANIAN,BAIK,WILAYAH 09
1292,POLITEKNIK BHAKTI SEMESTA,BAIK,WILAYAH 06
1293,POLITEKNIK RUKUN ABDI LUHUR,BAIK,WILAYAH 06
1294,UNIVERSITAS AL HIKMAH JEPARA,BAIK,WILAYAH 06
1295,POLITEKNIK SANDI KARSA,BAIK,WILAYAH 09
1296,SEKOLAH TINGGI ILMU KESEHATAN RS HUSADA,BAIK,WILAYAH 03
1297,SEKOLAH TINGGI ILMU EKONOMI PORT NUMBAY JAYAPURA,BAIK,WILAYAH 14
1298,SEKOLAH TINGGI TEOLOGI INJILI ARASTAMAR JAKARTA,BAIK,WILAYAH PTAS
1299,SEKOLAH TINGGI TEOLOGI IMANUEL MINISTRY EL SHADDAY,BAIK,WILAYAH PTAS
1300,AKADEMI ANALIS KESEHATAN MALANG,BAIK,WILAYAH 07
1301,SEKOLAH TINGGI TEOLOGI SOLA GRATIA INDONESIA,BAIK,WILAYAH PTAS
1302,UNIVERSITAS DARMA AGUNG,BAIK,WILAYAH 01
1303,UNIVERSITAS DR. DJAR WATTIHELUW,BAIK,WILAYAH 12
1304,SEKOLAH TINGGI SENI MUSIK BANDUNG,BAIK,WILAYAH 04
1305,SEKOLAH TINGGI BAHASA ASING BINA DINAMIKA CIANJUR,BAIK,WILAYAH 04
1306,INSTITUT NASIONAL FLORES,BAIK,WILAYAH 15
1307,POLTEKKES KEMENKES KENDARI,B,WILAYAH PTKL
1308,ATRO YAYASAN AMAL BHAKTI MEDAN,BAIK,WILAYAH 01
1309,"STAI MA`ARIF SINTANG, KALIMANTAN BARAT",BAIK,WILAYAH PTAS
1310,STKIP PGRI MANADO,BAIK,WILAYAH 16
1311,UNIVERSITAS PERTIWI,BAIK,WILAYAH 04
1312,SEKOLAH TINGGI ILMU KESEHATAN CIANJUR,BAIK,WILAYAH 04
1313,AKADEMI KEBIDANAN NUSANTARA JAYA,BAIK,WILAYAH 12
1314,AKADEMI TEKNIK ALAT BERAT INDONESIA,BAIK,WILAYAH 07
1315,INSTITUT TEKNOLOGI DAN BISNIS MESUJI,BAIK,WILAYAH 02
1316,POLITEKNIK INSAN TAZAKKA,BAIK,WILAYAH 04
1317,AKADEMI BAHASA ASING UMI MAKASSAR,BAIK,WILAYAH 09
