institution_code,institution_name,body_type,link,student_amount,lecturer_amount,contact,description,unknown_field,average_semester_fee,starting_semester_fee,ending_semester_fee,average_yearly_fee,starting_yearly_fee,ending_yearly_fee
quipper-354,INSTITUT MANAJEMEN KOPERASI INDONESIA,SWASTA,https://campus.quipper.com/directory/institut-manajemen-koperasi-indonesia,1924.0,47.0,"{""website"": ""www.ikopin.ac.id"", ""email"": ""humasikopin@gmail.com"", ""phone"": ""022-7794444""}","Quipperian, Institut Manajemen Koperasi Indonesia  merupakan salah satu perguruan tinggi swasta di Indonesia yang didirikan pada tanggal 7 Mei 1982 dan bertujuan untuk menjadi perguruan tinggi berkualitas dalam menyediakan pendidikan dalam bidang Ilmu Ekonomi, Perkoperasian dan Bisnis untuk mencetak pengusaha tangguh dalam menghadapi persaingan global. Kampus yang asri, fasilitas yang lengkap, dan dosen profesional di bidangnya berhasil membuat Ikopin mendapat akreditasi B dari BAN-PT.",{},7000000.0,7000000.0,7000000.0,14000000.0,14000000.0,14000000.0
quipper-355,UNIVERSITAS MUHAMMADIYAH MAGELANG,SWASTA,https://campus.quipper.com/directory/universitas-muhammadiyah-magelang,6270.0,176.0,"{""website"": ""www.ummgl.ac.id"", ""email"": ""humas@ummgl.ac.id"", ""phone"": ""0293-325554""}","Universitas Muhammadiyah Magelang adalah perguruan tinggi swasta yang berdiri tahun 1964 di bawah naungan persyarikatan Muhammadiyah. Hal ini membuat Universitas Muhammadiyah Magelang bertekad untuk tidak hanya membekali mahasiswanya dengan ilmu akademik, melainkan juga dengan wawasan keagamaan yang bisa jadi pegangan. Prestasi kampus ini juga tidak perlu diragukan. Buktinya pada 2017 lalu, Universitas Muhammadiyah Magelang termasuk dalam daftar 100 Besar Perguruan Tinggi non Politeknik berdasarkan penilaian dari Kemenristekdikti.",{},2300000.0,2300000.0,2300000.0,4600000.0,4600000.0,4600000.0
quipper-357,UNIVERSITAS PRIMA INDONESIA,SWASTA,https://campus.quipper.com/directory/universitas-prima-indonesia,11963.0,347.0,"{""website"": ""www.unprimdn.ac.id"", ""email"": ""contact@unprimdn.ac.id"", ""phone"": ""061-4578870""}","Quipperian, tahukah kamu? Universitas Prima Indonesia merupakan satu-satunya universitas swasta di Sumatera Utara yang memiliki rumah sakit pendidikan dan rumah sakit gigi dan mulut pendidikan, lho. Selain itu, universitas yang punya sepuluh fakultas ini rutin mengadakan Unpri Awards yang bertujuan memberikan penghargaan kepada tokoh pelopor pendidikan di Sumatera Utara. Ada juga Unpri Fiesta, event tahunan untuk memperingati ulang tahun universitas, penyambutan mahasiswa baru, dan pemilihan ikon kampus. Keren ya, Quipperian.",{},2500000.0,2500000.0,2500000.0,5000000.0,5000000.0,5000000.0
quipper-358,SEKOLAH TINGGI ILMU KESEHATAN HANG TUAH,SWASTA,https://campus.quipper.com/directory/sekolah-tinggi-ilmu-kesehatan-hang-tuah,334.0,29.0,"{""website"": ""www.stikeshangtuah-tpi.ac.id"", ""email"": ""stikestpi@gmail.com"", ""phone"": ""0771-4440071""}","Tahukah Quipperian, Sekolah Tinggi Ilmu Kesehatan  Hang Tuah telah mengalami perubahan sebelumnya dari Sekolah Perawat Kesehatan dan Akademi Perawatan. Kebutuhan lembaga pendidikan ini berawal dari tahun 1993. Saat itu, para perwira kesehatan TNI AL yang bertugas di Tanjungpinang, Kepulauan Riau, melihat tenaga perawat masih sangat kurang, sementara animo masyarakat untuk masuk pendidikan perawat sangat tinggi. Itulah sebabnya dibentuklah institusi pendidikan perawat Hang Tuah ini.",{},1600000.0,1600000.0,1600000.0,3200000.0,3200000.0,3200000.0
quipper-362,UNIVERSITAS ISLAM SUMATERA UTARA,SWASTA,https://campus.quipper.com/directory/universitas-islam-sumatera-utara-uisu,5621.0,299.0,"{""website"": ""www.uisu.ac.id"", ""email"": ""infokom@uisu.ac.id"", ""phone"": ""061-7869790""}","Universitas Islam Sumatera Utara  didirikan pada tanggal 7 Januari 1951, merupakan perguruan tinggi pertama yang berdiri diluar pulau Jawa. Universitas ini dipelopori oleh lima tokoh pemuda pemudi Islam, Quipperian. UISU pada mulanya membuka kelas persiapan Akademi Islam Indonesia, baru setahun setelahnya menjadi universitas dengan membuka Fakultas Hukum dan Ilmu Kemasyarakatan.",{},5000000.0,5000000.0,5000000.0,10000000.0,10000000.0,10000000.0
quipper-363,SEKOLAH TINGGI ILMU EKONOMI PELITA NUSANTARA,SWASTA,https://campus.quipper.com/directory/sekolah-tinggi-ilmu-ekonomi-pelita-nusantara,227.0,14.0,"{""website"": ""www.stiepena.ac.id"", ""email"": ""stiepena@yahoo.com"", ""phone"": ""024-6735414""}","Quipperian, Sekolah Tinggi Ilmu Ekonomi Pelita Nusantara Semarang , didirikan oleh Yayasan Pendidikan Nasional Pelita Nusantara dan secara resmi menerima Surat Keputusan Menteri Pendidikan Nasional Republik Indonesia pada tanggal 25 Agustus 2000. Kamu tidak perlu ragu untuk belajar soal ekonomi di sini, karena STIE PENA sudah terakreditasi dengan nilai B oleh BAN PT lho, Quipperian.",{},2000000.0,2000000.0,2000000.0,4000000.0,4000000.0,4000000.0
quipper-365,INSTITUT TEKNOLOGI HARAPAN BANGSA,SWASTA,https://campus.quipper.com/directory/institut-teknologi-harapan-bangsa,848.0,46.0,"{""website"": ""www.ithb.ac.id"", ""email"": ""akademik@ithb.ac.id"", ""phone"": ""022-2506636""}","Kampus yang berada di pusat Kota Bandung ini berdiri pada tahun 2002 dan didirikan oleh Yayasan Petra Harapan Bangsa. Visi dari kampus Institut Teknologi Harapan Bangsa ini adalah “Our vision to brighten the nation by educating future leaders who make a difference”. Nah, siapa yang mau berkuliah di Kota Bandung yang sejuk, ITHB bisa jadi pilihan, ya Quipperian!",{},37000000.0,37000000.0,37000000.0,74000000.0,74000000.0,74000000.0
quipper-366,UNIVERSITAS METHODIST INDONESIA,SWASTA,https://campus.quipper.com/directory/universitas-methodist-indonesia,4687.0,167.0,"{""website"": ""www.methodist.ac.id"", ""email"": ""humas@methodist.ac.id"", ""phone"": ""061-4157882""}","Universitas Methodist Indonesia  didirikan oleh Gereja Methodist Indonesia pada tahun 1965. Awalnya bernama Perguruan Tinggi Methodist Indonesia. Seiring dengan perkembangan dan penambahan jumlah fakultas, berubah menjadi Universitas pada tahun 1969. Saat ini UMI mengelola 5  Fakultas dengan 10  Program Studi berjenjang Strata-1  dan 2  program Studi berjenjang Diploma 3  yang semuanya berstatus terakreditasi BAN-PT.",{},25000000.0,25000000.0,25000000.0,50000000.0,50000000.0,50000000.0
quipper-367,UNIVERSITAS ISLAM SYEKH YUSUF,SWASTA,https://campus.quipper.com/directory/universitas-islam-syekh-yusuf,4306.0,160.0,"{""website"": ""www.unis.ac.id"", ""email"": ""uptmarketingunis@gmail.com dan akademik@unis.ac.id"", ""phone"": ""021 - 5527061""}","Universitas Islam Syekh-Yusuf  Tangerang merupakan universitas pertama di kawasan Banten, usianya sendiri sudah lebih dari setengah abad lho Quipperian. Sekarang ini UNIS Tangerang makin mengokohkan perannya sebagai salah satu perguruan tinggi bergengsi di kawasan aliran sungai Cisadane itu. Bagi Quipperian yang sulit mencari waktu kuliah, UNIS Tangerang membagi waktu belajarnya menjadi dua sesi yaitu Kelas Pagi dan Kelas Sore yang dimulai pada pukul 4 – 9 malam.",{},4700000.0,4700000.0,4700000.0,9400000.0,9400000.0,9400000.0
quipper-368,INTERNATIONAL UNIVERSITY LIAISON INDONESIA,SWASTA,https://campus.quipper.com/directory/international-university-liaison-indonesia,400.0,60.0,"{""website"": ""www.iuli.ac.id"", ""email"": ""info@iuli.ac.id"", ""phone"": ""0852 1231 8000""}","International University Liaison Indonesia  merupakan perguruan tinggi swasta yang didirikan pada tahun 2014. Kampus yang berada di bilangan BSD, Tangerang ini menjalin mitra strategis dengan Konsorsium Universitas Eropa-EUC dan dikoordinasi oleh TU Ilmenau , Jerman. Sebagai universitas berskala internasional, IULI juga telah menjalin kemitraan global dengan universitas Swiss dan Taiwan, lho, Quipperian!",{},110000002.66666667,8.0,255000000.0,220000005.33333334,16.0,510000000.0
quipper-369,UNIVERSITAS MULTIMEDIA NUSANTARA,SWASTA,https://campus.quipper.com/directory/universitas-multimedia-nusantara,6.0,215.0,"{""website"": ""www.umn.ac.id"", ""email"": ""admisi@umn.ac.id"", ""phone"": ""021-54220808""}","Universitas Multimedia Nusantara  masih terhitung muda. Perkuliahan perdana UMN berjalan sejak 3 September 2007. Namun, selama 10 tahun berjalan UMN telah memiliki sejumlah prestasi, salah satunya, penghargaan Ruedi Hofmann Media Awards dalam Festival Film Puskat 2017 untuk kategori Film Dokumenter. UMN terdiri atas empat fakultas, yaitu Teknologi Informasi dan Komunikasi, Bisnis, Ilmu Komunikasi, Seni & Desain. UMN juga menyediakan studi belajar di luar negeri melalui program internasional.",{},13500000.0,10500000.0,16500000.0,27000000.0,21000000.0,33000000.0
quipper-372,SEKOLAH TINGGI ILMU KOMUNIKASI INSTITUT TEKNOLOGI KOMUNIKASI DAN PEMASARAN,SWASTA,https://campus.quipper.com/directory/sekolah-tinggi-ilmu-komunikasi-institut-teknologi-komunikasi-dan-pemasaran,347.0,11.0,"{""website"": ""www.itkp.ac.id"", ""email"": ""adschool@itkp.ac.id"", ""phone"": ""021-7227338/021-7227339""}","Sekolah Tinggi Ilmu Komunikasi ITKP merupakan lembaga pendidikan swasta khusus periklanan pertama di Indonesia. Sebagai pelopor lembaga pendidikan periklanan, sekolah tinggi ini memiliki para pendidik yang merupakan praktisi dan ahli di bidang periklanan. Kalau kamu tertarik dengan dunia periklanan dan ruang lingkupnya, tak ada salahnya bergabung di sekolah tinggi ini! Pastinya akan seru banget!",{},5000000.0,5000000.0,5000000.0,10000000.0,10000000.0,10000000.0
quipper-373,STIKES JAYAKARTA PKP DKI JAKARTA,SWASTA,https://campus.quipper.com/directory/stikes-jayakarta-pkp-dki-jakarta,230.0,12.0,"{""website"": ""www.stikesjayakartapkp.ac.id"", ""email"": ""stikesjayakarta1@gmail.com"", ""phone"": ""021-22852216""}","STIKes Jayakarta adalah insitusi pendidikan tinggi yang bergerak pada bidang kesehatan. Sekolah tinggi yang berada di bawah yayasan PKP DKI Jakarta ini memiliki akreditasi dengan nilai Baik lho, Quipperian. Perlu kalian ketahui, saat ini STIKes Jayakarta bukan hanya bergerak pada bidang keperawatan saja, tapi juga mengembangkan prodi kesehatan lain, yaitu bidang kesehatan kerja dan hospital Informatica. Simak info lengkapnya yuk!",{},11000000.0,11000000.0,11000000.0,22000000.0,22000000.0,22000000.0
quipper-374,STKIP PGRI PACITAN,SWASTA,https://campus.quipper.com/directory/stkip-pgri-pacitan,1194.0,65.0,"{""website"": ""www.stkippacitan.ac.id"", ""email"": ""info@stkippacitan.ac.id"", ""phone"": ""0357-881488""}","Tahukah Quipperian, STKIP PGRI Pacitan merupakan salah satu perguruan tinggi swasta yang bernaung di bawah Perkumpulan Penyelenggara Lembaga Pembina Tinggi  PGRI Pacitan lho. Sekolah tinggi ini juga masuk di dalam lingkup Kopertis 7 Jawa Timur. Adapun, STKIP PGRI Pacitan menempati urutan ke-5 Perguruan Tinggi PGRI terbaik se-Indonesia di bidang riset.  Luar biasa yah! Mau tahu lebih lanjut? Yuk simak penjelasan berikut!",{},4000000.0,4000000.0,4000000.0,8000000.0,8000000.0,8000000.0
quipper-377,INSTITUT TEKNOLOGI YOGYAKARTA,SWASTA,https://campus.quipper.com/directory/institut-teknologi-yogyakarta,1339.0,60.0,"{""website"": ""www.ity.ac.id"", ""email"": ""ity.sttl@gmail.com"", ""phone"": ""0274-566863""}","Tahukah Quipperian, Institut Teknologi Yogyakarta merupakan salah satu perguruan tinggi pertama yang menawarkan pendidikan teknologi di bidang lingkungan hidup? Cikal bakal dari Institut Teknologi Yogyakarta tidak bisa dipisahkan dari pendirian Sekolah Tinggi Teknik Lingkungan  YLH yang telah berdiri dan beroperasi sejak tahun 1983. Kemudian seiring perkembangannya, pada tanggal 17 Oktober 2014 mengalami perubahan bentuk dari Sekolah Tinggi Teknik Lingkungan menjadi Institut Teknologi Yogyakarta.",{},4500000.0,4500000.0,4500000.0,9000000.0,9000000.0,9000000.0
quipper-378,UNIVERSITAS MUHAMMADIYAH MATARAM,SWASTA,https://campus.quipper.com/directory/universitas-muhammadiyah-mataram,7352.0,255.0,"{""website"": ""www.ummat.ac.id"", ""email"": ""um.mataram@ummat.ac.id"", ""phone"": ""0370-633723""}","Universitas Muhammadiyah Mataram  berdiri pada 25 Juni 1980 dan dikelola oleh Yayasan Perguruan Tinggi Muhammadiyah dengan Akta Notaris Abdurrahim, SH dengan No. 355 tanggal 24 Oktober 1981, kemudian diubah dengan Akta Notaris No. 16 tanggal 8 Agustus 1986. Semula fakultas ada empat, yakni Fakultas Pertanian, Fisipol, FKIP, dan Fakultas Teknik. Pada 2007 berdiri Fakultas Hukum dan Diploma Kesehatan pada 2008. Secara tototal saat ini UMMAt memiliki 13 Program Studi S1 dan empat prodi D3.",{},4000000.0,4000000.0,4000000.0,8000000.0,8000000.0,8000000.0
quipper-379,SEKOLAH TINGGI ILMU KESEHATAN SISMADI,SWASTA,https://campus.quipper.com/directory/sekolah-tinggi-ilmu-kesehatan-sismadi,170.0,20.0,"{""website"": ""www.stikes-sismadi.ac.id"", ""email"": ""info@stikes-sismadi.ac.id"", ""phone"": ""021-4351714""}","Program Studi D3 Keperawatan Sekolah Tinggi Ilmu Kesehatan Sismadi Jakarta  sudah ada sejak tahun 1996 lho!. Dalam rangka berpartisipasi aktif terkait dengan penyediaan SDM Kesehatan/Keperawatan/Ners, berdasarkan SK. Mendiknas No.107/D/O/2008, STIKes dr. Sismadi Jakarta juga telah membuka Program Studi S1 Keperawatan untuk Quipperian yang ingin berprofesi di bidang keperawatan setelah kuliah. STIKes dr. Sismadi Jakarta mempunyai keunggulan dalam bidang Keperawatan Penyakit Infeksi , Kegawatdaruratan , dan Kesehatan Keselamatan Kerja .",{},5000000.0,5000000.0,5000000.0,10000000.0,10000000.0,10000000.0
quipper-381,AKADEMI KEPERAWATAN HUSADA KARYA JAYA,SWASTA,https://campus.quipper.com/directory/akademi-keperawatan-husada-karya-jaya,112.0,11.0,"{""website"": ""www.husadakaryajaya.ac.id"", ""email"": ""akperhkj@husadakaryajaya.ac.id"", ""phone"": ""021-26608276""}","Tahukah Quipperian bahwa Akademi Keperawatan Husada Karya Jaya  didirikan di bawah naungan Yayasan Jaya Husada Jakarta dan mendapatkan izin dari Mendiknas RI yang dikeluarkan pada tanggal 30 Juni 2009? Akper HKJ memiliki visi untuk menjadi institusi pendidikan keperawatan yang unggul dalam pelayanan keperawatan berdasarkan caring di Indonesia pada 2025. Caring merupakan teori yang berkaitan dengan cara seseorang berpikir, berperasaan, dan bersikap ketika berhubungan dengan orang lain. Untuk kuliah di sini, besaran biaya yang perlu kamu keluarkan sangat terjangkau lho! Kamu cukup mengeluarkan Rp5.000.000 untuk biaya masuk, dan Rp1.000.000 per bulannya untuk biaya kuliah.",{},1000000.0,1000000.0,1000000.0,2000000.0,2000000.0,2000000.0
quipper-383,INSTITUT ILMU SOSIAL DAN ILMU POLITIK JAKARTA,SWASTA,https://campus.quipper.com/directory/institut-ilmu-sosial-dan-ilmu-politik-jakarta,4218.0,77.0,"{""website"": ""iisip.ac.id"", ""email"": ""admin@iisip.ac.id"", ""phone"": ""021-7806223""}","Perlu diketahui nih Quipperian, Institut Ilmu Sosial dan Ilmu Politik  awalnya adalah sebuah sekolah tinggi yang didirikan oleh Perhimpunan Mahasiswa Akademi Wartawan bernama Perguruan Tinggi Djurnalistik . Seiring dengan perkembangan keilmuan, pada 1990, IISIP memiliki dua fakultas tambahan yakni Fakultas Ilmu Sosial dan Politik serta Fakultas Ilmu Administrasi. Bagi Quipperian yang bercita-cita menjadi seorang insan pers, masuk ke IISIP merupakan pilihan yang tepat karena kampus ini sudah berdiri sejak tahun 1953 lho.",{},3000000.0,2000000.0,4000000.0,6000000.0,4000000.0,8000000.0
quipper-384,AKADEMI PELAYARAN NIAGA SEMARANG,SWASTA,https://campus.quipper.com/directory/akademi-pelayaran-niaga-semarang,1194.0,26.0,"{""website"": ""www.akpelni.ac.id"", ""email"": null, ""phone"": ""024-8446272""}","Tahukan Quipperian bahwa Akademi Pelayaran Niaga Indonesia  Semarang sudah berdiri puluhan tahun dan membuka tiga program studi? Yap, AKPELNI Semarang memiliki  tiga prodi yakni Nautika, Teknika, dan Ketatalaksanaan Pelayaran Niaga dan Kepelabuhan . Kamu tidak perlu ragu untuk masuk ke AKPELNI, karena akademi ini telah meraih akreditasi B dari BAN-PT untuk semua program studinya. Selain itu kompetensi lulusannya juga diakui secara internasional dengan kurikulum profesinya yang mengacu pada Quality Standard System sesuai persyaratan International Maritime Organization .",{},5000000.0,5000000.0,5000000.0,10000000.0,10000000.0,10000000.0
quipper-386,UNIVERSITAS MUHAMMADIYAH BENGKULU,SWASTA,https://campus.quipper.com/directory/universitas-muhammadiyah-bengkulu,8564.0,282.0,"{""website"": ""www.umb.ac.id"", ""email"": ""humas@umb.ac.id"", ""phone"": ""0736-22765""}","Quipperian, Universitas Muhammadiyah Bengkulu  berdiri sejak tahun 1991. Namun, kampus ini sudah dirintis sejak 1970 dengan dibukanya Fakultas Keguruan dan Ilmu Sosial cabang IKIP Muhammadiyah Jakarta. Saat ini, UMB memiliki delapan fakultas program Sarjana dan program Pascasarjana. Demi meningkatkan kualitasnya, UMB membangun kerja sama dengan dua kampus di Inggris, De Montfort University The Queen Elizabeth II dan Coventry University. Wah, menarik ya, Quipperian?",{},3300000.0,3300000.0,3300000.0,6600000.0,6600000.0,6600000.0
quipper-387,UNIVERSITAS MUHAMMADIYAH MAKASSAR,SWASTA,https://campus.quipper.com/directory/universitas-muhammadiyah-makassar,25002.0,588.0,"{""website"": ""www.unismuh.ac.id"", ""email"": ""info@unismuh.ac.id"", ""phone"": ""0411-866972""}","Universitas Muhammadiyah  Makassar didirikan pada tanggal 19 Juni 1963 sebagai cabang dari Universitas Muhammadiyah Jakarta. Sebagai salah satu Perguruan Tinggi Muhammadiyah , kampus ini turut mengemban tugas yang besar bagi agama, bangsa, dan negara, baik di masa sekarang maupun di masa depan. Nama Muhammadiyah yang terintegrasi dengan nama Makassar memberikan harapan terpadunya budaya, keilmuan, dan nafas keagamaan.",{},1000000.0,1000000.0,1000000.0,2000000.0,2000000.0,2000000.0
quipper-388,UNIVERSITAS KRISNADWIPAYANA,SWASTA,https://campus.quipper.com/directory/universitas-krisnadwipayana,7058.0,246.0,"{""website"": ""www.unkris.ac.id"", ""email"": ""marketing@unkris.ac.id"", ""phone"": ""021-8462230, 021-8462231""}","Universitas Krisnadwipayana memiliki visi yaitu “Terwujudnya Universitas Krisnadwipayana menjadi Perguruan Tinggi Unggulan pada Tahun 2025"". Untuk mewujudkan visi tersebut, kampus yang telah berusia 67 tahun ini terus melakukan pengembangan kualitas pendidikan. Salah satunya yaitu melakukan kerja sama dengan beberapa kampus di luar negeri, seperti Rajamangala University of Technology Khrungthep Thailand. Pada November 2017, Universitas Krisnadwipayana telah mengirimkan mahasiswa Fakultas Ilmu Administrasi untuk melaksanakan program Student Exchange ke kampus tersebut. Ingin tahu lebih lengkap mengenai kampus keren ini? Yuk, kita simak profilnya berikut ini!",{},7500000.0,5000000.0,10000000.0,15000000.0,10000000.0,20000000.0
quipper-389,AKADEMI PARIWISATA NUSANTARA JAYA,SWASTA,https://campus.quipper.com/directory/akademi-pariwisata-nusantara-jaya,114.0,11.0,"{""website"": ""www.akpar-enje.com"", ""email"": ""info@apnj.com"", ""phone"": ""021-7752335""}","Ingin lulus langsung kerja? Quipperian bisa memasukkan kampus ini sebagai referensi. Terletak di kawasan Depok, Jawa Barat, Akademi Pariwisata Nusantara Jaya mencetak tenaga ahli siap pakai di industri pariwisata. Dengan metode pengajaran 60% praktik dan 40% teori, Quipperian tidak hanya berteori tapi juga bisa berlatih sebelum terjun ke dunia kerja. Adapun spesifikasi ilmu yang bisa kalian pilih antara lain food pastry, kitchen and bar, room division, kapal pesiar, dan tentunya perhotelan.",{},7000000.0,7000000.0,7000000.0,14000000.0,14000000.0,14000000.0
quipper-391,SEKOLAH TINGGI ILMU KESEHATAN MERCUBAKTIJAYA PADANG,SWASTA,https://campus.quipper.com/directory/sekolah-tinggi-ilmu-kesehatan-mercubaktijaya-padang,1213.0,55.0,"{""website"": ""www.mercubaktijaya.ac.id"", ""email"": ""stikesmercubaktijaya@yahoo.co.id"", ""phone"": ""0751-442295""}","STIKES Mercubaktijaya menyelenggarakan pendidikan pertama pada tahun 1993 dengan Program Studi Diploma III Keperawatan. Selanjutnya kampus ini berkembang dengan membuat Program Studi Keperawatan, Profesi Keperawatan dan Diploma III Kebidanan. Kampus ini terakreditasi B dan mendapatkan penghargaan Apresiasi Sistem Penjaminan Mutu Internal dari Kementerian Ristekdikti. Kampus ini bisa menjadi piihan Quipperian yang tertarik menjadi Perawat atau Bidan.",{},3100000.0,3100000.0,3100000.0,6200000.0,6200000.0,6200000.0
quipper-393,SEKOLAH TINGGI ILMU EKONOMI INDONESIA BANJARMASIN,SWASTA,https://campus.quipper.com/directory/sekolah-tinggi-ilmu-ekonomi-indonesia-banjarmasin,284.0,42.0,"{""website"": ""www.stiei-kayutangi-bjm.ac.id"", ""email"": ""it@stiei-kayutangi-bjm.ac.id"", ""phone"": ""0511-3304652""}","Sekolah Tinggi Ilmu Ekonomi Indonesia Banjarmasin berhasil masuk dalam daftar 100 Besar Perguruan Tinggi Indonesia Non-Politeknik versi Kemenristekdikti pada 2017. Selain itu, sekolah tinggi ini juga menjadi satu dari 10 Sekolah Tinggi Ilmu Ekonomi di Indonesia yang mempunyai peringkat akreditasi institusi B, lho!",{},3500000.0,3500000.0,3500000.0,7000000.0,7000000.0,7000000.0
quipper-394,UNIVERSITAS PEMBANGUNAN PANCA BUDI,SWASTA,https://campus.quipper.com/directory/universitas-pembangunan-panca-budi,14508.0,288.0,"{""website"": ""www.pancabudi.ac.id"", ""email"": ""unpab@pancabudi.ac.id"", ""phone"": ""061-8455571""}","Ada yang unik dari sejarah Universitas Pembangunan Panca Budi . Unpab dulunya adalah sebuah sekolah untuk belajar ilmu metafisika yang didirikan pada 1956, oleh Prof. Dr. H. Kadirun Yahya. Dulu, Unpab bernama Sekolah Tinggi Metafisika. Unpab yang resmi berdiri pada 19 Desember 1961 ini memiliki visi untuk menjadi perguruan tinggi swasta yang terkemuka berbasis religius dalam mengembangkan IPTEK yang bermanfaat bagi kemaslahatan umat. Menarik, ya!",{},7500000.0,7500000.0,7500000.0,15000000.0,15000000.0,15000000.0
quipper-395,AKADEMI KEPERAWATAN PASAR REBO JAKARTA,SWASTA,https://campus.quipper.com/directory/akademi-keperawatan-pasar-rebo-jakarta,177.0,12.0,"{""website"": ""www.akperpasarrebo.ac.id"", ""email"": ""akperpasarrebo.com@gmail.com"", ""phone"": ""021-840 4242, 021-87790913""}","Dengan pesatnya perkembangan profesi perawat di Indonesia dalam 10 tahun belakangan ini, akan sangat menarik jika kita membahas kampus yang satu ini, Quipperian! Akademi Keperawatan Pasar Rebo merupakan salah satu kampus bidang keperawatan yang menyelenggarakan program studi pada tingkat diploma . Akper Pasar Rebo mengusung program pendidikan dengan kurikulum berbasis kompetensi dengan muatan pelengkap, antara lain: bahasa inggris keperawatan dan juga pengembangan sikap profesional dan layanan prima. Nggak heran ya, kalau kampus yang berdiri sejak 20 tahun ini telah meluluskan banyak tenaga perawat profesional yang sukses dalam berkarier, baik di dalam maupun luar negeri. Ingin tahu lebih lengkap tentang info kampus ini? Simak profilnya berikut ini ya, Quipperian!",{},8900000.0,8900000.0,8900000.0,17800000.0,17800000.0,17800000.0
quipper-396,SEKOLAH TINGGI ILMU HUKUM SUMPAH PEMUDA PALEMBANG,SWASTA,https://campus.quipper.com/directory/sekolah-tinggi-ilmu-hukum-sumpah-pemuda-palembang,905.0,34.0,"{""website"": ""www.stihpada.ac.id"", ""email"": ""stihpada@gmail.com"", ""phone"": ""0711 - 418873""}","Sekolah Tinggi Ilmu Hukum Sumpah Pemuda  Palembang didirikan atas pemikiran belum adanya lembaga pendidikan tinggi yang mengkhususkan diri kepada program studi ilmu hukum di Palembang. Maksud diberi nama Sumpah Pemuda adalah untuk selalu mengenang tekad pemuda-pemudi yang membentuk persatuan dan kesatuan bangsa yang berjuang untuk mencapai kemerdekaan. Mewarisi semangat juang pemuda pemudi inilah, maka didirikan STIHPADA.",{},3400000.0,3400000.0,3400000.0,6800000.0,6800000.0,6800000.0
quipper-397,UNIVERSITAS ALMA ATA,SWASTA,https://campus.quipper.com/directory/universitas-alma-ata,1227.0,133.0,"{""website"": ""www.almaata.ac.id"", ""email"": ""uaa@almaata.ac.id"", ""phone"": ""0274-434 2288""}","Quipperian, Universitas Alma Ata  adalah univesitas baru yang merupakan penggabungan dari dua kampus yang berbeda namun masih dalam satu yayasan, yaitu Sekolah Tinggi Ilmu Kesehatan  Alma Ata Yogyakarta dan Sekolah Tinggi Agama Islam  Alma Ata Yogyakarta. Seiring dan pertumbuhan dan kebutuhan masyarakat, akhirnya pada tanggal 21 Desember 2015 semua perguruan tinggi Alma Ata resmi menjadi Universitas Alma Ata",{},4000000.0,4000000.0,4000000.0,8000000.0,8000000.0,8000000.0
quipper-399,AKADEMI KOMUNIKASI INDONESIA  YPK,SWASTA,https://campus.quipper.com/directory/akademi-komunikasi-indonesia-akindo-ypk,523.0,25.0,"{""website"": ""www.akindo.ac.id"", ""email"": ""humas@akindo.ac.id"", ""phone"": ""0274-4533864""}","Tahukah Quipperian bahwa Akademi Komunikasi Indonesia   yang fokus pada komunikasi terapan itu sudah berdiri lebih dari 21 tahun? Lebih menarik lagi, perguruan tinggi vokasi swasta nasional ini punya tiga program studi unggulan, yakni Penyiaran, Periklanan, dan Hubungan Masyarakat. Dengan usia yang cukup lama, tak salah bila Quipperian mempertimbangkan AKINDO sebagai alternatif perguruan tinggi pilihan kalian.",{},4000000.0,4000000.0,4000000.0,8000000.0,8000000.0,8000000.0
quipper-400,UNIVERSITAS SANATA DHARMA,SWASTA,https://campus.quipper.com/directory/universitas-sanata-dharma,11856.0,346.0,"{""website"": ""www.usd.ac.id"", ""email"": ""humas@usd.ac.id"", ""phone"": ""0274-513301 atau 515352""}","Universitas Sanata Dharma  telah berhasil meraih akreditasi perguruan tinggi swasta terbaik di Yogyakarta. USD yang berkembang dari IKIP Sanata Dharma ini memiliki delapan fakultas yang terdiri dari 23 program studi dengan empat di antaranya adalah program pascasarjana. Selain itu, terdapat juga dua program profesi dan program kursus bersertifikat. USD atau yang lebih dikenal dengan sebutan Sadhar ini siap memadukan keunggulan akademik dengan nilai-nilai kemanusiaan yang cerdas dan humanis.",{},7000000.0,7000000.0,7000000.0,14000000.0,14000000.0,14000000.0
