institution_code,institution_name,body_type,link,student_amount,lecturer_amount,contact,description,unknown_field,average_semester_fee,starting_semester_fee,ending_semester_fee,average_yearly_fee,starting_yearly_fee,ending_yearly_fee
quipper-144,SEKOLAH TINGGI ILMU KESEHATAN RS BAPTIS KEDIRI,SWASTA,https://campus.quipper.com/directory/sekolah-tinggi-ilmu-kesehatan-rs-baptis-kediri,346.0,31.0,"{""website"": ""www.stikesbaptis.ac.id"", ""email"": ""stikes_rsbaptis@yahoo.co.id"", ""phone"": ""0354683470""}","Sekolah Tinggi Ilmu Kesehatan  RS Baptis Kediri telah meluluskan sekitar 55.000 alumni yang profesional di dunia kesehatan. Saat ini, STIKES RS Baptis Kediri menyediakan tiga jenjang pendidikan yaitu program diploma, program sarjana, dan program profesi. Bagi Quipperian yang berminat melanjutkan studi di bidang kesehatan, kalian dapat mempertimbangkan kampus ini!",{},3250000.0,3000000.0,3500000.0,6500000.0,6000000.0,7000000.0
quipper-146,STIKES KATOLIK ST. VINCENTIUS A PAULO  SURABAYA,SWASTA,https://campus.quipper.com/directory/stikes-katolik-st-vincentius-a-paulo-stikvinc-surabaya,588.0,31.0,"{""website"": ""www.stikvinc.ac.id"", ""email"": ""sekretariat@stikvinc.ac.id"", ""phone"": ""+62315612220""}","STIKES Katolik St. Vincentius A Paulo  Surabaya berdiri atas dasar banyaknya pasien di Rumah Sakit Katolik St. Vincentius a Paulo Surabaya  sehingga jumlah perawat kurang. Pada tahun 1954, para suster membuka Sekolah Pendidikan Perawat, sekolah inilah yang menjadi cikal bakal berdirinya STIKVINC atau dikenal juga dengan STIKES RKZ Surabaya.",{},6025000.0,5775000.0,6275000.0,12050000.0,11550000.0,12550000.0
quipper-147,SEKOLAH TINGGI MANAJEMEN INFORMATIKA DAN KOMPUTER JAKARTA STI&K,SWASTA,https://campus.quipper.com/directory/sekolah-tinggi-manajemen-informatika-dan-komputer-jakarta-sti-k,801.0,80.0,"{""website"": ""www.jak-stik.ac.id"", ""email"": ""info@jak-stik.ac.id"", ""phone"": "" 739 7973""}","Sekolah Tinggi Manajemen Informatika dan Komputer Jakarta STI&K  didirikan pada tahun 1978 dengan nama Institut Ilmu Komputer . Kemudian pada tahun 1990 IIK resmi berubah nama menjadi STMIK Jakarta STI&K. Saat ini, STMIK Jakarta STI&K menyediakan empat program studi yaitu D3 Manajemen Informatika, S1 Sistem Informasi, S1 Sistem Komputer, dan S2 Teknologi Informasi.",{},875000.0,750000.0,1000000.0,1750000.0,1500000.0,2000000.0
quipper-148,UNIVERSITAS MUHAMMADIYAH SEMARANG,SWASTA,https://campus.quipper.com/directory/universitas-muhammadiyah-semarang,12315.0,359.0,"{""website"": ""www.unimus.ac.id"", ""email"": ""sekretariat@unimus.ac.id"", ""phone"": ""024 - 74760296""}","Universitas Muhammadiyah Semarang  berdiri pada tahun 1999 hasil kerja sama para pemimpin Muhammadiyah di Jawa Tengah. Hadirnya Unimus merupakan hasil penggabungan dari beberapa perguruan tinggi Muhammadiyah, mulai dari akademi keperawatan, akademi gizi, dan akademi analis kesehatan. Hal ini membuat studi di bidang kesehatan menjadi salah satu andalan di kampus Unimus. Selain di tingkat nasional, Unimus juga memperluas jaringan kerja sama hingga ke Jepang lho Quipperian.",{},12600000.0,1200000.0,24000000.0,25200000.0,2400000.0,48000000.0
quipper-151,SEKOLAH TINGGI ILMU MANAJEMEN BUDI BAKTI,SWASTA,https://campus.quipper.com/directory/sekolah-tinggi-ilmu-manajemen-budi-bakti,493.0,41.0,"{""website"": ""https://stimbudibakti.ac.id/"", ""email"": ""admin@stimbudibakti.ac.id"", ""phone"": ""0251-8606509, 082111785006""}","Sekolah Tinggi Ilmu Manajemen Budi Bakti  dibangun pada tahun 2002. Awalnya, sekolah tinggi ini berada di bawah naungan Yayasan Pendidikan Ilmu Bakti, lalu pengelolaannya beralih ke Yayasan Dompet Dhuafa Republika pada tahun 2019. Sejak awal berdiri, STIM Budi Bakti memiliki 5 prinsip people campus: accesable, empowerment, social impact, dedication, dan local wisdom. Terbentuknya prinsip ini sejalan dengan tekad untuk mewujudkan visi dan misi kampus ini, yaitu menjadi people campus yang terdepan dalam menghasilkan lulusan berkarakter sosiotechnopreneur.",{},1500000.0,1200000.0,1800000.0,3000000.0,2400000.0,3600000.0
quipper-152,STIE JAKARTA INTERNATIONAL COLLEGE,SWASTA,https://campus.quipper.com/directory/stie-jakarta-international-college,1212.0,32.0,"{""website"": ""www.jic-stie.ac.id"", ""email"": ""info-business-school@jic.ac.id"", ""phone"": ""021-420 7238, 021-425 7368, 021-425 7369""}","Cikal bakal STIE Jakarta International College adalah STIE Setiabudi yang berasal dari Akademi Keuangan dan Perbankan Setiabudi  yang berdiri di bawah naungan Yayasan Pendidikan Setiabudi. Kampus ini berhasil mendapatkan akreditasi B oleh BAN-PT dan sudah menggunakan kurikulum berbasis nasional dan internasional yang ter-update, guna menopang kompetensi mahasiswa di dunia kerja. Selama masa studi, mahasiswa STIE Jakarta International College akan dibekali dengan beragam sertifikasi kompetensi seperti seminar, kegiatan kampus, dan sertifikat pendukung lainnya. Terdapat dua pilihan kelas yang tersedia di kampus ini, yaitu kelas reguler dengan jam perkuliahan pagi dan kelas profesional dengan jam perkuliahan malam. Yuk, simak dulu profil lengkapnya!",{},4842500.0,3585000.0,6100000.0,9685000.0,7170000.0,12200000.0
quipper-153,INSTITUT BISNIS DAN INFORMATIKA KWIK KIAN GIE,SWASTA,https://campus.quipper.com/directory/institut-bisnis-dan-informatika-kwik-kian-gie,2784.0,102.0,"{""website"": ""kwikkiangie.ac.id"", ""email"": ""rektorat@kwikkiangie.ac.id"", ""phone"": ""021-65307062""}","Cikal bakal berdirinya Institut Bisnis dan Informatika Kwik Kian Gie bermula dari inisiatif dua tokoh penting di Indonesia. Dengan semangat untuk berkontribusi membangun Indonesia melalui pendidikan, Kwik Kian Gie dan Djoenaedi Joesoef sepakat mendirikan lembaga pendidikan bertaraf internasional. Kwik Kian Gie adalah ekonom yang berkecimpung dalam dunia politik. Beliau pernah menjabat Menko Ekuin dan Kepala Bapenas pada pemerintahan Presiden Abdurrahman Wahid. Djoenaedi Joesoef adalah pendiri PT Konimex yang berpusat di Solo. Beliau adalah penerima anugerah Entrepreneur of The Year 2003 dari lembaga Ernst & Young, sebuah penghargaan yang mengakui kiprahnya sebagai pengusaha tingkat dunia. Di tahun 1987, kedua tokoh berprestasi ini mendirikan Institut Bisnis Indonesia  dan Yayasan Institut Bisnis Indonesia sebagai pengelolanya.",{},14500000.0,14500000.0,14500000.0,29000000.0,29000000.0,29000000.0
quipper-154,INSTITUT PTIQ JAKARTA,SWASTA,https://campus.quipper.com/directory/institut-ptiq-jakarta,4788.0,106.0,"{""website"": ""www.ptiq.ac.id"", ""email"": ""humas@ptiq.ac.id"", ""phone"": "" 7690901""}","Institut Perguruan Tinggi Ilmu Al-Qur’an  Jakarta didirikan pada 1 April 1971 oleh Yayasan Ihya Ulumudin. Namun, pada tanggal 12 Mei 1973 pengelolaan institut ini diserahkan kepada Yayasan Pendidikan Al-Qur’an. Awalnya, PTIQ hanya memiliki dua fakultas yaitu Syariah dan Ushuluddin. Kini PTIQ telah memiliki empat fakultas yaitu Syariah, Ushuluddin, Dakwah, dan Tarbiyah serta telah membuka Program Pascasarjana.",{},1875000.0,1250000.0,2500000.0,3750000.0,2500000.0,5000000.0
quipper-155,SEKOLAH TINGGI ILMU KESEHATAN SANTO BORROMEUS,SWASTA,https://campus.quipper.com/directory/sekolah-tinggi-ilmu-kesehatan-santo-borromeus,314.0,44.0,"{""website"": ""www.stikesborromeus.ac.id"", ""email"": ""sekretariat@stikesborromeus.ac.id"", ""phone"": ""022-6803961""}","Sekolah Tinggi Ilmu Kesehatan Santo Borromeus  telah mencetak ribuan lulusan sejak tahun 1926. Sempat berdiri sebagai Akademi Keperawatan , Santo Borromeus didirikan oleh Yayasan Pendidikan Kesehatan Borromeus dan berkedudukan di Kabupaten Bandung Barat. STIKes Santo Borromeus menyelenggarakan pendidikan tinggi kesehatan secara profesional dengan disiplin dan semangat Iman Kristiani, siap mengabdi kepada masyarakat dengan menjunjung tinggi nilai-nilai kemanusiaan sesuai falsafah Pancasila, UUD 1945, dan Guiding Principle of Carolus Borromeus.",{},10000000.0,10000000.0,10000000.0,20000000.0,20000000.0,20000000.0
quipper-158,UNIVERSITAS LANGLANGBUANA,SWASTA,https://campus.quipper.com/directory/universitas-langlangbuana,7872.0,259.0,"{""website"": ""www.unla.ac.id"", ""email"": ""info@unla.ac.id"", ""phone"": ""022-4218084""}",Berdirinya Universitas Langlangbuana  pada awal tahun 1980 diprakarsai oleh beberapa purnawirawan Polri yang peduli terhadap pendidikan yang berdomisili di Bandung dan cendikiawan dari Universitas Padjadjaran. Setelah mendapatkan restu oleh Kadapol VIII Langlangbuana Jabar  Universitas Langlangbuana didirikan secara resmi oleh Yayasan Pendidikan Tri Bhakti  pada tahun 1982.,{},5750000.0,4000000.0,7500000.0,11500000.0,8000000.0,15000000.0
quipper-159,UNIVERSITAS INDONESIA MAJU,SWASTA,https://campus.quipper.com/directory/universitas-indonesia-maju,2971.0,175.0,"{""website"": ""www.uima.ac.id"", ""email"": ""uima@uima.ac.id"", ""phone"": ""021-78894043""}","Universitas Indonesia Maju adalah perguruan tinggi swasta yang terbentuk dari penggabungan sekolah tinggi yang berada di bawah naungan Yayasan Indonesia Maju, yakni Sekolah Tinggi Ilmu Kesehatan Indonesia Maju  dan Sekolah Tinggi Ilmu Komunikasi Indonesia Maju . Sejak penyelenggaraan pendidikan dalam bentuk universitas disetujui oleh Kementerian Pendidikan, Kebudayaan, Riset, dan Teknologi pada tanggal 17 Januari 2022, kedua sekolah tinggi tersebut berubah menjadi Fakultas Kesehatan dan Fakultas Ilmu Komunikasi di Universitas Indonesia Maju.",{},6000000.0,6000000.0,6000000.0,12000000.0,12000000.0,12000000.0
quipper-163,UNIVERSITAS 17 AGUSTUS 1945 CIREBON,SWASTA,https://campus.quipper.com/directory/universitas-17-agustus-1945-cirebon,1651.0,95.0,"{""website"": ""www.untagcirebon.ac.id"", ""email"": ""akademik_center@untagcirebon.ac.id"", ""phone"": ""0231-481945""}","Sejarahnya, Universitas 17 Agustus 1945 Cirebon  didirikan pada tanggal 2 September 1962 sebagai cabang dari UNTAG Jakarta. Pendirian UNTAG Cirebon tidak terlepas dari perjuangan tokoh-tokoh yang semula mendirikan Akademi Pimpinan Perusahaan  Cirebon pada tahun 1961 yang dipimpin oleh D. Usman Imam sebagai Direktur APP Cirebon. Karena APP Cirebon tidak berhasil mempertahankan eksistensinya, maka perwakilian mahasiswa akademi tersebut memutuskan untuk berangkat ke Jakarta dan menemui Prof. Dr. Prajudi Atmosudirdjo yang saat itu menjadi Rektor Magnificus. Berdasarkan saran beliau, maka dibentuklah UNTAG Cirebon yang dilengkapi dengan susunan Pimpinan Yayasan dan Universitas. Sejak tahun 1975, UNTAG Cirebon resmi melepaskan diri dari induknya di Jakarta dan berdiri di bawah naungan Yayasan Perguruan Tinggi 17 Agustus 1945 Cirebon.",{},3500000.0,3500000.0,3500000.0,7000000.0,7000000.0,7000000.0
quipper-164,STIKES BHAKTI MULIA,SWASTA,https://campus.quipper.com/directory/stikes-bhakti-mulia,169.0,19.0,"{""website"": ""www.stikesbhaktimulia.ac.id"", ""email"": ""stikesbhaktimulia@gmail.com"", ""phone"": ""0354395455""}","Sekolah Tinggi Ilmu Kesehatan  Bhakti Mulia merupakan perguruan tinggi yang didirikan oleh Yayasan Pendidikan Bhakti Mulia pada tahun 2006. Saat awal berdiri, kampus ini hanya membuka dua program studi yaitu Profesi Ners dan D3 Kebidanan. Namun, seiring berjalannya waktu, STIKES Bhakti Mulia menambah program studi dan jenjang pendidikan baru yaitu Sarjana Ilmu Keperawatan.",{},6500000.0,6500000.0,6500000.0,13000000.0,13000000.0,13000000.0
quipper-165,SEKOLAH TINGGI ILMU KESEHATAN AHMAD DAHLAN CIREBON,SWASTA,https://campus.quipper.com/directory/sekolah-tinggi-ilmu-kesehatan-ahmad-dahlan-cirebon,246.0,12.0,"{""website"": ""stikes-adc.ac.id"", ""email"": ""info_akpermuh@akpermuh.ac.id"", ""phone"": ""0231-201942""}","Sekolah Tinggi Ilmu Kesehatan Ahmad Dahlan Cirebon merupakan bentuk transformasi dari Akademi Keperawatan  Muhammadiyah Cirebon yang diresmikan sejak bulan Oktober 2020. STIKes Ahmad Dahlan Cirebon menyediakan pembelajaran dengan kurikulum kekinian yang sesuai dengan kebutuhan instansi kesehatan yang ada di Indonesia, khususnya di Wilayah 3 Cirebon.",{},10425000.0,7775000.0,13075000.0,20850000.0,15550000.0,26150000.0
quipper-166,INSTITUT KESENIAN JAKARTA,SWASTA,https://campus.quipper.com/directory/institut-kesenian-jakarta-lpkj,2805.0,125.0,"{""website"": ""www.ikj.ac.id"", ""email"": ""info@ikj.ac.id"", ""phone"": ""+62 21-3924018""}","Awalnya Institut Kesenian Jakarta  merupakan sebuah Lembaga Pendidikan Kesenian Jakarta  berbentuk sanggar yang didirikan pada tahun 1970 oleh Gubernur DKI Jakarta Ali Sadikin. Kemudian pada tahun 1980, LPKJ kian berkembang dan berganti nama menjadi Institut Kesenian Jakarta. Saat ini, IKJ terdiri atas berbagai program studi yang terangkum dalam tiga Fakultas, yakni: Fakultas Film dan Televisi , Fakultas Seni Rupa , Fakultas Seni Pertunjukan  serta ditambah dengan Sekolah Pascasarjana. Sebagian program studi telah meraih akreditasi dari Badan Akreditasi Nasional Perguruan Tinggi .",{},20750000.0,6500000.0,35000000.0,41500000.0,13000000.0,70000000.0
quipper-168,SEKOLAH TINGGI PERPAJAKAN INDONESIA,SWASTA,https://campus.quipper.com/directory/sekolah-tinggi-perpajakan-indonesia,864.0,25.0,"{""website"": ""www.stpi-pajak.ac.id"", ""email"": ""info@stpi-pajak.ac.id"", ""phone"": "" 8513390 /  85908938""}","Sekolah Tinggi Perpajakan Indonesia  merupakan satu-satunya sekolah tinggi perpajakan di Indonesia yang didirikan dan diasuh oleh para pejabat Direktorat Jenderal Pajak , pejabat Departemen Keuangan, dan para konsultan pajak ternama. Saat ini, STPI menyediakan satu program studi yaitu D4 Perpajakan yang telah terakreditasi B oleh Badan Akreditasi Nasional Perguruan Tinggi . Nantinya para lulusan akan mendapatkan gelar Sarjana Terapan Pajak .",{},5250000.0,3000000.0,7500000.0,10500000.0,6000000.0,15000000.0
quipper-170,SEKOLAH TINGGI ILMU KESEHATAN SINT CAROLUS,SWASTA,https://campus.quipper.com/directory/sekolah-tinggi-ilmu-kesehatan-sint-carolus,525.0,37.0,"{""website"": ""www.stik-sintcarolus.ac.id"", ""email"": ""stiksc@stik-sintcarolus.ac.id"", ""phone"": ""021-3904441""}","Sekolah Tinggi Ilmu Kesehatan Sint Carolus adalah salah satu sekolah tinggi di bidang kesehatan tertua yang ada di Indonesia. Resmi berdiri sejak 1962 di bawah naungan Yayasan Pendidikan Kesehatan Carolus Jakarta, sekolah tinggi ini berfokus menyediakan pendidikan ilmu keperawatan, kebidanan, dan gizi. Kampus ini memiliki jaringan kerja sama yang luas, lulusannya banyak diserap menjadi tenaga kesehatan di rumah sakit besar di Indonesia, seperti RS Sint Carolus, RS Persahabatan, RS Pondok Indah, RS Eka Hospital, dan masih banyak lagi. Bukan hanya di Indonesia, alumni STIK Sint Carolus pun banyak yang bekerja di luar negeri seperti Jepang, Belanda, sampai United Arab Emirates, lho. Tertarik mendaftar di kampus ini? Cek dulu profil lengkapnya, yuk!",{},16200000.0,9900000.0,22500000.0,32400000.0,19800000.0,45000000.0
quipper-171,SEKOLAH TINGGI EKONOMI ISLAM SEBI,SWASTA,https://campus.quipper.com/directory/sekolah-tinggi-ekonomi-islam-sebi-stei-sebi,1209.0,41.0,"{""website"": ""www.sebi.ac.id"", ""email"": ""pmb@sebi.ac.id"", ""phone"": ""0251-8616655, 0251-8604985""}","Sekolah Tinggi Ekonomi Islam SEBI  adalah institusi pendidikan yang didirikan oleh Yayasan Bina Tsaqofah dan lahir dari sebuah gagasan untuk menjadi institusi yang memberikan kontribusi bagi kemaslahatan bangsa, negara, umat dan agama. Kontribusi tersebut diwujudkan dalam bentuk edukasi, sosialisasi, konsultasi, implementasi dan penyiapan sumber daya insani di bidang ekonomi dan lembaga keuangan syariah.",{},7500000.0,7500000.0,7500000.0,15000000.0,15000000.0,15000000.0
quipper-174,SEKOLAH TINGGI ILMU EKONOMI CIREBON,SWASTA,https://campus.quipper.com/directory/sekolah-tinggi-ilmu-ekonomi-cirebon,267.0,25.0,"{""website"": ""www.stiecirebon.ac.id"", ""email"": ""pmb@stiecirebon.ac.id"", ""phone"": ""081111122543""}","Sekolah Tinggi Ilmu Ekonomi Cirebon didirikan pada tanggal 22 Agustus 1996 dengan visi menjadi sekolah ekonomi berbasis Information and Communication Technology . STIE Cirebon berusaha untuk selalu mengedepankan pengetahuan dan pemahaman tentang ICT untuk menunjang kegiatan ekonomi, bisnis, dan perdagangan. Pembelajaran yang ada di kampus ini pun dirancang untuk memahami dan menguasai kondisi lingkungan yang dinamis, inovatif, dan kreatif yang berlandaskan teknologi mobile computing.",{},10000000.0,5000000.0,15000000.0,20000000.0,10000000.0,30000000.0
quipper-175,SEKOLAH TINGGI ILMU KESEHATAN MAHARDIKA CIREBON,SWASTA,https://campus.quipper.com/directory/sekolah-tinggi-ilmu-kesehatan-mahardika-cirebon,866.0,50.0,"{""website"": ""mahardika.ac.id"", ""email"": ""akademik@mahardika.ac.id"", ""phone"": ""0231-488123""}","Sekolah Tinggi Ilmu Kesehatan Mahardika Cirebon didirikan oleh Yayasan Pengembangan Ilmu Mahardika  pada tanggal 14 Agustus 2002. Berdirinya kampus ini sesuai dengan dinamika laju pertumbuhan dan perkembangan sebuah daerah, serta kebutuhan nyata akan peningkatan Indeks Pembangunan Manusia  yang ditekankan pada tiga domain, yaitu pendidikan, kesehatan dan ekonomi.",{},5850000.0,5850000.0,5850000.0,11700000.0,11700000.0,11700000.0
quipper-176,POLITEKNIK SAHID,SWASTA,https://campus.quipper.com/directory/sekolah-tinggi-pariwisata-sahid,1953.0,66.0,"{""website"": ""www.polteksahid.ac.id"", ""email"": ""info@polteksahid.ac.id"", ""phone"": ""021-7402329, 7402339""}","Politeknik Sahid didirikan pada tahun 1983 di bawah Yayasan Kesejahteraan, Pendidikan, dan Sosial Sahid Jaya. FYI, yayasan tersebut merupakan salah satu pelopor pendidikan pariwisata di Indonesia. Awalnya, politeknik ini bernama Akademi Perhotelan dan Pariwisata Sahid, tetapi pada tahun 2000 berubah menjadi Institut Pariwisata Sahid, kemudian berubah bentuk menjadi Politeknik Sahid pada tahun 2019.",{},14737500.0,6925000.0,22550000.0,29475000.0,13850000.0,45100000.0
quipper-177,UNIVERSITAS KRISTEN DUTA WACANA,SWASTA,https://campus.quipper.com/directory/universitas-kristen-duta-wacana,4420.0,153.0,"{""website"": ""www.ukdw.ac.id"", ""email"": ""humas@staff.ukdw.ac.id"", ""phone"": ""0274-563929""}","Berawal dari Sekolah Tinggi Theologia Duta Wacana, saat ini Universitas Kristen Duta Wacana  menjadi kampus swasta terkemuka di Yogyakarta. Kualitasnya dibuktikan lewat akreditasi A dari Badan Akreditasi Nasional Perguruan Tinggi  berdasarkan Surat Keputusan  Nomor 3290/SK/BAN-PT/Akred/PT/IX/2017. UKDW juga termasuk perguruan tinggi protestan terbaik seluruh dunia pada posisi ke-61 berdasarkan daftar Top Protestant Universities in the World dari University Ranking  2022, keren banget ya Quipperian!",{},8000000.0,8000000.0,8000000.0,16000000.0,16000000.0,16000000.0
quipper-178,SEKOLAH TINGGI ILMU KESEHATAN RS HUSADA,SWASTA,https://campus.quipper.com/directory/sekolah-tinggi-ilmu-kesehatan-rs-husada,533.0,28.0,"{""website"": ""www.stikesrshusada.ac.id"", ""email"": ""admission@stikesrshusada.ac.id"", ""phone"": ""021-6259984""}","Sekolah Tinggi Ilmu Kesehatan RS Husada merupakan institusi pendidikan yang telah berdiri dan menyelenggarakan pendidikan keperawatan sejak tahun 1943 di bawah Perkumpulan Husada. Di tahun 1989, kampus ini berganti nama menjadi Akademi Keperawatan Husada. Setelah 30 tahun menjalankan program pendidikan keperawatan dalam bentuk akademi, kampus ini resmi bertransformasi menjadi Sekolah Tinggi Ilmu Kesehatan di tahun 2019 dengan menambahkan program studi baru, yakni Administrasi Kesehatan.",{},9000000.0,9000000.0,9000000.0,18000000.0,18000000.0,18000000.0
quipper-179,UNIVERSITAS JAYABAYA,SWASTA,https://campus.quipper.com/directory/universitas-jayabaya,4407.0,192.0,"{""website"": ""www.jayabaya.ac.id"", ""email"": ""info@jayabaya.ac.id"", ""phone"": ""021-4700892""}","Universitas Jayabaya adalah salah satu universitas swasta tertua di Indonesia, tepatnya didirikan pada tahun 1958 oleh Yayasan Jayabaya. Selama lebih dari 50 tahun kiprahnya dalam dunia pendidikan tinggi di Indonesia, Universitas Jayabaya telah menghasilkan lebih dari 58.500 orang lulusan berkualitas. Quipperian tertarik menjadi mahasiswa Universitas Jayabaya? Baca lebih lanjut ya.",{},10475000.0,10175000.0,10775000.0,20950000.0,20350000.0,21550000.0
quipper-181,STIKES PANTI WALUYA MALANG,SWASTA,https://campus.quipper.com/directory/stikes-panti-waluya-malang,246.0,29.0,"{""website"": ""www.stikespantiwaluya.ac.id"", ""email"": ""admin@stikespantiwaluya.ac.id"", ""phone"": ""0341-369003""}","Sekolah Tinggi Ilmu Kesehatan  Panti Waluya Malang dinaungi oleh Yayasan Pendidikan Misericordia. Kampus ini mengalami beberapa kali perubahan bentuk mulai dari Djuru Kesehatan , Sekolah Perawat Kesehatan , Akademi Perawat Panti Waluya Malang , dan pada tahun 2018 menjadi STIKes Panti Waluya Malang.",{},6925000.0,5800000.0,8050000.0,13850000.0,11600000.0,16100000.0
quipper-182,UNIVERSITAS HAYAM WURUK PERBANAS,SWASTA,https://campus.quipper.com/directory/sekolah-tinggi-ilmu-ekonomi-perbanas-surabaya,1842.0,108.0,"{""website"": ""www.perbanas.ac.id"", ""email"": ""humas@hayamwuruk.ac.id"", ""phone"": ""031-5947151, 031-5947152""}","Tahukah Quipperian kalau Universitas Hayam Wuruk  Perbanas merupakan bentuk pengembangan dari Sekolah Tinggi Ilmu Ekonomi Perbanas Surabaya? Setelah menyelenggarakan pendidikan ekonomi selama 36 tahun sejak 1985, STIE Perbanas Surabaya resmi bertransformasi menjadi Universitas Hayam Wuruk Perbanas di tahun 2021. Setelah berubah menjadi universitas, kampus ini mulai menambahkan program studi di luar bidang ekonomi, seperti Informatika, Sistem Informasi, dan Desain Komunikasi Visual.",{},8900000.0,7300000.0,10500000.0,17800000.0,14600000.0,21000000.0
quipper-184,INSTITUT TEKNOLOGI NASIONAL MALANG,SWASTA,https://campus.quipper.com/directory/institut-teknologi-nasional-malang,5212.0,201.0,"{""website"": ""www.itn.ac.id"", ""email"": ""pmb.itn@scholar.itn.ac.id"", ""phone"": ""0341-551431, 0341-417636""}","Institut Teknologi Nasional Malang bermula dari Akademi Teknik Nasional  Malang yang didirikan oleh Yayasan Pendidikan Umum dan Teknologi Nasional  Malang di tahun 1969. Berdasarkan keputusan Menteri Pendidikan dan Kebudayaan No. 0104/0/1983 yang diterima pada tahun 1983, akademi tersebut kemudian dikembangkan menjadi Institut Teknologi Nasional Malang yang terdiri dari 2 fakultas yaitu Fakultas Teknologi Industri  dan Fakultas Teknik Sipil dan Perencanaan .",{},8162500.0,5000000.0,11325000.0,16325000.0,10000000.0,22650000.0
quipper-185,UNIVERSITAS MA CHUNG,SWASTA,https://campus.quipper.com/directory/universitas-ma-chung,1706.0,83.0,"{""website"": ""www.machung.ac.id"", ""email"": ""info@machung.ac.id"", ""phone"": ""0341-550171""}","Ide pendirian Universitas Ma Chung dicetuskan pada saat pelaksanaan Reuni Akbar peringatan hari ulang tahun ke-55 sekolah Ma Chung pada September 2001 di kota Xiamen, China, yang dilandasi oleh warisan semangat Ma Chung: rukun, bersatu, mengabdi kepada masyarakat, serta mewujudkan dedikasi kepada dunia pendidikan Indonesia. Berselang hampir enam tahun kemudian tepatnya 7 Juli 2007, Universitas Ma Chung resmi beroperasi sebagai perguruan tinggi swasta di Malang.",{},9825000.0,7650000.0,12000000.0,19650000.0,15300000.0,24000000.0
quipper-186,INSTITUT ILMU KESEHATAN STRADA INDONESIA,SWASTA,https://campus.quipper.com/directory/institut-ilmu-kesehatan-strada-indonesia,1341.0,116.0,"{""website"": ""https://iik-strada.ac.id/"", ""email"": ""official@iik-strada.ac.id"", ""phone"": ""08113500876""}","Kampus yang awalnya bernama STIkes Surya Mitra Husada ini mengalami perubahan bentuk menjadi Institut Ilmu Kesehatan  STRADA Indonesia di tahun 2019. IIK STRADA Indonesia berusaha mempersiapkan mahasiswa agar menjadi lulusan yang handal dan profesional di dunia kerja dengan menerapkan 4G: Good Competence, Good English, Good Personality and Mentality, Good Placement and Preparation.",{},6000000.0,3000000.0,9000000.0,12000000.0,6000000.0,18000000.0
quipper-195,UNIVERSITAS 17 AGUSTUS 1945  SURABAYA,SWASTA,https://campus.quipper.com/directory/universitas-17-agustus-1945-surabaya,14845.0,374.0,"{""website"": ""www.untag-sby.ac.id"", ""email"": ""humas@untag-sby.ac.id"", ""phone"": ""031-5931800""}","Universitas 17 Agustus 1945  Surabaya berdiri pada tahun 1958 dengan nama Akademi Administrasi Negara dan Niaga  Surabaya. Lalu, pada tahun 1962, AANN digabung dengan Universitas 17 Agustus 1945 Jakarta menjadi Akademi Administrasi Negara dan Niaga Universitas 1945 Cabang Surabaya . Dengan terbentuknya Yayasan Perguruan 17 Agustus 1945 Surabaya, pada tahun 1966, Untag Surabaya resmi memisahkan diri dan tidak lagi menjadi cabang dari Universitas 17 Agustus 1945 Jakarta. Saat ini, Untag Surabaya telah terakreditasi A oleh Badan Akreditasi Nasional Perguruan Tinggi  dan menyediakan 7 fakultas dengan berbagai macam bidang keilmuan.",{},1100000.0,900000.0,1300000.0,2200000.0,1800000.0,2600000.0
quipper-230,UNIVERSITAS PAMULANG,SWASTA,https://campus.quipper.com/directory/universitas-pamulang,90.0,2.0,"{""website"": ""https://unpam.ac.id/"", ""email"": ""admin@unpam.ac.id"", ""phone"": ""021-7412566""}","Universitas Pamulang  berdiri pada tahun 2000 oleh Yayasan Prima Jaya. Namun karena ketidakmampuan Yayasan Prima Jaya dalam pengelolaannya, maka mereka pun mengalihkan kepemilikan dan pengelolaannya kepada Yayasan Sasmita Jaya pada awal tahun 2005.",{},1575000.0,1200000.0,1950000.0,3150000.0,2400000.0,3900000.0
quipper-245,UNIVERSITAS AGUNG PODOMORO,SWASTA,https://campus.quipper.com/directory/universitas-podomoro,965.0,61.0,"{""website"": ""www.podomorouniversity.ac.id"", ""email"": ""info@podomorouniversity.ac.id"", ""phone"": ""021-29200456""}",Universitas Agung Podomoro didirikan pada tahun 2014 oleh Yayasan Pendidikan Agung Podomoro. Universitas yang meraih akreditasi Baik Sekali ini punya delapan program studi berbasis pengetahuan umum serta memberikan pengalaman kerja langsung di industri.,{},14000000.0,9500000.0,18500000.0,28000000.0,19000000.0,37000000.0
